"No.","Time","Source","Destination","Protocol","Length","Info"
"1","0.000000","192.168.43.215","52.113.194.133","TCP","66","52004  >  443 [SYN] Seq=0 Win=8192 Len=0 MSS=1460 WS=256 SACK_PERM=1"
"2","0.034535","52.113.194.133","192.168.43.215","TCP","66","443  >  52004 [SYN, ACK] Seq=0 Ack=1 Win=65535 Len=0 MSS=1352 WS=256 SACK_PERM=1"
"3","0.034738","192.168.43.215","52.113.194.133","TCP","54","52004  >  443 [ACK] Seq=1 Ack=1 Win=66048 Len=0"
"4","0.035554","192.168.43.215","52.113.194.133","TLSv1.2","571","Client Hello"
"5","0.071357","52.113.194.133","192.168.43.215","TCP","54","443  >  52004 [ACK] Seq=1 Ack=518 Win=524032 Len=0"
"6","0.086908","52.113.194.133","192.168.43.215","TCP","1406","443  >  52004 [ACK] Seq=1 Ack=518 Win=524032 Len=1352 [TCP segment of a reassembled PDU]"
"7","0.087119","52.113.194.133","192.168.43.215","TCP","1406","443  >  52004 [ACK] Seq=1353 Ack=518 Win=524032 Len=1352 [TCP segment of a reassembled PDU]"
"8","0.087182","192.168.43.215","52.113.194.133","TCP","54","52004  >  443 [ACK] Seq=518 Ack=2705 Win=66048 Len=0"
"9","0.087426","52.113.194.133","192.168.43.215","TCP","1406","443  >  52004 [ACK] Seq=2705 Ack=518 Win=524032 Len=1352 [TCP segment of a reassembled PDU]"
"10","0.087553","52.113.194.133","192.168.43.215","TCP","1406","443  >  52004 [ACK] Seq=4057 Ack=518 Win=524032 Len=1352 [TCP segment of a reassembled PDU]"
"11","0.087610","192.168.43.215","52.113.194.133","TCP","54","52004  >  443 [ACK] Seq=518 Ack=5409 Win=66048 Len=0"
"12","0.087826","52.113.194.133","192.168.43.215","TLSv1.2","671","Server Hello, Certificate, Certificate Status, Server Key Exchange, Server Hello Done"
"13","0.105176","192.168.43.215","52.113.194.133","TLSv1.2","212","Client Key Exchange, Change Cipher Spec, Encrypted Handshake Message"
"14","0.106049","192.168.43.215","52.113.194.133","TLSv1.2","153","Application Data"
"15","0.106672","192.168.43.215","52.113.194.133","TLSv1.2","607","Application Data"
"16","0.139725","52.113.194.133","192.168.43.215","TCP","54","443  >  52004 [ACK] Seq=6026 Ack=676 Win=523776 Len=0"
"17","0.139832","52.113.194.133","192.168.43.215","TCP","54","443  >  52004 [ACK] Seq=6026 Ack=775 Win=523776 Len=0"
"18","0.139987","52.113.194.133","192.168.43.215","TLSv1.2","380","New Session Ticket, Change Cipher Spec, Encrypted Handshake Message"
"19","0.141610","52.113.194.133","192.168.43.215","TLSv1.2","123","Application Data"
"20","0.141740","192.168.43.215","52.113.194.133","TCP","54","52004  >  443 [ACK] Seq=1328 Ack=6421 Win=65024 Len=0"
"21","0.142151","192.168.43.215","52.113.194.133","TLSv1.2","92","Application Data"
"22","0.143605","52.113.194.133","192.168.43.215","TLSv1.2","92","Application Data"
"23","0.179979","52.113.194.133","192.168.43.215","TCP","1406","443  >  52004 [ACK] Seq=6459 Ack=1328 Win=523008 Len=1352 [TCP segment of a reassembled PDU]"
"24","0.180115","192.168.43.215","52.113.194.133","TCP","54","52004  >  443 [ACK] Seq=1366 Ack=7811 Win=66048 Len=0"
"25","0.180222","52.113.194.133","192.168.43.215","TLSv1.2","692","Application Data"
"26","0.180345","52.113.194.133","192.168.43.215","TLSv1.2","92","Application Data"
"27","0.180392","192.168.43.215","52.113.194.133","TCP","54","52004  >  443 [ACK] Seq=1366 Ack=8487 Win=65536 Len=0"
"28","0.183542","52.113.194.133","192.168.43.215","TCP","54","443  >  52004 [ACK] Seq=8487 Ack=1366 Win=524544 Len=0"
"29","0.196339","192.168.43.215","52.113.194.133","TLSv1.2","123","Application Data"
"30","0.229448","52.113.194.133","192.168.43.215","TCP","54","443  >  52004 [ACK] Seq=8487 Ack=1435 Win=524288 Len=0"
"31","0.274253","52.113.194.133","192.168.43.215","TCP","1406","443  >  52004 [ACK] Seq=8487 Ack=1435 Win=524288 Len=1352 [TCP segment of a reassembled PDU]"
"32","0.274459","52.113.194.133","192.168.43.215","TCP","1406","443  >  52004 [ACK] Seq=9839 Ack=1435 Win=524288 Len=1352 [TCP segment of a reassembled PDU]"
"33","0.274523","192.168.43.215","52.113.194.133","TCP","54","52004  >  443 [ACK] Seq=1435 Ack=11191 Win=66048 Len=0"
"34","0.274608","52.113.194.133","192.168.43.215","TLSv1.2","453","Application Data"
"35","0.276005","52.113.194.133","192.168.43.215","TCP","1406","443  >  52004 [ACK] Seq=11590 Ack=1435 Win=524288 Len=1352 [TCP segment of a reassembled PDU]"
"36","0.276160","192.168.43.215","52.113.194.133","TCP","54","52004  >  443 [ACK] Seq=1435 Ack=12942 Win=66048 Len=0"
"37","0.277580","52.113.194.133","192.168.43.215","TCP","1406","443  >  52004 [ACK] Seq=12942 Ack=1435 Win=524288 Len=1352 [TCP segment of a reassembled PDU]"
"38","0.277690","52.113.194.133","192.168.43.215","TCP","1406","443  >  52004 [ACK] Seq=14294 Ack=1435 Win=524288 Len=1352 [TCP segment of a reassembled PDU]"
"39","0.277750","192.168.43.215","52.113.194.133","TCP","54","52004  >  443 [ACK] Seq=1435 Ack=15646 Win=66048 Len=0"
"40","0.277827","52.113.194.133","192.168.43.215","TCP","1406","443  >  52004 [ACK] Seq=15646 Ack=1435 Win=524288 Len=1352 [TCP segment of a reassembled PDU]"
"41","0.280887","52.113.194.133","192.168.43.215","TCP","1406","443  >  52004 [ACK] Seq=16998 Ack=1435 Win=524288 Len=1352 [TCP segment of a reassembled PDU]"
"42","0.281042","192.168.43.215","52.113.194.133","TCP","54","52004  >  443 [ACK] Seq=1435 Ack=18350 Win=66048 Len=0"
"43","0.281172","52.113.194.133","192.168.43.215","TCP","1406","443  >  52004 [ACK] Seq=18350 Ack=1435 Win=524288 Len=1352 [TCP segment of a reassembled PDU]"
"44","0.281226","52.113.194.133","192.168.43.215","TLSv1.2","172","Application Data"
"45","0.281266","192.168.43.215","52.113.194.133","TCP","54","52004  >  443 [ACK] Seq=1435 Ack=19820 Win=66048 Len=0"
"46","0.281333","52.113.194.133","192.168.43.215","TCP","1406","443  >  52004 [ACK] Seq=19820 Ack=1435 Win=524288 Len=1352 [TCP segment of a reassembled PDU]"
"47","0.281378","52.113.194.133","192.168.43.215","TCP","1406","443  >  52004 [ACK] Seq=21172 Ack=1435 Win=524288 Len=1352 [TCP segment of a reassembled PDU]"
"48","0.281413","192.168.43.215","52.113.194.133","TCP","54","52004  >  443 [ACK] Seq=1435 Ack=22524 Win=66048 Len=0"
"49","0.281460","52.113.194.133","192.168.43.215","TLSv1.2","118","Application Data"
"50","0.281503","52.113.194.133","192.168.43.215","TCP","1406","443  >  52004 [ACK] Seq=22588 Ack=1435 Win=524288 Len=1352 [TCP segment of a reassembled PDU]"
"51","0.281538","192.168.43.215","52.113.194.133","TCP","54","52004  >  443 [ACK] Seq=1435 Ack=23940 Win=66048 Len=0"
"52","0.281593","52.113.194.133","192.168.43.215","TCP","1406","443  >  52004 [ACK] Seq=23940 Ack=1435 Win=524288 Len=1352 [TCP segment of a reassembled PDU]"
"53","0.281637","52.113.194.133","192.168.43.215","TCP","1406","443  >  52004 [ACK] Seq=25292 Ack=1435 Win=524288 Len=1352 [TCP segment of a reassembled PDU]"
"54","0.281670","192.168.43.215","52.113.194.133","TCP","54","52004  >  443 [ACK] Seq=1435 Ack=26644 Win=66048 Len=0"
"55","0.281721","52.113.194.133","192.168.43.215","TCP","1406","443  >  52004 [ACK] Seq=26644 Ack=1435 Win=524288 Len=1352 [TCP segment of a reassembled PDU]"
"56","0.281786","52.113.194.133","192.168.43.215","TLSv1.2","1272","Application Data"
"57","0.281836","192.168.43.215","52.113.194.133","TCP","54","52004  >  443 [ACK] Seq=1435 Ack=29214 Win=66048 Len=0"
"58","0.281896","52.113.194.133","192.168.43.215","TLSv1.2","92","Application Data"
"59","0.341591","192.168.43.215","52.113.194.133","TCP","54","52004  >  443 [ACK] Seq=1435 Ack=29252 Win=66048 Len=0"
"60","29.923626","192.168.43.215","52.113.194.133","TLSv1.2","198","Application Data"
"61","29.923889","192.168.43.215","52.113.194.133","TLSv1.2","100","Application Data"
"62","30.066892","52.113.194.133","192.168.43.215","TCP","54","443  >  52004 [ACK] Seq=29252 Ack=1625 Win=524288 Len=0"
"63","30.067014","52.113.194.133","192.168.43.215","TLSv1.2","100","Application Data"
"64","30.126214","192.168.43.215","52.113.194.133","TCP","54","52004  >  443 [ACK] Seq=1625 Ack=29298 Win=66048 Len=0"
"65","30.167358","52.113.194.133","192.168.43.215","TCP","1406","443  >  52004 [ACK] Seq=29298 Ack=1625 Win=524288 Len=1352 [TCP segment of a reassembled PDU]"
"66","30.167526","52.113.194.133","192.168.43.215","TLSv1.2","285","Application Data"
"67","30.167598","192.168.43.215","52.113.194.133","TCP","54","52004  >  443 [ACK] Seq=1625 Ack=30881 Win=66048 Len=0"
"68","30.168720","52.113.194.133","192.168.43.215","TCP","1406","443  >  52004 [ACK] Seq=30881 Ack=1625 Win=524288 Len=1352 [TCP segment of a reassembled PDU]"
"69","30.169080","52.113.194.133","192.168.43.215","TCP","1406","443  >  52004 [ACK] Seq=32233 Ack=1625 Win=524288 Len=1352 [TCP segment of a reassembled PDU]"
"70","30.169144","192.168.43.215","52.113.194.133","TCP","54","52004  >  443 [ACK] Seq=1625 Ack=33585 Win=66048 Len=0"
"71","30.170464","52.113.194.133","192.168.43.215","TCP","1406","443  >  52004 [ACK] Seq=33585 Ack=1625 Win=524288 Len=1352 [TCP segment of a reassembled PDU]"
"72","30.170606","52.113.194.133","192.168.43.215","TCP","1406","443  >  52004 [ACK] Seq=34937 Ack=1625 Win=524288 Len=1352 [TCP segment of a reassembled PDU]"
"73","30.170695","192.168.43.215","52.113.194.133","TCP","54","52004  >  443 [ACK] Seq=1625 Ack=36289 Win=66048 Len=0"
"74","30.171124","52.113.194.133","192.168.43.215","TCP","1406","443  >  52004 [ACK] Seq=36289 Ack=1625 Win=524288 Len=1352 [TCP segment of a reassembled PDU]"
"75","30.171405","52.113.194.133","192.168.43.215","TCP","1406","443  >  52004 [ACK] Seq=37641 Ack=1625 Win=524288 Len=1352 [TCP segment of a reassembled PDU]"
"76","30.171470","192.168.43.215","52.113.194.133","TCP","54","52004  >  443 [ACK] Seq=1625 Ack=38993 Win=66048 Len=0"
"77","30.171546","52.113.194.133","192.168.43.215","TLSv1.2","172","Application Data"
"78","30.173150","52.113.194.133","192.168.43.215","TCP","1406","443  >  52004 [ACK] Seq=39111 Ack=1625 Win=524288 Len=1352 [TCP segment of a reassembled PDU]"
"79","30.173279","192.168.43.215","52.113.194.133","TCP","54","52004  >  443 [ACK] Seq=1625 Ack=40463 Win=66048 Len=0"
"80","30.173406","52.113.194.133","192.168.43.215","TCP","1406","443  >  52004 [ACK] Seq=40463 Ack=1625 Win=524288 Len=1352 [TCP segment of a reassembled PDU]"
"81","30.173868","52.113.194.133","192.168.43.215","TCP","1406","443  >  52004 [ACK] Seq=41815 Ack=1625 Win=524288 Len=1352 [TCP segment of a reassembled PDU]"
"82","30.174020","192.168.43.215","52.113.194.133","TCP","54","52004  >  443 [ACK] Seq=1625 Ack=43167 Win=66048 Len=0"
"83","30.174127","52.113.194.133","192.168.43.215","TLSv1.2","187","Application Data"
"84","30.175699","52.113.194.133","192.168.43.215","TCP","1406","443  >  52004 [ACK] Seq=43300 Ack=1625 Win=524288 Len=1352 [TCP segment of a reassembled PDU]"
"85","30.175836","192.168.43.215","52.113.194.133","TCP","54","52004  >  443 [ACK] Seq=1625 Ack=44652 Win=66048 Len=0"
"86","30.175928","52.113.194.133","192.168.43.215","TCP","1406","443  >  52004 [ACK] Seq=44652 Ack=1625 Win=524288 Len=1352 [TCP segment of a reassembled PDU]"
"87","30.176841","52.113.194.133","192.168.43.215","TCP","1406","443  >  52004 [ACK] Seq=46004 Ack=1625 Win=524288 Len=1352 [TCP segment of a reassembled PDU]"
"88","30.176883","192.168.43.215","52.113.194.133","TCP","54","52004  >  443 [ACK] Seq=1625 Ack=47356 Win=66048 Len=0"
"89","30.177081","52.113.194.133","192.168.43.215","TCP","1406","443  >  52004 [ACK] Seq=47356 Ack=1625 Win=524288 Len=1352 [TCP segment of a reassembled PDU]"
"90","30.177222","52.113.194.133","192.168.43.215","TLSv1.2","1272","Application Data"
"91","30.177288","192.168.43.215","52.113.194.133","TCP","54","52004  >  443 [ACK] Seq=1625 Ack=49926 Win=66048 Len=0"
"92","30.179217","52.113.194.133","192.168.43.215","TLSv1.2","92","Application Data"
"93","30.230134","192.168.43.215","52.113.194.133","TCP","54","52004  >  443 [ACK] Seq=1625 Ack=49964 Win=66048 Len=0"
"94","49.891570","192.168.43.215","52.113.194.133","TLSv1.2","227","Application Data"
"95","49.891799","192.168.43.215","52.113.194.133","TLSv1.2","100","Application Data"
"96","49.972770","52.113.194.133","192.168.43.215","TCP","54","443  >  52004 [ACK] Seq=49964 Ack=1798 Win=524032 Len=0"
"97","49.973046","52.113.194.133","192.168.43.215","TCP","54","443  >  52004 [ACK] Seq=49964 Ack=1844 Win=524032 Len=0"
"98","49.973156","52.113.194.133","192.168.43.215","TLSv1.2","100","Application Data"
"99","50.030252","52.113.194.133","192.168.43.215","TCP","1406","443  >  52004 [ACK] Seq=50010 Ack=1844 Win=524032 Len=1352 [TCP segment of a reassembled PDU]"
"100","50.030377","192.168.43.215","52.113.194.133","TCP","54","52004  >  443 [ACK] Seq=1844 Ack=51362 Win=66048 Len=0"
"101","50.030485","52.113.194.133","192.168.43.215","TLSv1.2","285","Application Data"
"102","50.030662","52.113.194.133","192.168.43.215","TCP","1406","443  >  52004 [ACK] Seq=51593 Ack=1844 Win=524032 Len=1352 [TCP segment of a reassembled PDU]"
"103","50.030776","192.168.43.215","52.113.194.133","TCP","54","52004  >  443 [ACK] Seq=1844 Ack=52945 Win=66048 Len=0"
"104","50.031913","52.113.194.133","192.168.43.215","TCP","1406","443  >  52004 [ACK] Seq=52945 Ack=1844 Win=524032 Len=1352 [TCP segment of a reassembled PDU]"
"105","50.032238","52.113.194.133","192.168.43.215","TCP","1406","443  >  52004 [ACK] Seq=54297 Ack=1844 Win=524032 Len=1352 [TCP segment of a reassembled PDU]"
"106","50.032297","192.168.43.215","52.113.194.133","TCP","54","52004  >  443 [ACK] Seq=1844 Ack=55649 Win=66048 Len=0"
"107","50.034133","52.113.194.133","192.168.43.215","TCP","1406","443  >  52004 [ACK] Seq=55649 Ack=1844 Win=524032 Len=1352 [TCP segment of a reassembled PDU]"
"108","50.036929","52.113.194.133","192.168.43.215","TCP","1406","443  >  52004 [ACK] Seq=57001 Ack=1844 Win=524032 Len=1352 [TCP segment of a reassembled PDU]"
"109","50.037081","192.168.43.215","52.113.194.133","TCP","54","52004  >  443 [ACK] Seq=1844 Ack=58353 Win=66048 Len=0"
"110","50.037206","52.113.194.133","192.168.43.215","TCP","1406","443  >  52004 [ACK] Seq=58353 Ack=1844 Win=524032 Len=1352 [TCP segment of a reassembled PDU]"
"111","50.037259","52.113.194.133","192.168.43.215","TLSv1.2","172","Application Data"
"112","50.037301","192.168.43.215","52.113.194.133","TCP","54","52004  >  443 [ACK] Seq=1844 Ack=59823 Win=66048 Len=0"
"113","50.037364","52.113.194.133","192.168.43.215","TCP","1406","443  >  52004 [ACK] Seq=59823 Ack=1844 Win=524032 Len=1352 [TCP segment of a reassembled PDU]"
"114","50.039351","52.113.194.133","192.168.43.215","TCP","1406","443  >  52004 [ACK] Seq=61175 Ack=1844 Win=524032 Len=1352 [TCP segment of a reassembled PDU]"
"115","50.039472","192.168.43.215","52.113.194.133","TCP","54","52004  >  443 [ACK] Seq=1844 Ack=62527 Win=66048 Len=0"
"116","50.039561","52.113.194.133","192.168.43.215","TCP","1406","443  >  52004 [ACK] Seq=62527 Ack=1844 Win=524032 Len=1352 [TCP segment of a reassembled PDU]"
"117","50.039601","52.113.194.133","192.168.43.215","TLSv1.2","187","Application Data"
"118","50.039640","192.168.43.215","52.113.194.133","TCP","54","52004  >  443 [ACK] Seq=1844 Ack=64012 Win=66048 Len=0"
"119","50.039685","52.113.194.133","192.168.43.215","TLSv1.2","817","Application Data"
"120","50.039731","52.113.194.133","192.168.43.215","TLSv1.2","92","Application Data"
"121","50.039766","192.168.43.215","52.113.194.133","TCP","54","52004  >  443 [ACK] Seq=1844 Ack=64813 Win=65280 Len=0"
"122","64.785919","192.168.43.215","52.113.194.133","TLSv1.2","230","Application Data"
"123","64.786038","192.168.43.215","52.113.194.133","TLSv1.2","100","Application Data"
"124","64.862311","52.113.194.133","192.168.43.215","TCP","54","443  >  52004 [ACK] Seq=64813 Ack=2066 Win=523776 Len=0"
"125","64.862434","52.113.194.133","192.168.43.215","TLSv1.2","100","Application Data"
"126","64.908510","192.168.43.215","52.113.194.133","TCP","54","52004  >  443 [ACK] Seq=2066 Ack=64859 Win=65280 Len=0"
"127","65.020235","52.113.194.133","192.168.43.215","TCP","1406","443  >  52004 [ACK] Seq=64859 Ack=2066 Win=523776 Len=1352 [TCP segment of a reassembled PDU]"
"128","65.020393","52.113.194.133","192.168.43.215","TCP","1406","443  >  52004 [ACK] Seq=66211 Ack=2066 Win=523776 Len=1352 [TCP segment of a reassembled PDU]"
"129","65.020462","192.168.43.215","52.113.194.133","TCP","54","52004  >  443 [ACK] Seq=2066 Ack=67563 Win=66048 Len=0"
"130","65.020601","52.113.194.133","192.168.43.215","TLSv1.2","399","Application Data"
"131","65.020813","52.113.194.133","192.168.43.215","TCP","1406","443  >  52004 [ACK] Seq=67908 Ack=2066 Win=523776 Len=1352 [TCP segment of a reassembled PDU]"
"132","65.020863","192.168.43.215","52.113.194.133","TCP","54","52004  >  443 [ACK] Seq=2066 Ack=69260 Win=66048 Len=0"
"133","65.022362","52.113.194.133","192.168.43.215","TCP","1406","443  >  52004 [ACK] Seq=69260 Ack=2066 Win=523776 Len=1352 [TCP segment of a reassembled PDU]"
"134","65.022487","52.113.194.133","192.168.43.215","TLSv1.2","743","Application Data"
"135","65.022541","192.168.43.215","52.113.194.133","TCP","54","52004  >  443 [ACK] Seq=2066 Ack=71301 Win=66048 Len=0"
"136","65.022623","52.113.194.133","192.168.43.215","TLSv1.2","92","Application Data"
"137","65.068425","192.168.43.215","52.113.194.133","TCP","54","52004  >  443 [ACK] Seq=2066 Ack=71339 Win=66048 Len=0"
"138","71.171500","192.168.43.215","52.113.194.133","TLSv1.2","234","Application Data"
"139","71.304234","52.113.194.133","192.168.43.215","TCP","54","443  >  52004 [ACK] Seq=71339 Ack=2246 Win=523520 Len=0"
"140","71.437696","52.113.194.133","192.168.43.215","TCP","1406","443  >  52004 [ACK] Seq=71339 Ack=2246 Win=523520 Len=1352 [TCP segment of a reassembled PDU]"
"141","71.437931","52.113.194.133","192.168.43.215","TCP","1406","443  >  52004 [ACK] Seq=72691 Ack=2246 Win=523520 Len=1352 [TCP segment of a reassembled PDU]"
"142","71.438010","192.168.43.215","52.113.194.133","TCP","54","52004  >  443 [ACK] Seq=2246 Ack=74043 Win=66048 Len=0"
"143","71.438098","52.113.194.133","192.168.43.215","TLSv1.2","1347","Application Data"
"144","71.438226","52.113.194.133","192.168.43.215","TCP","1406","443  >  52004 [ACK] Seq=75336 Ack=2246 Win=523520 Len=1352 [TCP segment of a reassembled PDU]"
"145","71.438265","192.168.43.215","52.113.194.133","TCP","54","52004  >  443 [ACK] Seq=2246 Ack=76688 Win=66048 Len=0"
"146","71.438428","52.113.194.133","192.168.43.215","TLSv1.2","1090","Application Data"
"147","71.439621","52.113.194.133","192.168.43.215","TCP","1406","443  >  52004 [ACK] Seq=77724 Ack=2246 Win=523520 Len=1352 [TCP segment of a reassembled PDU]"
"148","71.439738","192.168.43.215","52.113.194.133","TCP","54","52004  >  443 [ACK] Seq=2246 Ack=79076 Win=66048 Len=0"
"149","71.439925","52.113.194.133","192.168.43.215","TCP","1406","443  >  52004 [ACK] Seq=79076 Ack=2246 Win=523520 Len=1352 [TCP segment of a reassembled PDU]"
"150","71.439988","52.113.194.133","192.168.43.215","TCP","1406","443  >  52004 [ACK] Seq=80428 Ack=2246 Win=523520 Len=1352 [TCP segment of a reassembled PDU]"
"151","71.440038","192.168.43.215","52.113.194.133","TCP","54","52004  >  443 [ACK] Seq=2246 Ack=81780 Win=66048 Len=0"
"152","71.441242","52.113.194.133","192.168.43.215","TCP","1406","443  >  52004 [ACK] Seq=81780 Ack=2246 Win=523520 Len=1352 [TCP segment of a reassembled PDU]"
"153","71.442550","52.113.194.133","192.168.43.215","TCP","1406","443  >  52004 [ACK] Seq=83132 Ack=2246 Win=523520 Len=1352 [TCP segment of a reassembled PDU]"
"154","71.442645","192.168.43.215","52.113.194.133","TCP","54","52004  >  443 [ACK] Seq=2246 Ack=84484 Win=66048 Len=0"
"155","71.442738","52.113.194.133","192.168.43.215","TCP","1406","443  >  52004 [ACK] Seq=84484 Ack=2246 Win=523520 Len=1352 [TCP segment of a reassembled PDU]"
"156","71.442780","52.113.194.133","192.168.43.215","TLSv1.2","172","Application Data"
"157","71.442814","192.168.43.215","52.113.194.133","TCP","54","52004  >  443 [ACK] Seq=2246 Ack=85954 Win=66048 Len=0"
"158","71.442860","52.113.194.133","192.168.43.215","TLSv1.2","195","Application Data"
"159","71.442929","52.113.194.133","192.168.43.215","TCP","1406","443  >  52004 [ACK] Seq=86095 Ack=2246 Win=523520 Len=1352 [TCP segment of a reassembled PDU]"
"160","71.442975","192.168.43.215","52.113.194.133","TCP","54","52004  >  443 [ACK] Seq=2246 Ack=87447 Win=66048 Len=0"
"161","71.444559","52.113.194.133","192.168.43.215","TCP","1406","443  >  52004 [ACK] Seq=87447 Ack=2246 Win=523520 Len=1352 [TCP segment of a reassembled PDU]"
"162","71.444665","52.113.194.133","192.168.43.215","TCP","1406","443  >  52004 [ACK] Seq=88799 Ack=2246 Win=523520 Len=1352 [TCP segment of a reassembled PDU]"
"163","71.444715","192.168.43.215","52.113.194.133","TCP","54","52004  >  443 [ACK] Seq=2246 Ack=90151 Win=66048 Len=0"
"164","71.444801","52.113.194.133","192.168.43.215","TCP","1406","443  >  52004 [ACK] Seq=90151 Ack=2246 Win=523520 Len=1352 [TCP segment of a reassembled PDU]"
"165","71.444843","52.113.194.133","192.168.43.215","TLSv1.2","500","Application Data"
"166","71.444878","192.168.43.215","52.113.194.133","TCP","54","52004  >  443 [ACK] Seq=2246 Ack=91949 Win=66048 Len=0"
"167","71.444922","52.113.194.133","192.168.43.215","TLSv1.2","92","Application Data"
"168","71.492621","192.168.43.215","52.113.194.133","TCP","54","52004  >  443 [ACK] Seq=2246 Ack=91987 Win=66048 Len=0"
"169","75.913557","192.168.43.215","52.113.194.133","TLSv1.2","145","Application Data"
"170","76.019333","52.113.194.133","192.168.43.215","TCP","54","443  >  52004 [ACK] Seq=91987 Ack=2337 Win=523520 Len=0"
"171","76.045162","52.113.194.133","192.168.43.215","TCP","1406","443  >  52004 [ACK] Seq=91987 Ack=2337 Win=523520 Len=1352 [TCP segment of a reassembled PDU]"
"172","76.045291","52.113.194.133","192.168.43.215","TLSv1.2","575","Application Data"
"173","76.045347","192.168.43.215","52.113.194.133","TCP","54","52004  >  443 [ACK] Seq=2337 Ack=93860 Win=66048 Len=0"
"174","76.046765","52.113.194.133","192.168.43.215","TLSv1.2","92","Application Data"
"175","76.066974","192.168.43.215","52.113.194.133","TLSv1.2","124","Application Data"
"176","76.102834","52.113.194.133","192.168.43.215","TCP","54","443  >  52004 [ACK] Seq=93898 Ack=2407 Win=523520 Len=0"
"177","76.145547","52.113.194.133","192.168.43.215","TCP","1406","443  >  52004 [ACK] Seq=93898 Ack=2407 Win=523520 Len=1352 [TCP segment of a reassembled PDU]"
"178","76.151516","52.113.194.133","192.168.43.215","TCP","1406","443  >  52004 [ACK] Seq=95250 Ack=2407 Win=523520 Len=1352 [TCP segment of a reassembled PDU]"
"179","76.151599","192.168.43.215","52.113.194.133","TCP","54","52004  >  443 [ACK] Seq=2407 Ack=96602 Win=66048 Len=0"
"180","76.151658","52.113.194.133","192.168.43.215","TLSv1.2","446","Application Data"
"181","76.151704","52.113.194.133","192.168.43.215","TCP","1406","443  >  52004 [ACK] Seq=96994 Ack=2407 Win=523520 Len=1352 [TCP segment of a reassembled PDU]"
"182","76.151739","192.168.43.215","52.113.194.133","TCP","54","52004  >  443 [ACK] Seq=2407 Ack=98346 Win=66048 Len=0"
"183","76.151792","52.113.194.133","192.168.43.215","TCP","1406","443  >  52004 [ACK] Seq=98346 Ack=2407 Win=523520 Len=1352 [TCP segment of a reassembled PDU]"
"184","76.151842","52.113.194.133","192.168.43.215","TCP","1406","443  >  52004 [ACK] Seq=99698 Ack=2407 Win=523520 Len=1352 [TCP segment of a reassembled PDU]"
"185","76.151874","192.168.43.215","52.113.194.133","TCP","54","52004  >  443 [ACK] Seq=2407 Ack=101050 Win=66048 Len=0"
"186","76.151919","52.113.194.133","192.168.43.215","TCP","1406","443  >  52004 [ACK] Seq=101050 Ack=2407 Win=523520 Len=1352 [TCP segment of a reassembled PDU]"
"187","76.151959","52.113.194.133","192.168.43.215","TCP","1406","443  >  52004 [ACK] Seq=102402 Ack=2407 Win=523520 Len=1352 [TCP segment of a reassembled PDU]"
"188","76.151987","192.168.43.215","52.113.194.133","TCP","54","52004  >  443 [ACK] Seq=2407 Ack=103754 Win=66048 Len=0"
"189","76.152031","52.113.194.133","192.168.43.215","TCP","1406","443  >  52004 [ACK] Seq=103754 Ack=2407 Win=523520 Len=1352 [TCP segment of a reassembled PDU]"
"190","76.152068","52.113.194.133","192.168.43.215","TLSv1.2","172","Application Data"
"191","76.152094","192.168.43.215","52.113.194.133","TCP","54","52004  >  443 [ACK] Seq=2407 Ack=105224 Win=66048 Len=0"
"192","76.152132","52.113.194.133","192.168.43.215","TCP","1406","443  >  52004 [ACK] Seq=105224 Ack=2407 Win=523520 Len=1352 [TCP segment of a reassembled PDU]"
"193","76.152170","52.113.194.133","192.168.43.215","TCP","1406","443  >  52004 [ACK] Seq=106576 Ack=2407 Win=523520 Len=1352 [TCP segment of a reassembled PDU]"
"194","76.152198","192.168.43.215","52.113.194.133","TCP","54","52004  >  443 [ACK] Seq=2407 Ack=107928 Win=66048 Len=0"
"195","76.152243","52.113.194.133","192.168.43.215","TLSv1.2","111","Application Data"
"196","76.152288","52.113.194.133","192.168.43.215","TCP","1406","443  >  52004 [ACK] Seq=107985 Ack=2407 Win=523520 Len=1352 [TCP segment of a reassembled PDU]"
"197","76.152319","192.168.43.215","52.113.194.133","TCP","54","52004  >  443 [ACK] Seq=2407 Ack=109337 Win=66048 Len=0"
"198","76.152375","52.113.194.133","192.168.43.215","TCP","1406","443  >  52004 [ACK] Seq=109337 Ack=2407 Win=523520 Len=1352 [TCP segment of a reassembled PDU]"
"199","76.152422","52.113.194.133","192.168.43.215","TCP","1406","443  >  52004 [ACK] Seq=110689 Ack=2407 Win=523520 Len=1352 [TCP segment of a reassembled PDU]"
"200","76.152450","192.168.43.215","52.113.194.133","TCP","54","52004  >  443 [ACK] Seq=2407 Ack=112041 Win=66048 Len=0"
"201","76.152505","52.113.194.133","192.168.43.215","TCP","1406","443  >  52004 [ACK] Seq=112041 Ack=2407 Win=523520 Len=1352 [TCP segment of a reassembled PDU]"
"202","76.152546","52.113.194.133","192.168.43.215","TLSv1.2","1272","Application Data"
"203","76.152577","192.168.43.215","52.113.194.133","TCP","54","52004  >  443 [ACK] Seq=2407 Ack=114611 Win=66048 Len=0"
"204","76.152620","52.113.194.133","192.168.43.215","TLSv1.2","92","Application Data"
"205","76.199552","192.168.43.215","52.113.194.133","TCP","54","52004  >  443 [ACK] Seq=2407 Ack=114649 Win=66048 Len=0"
"206","78.483452","192.168.43.215","52.113.194.133","TLSv1.2","198","Application Data"
"207","78.521308","52.113.194.133","192.168.43.215","TCP","54","443  >  52004 [ACK] Seq=114649 Ack=2551 Win=523264 Len=0"
"208","78.559513","52.113.194.133","192.168.43.215","TCP","1406","443  >  52004 [ACK] Seq=114649 Ack=2551 Win=523264 Len=1352 [TCP segment of a reassembled PDU]"
"209","78.559673","52.113.194.133","192.168.43.215","TLSv1.2","284","Application Data"
"210","78.559734","192.168.43.215","52.113.194.133","TCP","54","52004  >  443 [ACK] Seq=2551 Ack=116231 Win=66048 Len=0"
"211","78.559840","52.113.194.133","192.168.43.215","TCP","1406","443  >  52004 [ACK] Seq=116231 Ack=2551 Win=523264 Len=1352 [TCP segment of a reassembled PDU]"
"212","78.559884","52.113.194.133","192.168.43.215","TCP","1406","443  >  52004 [ACK] Seq=117583 Ack=2551 Win=523264 Len=1352 [TCP segment of a reassembled PDU]"
"213","78.559920","192.168.43.215","52.113.194.133","TCP","54","52004  >  443 [ACK] Seq=2551 Ack=118935 Win=66048 Len=0"
"214","78.559969","52.113.194.133","192.168.43.215","TCP","1406","443  >  52004 [ACK] Seq=118935 Ack=2551 Win=523264 Len=1352 [TCP segment of a reassembled PDU]"
"215","78.560017","52.113.194.133","192.168.43.215","TCP","1406","443  >  52004 [ACK] Seq=120287 Ack=2551 Win=523264 Len=1352 [TCP segment of a reassembled PDU]"
"216","78.560050","192.168.43.215","52.113.194.133","TCP","54","52004  >  443 [ACK] Seq=2551 Ack=121639 Win=66048 Len=0"
"217","78.563423","52.113.194.133","192.168.43.215","TCP","1406","443  >  52004 [ACK] Seq=121639 Ack=2551 Win=523264 Len=1352 [TCP segment of a reassembled PDU]"
"218","78.563568","52.113.194.133","192.168.43.215","TCP","1406","443  >  52004 [ACK] Seq=122991 Ack=2551 Win=523264 Len=1352 [TCP segment of a reassembled PDU]"
"219","78.563630","192.168.43.215","52.113.194.133","TCP","54","52004  >  443 [ACK] Seq=2551 Ack=124343 Win=66048 Len=0"
"220","78.563710","52.113.194.133","192.168.43.215","TLSv1.2","172","Application Data"
"221","78.564065","52.113.194.133","192.168.43.215","TCP","1406","443  >  52004 [ACK] Seq=124461 Ack=2551 Win=523264 Len=1352 [TCP segment of a reassembled PDU]"
"222","78.564230","192.168.43.215","52.113.194.133","TCP","54","52004  >  443 [ACK] Seq=2551 Ack=125813 Win=66048 Len=0"
"223","78.564360","52.113.194.133","192.168.43.215","TCP","1406","443  >  52004 [ACK] Seq=125813 Ack=2551 Win=523264 Len=1352 [TCP segment of a reassembled PDU]"
"224","78.567635","52.113.194.133","192.168.43.215","TCP","1406","443  >  52004 [ACK] Seq=127165 Ack=2551 Win=523264 Len=1352 [TCP segment of a reassembled PDU]"
"225","78.567799","192.168.43.215","52.113.194.133","TCP","54","52004  >  443 [ACK] Seq=2551 Ack=128517 Win=66048 Len=0"
"226","78.567939","52.113.194.133","192.168.43.215","TLSv1.2","187","Application Data"
"227","78.567990","52.113.194.133","192.168.43.215","TCP","1406","443  >  52004 [ACK] Seq=128650 Ack=2551 Win=523264 Len=1352 [TCP segment of a reassembled PDU]"
"228","78.568027","192.168.43.215","52.113.194.133","TCP","54","52004  >  443 [ACK] Seq=2551 Ack=130002 Win=66048 Len=0"
"229","78.568084","52.113.194.133","192.168.43.215","TLSv1.2","768","Application Data"
"230","78.568131","52.113.194.133","192.168.43.215","TLSv1.2","92","Application Data"
"231","78.568163","192.168.43.215","52.113.194.133","TCP","54","52004  >  443 [ACK] Seq=2551 Ack=130754 Win=65280 Len=0"
"232","81.780534","192.168.43.215","52.113.194.133","TLSv1.2","224","Application Data"
"233","81.950526","52.113.194.133","192.168.43.215","TCP","54","443  >  52004 [ACK] Seq=130754 Ack=2721 Win=524544 Len=0"
"234","81.975642","52.113.194.133","192.168.43.215","TCP","1406","443  >  52004 [ACK] Seq=130754 Ack=2721 Win=524544 Len=1352 [TCP segment of a reassembled PDU]"
"235","81.975854","52.113.194.133","192.168.43.215","TLSv1.2","284","Application Data"
"236","81.975959","192.168.43.215","52.113.194.133","TCP","54","52004  >  443 [ACK] Seq=2721 Ack=132336 Win=66048 Len=0"
"237","81.976101","52.113.194.133","192.168.43.215","TCP","1406","443  >  52004 [ACK] Seq=132336 Ack=2721 Win=524544 Len=1352 [TCP segment of a reassembled PDU]"
"238","81.976158","52.113.194.133","192.168.43.215","TCP","1406","443  >  52004 [ACK] Seq=133688 Ack=2721 Win=524544 Len=1352 [TCP segment of a reassembled PDU]"
"239","81.976200","192.168.43.215","52.113.194.133","TCP","54","52004  >  443 [ACK] Seq=2721 Ack=135040 Win=66048 Len=0"
"240","81.976259","52.113.194.133","192.168.43.215","TCP","1406","443  >  52004 [ACK] Seq=135040 Ack=2721 Win=524544 Len=1352 [TCP segment of a reassembled PDU]"
"241","81.977426","52.113.194.133","192.168.43.215","TCP","1406","443  >  52004 [ACK] Seq=136392 Ack=2721 Win=524544 Len=1352 [TCP segment of a reassembled PDU]"
"242","81.977502","192.168.43.215","52.113.194.133","TCP","54","52004  >  443 [ACK] Seq=2721 Ack=137744 Win=66048 Len=0"
"243","81.977586","52.113.194.133","192.168.43.215","TCP","1406","443  >  52004 [ACK] Seq=137744 Ack=2721 Win=524544 Len=1352 [TCP segment of a reassembled PDU]"
"244","81.978520","52.113.194.133","192.168.43.215","TCP","1406","443  >  52004 [ACK] Seq=139096 Ack=2721 Win=524544 Len=1352 [TCP segment of a reassembled PDU]"
"245","81.978606","192.168.43.215","52.113.194.133","TCP","54","52004  >  443 [ACK] Seq=2721 Ack=140448 Win=66048 Len=0"
"246","81.978678","52.113.194.133","192.168.43.215","TLSv1.2","172","Application Data"
"247","81.978727","52.113.194.133","192.168.43.215","TCP","1406","443  >  52004 [ACK] Seq=140566 Ack=2721 Win=524544 Len=1352 [TCP segment of a reassembled PDU]"
"248","81.978760","192.168.43.215","52.113.194.133","TCP","54","52004  >  443 [ACK] Seq=2721 Ack=141918 Win=66048 Len=0"
"249","81.978822","52.113.194.133","192.168.43.215","TCP","1406","443  >  52004 [ACK] Seq=141918 Ack=2721 Win=524544 Len=1352 [TCP segment of a reassembled PDU]"
"250","81.978869","52.113.194.133","192.168.43.215","TCP","1406","443  >  52004 [ACK] Seq=143270 Ack=2721 Win=524544 Len=1352 [TCP segment of a reassembled PDU]"
"251","81.978906","192.168.43.215","52.113.194.133","TCP","54","52004  >  443 [ACK] Seq=2721 Ack=144622 Win=66048 Len=0"
"252","81.978953","52.113.194.133","192.168.43.215","TLSv1.2","187","Application Data"
"253","81.982558","52.113.194.133","192.168.43.215","TCP","1406","443  >  52004 [ACK] Seq=144755 Ack=2721 Win=524544 Len=1352 [TCP segment of a reassembled PDU]"
"254","81.982656","192.168.43.215","52.113.194.133","TCP","54","52004  >  443 [ACK] Seq=2721 Ack=146107 Win=66048 Len=0"
"255","81.982742","52.113.194.133","192.168.43.215","TCP","1406","443  >  52004 [ACK] Seq=146107 Ack=2721 Win=524544 Len=1352 [TCP segment of a reassembled PDU]"
"256","81.999591","52.113.194.133","192.168.43.215","TCP","1406","443  >  52004 [ACK] Seq=147459 Ack=2721 Win=524544 Len=1352 [TCP segment of a reassembled PDU]"
"257","81.999686","192.168.43.215","52.113.194.133","TCP","54","52004  >  443 [ACK] Seq=2721 Ack=148811 Win=66048 Len=0"
"258","81.999752","52.113.194.133","192.168.43.215","TCP","1406","443  >  52004 [ACK] Seq=148811 Ack=2721 Win=524544 Len=1352 [TCP segment of a reassembled PDU]"
"259","81.999784","52.113.194.133","192.168.43.215","TLSv1.2","667","Application Data"
"260","81.999808","192.168.43.215","52.113.194.133","TCP","54","52004  >  443 [ACK] Seq=2721 Ack=150776 Win=66048 Len=0"
"261","81.999835","52.113.194.133","192.168.43.215","TLSv1.2","92","Application Data"
"262","82.050418","192.168.43.215","52.113.194.133","TCP","54","52004  >  443 [ACK] Seq=2721 Ack=150814 Win=66048 Len=0"
"263","82.129522","52.113.194.133","192.168.43.215","TCP","1406","[TCP Spurious Retransmission] 443  >  52004 [PSH, ACK] Seq=149462 Ack=2721 Win=524544 Len=1352[Reassembly error, protocol TCP: New fragment overlaps old data (retransmission?)]"
"264","82.129594","192.168.43.215","52.113.194.133","TCP","66","[TCP Dup ACK 262#1] 52004  >  443 [ACK] Seq=2721 Ack=150814 Win=66048 Len=0 SLE=149462 SRE=150814"
"265","95.578832","192.168.43.215","52.113.194.133","TLSv1.2","228","Application Data"
"266","95.579557","192.168.43.215","52.113.194.133","TLSv1.2","100","Application Data"
"267","95.946782","192.168.43.215","52.113.194.133","TCP","274","[TCP Retransmission] 52004  >  443 [PSH, ACK] Seq=2721 Ack=150814 Win=66048 Len=220"
"268","96.003857","52.113.194.133","192.168.43.215","TCP","54","443  >  52004 [ACK] Seq=150814 Ack=2895 Win=524288 Len=0"
"269","96.003955","52.113.194.133","192.168.43.215","TCP","54","443  >  52004 [ACK] Seq=150814 Ack=2941 Win=524288 Len=0"
"270","96.004243","52.113.194.133","192.168.43.215","TLSv1.2","100","Application Data"
"271","96.004760","52.113.194.133","192.168.43.215","TCP","66","[TCP Dup ACK 269#1] 443  >  52004 [ACK] Seq=150860 Ack=2941 Win=524288 Len=0 SLE=2721 SRE=2941"
"272","96.050792","192.168.43.215","52.113.194.133","TCP","54","52004  >  443 [ACK] Seq=2941 Ack=150860 Win=66048 Len=0"
"273","96.281086","52.113.194.133","192.168.43.215","TCP","1406","443  >  52004 [ACK] Seq=150860 Ack=2941 Win=524288 Len=1352 [TCP segment of a reassembled PDU]"
"274","96.281199","52.113.194.133","192.168.43.215","TLSv1.2","377","Application Data"
"275","96.281249","192.168.43.215","52.113.194.133","TCP","54","52004  >  443 [ACK] Seq=2941 Ack=152535 Win=66048 Len=0"
"276","96.281445","52.113.194.133","192.168.43.215","TCP","1406","443  >  52004 [ACK] Seq=152535 Ack=2941 Win=524288 Len=1352 [TCP segment of a reassembled PDU]"
"277","96.281682","52.113.194.133","192.168.43.215","TCP","1406","443  >  52004 [ACK] Seq=153887 Ack=2941 Win=524288 Len=1352 [TCP segment of a reassembled PDU]"
"278","96.281733","192.168.43.215","52.113.194.133","TCP","54","52004  >  443 [ACK] Seq=2941 Ack=155239 Win=66048 Len=0"
"279","96.282382","52.113.194.133","192.168.43.215","TCP","1406","443  >  52004 [ACK] Seq=155239 Ack=2941 Win=524288 Len=1352 [TCP segment of a reassembled PDU]"
"280","96.282847","52.113.194.133","192.168.43.215","TCP","1406","443  >  52004 [ACK] Seq=156591 Ack=2941 Win=524288 Len=1352 [TCP segment of a reassembled PDU]"
"281","96.282905","192.168.43.215","52.113.194.133","TCP","54","52004  >  443 [ACK] Seq=2941 Ack=157943 Win=66048 Len=0"
"282","96.283121","52.113.194.133","192.168.43.215","TCP","1406","443  >  52004 [ACK] Seq=157943 Ack=2941 Win=524288 Len=1352 [TCP segment of a reassembled PDU]"
"283","96.283175","52.113.194.133","192.168.43.215","TCP","1406","443  >  52004 [ACK] Seq=159295 Ack=2941 Win=524288 Len=1352 [TCP segment of a reassembled PDU]"
"284","96.283211","192.168.43.215","52.113.194.133","TCP","54","52004  >  443 [ACK] Seq=2941 Ack=160647 Win=66048 Len=0"
"285","96.283339","52.113.194.133","192.168.43.215","TLSv1.2","172","Application Data"
"286","96.283617","52.113.194.133","192.168.43.215","TCP","1406","443  >  52004 [ACK] Seq=160765 Ack=2941 Win=524288 Len=1352 [TCP segment of a reassembled PDU]"
"287","96.283703","192.168.43.215","52.113.194.133","TCP","54","52004  >  443 [ACK] Seq=2941 Ack=162117 Win=66048 Len=0"
"288","96.283851","52.113.194.133","192.168.43.215","TCP","1406","443  >  52004 [ACK] Seq=162117 Ack=2941 Win=524288 Len=1352 [TCP segment of a reassembled PDU]"
"289","96.283913","52.113.194.133","192.168.43.215","TCP","1406","443  >  52004 [ACK] Seq=163469 Ack=2941 Win=524288 Len=1352 [TCP segment of a reassembled PDU]"
"290","96.283958","192.168.43.215","52.113.194.133","TCP","54","52004  >  443 [ACK] Seq=2941 Ack=164821 Win=66048 Len=0"
"291","96.284011","52.113.194.133","192.168.43.215","TLSv1.2","187","Application Data"
"292","96.286280","52.113.194.133","192.168.43.215","TCP","1406","443  >  52004 [ACK] Seq=164954 Ack=2941 Win=524288 Len=1352 [TCP segment of a reassembled PDU]"
"293","96.286356","192.168.43.215","52.113.194.133","TCP","54","52004  >  443 [ACK] Seq=2941 Ack=166306 Win=66048 Len=0"
"294","96.286415","52.113.194.133","192.168.43.215","TCP","1406","443  >  52004 [ACK] Seq=166306 Ack=2941 Win=524288 Len=1352 [TCP segment of a reassembled PDU]"
"295","96.286467","52.113.194.133","192.168.43.215","TCP","1406","443  >  52004 [ACK] Seq=167658 Ack=2941 Win=524288 Len=1352 [TCP segment of a reassembled PDU]"
"296","96.286502","192.168.43.215","52.113.194.133","TCP","54","52004  >  443 [ACK] Seq=2941 Ack=169010 Win=66048 Len=0"
"297","96.286554","52.113.194.133","192.168.43.215","TLSv1.2","1071","Application Data"
"298","96.286594","52.113.194.133","192.168.43.215","TLSv1.2","92","Application Data"
"299","96.286625","192.168.43.215","52.113.194.133","TCP","54","52004  >  443 [ACK] Seq=2941 Ack=170065 Win=65024 Len=0"
"300","104.795575","192.168.43.215","52.113.194.133","TLSv1.2","276","Application Data"
"301","104.834217","52.113.194.133","192.168.43.215","TCP","54","443  >  52004 [ACK] Seq=170065 Ack=3163 Win=524032 Len=0"
"302","104.958091","52.113.194.133","192.168.43.215","TCP","1406","443  >  52004 [ACK] Seq=170065 Ack=3163 Win=524032 Len=1352 [TCP segment of a reassembled PDU]"
"303","104.958235","52.113.194.133","192.168.43.215","TCP","1406","443  >  52004 [ACK] Seq=171417 Ack=3163 Win=524032 Len=1352 [TCP segment of a reassembled PDU]"
"304","104.958295","192.168.43.215","52.113.194.133","TCP","54","52004  >  443 [ACK] Seq=3163 Ack=172769 Win=66048 Len=0"
"305","104.958453","52.113.194.133","192.168.43.215","TLSv1.2","486","Application Data"
"306","104.958508","52.113.194.133","192.168.43.215","TCP","1406","443  >  52004 [ACK] Seq=173201 Ack=3163 Win=524032 Len=1352 [TCP segment of a reassembled PDU]"
"307","104.958555","192.168.43.215","52.113.194.133","TCP","54","52004  >  443 [ACK] Seq=3163 Ack=174553 Win=66048 Len=0"
"308","104.958765","52.113.194.133","192.168.43.215","TCP","1406","443  >  52004 [ACK] Seq=174553 Ack=3163 Win=524032 Len=1352 [TCP segment of a reassembled PDU]"
