"No.","Time","Source","Destination","Protocol","Length","Info"
"1","0.000000","192.168.43.215","52.113.194.133","TCP","55","49262  >  443 [ACK] Seq=1 Ack=1 Win=258 Len=1 [TCP segment of a reassembled PDU]"
"2","0.041435","52.113.194.133","192.168.43.215","TCP","66","443  >  49262 [ACK] Seq=1 Ack=2 Win=2051 Len=0 SLE=1 SRE=2"
"3","29.823995","192.168.43.215","52.113.194.133","TLSv1.2","258","Ignored Unknown Record"
"4","29.824061","192.168.43.215","52.113.194.133","TLSv1.2","100","Application Data"
"5","29.857694","52.113.194.133","192.168.43.215","TCP","54","443  >  49262 [ACK] Seq=1 Ack=252 Win=2050 Len=0"
"6","29.858513","52.113.194.133","192.168.43.215","TLSv1.2","100","Application Data"
"7","29.908235","192.168.43.215","52.113.194.133","TCP","54","49262  >  443 [ACK] Seq=252 Ack=47 Win=258 Len=0"
"8","29.910448","52.113.194.133","192.168.43.215","TCP","1354","443  >  49262 [ACK] Seq=47 Ack=252 Win=2050 Len=1300 [TCP segment of a reassembled PDU]"
"9","29.910599","52.113.194.133","192.168.43.215","TLSv1.2","336","Application Data"
"10","29.910680","192.168.43.215","52.113.194.133","TCP","54","49262  >  443 [ACK] Seq=252 Ack=1629 Win=258 Len=0"
"11","29.910892","52.113.194.133","192.168.43.215","TCP","1354","443  >  49262 [ACK] Seq=1629 Ack=252 Win=2050 Len=1300 [TCP segment of a reassembled PDU]"
"12","29.912204","52.113.194.133","192.168.43.215","TCP","1354","443  >  49262 [ACK] Seq=2929 Ack=252 Win=2050 Len=1300 [TCP segment of a reassembled PDU]"
"13","29.912253","192.168.43.215","52.113.194.133","TCP","54","49262  >  443 [ACK] Seq=252 Ack=4229 Win=258 Len=0"
"14","29.912445","52.113.194.133","192.168.43.215","TCP","1354","443  >  49262 [ACK] Seq=4229 Ack=252 Win=2050 Len=1300 [TCP segment of a reassembled PDU]"
"15","29.912704","52.113.194.133","192.168.43.215","TCP","1354","443  >  49262 [ACK] Seq=5529 Ack=252 Win=2050 Len=1300 [TCP segment of a reassembled PDU]"
"16","29.912732","192.168.43.215","52.113.194.133","TCP","54","49262  >  443 [ACK] Seq=252 Ack=6829 Win=258 Len=0"
"17","29.912980","52.113.194.133","192.168.43.215","TCP","1354","443  >  49262 [ACK] Seq=6829 Ack=252 Win=2050 Len=1300 [TCP segment of a reassembled PDU]"
"18","29.913244","52.113.194.133","192.168.43.215","TCP","1354","443  >  49262 [ACK] Seq=8129 Ack=252 Win=2050 Len=1300 [TCP segment of a reassembled PDU]"
"19","29.913279","192.168.43.215","52.113.194.133","TCP","54","49262  >  443 [ACK] Seq=252 Ack=9429 Win=258 Len=0"
"20","29.913380","52.113.194.133","192.168.43.215","TLSv1.2","484","Application Data"
"21","29.914117","52.113.194.133","192.168.43.215","TCP","1354","443  >  49262 [ACK] Seq=9859 Ack=252 Win=2050 Len=1300 [TCP segment of a reassembled PDU]"
"22","29.914144","192.168.43.215","52.113.194.133","TCP","54","49262  >  443 [ACK] Seq=252 Ack=11159 Win=258 Len=0"
"23","29.914290","52.113.194.133","192.168.43.215","TCP","1354","443  >  49262 [ACK] Seq=11159 Ack=252 Win=2050 Len=1300 [TCP segment of a reassembled PDU]"
"24","29.914544","52.113.194.133","192.168.43.215","TCP","1354","443  >  49262 [ACK] Seq=12459 Ack=252 Win=2050 Len=1300 [TCP segment of a reassembled PDU]"
"25","29.914571","192.168.43.215","52.113.194.133","TCP","54","49262  >  443 [ACK] Seq=252 Ack=13759 Win=258 Len=0"
"26","29.914685","52.113.194.133","192.168.43.215","TLSv1.2","343","Application Data"
"27","29.914856","52.113.194.133","192.168.43.215","TCP","1354","443  >  49262 [ACK] Seq=14048 Ack=252 Win=2050 Len=1300 [TCP segment of a reassembled PDU]"
"28","29.914883","192.168.43.215","52.113.194.133","TCP","54","49262  >  443 [ACK] Seq=252 Ack=15348 Win=258 Len=0"
"29","29.915131","52.113.194.133","192.168.43.215","TCP","1354","443  >  49262 [ACK] Seq=15348 Ack=252 Win=2050 Len=1300 [TCP segment of a reassembled PDU]"
"30","29.915389","52.113.194.133","192.168.43.215","TCP","1354","443  >  49262 [ACK] Seq=16648 Ack=252 Win=2050 Len=1300 [TCP segment of a reassembled PDU]"
"31","29.915422","192.168.43.215","52.113.194.133","TCP","54","49262  >  443 [ACK] Seq=252 Ack=17948 Win=258 Len=0"
"32","29.916256","52.113.194.133","192.168.43.215","TCP","1354","443  >  49262 [ACK] Seq=17948 Ack=252 Win=2050 Len=1300 [TCP segment of a reassembled PDU]"
"33","29.916354","52.113.194.133","192.168.43.215","TCP","1354","443  >  49262 [ACK] Seq=19248 Ack=252 Win=2050 Len=1300 [TCP segment of a reassembled PDU]"
"34","29.916389","192.168.43.215","52.113.194.133","TCP","54","49262  >  443 [ACK] Seq=252 Ack=20548 Win=258 Len=0"
"35","29.916490","52.113.194.133","192.168.43.215","TLSv1.2","141","Application Data"
"36","29.917185","52.113.194.133","192.168.43.215","TLSv1.2","92","Application Data"
"37","29.917236","192.168.43.215","52.113.194.133","TCP","54","49262  >  443 [ACK] Seq=252 Ack=20673 Win=258 Len=0"
"38","43.772810","192.168.43.215","52.113.194.133","TLSv1.2","186","Application Data"
"39","43.772878","192.168.43.215","52.113.194.133","TLSv1.2","100","Application Data"
"40","43.796146","52.113.194.133","192.168.43.215","TCP","54","443  >  49262 [ACK] Seq=20673 Ack=384 Win=2049 Len=0"
"41","43.796992","52.113.194.133","192.168.43.215","TCP","54","443  >  49262 [ACK] Seq=20673 Ack=430 Win=2049 Len=0"
"42","43.797123","52.113.194.133","192.168.43.215","TLSv1.2","100","Application Data"
"43","43.839326","52.113.194.133","192.168.43.215","TCP","1354","443  >  49262 [ACK] Seq=20719 Ack=430 Win=2049 Len=1300 [TCP segment of a reassembled PDU]"
"44","43.839428","192.168.43.215","52.113.194.133","TCP","54","49262  >  443 [ACK] Seq=430 Ack=22019 Win=258 Len=0"
"45","43.839522","52.113.194.133","192.168.43.215","TLSv1.2","336","Application Data"
"46","43.839669","52.113.194.133","192.168.43.215","TCP","1354","443  >  49262 [ACK] Seq=22301 Ack=430 Win=2049 Len=1300 [TCP segment of a reassembled PDU]"
"47","43.839773","192.168.43.215","52.113.194.133","TCP","54","49262  >  443 [ACK] Seq=430 Ack=23601 Win=258 Len=0"
"48","43.839948","52.113.194.133","192.168.43.215","TCP","1354","443  >  49262 [ACK] Seq=23601 Ack=430 Win=2049 Len=1300 [TCP segment of a reassembled PDU]"
"49","43.840089","52.113.194.133","192.168.43.215","TCP","1354","443  >  49262 [ACK] Seq=24901 Ack=430 Win=2049 Len=1300 [TCP segment of a reassembled PDU]"
"50","43.840139","192.168.43.215","52.113.194.133","TCP","54","49262  >  443 [ACK] Seq=430 Ack=26201 Win=258 Len=0"
"51","43.840305","52.113.194.133","192.168.43.215","TCP","1354","443  >  49262 [ACK] Seq=26201 Ack=430 Win=2049 Len=1300 [TCP segment of a reassembled PDU]"
"52","43.840448","52.113.194.133","192.168.43.215","TCP","1354","443  >  49262 [ACK] Seq=27501 Ack=430 Win=2049 Len=1300 [TCP segment of a reassembled PDU]"
"53","43.840491","192.168.43.215","52.113.194.133","TCP","54","49262  >  443 [ACK] Seq=430 Ack=28801 Win=258 Len=0"
"54","43.840674","52.113.194.133","192.168.43.215","TCP","1354","443  >  49262 [ACK] Seq=28801 Ack=430 Win=2049 Len=1300 [TCP segment of a reassembled PDU]"
"55","43.840834","52.113.194.133","192.168.43.215","TLSv1.2","484","Application Data"
"56","43.840898","192.168.43.215","52.113.194.133","TCP","54","49262  >  443 [ACK] Seq=430 Ack=30531 Win=258 Len=0"
"57","43.843001","52.113.194.133","192.168.43.215","TCP","1354","443  >  49262 [ACK] Seq=30531 Ack=430 Win=2049 Len=1300 [TCP segment of a reassembled PDU]"
"58","43.843168","52.113.194.133","192.168.43.215","TCP","1354","443  >  49262 [ACK] Seq=31831 Ack=430 Win=2049 Len=1300 [TCP segment of a reassembled PDU]"
"59","43.843235","192.168.43.215","52.113.194.133","TCP","54","49262  >  443 [ACK] Seq=430 Ack=33131 Win=258 Len=0"
"60","43.843384","52.113.194.133","192.168.43.215","TCP","1354","443  >  49262 [ACK] Seq=33131 Ack=430 Win=2049 Len=1300 [TCP segment of a reassembled PDU]"
"61","43.843487","52.113.194.133","192.168.43.215","TLSv1.2","343","Application Data"
"62","43.843545","192.168.43.215","52.113.194.133","TCP","54","49262  >  443 [ACK] Seq=430 Ack=34720 Win=258 Len=0"
"63","43.844460","52.113.194.133","192.168.43.215","TCP","1354","443  >  49262 [ACK] Seq=34720 Ack=430 Win=2049 Len=1300 [TCP segment of a reassembled PDU]"
"64","43.844607","52.113.194.133","192.168.43.215","TCP","1354","443  >  49262 [ACK] Seq=36020 Ack=430 Win=2049 Len=1300 [TCP segment of a reassembled PDU]"
"65","43.844675","192.168.43.215","52.113.194.133","TCP","54","49262  >  443 [ACK] Seq=430 Ack=37320 Win=258 Len=0"
"66","43.844791","52.113.194.133","192.168.43.215","TCP","1354","443  >  49262 [ACK] Seq=37320 Ack=430 Win=2049 Len=1300 [TCP segment of a reassembled PDU]"
"67","43.844921","52.113.194.133","192.168.43.215","TCP","1354","443  >  49262 [ACK] Seq=38620 Ack=430 Win=2049 Len=1300 [TCP segment of a reassembled PDU]"
"68","43.844988","192.168.43.215","52.113.194.133","TCP","54","49262  >  443 [ACK] Seq=430 Ack=39920 Win=258 Len=0"
"69","43.845127","52.113.194.133","192.168.43.215","TCP","1354","443  >  49262 [ACK] Seq=39920 Ack=430 Win=2049 Len=1300 [TCP segment of a reassembled PDU]"
"70","43.845258","52.113.194.133","192.168.43.215","TLSv1.2","141","Application Data"
"71","43.845305","192.168.43.215","52.113.194.133","TCP","54","49262  >  443 [ACK] Seq=430 Ack=41307 Win=258 Len=0"
"72","43.845358","52.113.194.133","192.168.43.215","TLSv1.2","92","Application Data"
"73","43.899142","192.168.43.215","52.113.194.133","TCP","54","49262  >  443 [ACK] Seq=430 Ack=41345 Win=258 Len=0"
"74","66.503381","192.168.43.215","52.113.194.133","TLSv1.2","186","Application Data"
"75","66.503741","192.168.43.215","52.113.194.133","TLSv1.2","100","Application Data"
"76","66.536180","52.113.194.133","192.168.43.215","TCP","54","443  >  49262 [ACK] Seq=41345 Ack=608 Win=2048 Len=0"
"77","66.536290","52.113.194.133","192.168.43.215","TLSv1.2","100","Application Data"
"78","66.587621","192.168.43.215","52.113.194.133","TCP","54","49262  >  443 [ACK] Seq=608 Ack=41391 Win=258 Len=0"
"79","66.606713","52.113.194.133","192.168.43.215","TCP","1354","443  >  49262 [ACK] Seq=41391 Ack=608 Win=2048 Len=1300 [TCP segment of a reassembled PDU]"
"80","66.606873","52.113.194.133","192.168.43.215","TLSv1.2","336","Application Data"
"81","66.606921","192.168.43.215","52.113.194.133","TCP","54","49262  >  443 [ACK] Seq=608 Ack=42973 Win=258 Len=0"
"82","66.606957","52.113.194.133","192.168.43.215","TCP","1354","443  >  49262 [ACK] Seq=42973 Ack=608 Win=2048 Len=1300 [TCP segment of a reassembled PDU]"
"83","66.607129","52.113.194.133","192.168.43.215","TCP","1354","443  >  49262 [ACK] Seq=44273 Ack=608 Win=2048 Len=1300 [TCP segment of a reassembled PDU]"
"84","66.607163","192.168.43.215","52.113.194.133","TCP","54","49262  >  443 [ACK] Seq=608 Ack=45573 Win=258 Len=0"
"85","66.607438","52.113.194.133","192.168.43.215","TCP","1354","443  >  49262 [ACK] Seq=45573 Ack=608 Win=2048 Len=1300 [TCP segment of a reassembled PDU]"
"86","66.607673","52.113.194.133","192.168.43.215","TCP","1354","443  >  49262 [ACK] Seq=46873 Ack=608 Win=2048 Len=1300 [TCP segment of a reassembled PDU]"
"87","66.607702","192.168.43.215","52.113.194.133","TCP","54","49262  >  443 [ACK] Seq=608 Ack=48173 Win=258 Len=0"
"88","66.607807","52.113.194.133","192.168.43.215","TCP","1354","443  >  49262 [ACK] Seq=48173 Ack=608 Win=2048 Len=1300 [TCP segment of a reassembled PDU]"
"89","66.607996","52.113.194.133","192.168.43.215","TCP","1354","443  >  49262 [ACK] Seq=49473 Ack=608 Win=2048 Len=1300 [TCP segment of a reassembled PDU]"
"90","66.608032","192.168.43.215","52.113.194.133","TCP","54","49262  >  443 [ACK] Seq=608 Ack=50773 Win=258 Len=0"
"91","66.608130","52.113.194.133","192.168.43.215","TLSv1.2","484","Application Data"
"92","66.608278","52.113.194.133","192.168.43.215","TCP","1354","443  >  49262 [ACK] Seq=51203 Ack=608 Win=2048 Len=1300 [TCP segment of a reassembled PDU]"
"93","66.608306","192.168.43.215","52.113.194.133","TCP","54","49262  >  443 [ACK] Seq=608 Ack=52503 Win=258 Len=0"
"94","66.608443","52.113.194.133","192.168.43.215","TCP","1354","443  >  49262 [ACK] Seq=52503 Ack=608 Win=2048 Len=1300 [TCP segment of a reassembled PDU]"
"95","66.608758","52.113.194.133","192.168.43.215","TCP","1354","443  >  49262 [ACK] Seq=53803 Ack=608 Win=2048 Len=1300 [TCP segment of a reassembled PDU]"
"96","66.608792","192.168.43.215","52.113.194.133","TCP","54","49262  >  443 [ACK] Seq=608 Ack=55103 Win=258 Len=0"
"97","66.608847","52.113.194.133","192.168.43.215","TLSv1.2","343","Application Data"
"98","66.609045","52.113.194.133","192.168.43.215","TCP","1354","443  >  49262 [ACK] Seq=55392 Ack=608 Win=2048 Len=1300 [TCP segment of a reassembled PDU]"
"99","66.609082","192.168.43.215","52.113.194.133","TCP","54","49262  >  443 [ACK] Seq=608 Ack=56692 Win=258 Len=0"
"100","66.609235","52.113.194.133","192.168.43.215","TCP","1354","443  >  49262 [ACK] Seq=56692 Ack=608 Win=2048 Len=1300 [TCP segment of a reassembled PDU]"
"101","66.609306","52.113.194.133","192.168.43.215","TCP","1354","443  >  49262 [ACK] Seq=57992 Ack=608 Win=2048 Len=1300 [TCP segment of a reassembled PDU]"
"102","66.609329","192.168.43.215","52.113.194.133","TCP","54","49262  >  443 [ACK] Seq=608 Ack=59292 Win=258 Len=0"
"103","66.609485","52.113.194.133","192.168.43.215","TCP","1354","443  >  49262 [ACK] Seq=59292 Ack=608 Win=2048 Len=1300 [TCP segment of a reassembled PDU]"
"104","66.609746","52.113.194.133","192.168.43.215","TCP","1354","443  >  49262 [ACK] Seq=60592 Ack=608 Win=2048 Len=1300 [TCP segment of a reassembled PDU]"
"105","66.609782","192.168.43.215","52.113.194.133","TCP","54","49262  >  443 [ACK] Seq=608 Ack=61892 Win=258 Len=0"
"106","66.609819","52.113.194.133","192.168.43.215","TLSv1.2","141","Application Data"
"107","66.609871","52.113.194.133","192.168.43.215","TLSv1.2","92","Application Data"
"108","66.609909","192.168.43.215","52.113.194.133","TCP","54","49262  >  443 [ACK] Seq=608 Ack=62017 Win=258 Len=0"
"109","70.505739","192.168.43.215","52.113.194.133","TLSv1.2","186","Application Data"
"110","70.535128","52.113.194.133","192.168.43.215","TCP","54","443  >  49262 [ACK] Seq=62017 Ack=740 Win=2048 Len=0"
"111","70.745936","52.113.194.133","192.168.43.215","TCP","1354","443  >  49262 [ACK] Seq=62017 Ack=740 Win=2048 Len=1300 [TCP segment of a reassembled PDU]"
"112","70.746006","52.113.194.133","192.168.43.215","TLSv1.2","337","Application Data"
"113","70.746034","192.168.43.215","52.113.194.133","TCP","54","49262  >  443 [ACK] Seq=740 Ack=63600 Win=258 Len=0"
"114","70.746199","52.113.194.133","192.168.43.215","TCP","1354","443  >  49262 [ACK] Seq=63600 Ack=740 Win=2048 Len=1300 [TCP segment of a reassembled PDU]"
"115","70.748312","52.113.194.133","192.168.43.215","TCP","1354","443  >  49262 [ACK] Seq=64900 Ack=740 Win=2048 Len=1300 [TCP segment of a reassembled PDU]"
"116","70.748383","192.168.43.215","52.113.194.133","TCP","54","49262  >  443 [ACK] Seq=740 Ack=66200 Win=258 Len=0"
"117","70.748520","52.113.194.133","192.168.43.215","TCP","1354","443  >  49262 [ACK] Seq=66200 Ack=740 Win=2048 Len=1300 [TCP segment of a reassembled PDU]"
"118","70.748782","52.113.194.133","192.168.43.215","TCP","1354","443  >  49262 [ACK] Seq=67500 Ack=740 Win=2048 Len=1300 [TCP segment of a reassembled PDU]"
"119","70.748820","192.168.43.215","52.113.194.133","TCP","54","49262  >  443 [ACK] Seq=740 Ack=68800 Win=258 Len=0"
"120","70.750496","52.113.194.133","192.168.43.215","TCP","1354","443  >  49262 [ACK] Seq=68800 Ack=740 Win=2048 Len=1300 [TCP segment of a reassembled PDU]"
"121","70.750644","52.113.194.133","192.168.43.215","TCP","1354","443  >  49262 [ACK] Seq=70100 Ack=740 Win=2048 Len=1300 [TCP segment of a reassembled PDU]"
"122","70.750715","192.168.43.215","52.113.194.133","TCP","54","49262  >  443 [ACK] Seq=740 Ack=71400 Win=258 Len=0"
"123","70.750789","52.113.194.133","192.168.43.215","TLSv1.2","484","Application Data"
"124","70.751027","52.113.194.133","192.168.43.215","TCP","1354","443  >  49262 [ACK] Seq=71830 Ack=740 Win=2048 Len=1300 [TCP segment of a reassembled PDU]"
"125","70.751071","192.168.43.215","52.113.194.133","TCP","54","49262  >  443 [ACK] Seq=740 Ack=73130 Win=258 Len=0"
"126","70.753676","52.113.194.133","192.168.43.215","TCP","1354","443  >  49262 [ACK] Seq=73130 Ack=740 Win=2048 Len=1300 [TCP segment of a reassembled PDU]"
"127","70.753790","52.113.194.133","192.168.43.215","TCP","1354","443  >  49262 [ACK] Seq=74430 Ack=740 Win=2048 Len=1300 [TCP segment of a reassembled PDU]"
"128","70.753821","192.168.43.215","52.113.194.133","TCP","54","49262  >  443 [ACK] Seq=740 Ack=75730 Win=258 Len=0"
"129","70.753910","52.113.194.133","192.168.43.215","TLSv1.2","343","Application Data"
"130","70.754237","52.113.194.133","192.168.43.215","TCP","1354","443  >  49262 [ACK] Seq=76019 Ack=740 Win=2048 Len=1300 [TCP segment of a reassembled PDU]"
"131","70.754327","192.168.43.215","52.113.194.133","TCP","54","49262  >  443 [ACK] Seq=740 Ack=77319 Win=258 Len=0"
"132","70.754445","52.113.194.133","192.168.43.215","TCP","1354","443  >  49262 [ACK] Seq=77319 Ack=740 Win=2048 Len=1300 [TCP segment of a reassembled PDU]"
"133","70.754525","52.113.194.133","192.168.43.215","TCP","1354","443  >  49262 [ACK] Seq=78619 Ack=740 Win=2048 Len=1300 [TCP segment of a reassembled PDU]"
"134","70.754555","192.168.43.215","52.113.194.133","TCP","54","49262  >  443 [ACK] Seq=740 Ack=79919 Win=258 Len=0"
"135","70.754754","52.113.194.133","192.168.43.215","TCP","1354","443  >  49262 [ACK] Seq=79919 Ack=740 Win=2048 Len=1300 [TCP segment of a reassembled PDU]"
"136","70.754921","52.113.194.133","192.168.43.215","TCP","1354","443  >  49262 [ACK] Seq=81219 Ack=740 Win=2048 Len=1300 [TCP segment of a reassembled PDU]"
"137","70.754954","192.168.43.215","52.113.194.133","TCP","54","49262  >  443 [ACK] Seq=740 Ack=82519 Win=258 Len=0"
"138","70.755035","52.113.194.133","192.168.43.215","TLSv1.2","141","Application Data"
"139","70.755134","52.113.194.133","192.168.43.215","TLSv1.2","92","Application Data"
"140","70.755182","192.168.43.215","52.113.194.133","TCP","54","49262  >  443 [ACK] Seq=740 Ack=82644 Win=258 Len=0"
"141","72.579367","192.168.43.215","52.113.194.133","TLSv1.2","186","Application Data"
"142","72.616195","52.113.194.133","192.168.43.215","TCP","54","443  >  49262 [ACK] Seq=82644 Ack=872 Win=2047 Len=0"
"143","72.655490","52.113.194.133","192.168.43.215","TCP","1354","443  >  49262 [ACK] Seq=82644 Ack=872 Win=2047 Len=1300 [TCP segment of a reassembled PDU]"
"144","72.655584","52.113.194.133","192.168.43.215","TLSv1.2","349","Application Data"
"145","72.655632","192.168.43.215","52.113.194.133","TCP","54","49262  >  443 [ACK] Seq=872 Ack=84239 Win=258 Len=0"
"146","72.655837","52.113.194.133","192.168.43.215","TCP","1354","443  >  49262 [ACK] Seq=84239 Ack=872 Win=2047 Len=1300 [TCP segment of a reassembled PDU]"
"147","72.655992","52.113.194.133","192.168.43.215","TCP","1354","443  >  49262 [ACK] Seq=85539 Ack=872 Win=2047 Len=1300 [TCP segment of a reassembled PDU]"
"148","72.656046","192.168.43.215","52.113.194.133","TCP","54","49262  >  443 [ACK] Seq=872 Ack=86839 Win=258 Len=0"
"149","72.656188","52.113.194.133","192.168.43.215","TCP","1354","443  >  49262 [ACK] Seq=86839 Ack=872 Win=2047 Len=1300 [TCP segment of a reassembled PDU]"
"150","72.656442","52.113.194.133","192.168.43.215","TCP","1354","443  >  49262 [ACK] Seq=88139 Ack=872 Win=2047 Len=1300 [TCP segment of a reassembled PDU]"
"151","72.656485","192.168.43.215","52.113.194.133","TCP","54","49262  >  443 [ACK] Seq=872 Ack=89439 Win=258 Len=0"
"152","72.664356","52.113.194.133","192.168.43.215","TCP","1354","443  >  49262 [ACK] Seq=89439 Ack=872 Win=2047 Len=1300 [TCP segment of a reassembled PDU]"
"153","72.664581","52.113.194.133","192.168.43.215","TCP","1354","443  >  49262 [ACK] Seq=90739 Ack=872 Win=2047 Len=1300 [TCP segment of a reassembled PDU]"
"154","72.664658","192.168.43.215","52.113.194.133","TCP","54","49262  >  443 [ACK] Seq=872 Ack=92039 Win=258 Len=0"
"155","72.664735","52.113.194.133","192.168.43.215","TLSv1.2","484","Application Data"
"156","72.664800","52.113.194.133","192.168.43.215","TCP","1354","443  >  49262 [ACK] Seq=92469 Ack=872 Win=2047 Len=1300 [TCP segment of a reassembled PDU]"
"157","72.664836","192.168.43.215","52.113.194.133","TCP","54","49262  >  443 [ACK] Seq=872 Ack=93769 Win=258 Len=0"
"158","72.664878","52.113.194.133","192.168.43.215","TCP","1354","443  >  49262 [ACK] Seq=93769 Ack=872 Win=2047 Len=1300 [TCP segment of a reassembled PDU]"
"159","72.665086","52.113.194.133","192.168.43.215","TCP","1354","443  >  49262 [ACK] Seq=95069 Ack=872 Win=2047 Len=1300 [TCP segment of a reassembled PDU]"
"160","72.665148","192.168.43.215","52.113.194.133","TCP","54","49262  >  443 [ACK] Seq=872 Ack=96369 Win=258 Len=0"
"161","72.665212","52.113.194.133","192.168.43.215","TLSv1.2","343","Application Data"
"162","72.665276","52.113.194.133","192.168.43.215","TCP","1354","443  >  49262 [ACK] Seq=96658 Ack=872 Win=2047 Len=1300 [TCP segment of a reassembled PDU]"
"163","72.665314","192.168.43.215","52.113.194.133","TCP","54","49262  >  443 [ACK] Seq=872 Ack=97958 Win=258 Len=0"
"164","72.665396","52.113.194.133","192.168.43.215","TCP","1354","443  >  49262 [ACK] Seq=97958 Ack=872 Win=2047 Len=1300 [TCP segment of a reassembled PDU]"
"165","72.665645","52.113.194.133","192.168.43.215","TCP","1354","443  >  49262 [ACK] Seq=99258 Ack=872 Win=2047 Len=1300 [TCP segment of a reassembled PDU]"
"166","72.665690","192.168.43.215","52.113.194.133","TCP","54","49262  >  443 [ACK] Seq=872 Ack=100558 Win=258 Len=0"
"167","72.665808","52.113.194.133","192.168.43.215","TCP","1354","443  >  49262 [ACK] Seq=100558 Ack=872 Win=2047 Len=1300 [TCP segment of a reassembled PDU]"
"168","72.666069","52.113.194.133","192.168.43.215","TCP","1354","443  >  49262 [ACK] Seq=101858 Ack=872 Win=2047 Len=1300 [TCP segment of a reassembled PDU]"
"169","72.666108","192.168.43.215","52.113.194.133","TCP","54","49262  >  443 [ACK] Seq=872 Ack=103158 Win=258 Len=0"
"170","72.666183","52.113.194.133","192.168.43.215","TLSv1.2","141","Application Data"
"171","72.666299","52.113.194.133","192.168.43.215","TLSv1.2","92","Application Data"
"172","72.666341","192.168.43.215","52.113.194.133","TCP","54","49262  >  443 [ACK] Seq=872 Ack=103283 Win=258 Len=0"
"173","73.028271","192.168.43.215","52.113.194.133","TLSv1.2","120","Application Data"
"174","73.055287","52.113.194.133","192.168.43.215","TCP","54","443  >  49262 [ACK] Seq=103283 Ack=938 Win=2047 Len=0"
"175","73.106148","52.113.194.133","192.168.43.215","TCP","1354","443  >  49262 [ACK] Seq=103283 Ack=938 Win=2047 Len=1300 [TCP segment of a reassembled PDU]"
"176","73.106376","52.113.194.133","192.168.43.215","TCP","1354","443  >  49262 [ACK] Seq=104583 Ack=938 Win=2047 Len=1300 [TCP segment of a reassembled PDU]"
"177","73.106484","192.168.43.215","52.113.194.133","TCP","54","49262  >  443 [ACK] Seq=938 Ack=105883 Win=258 Len=0"
"178","73.106581","52.113.194.133","192.168.43.215","TLSv1.2","610","Application Data"
"179","73.109253","52.113.194.133","192.168.43.215","TCP","1354","443  >  49262 [ACK] Seq=106439 Ack=938 Win=2047 Len=1300 [TCP segment of a reassembled PDU]"
"180","73.109356","192.168.43.215","52.113.194.133","TCP","54","49262  >  443 [ACK] Seq=938 Ack=107739 Win=258 Len=0"
"181","73.109433","52.113.194.133","192.168.43.215","TCP","1354","443  >  49262 [ACK] Seq=107739 Ack=938 Win=2047 Len=1300 [TCP segment of a reassembled PDU]"
"182","73.109505","52.113.194.133","192.168.43.215","TCP","1354","443  >  49262 [ACK] Seq=109039 Ack=938 Win=2047 Len=1300 [TCP segment of a reassembled PDU]"
"183","73.109546","192.168.43.215","52.113.194.133","TCP","54","49262  >  443 [ACK] Seq=938 Ack=110339 Win=258 Len=0"
"184","73.109695","52.113.194.133","192.168.43.215","TCP","1354","443  >  49262 [ACK] Seq=110339 Ack=938 Win=2047 Len=1300 [TCP segment of a reassembled PDU]"
"185","73.109849","52.113.194.133","192.168.43.215","TCP","1354","443  >  49262 [ACK] Seq=111639 Ack=938 Win=2047 Len=1300 [TCP segment of a reassembled PDU]"
"186","73.109876","192.168.43.215","52.113.194.133","TCP","54","49262  >  443 [ACK] Seq=938 Ack=112939 Win=258 Len=0"
"187","73.109972","52.113.194.133","192.168.43.215","TCP","1354","443  >  49262 [ACK] Seq=112939 Ack=938 Win=2047 Len=1300 [TCP segment of a reassembled PDU]"
"188","73.110064","52.113.194.133","192.168.43.215","TLSv1.2","484","Application Data"
"189","73.110118","192.168.43.215","52.113.194.133","TCP","54","49262  >  443 [ACK] Seq=938 Ack=114669 Win=258 Len=0"
"190","73.110214","52.113.194.133","192.168.43.215","TCP","1354","443  >  49262 [ACK] Seq=114669 Ack=938 Win=2047 Len=1300 [TCP segment of a reassembled PDU]"
"191","73.110332","52.113.194.133","192.168.43.215","TCP","1354","443  >  49262 [ACK] Seq=115969 Ack=938 Win=2047 Len=1300 [TCP segment of a reassembled PDU]"
"192","73.110359","192.168.43.215","52.113.194.133","TCP","54","49262  >  443 [ACK] Seq=938 Ack=117269 Win=258 Len=0"
"193","73.110481","52.113.194.133","192.168.43.215","TCP","1354","443  >  49262 [ACK] Seq=117269 Ack=938 Win=2047 Len=1300 [TCP segment of a reassembled PDU]"
"194","73.110520","52.113.194.133","192.168.43.215","TLSv1.2","343","Application Data"
"195","73.110544","192.168.43.215","52.113.194.133","TCP","54","49262  >  443 [ACK] Seq=938 Ack=118858 Win=258 Len=0"
"196","73.110815","52.113.194.133","192.168.43.215","TCP","1354","443  >  49262 [ACK] Seq=118858 Ack=938 Win=2047 Len=1300 [TCP segment of a reassembled PDU]"
"197","73.110938","52.113.194.133","192.168.43.215","TCP","1354","443  >  49262 [ACK] Seq=120158 Ack=938 Win=2047 Len=1300 [TCP segment of a reassembled PDU]"
"198","73.110973","192.168.43.215","52.113.194.133","TCP","54","49262  >  443 [ACK] Seq=938 Ack=121458 Win=258 Len=0"
"199","73.111117","52.113.194.133","192.168.43.215","TCP","1354","443  >  49262 [ACK] Seq=121458 Ack=938 Win=2047 Len=1300 [TCP segment of a reassembled PDU]"
"200","73.111238","52.113.194.133","192.168.43.215","TCP","1354","443  >  49262 [ACK] Seq=122758 Ack=938 Win=2047 Len=1300 [TCP segment of a reassembled PDU]"
"201","73.111274","192.168.43.215","52.113.194.133","TCP","54","49262  >  443 [ACK] Seq=938 Ack=124058 Win=258 Len=0"
"202","73.111533","52.113.194.133","192.168.43.215","TCP","1354","443  >  49262 [ACK] Seq=124058 Ack=938 Win=2047 Len=1300 [TCP segment of a reassembled PDU]"
"203","73.111577","52.113.194.133","192.168.43.215","TLSv1.2","141","Application Data"
"204","73.111615","192.168.43.215","52.113.194.133","TCP","54","49262  >  443 [ACK] Seq=938 Ack=125445 Win=258 Len=0"
"205","73.111689","52.113.194.133","192.168.43.215","TLSv1.2","92","Application Data"
"206","73.161974","192.168.43.215","52.113.194.133","TCP","54","49262  >  443 [ACK] Seq=938 Ack=125483 Win=258 Len=0"
"207","73.703888","192.168.43.215","52.113.194.133","TLSv1.2","186","Application Data"
"208","73.728065","52.113.194.133","192.168.43.215","TCP","54","443  >  49262 [ACK] Seq=125483 Ack=1070 Win=2047 Len=0"
"209","73.785518","52.113.194.133","192.168.43.215","TCP","1354","443  >  49262 [ACK] Seq=125483 Ack=1070 Win=2047 Len=1300 [TCP segment of a reassembled PDU]"
"210","73.785603","52.113.194.133","192.168.43.215","TLSv1.2","336","Application Data"
"211","73.785635","192.168.43.215","52.113.194.133","TCP","54","49262  >  443 [ACK] Seq=1070 Ack=127065 Win=258 Len=0"
"212","73.785763","52.113.194.133","192.168.43.215","TCP","1354","443  >  49262 [ACK] Seq=127065 Ack=1070 Win=2047 Len=1300 [TCP segment of a reassembled PDU]"
"213","73.785906","52.113.194.133","192.168.43.215","TCP","1354","443  >  49262 [ACK] Seq=128365 Ack=1070 Win=2047 Len=1300 [TCP segment of a reassembled PDU]"
"214","73.785938","192.168.43.215","52.113.194.133","TCP","54","49262  >  443 [ACK] Seq=1070 Ack=129665 Win=258 Len=0"
"215","73.786190","52.113.194.133","192.168.43.215","TCP","1354","443  >  49262 [ACK] Seq=129665 Ack=1070 Win=2047 Len=1300 [TCP segment of a reassembled PDU]"
"216","73.786457","52.113.194.133","192.168.43.215","TCP","1354","443  >  49262 [ACK] Seq=130965 Ack=1070 Win=2047 Len=1300 [TCP segment of a reassembled PDU]"
"217","73.786498","192.168.43.215","52.113.194.133","TCP","54","49262  >  443 [ACK] Seq=1070 Ack=132265 Win=258 Len=0"
"218","73.794383","52.113.194.133","192.168.43.215","TCP","1354","443  >  49262 [ACK] Seq=132265 Ack=1070 Win=2047 Len=1300 [TCP segment of a reassembled PDU]"
"219","73.794629","52.113.194.133","192.168.43.215","TCP","1354","443  >  49262 [ACK] Seq=133565 Ack=1070 Win=2047 Len=1300 [TCP segment of a reassembled PDU]"
"220","73.794743","192.168.43.215","52.113.194.133","TCP","54","49262  >  443 [ACK] Seq=1070 Ack=134865 Win=258 Len=0"
"221","73.794818","52.113.194.133","192.168.43.215","TLSv1.2","484","Application Data"
"222","73.794909","52.113.194.133","192.168.43.215","TCP","1354","443  >  49262 [ACK] Seq=135295 Ack=1070 Win=2047 Len=1300 [TCP segment of a reassembled PDU]"
"223","73.794959","192.168.43.215","52.113.194.133","TCP","54","49262  >  443 [ACK] Seq=1070 Ack=136595 Win=258 Len=0"
"224","73.795013","52.113.194.133","192.168.43.215","TCP","1354","443  >  49262 [ACK] Seq=136595 Ack=1070 Win=2047 Len=1300 [TCP segment of a reassembled PDU]"
"225","73.795111","52.113.194.133","192.168.43.215","TCP","1354","443  >  49262 [ACK] Seq=137895 Ack=1070 Win=2047 Len=1300 [TCP segment of a reassembled PDU]"
"226","73.795141","192.168.43.215","52.113.194.133","TCP","54","49262  >  443 [ACK] Seq=1070 Ack=139195 Win=258 Len=0"
"227","73.795180","52.113.194.133","192.168.43.215","TLSv1.2","343","Application Data"
"228","73.795240","52.113.194.133","192.168.43.215","TCP","1354","443  >  49262 [ACK] Seq=139484 Ack=1070 Win=2047 Len=1300 [TCP segment of a reassembled PDU]"
"229","73.795272","192.168.43.215","52.113.194.133","TCP","54","49262  >  443 [ACK] Seq=1070 Ack=140784 Win=258 Len=0"
"230","73.795406","52.113.194.133","192.168.43.215","TCP","1354","443  >  49262 [ACK] Seq=140784 Ack=1070 Win=2047 Len=1300 [TCP segment of a reassembled PDU]"
"231","73.795554","52.113.194.133","192.168.43.215","TCP","1354","443  >  49262 [ACK] Seq=142084 Ack=1070 Win=2047 Len=1300 [TCP segment of a reassembled PDU]"
"232","73.795600","192.168.43.215","52.113.194.133","TCP","54","49262  >  443 [ACK] Seq=1070 Ack=143384 Win=258 Len=0"
"233","73.795873","52.113.194.133","192.168.43.215","TCP","1354","443  >  49262 [ACK] Seq=143384 Ack=1070 Win=2047 Len=1300 [TCP segment of a reassembled PDU]"
"234","73.796016","52.113.194.133","192.168.43.215","TCP","1354","443  >  49262 [ACK] Seq=144684 Ack=1070 Win=2047 Len=1300 [TCP segment of a reassembled PDU]"
"235","73.796063","192.168.43.215","52.113.194.133","TCP","54","49262  >  443 [ACK] Seq=1070 Ack=145984 Win=258 Len=0"
"236","73.796149","52.113.194.133","192.168.43.215","TLSv1.2","141","Application Data"
"237","73.796230","52.113.194.133","192.168.43.215","TLSv1.2","92","Application Data"
"238","73.796263","192.168.43.215","52.113.194.133","TCP","54","49262  >  443 [ACK] Seq=1070 Ack=146109 Win=258 Len=0"
"239","76.002484","192.168.43.215","52.113.194.133","TLSv1.2","186","Application Data"
"240","76.029283","52.113.194.133","192.168.43.215","TCP","54","443  >  49262 [ACK] Seq=146109 Ack=1202 Win=2046 Len=0"
"241","76.066552","52.113.194.133","192.168.43.215","TCP","1354","443  >  49262 [ACK] Seq=146109 Ack=1202 Win=2046 Len=1300 [TCP segment of a reassembled PDU]"
"242","76.066658","52.113.194.133","192.168.43.215","TLSv1.2","460","Application Data"
"243","76.066711","192.168.43.215","52.113.194.133","TCP","54","49262  >  443 [ACK] Seq=1202 Ack=147815 Win=258 Len=0"
"244","76.066834","52.113.194.133","192.168.43.215","TCP","1354","443  >  49262 [ACK] Seq=147815 Ack=1202 Win=2046 Len=1300 [TCP segment of a reassembled PDU]"
"245","76.066963","52.113.194.133","192.168.43.215","TCP","1354","443  >  49262 [ACK] Seq=149115 Ack=1202 Win=2046 Len=1300 [TCP segment of a reassembled PDU]"
"246","76.067014","192.168.43.215","52.113.194.133","TCP","54","49262  >  443 [ACK] Seq=1202 Ack=150415 Win=258 Len=0"
"247","76.067086","52.113.194.133","192.168.43.215","TCP","1354","443  >  49262 [ACK] Seq=150415 Ack=1202 Win=2046 Len=1300 [TCP segment of a reassembled PDU]"
"248","76.067263","52.113.194.133","192.168.43.215","TCP","1354","443  >  49262 [ACK] Seq=151715 Ack=1202 Win=2046 Len=1300 [TCP segment of a reassembled PDU]"
"249","76.067311","192.168.43.215","52.113.194.133","TCP","54","49262  >  443 [ACK] Seq=1202 Ack=153015 Win=258 Len=0"
"250","76.067407","52.113.194.133","192.168.43.215","TCP","1354","443  >  49262 [ACK] Seq=153015 Ack=1202 Win=2046 Len=1300 [TCP segment of a reassembled PDU]"
"251","76.067571","52.113.194.133","192.168.43.215","TCP","1354","443  >  49262 [ACK] Seq=154315 Ack=1202 Win=2046 Len=1300 [TCP segment of a reassembled PDU]"
"252","76.067622","192.168.43.215","52.113.194.133","TCP","54","49262  >  443 [ACK] Seq=1202 Ack=155615 Win=258 Len=0"
"253","76.067713","52.113.194.133","192.168.43.215","TLSv1.2","484","Application Data"
"254","76.067868","52.113.194.133","192.168.43.215","TCP","1354","443  >  49262 [ACK] Seq=156045 Ack=1202 Win=2046 Len=1300 [TCP segment of a reassembled PDU]"
"255","76.067912","192.168.43.215","52.113.194.133","TCP","54","49262  >  443 [ACK] Seq=1202 Ack=157345 Win=258 Len=0"
"256","76.068084","52.113.194.133","192.168.43.215","TCP","1354","443  >  49262 [ACK] Seq=157345 Ack=1202 Win=2046 Len=1300 [TCP segment of a reassembled PDU]"
"257","76.068347","52.113.194.133","192.168.43.215","TCP","1354","443  >  49262 [ACK] Seq=158645 Ack=1202 Win=2046 Len=1300 [TCP segment of a reassembled PDU]"
"258","76.068403","192.168.43.215","52.113.194.133","TCP","54","49262  >  443 [ACK] Seq=1202 Ack=159945 Win=258 Len=0"
"259","76.068491","52.113.194.133","192.168.43.215","TLSv1.2","343","Application Data"
"260","76.068619","52.113.194.133","192.168.43.215","TCP","1354","443  >  49262 [ACK] Seq=160234 Ack=1202 Win=2046 Len=1300 [TCP segment of a reassembled PDU]"
"261","76.068671","192.168.43.215","52.113.194.133","TCP","54","49262  >  443 [ACK] Seq=1202 Ack=161534 Win=258 Len=0"
"262","76.068869","52.113.194.133","192.168.43.215","TCP","1354","443  >  49262 [ACK] Seq=161534 Ack=1202 Win=2046 Len=1300 [TCP segment of a reassembled PDU]"
"263","76.069150","52.113.194.133","192.168.43.215","TCP","1354","443  >  49262 [ACK] Seq=162834 Ack=1202 Win=2046 Len=1300 [TCP segment of a reassembled PDU]"
"264","76.069213","192.168.43.215","52.113.194.133","TCP","54","49262  >  443 [ACK] Seq=1202 Ack=164134 Win=258 Len=0"
"265","76.069401","52.113.194.133","192.168.43.215","TCP","1354","443  >  49262 [ACK] Seq=164134 Ack=1202 Win=2046 Len=1300 [TCP segment of a reassembled PDU]"
"266","76.069546","52.113.194.133","192.168.43.215","TCP","1354","443  >  49262 [ACK] Seq=165434 Ack=1202 Win=2046 Len=1300 [TCP segment of a reassembled PDU]"
"267","76.069591","192.168.43.215","52.113.194.133","TCP","54","49262  >  443 [ACK] Seq=1202 Ack=166734 Win=258 Len=0"
"268","76.069662","52.113.194.133","192.168.43.215","TLSv1.2","141","Application Data"
"269","76.069809","52.113.194.133","192.168.43.215","TLSv1.2","92","Application Data"
"270","76.069868","192.168.43.215","52.113.194.133","TCP","54","49262  >  443 [ACK] Seq=1202 Ack=166859 Win=258 Len=0"
"271","77.087390","192.168.43.215","52.113.194.133","TLSv1.2","186","Application Data"
"272","77.145026","52.113.194.133","192.168.43.215","TCP","54","443  >  49262 [ACK] Seq=166859 Ack=1334 Win=2051 Len=0"
"273","77.156350","52.113.194.133","192.168.43.215","TCP","1354","443  >  49262 [ACK] Seq=166859 Ack=1334 Win=2051 Len=1300 [TCP segment of a reassembled PDU]"
"274","77.156431","52.113.194.133","192.168.43.215","TLSv1.2","336","Application Data"
"275","77.156469","192.168.43.215","52.113.194.133","TCP","54","49262  >  443 [ACK] Seq=1334 Ack=168441 Win=258 Len=0"
"276","77.156603","52.113.194.133","192.168.43.215","TCP","1354","443  >  49262 [ACK] Seq=168441 Ack=1334 Win=2051 Len=1300 [TCP segment of a reassembled PDU]"
"277","77.156756","52.113.194.133","192.168.43.215","TCP","1354","443  >  49262 [ACK] Seq=169741 Ack=1334 Win=2051 Len=1300 [TCP segment of a reassembled PDU]"
"278","77.156795","192.168.43.215","52.113.194.133","TCP","54","49262  >  443 [ACK] Seq=1334 Ack=171041 Win=258 Len=0"
"279","77.156936","52.113.194.133","192.168.43.215","TCP","1354","443  >  49262 [ACK] Seq=171041 Ack=1334 Win=2051 Len=1300 [TCP segment of a reassembled PDU]"
"280","77.157060","52.113.194.133","192.168.43.215","TCP","1354","443  >  49262 [ACK] Seq=172341 Ack=1334 Win=2051 Len=1300 [TCP segment of a reassembled PDU]"
"281","77.157109","192.168.43.215","52.113.194.133","TCP","54","49262  >  443 [ACK] Seq=1334 Ack=173641 Win=258 Len=0"
"282","77.157334","52.113.194.133","192.168.43.215","TCP","1354","443  >  49262 [ACK] Seq=173641 Ack=1334 Win=2051 Len=1300 [TCP segment of a reassembled PDU]"
"283","77.158167","52.113.194.133","192.168.43.215","TCP","1354","443  >  49262 [ACK] Seq=174941 Ack=1334 Win=2051 Len=1300 [TCP segment of a reassembled PDU]"
"284","77.158290","192.168.43.215","52.113.194.133","TCP","54","49262  >  443 [ACK] Seq=1334 Ack=176241 Win=258 Len=0"
"285","77.158373","52.113.194.133","192.168.43.215","TLSv1.2","484","Application Data"
"286","77.158451","52.113.194.133","192.168.43.215","TCP","1354","443  >  49262 [ACK] Seq=176671 Ack=1334 Win=2051 Len=1300 [TCP segment of a reassembled PDU]"
"287","77.158482","192.168.43.215","52.113.194.133","TCP","54","49262  >  443 [ACK] Seq=1334 Ack=177971 Win=258 Len=0"
"288","77.158525","52.113.194.133","192.168.43.215","TCP","1354","443  >  49262 [ACK] Seq=177971 Ack=1334 Win=2051 Len=1300 [TCP segment of a reassembled PDU]"
"289","77.158659","52.113.194.133","192.168.43.215","TCP","1354","443  >  49262 [ACK] Seq=179271 Ack=1334 Win=2051 Len=1300 [TCP segment of a reassembled PDU]"
"290","77.158722","192.168.43.215","52.113.194.133","TCP","54","49262  >  443 [ACK] Seq=1334 Ack=180571 Win=258 Len=0"
"291","77.158792","52.113.194.133","192.168.43.215","TLSv1.2","343","Application Data"
"292","77.158845","52.113.194.133","192.168.43.215","TCP","1354","443  >  49262 [ACK] Seq=180860 Ack=1334 Win=2051 Len=1300 [TCP segment of a reassembled PDU]"
"293","77.158893","192.168.43.215","52.113.194.133","TCP","54","49262  >  443 [ACK] Seq=1334 Ack=182160 Win=258 Len=0"
"294","77.159058","52.113.194.133","192.168.43.215","TCP","1354","443  >  49262 [ACK] Seq=182160 Ack=1334 Win=2051 Len=1300 [TCP segment of a reassembled PDU]"
"295","77.159187","52.113.194.133","192.168.43.215","TCP","1354","443  >  49262 [ACK] Seq=183460 Ack=1334 Win=2051 Len=1300 [TCP segment of a reassembled PDU]"
"296","77.159219","192.168.43.215","52.113.194.133","TCP","54","49262  >  443 [ACK] Seq=1334 Ack=184760 Win=258 Len=0"
"297","77.159648","52.113.194.133","192.168.43.215","TCP","1354","443  >  49262 [ACK] Seq=184760 Ack=1334 Win=2051 Len=1300 [TCP segment of a reassembled PDU]"
"298","77.160006","52.113.194.133","192.168.43.215","TCP","1354","443  >  49262 [ACK] Seq=186060 Ack=1334 Win=2051 Len=1300 [TCP segment of a reassembled PDU]"
"299","77.160091","192.168.43.215","52.113.194.133","TCP","54","49262  >  443 [ACK] Seq=1334 Ack=187360 Win=258 Len=0"
"300","77.160172","52.113.194.133","192.168.43.215","TLSv1.2","141","Application Data"
"301","77.160201","52.113.194.133","192.168.43.215","TLSv1.2","92","Application Data"
"302","77.160231","192.168.43.215","52.113.194.133","TCP","54","49262  >  443 [ACK] Seq=1334 Ack=187485 Win=258 Len=0"
"303","91.739771","192.168.43.215","52.113.194.133","TLSv1.2","186","Application Data"
"304","91.739941","192.168.43.215","52.113.194.133","TLSv1.2","100","Application Data"
"305","91.776556","52.113.194.133","192.168.43.215","TCP","54","443  >  49262 [ACK] Seq=187485 Ack=1512 Win=2050 Len=0"
"306","91.776621","52.113.194.133","192.168.43.215","TLSv1.2","100","Application Data"
