"No.","Time","Source","Destination","Protocol","Length","Info"
"1","0.000000","127.0.0.1","127.0.0.1","TCP","56","51944  >  33333 [SYN] Seq=0 Win=8192 Len=0 MSS=65495 WS=256 SACK_PERM=1"
"2","0.000057","127.0.0.1","127.0.0.1","TCP","56","33333  >  51944 [SYN, ACK] Seq=0 Ack=1 Win=8192 Len=0 MSS=65495 WS=256 SACK_PERM=1"
"3","0.000225","127.0.0.1","127.0.0.1","TCP","44","51944  >  33333 [ACK] Seq=1 Ack=1 Win=65536 Len=0"
"4","0.094547","127.0.0.1","127.0.0.1","TLSv1.2","256","Client Hello"
"5","0.094601","127.0.0.1","127.0.0.1","TCP","44","33333  >  51944 [ACK] Seq=1 Ack=213 Win=65536 Len=0"
"6","0.103829","127.0.0.1","127.0.0.1","TCP","1504","33333  >  51944 [ACK] Seq=1 Ack=213 Win=65536 Len=1460 [TCP segment of a reassembled PDU]"
"7","0.103842","127.0.0.1","127.0.0.1","TLSv1.2","268","Server Hello, Certificate, Server Key Exchange, Server Hello Done"
"8","0.103904","127.0.0.1","127.0.0.1","TCP","44","51944  >  33333 [ACK] Seq=213 Ack=1685 Win=65536 Len=0"
"9","0.145321","127.0.0.1","127.0.0.1","TLSv1.2","183","Client Key Exchange"
"10","0.145373","127.0.0.1","127.0.0.1","TCP","44","33333  >  51944 [ACK] Seq=1685 Ack=352 Win=65536 Len=0"
"11","0.164241","127.0.0.1","127.0.0.1","TLSv1.2","50","Change Cipher Spec"
"12","0.164298","127.0.0.1","127.0.0.1","TCP","44","33333  >  51944 [ACK] Seq=1685 Ack=358 Win=65536 Len=0"
"13","0.198366","127.0.0.1","127.0.0.1","TLSv1.2","129","Encrypted Handshake Message"
"14","0.198419","127.0.0.1","127.0.0.1","TCP","44","33333  >  51944 [ACK] Seq=1685 Ack=443 Win=65280 Len=0"
"15","0.198879","127.0.0.1","127.0.0.1","TLSv1.2","50","Change Cipher Spec"
"16","0.198935","127.0.0.1","127.0.0.1","TCP","44","51944  >  33333 [ACK] Seq=443 Ack=1691 Win=65536 Len=0"
"17","0.199225","127.0.0.1","127.0.0.1","TLSv1.2","129","Encrypted Handshake Message"
"18","0.199244","127.0.0.1","127.0.0.1","TCP","44","51944  >  33333 [ACK] Seq=443 Ack=1776 Win=65536 Len=0"
"19","0.443846","127.0.0.1","127.0.0.1","TLSv1.2","177","Application Data"
"20","0.443904","127.0.0.1","127.0.0.1","TCP","44","33333  >  51944 [ACK] Seq=1776 Ack=576 Win=65280 Len=0"
"21","0.444122","127.0.0.1","127.0.0.1","TLSv1.2","113","Application Data"
"22","0.444145","127.0.0.1","127.0.0.1","TCP","44","33333  >  51944 [ACK] Seq=1776 Ack=645 Win=65024 Len=0"
"23","0.450014","127.0.0.1","127.0.0.1","TCP","1504","33333  >  51944 [ACK] Seq=1776 Ack=645 Win=65024 Len=1460 [TCP segment of a reassembled PDU]"
"24","0.450026","127.0.0.1","127.0.0.1","TCP","1504","33333  >  51944 [ACK] Seq=3236 Ack=645 Win=65024 Len=1460 [TCP segment of a reassembled PDU]"
"25","0.450037","127.0.0.1","127.0.0.1","TLSv1.2","1289","Application Data"
"26","0.450095","127.0.0.1","127.0.0.1","TCP","44","51944  >  33333 [ACK] Seq=645 Ack=5941 Win=65536 Len=0"
"27","0.450508","127.0.0.1","127.0.0.1","TCP","1504","33333  >  51944 [ACK] Seq=5941 Ack=645 Win=65024 Len=1460 [TCP segment of a reassembled PDU]"
"28","0.450520","127.0.0.1","127.0.0.1","TCP","1504","33333  >  51944 [ACK] Seq=7401 Ack=645 Win=65024 Len=1460 [TCP segment of a reassembled PDU]"
"29","0.450530","127.0.0.1","127.0.0.1","TCP","1504","33333  >  51944 [ACK] Seq=8861 Ack=645 Win=65024 Len=1460 [TCP segment of a reassembled PDU]"
"30","0.450540","127.0.0.1","127.0.0.1","TCP","1504","33333  >  51944 [ACK] Seq=10321 Ack=645 Win=65024 Len=1460 [TCP segment of a reassembled PDU]"
"31","0.450550","127.0.0.1","127.0.0.1","TCP","1504","33333  >  51944 [ACK] Seq=11781 Ack=645 Win=65024 Len=1460 [TCP segment of a reassembled PDU]"
"32","0.450560","127.0.0.1","127.0.0.1","TCP","1504","33333  >  51944 [ACK] Seq=13241 Ack=645 Win=65024 Len=1460 [TCP segment of a reassembled PDU]"
"33","0.450570","127.0.0.1","127.0.0.1","TCP","1504","33333  >  51944 [ACK] Seq=14701 Ack=645 Win=65024 Len=1460 [TCP segment of a reassembled PDU]"
"34","0.450580","127.0.0.1","127.0.0.1","TCP","1504","33333  >  51944 [ACK] Seq=16161 Ack=645 Win=65024 Len=1460 [TCP segment of a reassembled PDU]"
"35","0.450630","127.0.0.1","127.0.0.1","TCP","44","51944  >  33333 [ACK] Seq=645 Ack=17621 Win=65536 Len=0"
"36","0.450669","127.0.0.1","127.0.0.1","TCP","1504","33333  >  51944 [ACK] Seq=17621 Ack=645 Win=65024 Len=1460 [TCP segment of a reassembled PDU]"
"37","0.450680","127.0.0.1","127.0.0.1","TCP","1504","33333  >  51944 [ACK] Seq=19081 Ack=645 Win=65024 Len=1460 [TCP segment of a reassembled PDU]"
"38","0.450691","127.0.0.1","127.0.0.1","TCP","1504","33333  >  51944 [ACK] Seq=20541 Ack=645 Win=65024 Len=1460 [TCP segment of a reassembled PDU]"
"39","0.450702","127.0.0.1","127.0.0.1","TLSv1.2","437","Application Data"
"40","0.450737","127.0.0.1","127.0.0.1","TCP","44","51944  >  33333 [ACK] Seq=645 Ack=22394 Win=65536 Len=0"
"41","0.451161","127.0.0.1","127.0.0.1","TCP","1504","33333  >  51944 [ACK] Seq=22394 Ack=645 Win=65024 Len=1460 [TCP segment of a reassembled PDU]"
"42","0.451170","127.0.0.1","127.0.0.1","TCP","1504","33333  >  51944 [ACK] Seq=23854 Ack=645 Win=65024 Len=1460 [TCP segment of a reassembled PDU]"
"43","0.451183","127.0.0.1","127.0.0.1","TCP","1504","33333  >  51944 [ACK] Seq=25314 Ack=645 Win=65024 Len=1460 [TCP segment of a reassembled PDU]"
"44","0.451197","127.0.0.1","127.0.0.1","TCP","1504","33333  >  51944 [ACK] Seq=26774 Ack=645 Win=65024 Len=1460 [TCP segment of a reassembled PDU]"
"45","0.451209","127.0.0.1","127.0.0.1","TCP","1504","33333  >  51944 [ACK] Seq=28234 Ack=645 Win=65024 Len=1460 [TCP segment of a reassembled PDU]"
"46","0.451223","127.0.0.1","127.0.0.1","TCP","1504","33333  >  51944 [ACK] Seq=29694 Ack=645 Win=65024 Len=1460 [TCP segment of a reassembled PDU]"
"47","0.451235","127.0.0.1","127.0.0.1","TCP","1504","33333  >  51944 [ACK] Seq=31154 Ack=645 Win=65024 Len=1460 [TCP segment of a reassembled PDU]"
"48","0.451247","127.0.0.1","127.0.0.1","TCP","1504","33333  >  51944 [ACK] Seq=32614 Ack=645 Win=65024 Len=1460 [TCP segment of a reassembled PDU]"
"49","0.451261","127.0.0.1","127.0.0.1","TCP","1504","33333  >  51944 [ACK] Seq=34074 Ack=645 Win=65024 Len=1460 [TCP segment of a reassembled PDU]"
"50","0.451274","127.0.0.1","127.0.0.1","TCP","1504","33333  >  51944 [ACK] Seq=35534 Ack=645 Win=65024 Len=1460 [TCP segment of a reassembled PDU]"
"51","0.451286","127.0.0.1","127.0.0.1","TCP","1504","33333  >  51944 [ACK] Seq=36994 Ack=645 Win=65024 Len=1460 [TCP segment of a reassembled PDU]"
"52","0.451298","127.0.0.1","127.0.0.1","TLSv1.2","437","Application Data"
"53","0.451383","127.0.0.1","127.0.0.1","TCP","44","51944  >  33333 [ACK] Seq=645 Ack=38847 Win=65536 Len=0"
"54","0.451860","127.0.0.1","127.0.0.1","TCP","1504","33333  >  51944 [ACK] Seq=38847 Ack=645 Win=65024 Len=1460 [TCP segment of a reassembled PDU]"
"55","0.451873","127.0.0.1","127.0.0.1","TCP","1504","33333  >  51944 [ACK] Seq=40307 Ack=645 Win=65024 Len=1460 [TCP segment of a reassembled PDU]"
"56","0.451885","127.0.0.1","127.0.0.1","TCP","1504","33333  >  51944 [ACK] Seq=41767 Ack=645 Win=65024 Len=1460 [TCP segment of a reassembled PDU]"
"57","0.451898","127.0.0.1","127.0.0.1","TCP","1504","33333  >  51944 [ACK] Seq=43227 Ack=645 Win=65024 Len=1460 [TCP segment of a reassembled PDU]"
"58","0.451909","127.0.0.1","127.0.0.1","TCP","1504","33333  >  51944 [ACK] Seq=44687 Ack=645 Win=65024 Len=1460 [TCP segment of a reassembled PDU]"
"59","0.451921","127.0.0.1","127.0.0.1","TCP","1504","33333  >  51944 [ACK] Seq=46147 Ack=645 Win=65024 Len=1460 [TCP segment of a reassembled PDU]"
"60","0.451930","127.0.0.1","127.0.0.1","TCP","1504","33333  >  51944 [ACK] Seq=47607 Ack=645 Win=65024 Len=1460 [TCP segment of a reassembled PDU]"
"61","0.451940","127.0.0.1","127.0.0.1","TCP","1504","33333  >  51944 [ACK] Seq=49067 Ack=645 Win=65024 Len=1460 [TCP segment of a reassembled PDU]"
"62","0.451950","127.0.0.1","127.0.0.1","TCP","1504","33333  >  51944 [ACK] Seq=50527 Ack=645 Win=65024 Len=1460 [TCP segment of a reassembled PDU]"
"63","0.451959","127.0.0.1","127.0.0.1","TCP","1504","33333  >  51944 [ACK] Seq=51987 Ack=645 Win=65024 Len=1460 [TCP segment of a reassembled PDU]"
"64","0.451969","127.0.0.1","127.0.0.1","TCP","1504","33333  >  51944 [ACK] Seq=53447 Ack=645 Win=65024 Len=1460 [TCP segment of a reassembled PDU]"
"65","0.451981","127.0.0.1","127.0.0.1","TLSv1.2","437","Application Data"
"66","0.452045","127.0.0.1","127.0.0.1","TCP","44","51944  >  33333 [ACK] Seq=645 Ack=55300 Win=65536 Len=0"
"67","0.452479","127.0.0.1","127.0.0.1","TCP","1504","33333  >  51944 [ACK] Seq=55300 Ack=645 Win=65024 Len=1460 [TCP segment of a reassembled PDU]"
"68","0.452489","127.0.0.1","127.0.0.1","TCP","1504","33333  >  51944 [ACK] Seq=56760 Ack=645 Win=65024 Len=1460 [TCP segment of a reassembled PDU]"
"69","0.452499","127.0.0.1","127.0.0.1","TCP","1504","33333  >  51944 [ACK] Seq=58220 Ack=645 Win=65024 Len=1460 [TCP segment of a reassembled PDU]"
"70","0.452508","127.0.0.1","127.0.0.1","TCP","1504","33333  >  51944 [ACK] Seq=59680 Ack=645 Win=65024 Len=1460 [TCP segment of a reassembled PDU]"
"71","0.452517","127.0.0.1","127.0.0.1","TCP","1504","33333  >  51944 [ACK] Seq=61140 Ack=645 Win=65024 Len=1460 [TCP segment of a reassembled PDU]"
"72","0.452526","127.0.0.1","127.0.0.1","TCP","1504","33333  >  51944 [ACK] Seq=62600 Ack=645 Win=65024 Len=1460 [TCP segment of a reassembled PDU]"
"73","0.452536","127.0.0.1","127.0.0.1","TCP","1504","33333  >  51944 [ACK] Seq=64060 Ack=645 Win=65024 Len=1460 [TCP segment of a reassembled PDU]"
"74","0.452549","127.0.0.1","127.0.0.1","TCP","1504","33333  >  51944 [ACK] Seq=65520 Ack=645 Win=65024 Len=1460 [TCP segment of a reassembled PDU]"
"75","0.452562","127.0.0.1","127.0.0.1","TCP","1504","33333  >  51944 [ACK] Seq=66980 Ack=645 Win=65024 Len=1460 [TCP segment of a reassembled PDU]"
"76","0.452571","127.0.0.1","127.0.0.1","TCP","1504","33333  >  51944 [ACK] Seq=68440 Ack=645 Win=65024 Len=1460 [TCP segment of a reassembled PDU]"
"77","0.452581","127.0.0.1","127.0.0.1","TCP","1504","33333  >  51944 [ACK] Seq=69900 Ack=645 Win=65024 Len=1460 [TCP segment of a reassembled PDU]"
"78","0.452598","127.0.0.1","127.0.0.1","TLSv1.2","437","Application Data"
"79","0.452675","127.0.0.1","127.0.0.1","TCP","44","51944  >  33333 [ACK] Seq=645 Ack=71753 Win=65536 Len=0"
"80","0.453165","127.0.0.1","127.0.0.1","TCP","1504","33333  >  51944 [ACK] Seq=71753 Ack=645 Win=65024 Len=1460 [TCP segment of a reassembled PDU]"
"81","0.453176","127.0.0.1","127.0.0.1","TCP","1504","33333  >  51944 [ACK] Seq=73213 Ack=645 Win=65024 Len=1460 [TCP segment of a reassembled PDU]"
"82","0.453185","127.0.0.1","127.0.0.1","TCP","1504","33333  >  51944 [ACK] Seq=74673 Ack=645 Win=65024 Len=1460 [TCP segment of a reassembled PDU]"
"83","0.453195","127.0.0.1","127.0.0.1","TCP","1504","33333  >  51944 [ACK] Seq=76133 Ack=645 Win=65024 Len=1460 [TCP segment of a reassembled PDU]"
"84","0.453205","127.0.0.1","127.0.0.1","TCP","1504","33333  >  51944 [ACK] Seq=77593 Ack=645 Win=65024 Len=1460 [TCP segment of a reassembled PDU]"
"85","0.453213","127.0.0.1","127.0.0.1","TCP","1504","33333  >  51944 [ACK] Seq=79053 Ack=645 Win=65024 Len=1460 [TCP segment of a reassembled PDU]"
"86","0.453223","127.0.0.1","127.0.0.1","TCP","1504","33333  >  51944 [ACK] Seq=80513 Ack=645 Win=65024 Len=1460 [TCP segment of a reassembled PDU]"
"87","0.453232","127.0.0.1","127.0.0.1","TCP","1504","33333  >  51944 [ACK] Seq=81973 Ack=645 Win=65024 Len=1460 [TCP segment of a reassembled PDU]"
"88","0.453242","127.0.0.1","127.0.0.1","TCP","1504","33333  >  51944 [ACK] Seq=83433 Ack=645 Win=65024 Len=1460 [TCP segment of a reassembled PDU]"
"89","0.453251","127.0.0.1","127.0.0.1","TCP","1504","33333  >  51944 [ACK] Seq=84893 Ack=645 Win=65024 Len=1460 [TCP segment of a reassembled PDU]"
"90","0.453260","127.0.0.1","127.0.0.1","TCP","1504","33333  >  51944 [ACK] Seq=86353 Ack=645 Win=65024 Len=1460 [TCP segment of a reassembled PDU]"
"91","0.453275","127.0.0.1","127.0.0.1","TLSv1.2","437","Application Data"
"92","0.453342","127.0.0.1","127.0.0.1","TCP","44","51944  >  33333 [ACK] Seq=645 Ack=88206 Win=49152 Len=0"
"93","0.453844","127.0.0.1","127.0.0.1","TCP","1504","33333  >  51944 [ACK] Seq=88206 Ack=645 Win=65024 Len=1460 [TCP segment of a reassembled PDU]"
"94","0.453857","127.0.0.1","127.0.0.1","TCP","1504","33333  >  51944 [ACK] Seq=89666 Ack=645 Win=65024 Len=1460 [TCP segment of a reassembled PDU]"
"95","0.453870","127.0.0.1","127.0.0.1","TCP","1504","33333  >  51944 [ACK] Seq=91126 Ack=645 Win=65024 Len=1460 [TCP segment of a reassembled PDU]"
"96","0.453882","127.0.0.1","127.0.0.1","TCP","1504","33333  >  51944 [ACK] Seq=92586 Ack=645 Win=65024 Len=1460 [TCP segment of a reassembled PDU]"
"97","0.453895","127.0.0.1","127.0.0.1","TCP","1504","33333  >  51944 [ACK] Seq=94046 Ack=645 Win=65024 Len=1460 [TCP segment of a reassembled PDU]"
"98","0.453908","127.0.0.1","127.0.0.1","TCP","1504","33333  >  51944 [ACK] Seq=95506 Ack=645 Win=65024 Len=1460 [TCP segment of a reassembled PDU]"
"99","0.453919","127.0.0.1","127.0.0.1","TCP","1504","33333  >  51944 [ACK] Seq=96966 Ack=645 Win=65024 Len=1460 [TCP segment of a reassembled PDU]"
"100","0.453930","127.0.0.1","127.0.0.1","TCP","1504","33333  >  51944 [ACK] Seq=98426 Ack=645 Win=65024 Len=1460 [TCP segment of a reassembled PDU]"
"101","0.453940","127.0.0.1","127.0.0.1","TCP","1504","33333  >  51944 [ACK] Seq=99886 Ack=645 Win=65024 Len=1460 [TCP segment of a reassembled PDU]"
"102","0.453951","127.0.0.1","127.0.0.1","TCP","1504","33333  >  51944 [ACK] Seq=101346 Ack=645 Win=65024 Len=1460 [TCP segment of a reassembled PDU]"
"103","0.453963","127.0.0.1","127.0.0.1","TCP","1504","33333  >  51944 [ACK] Seq=102806 Ack=645 Win=65024 Len=1460 [TCP segment of a reassembled PDU]"
"104","0.453976","127.0.0.1","127.0.0.1","TLSv1.2","437","Application Data"
"105","0.454036","127.0.0.1","127.0.0.1","TCP","44","51944  >  33333 [ACK] Seq=645 Ack=104659 Win=32768 Len=0"
"106","0.454508","127.0.0.1","127.0.0.1","TCP","1504","33333  >  51944 [ACK] Seq=104659 Ack=645 Win=65024 Len=1460 [TCP segment of a reassembled PDU]"
"107","0.454521","127.0.0.1","127.0.0.1","TCP","1504","33333  >  51944 [ACK] Seq=106119 Ack=645 Win=65024 Len=1460 [TCP segment of a reassembled PDU]"
"108","0.454533","127.0.0.1","127.0.0.1","TCP","1504","33333  >  51944 [ACK] Seq=107579 Ack=645 Win=65024 Len=1460 [TCP segment of a reassembled PDU]"
"109","0.454545","127.0.0.1","127.0.0.1","TCP","1504","33333  >  51944 [ACK] Seq=109039 Ack=645 Win=65024 Len=1460 [TCP segment of a reassembled PDU]"
"110","0.454556","127.0.0.1","127.0.0.1","TCP","1504","33333  >  51944 [ACK] Seq=110499 Ack=645 Win=65024 Len=1460 [TCP segment of a reassembled PDU]"
"111","0.454569","127.0.0.1","127.0.0.1","TCP","1504","33333  >  51944 [ACK] Seq=111959 Ack=645 Win=65024 Len=1460 [TCP segment of a reassembled PDU]"
"112","0.454581","127.0.0.1","127.0.0.1","TCP","1504","33333  >  51944 [ACK] Seq=113419 Ack=645 Win=65024 Len=1460 [TCP segment of a reassembled PDU]"
"113","0.454592","127.0.0.1","127.0.0.1","TCP","1504","33333  >  51944 [ACK] Seq=114879 Ack=645 Win=65024 Len=1460 [TCP segment of a reassembled PDU]"
"114","0.454603","127.0.0.1","127.0.0.1","TCP","1504","33333  >  51944 [ACK] Seq=116339 Ack=645 Win=65024 Len=1460 [TCP segment of a reassembled PDU]"
"115","0.454615","127.0.0.1","127.0.0.1","TCP","1504","33333  >  51944 [ACK] Seq=117799 Ack=645 Win=65024 Len=1460 [TCP segment of a reassembled PDU]"
"116","0.454627","127.0.0.1","127.0.0.1","TCP","1504","33333  >  51944 [ACK] Seq=119259 Ack=645 Win=65024 Len=1460 [TCP segment of a reassembled PDU]"
"117","0.454638","127.0.0.1","127.0.0.1","TLSv1.2","437","Application Data"
"118","0.454702","127.0.0.1","127.0.0.1","TCP","44","51944  >  33333 [ACK] Seq=645 Ack=121112 Win=16128 Len=0"
"119","0.455147","127.0.0.1","127.0.0.1","TCP","1504","33333  >  51944 [ACK] Seq=121112 Ack=645 Win=65024 Len=1460 [TCP segment of a reassembled PDU]"
"120","0.455156","127.0.0.1","127.0.0.1","TCP","1504","33333  >  51944 [ACK] Seq=122572 Ack=645 Win=65024 Len=1460 [TCP segment of a reassembled PDU]"
"121","0.455165","127.0.0.1","127.0.0.1","TCP","1504","33333  >  51944 [ACK] Seq=124032 Ack=645 Win=65024 Len=1460 [TCP segment of a reassembled PDU]"
"122","0.455174","127.0.0.1","127.0.0.1","TCP","1504","33333  >  51944 [ACK] Seq=125492 Ack=645 Win=65024 Len=1460 [TCP segment of a reassembled PDU]"
"123","0.455183","127.0.0.1","127.0.0.1","TCP","1504","33333  >  51944 [ACK] Seq=126952 Ack=645 Win=65024 Len=1460 [TCP segment of a reassembled PDU]"
"124","0.455192","127.0.0.1","127.0.0.1","TCP","1504","33333  >  51944 [ACK] Seq=128412 Ack=645 Win=65024 Len=1460 [TCP segment of a reassembled PDU]"
"125","0.455201","127.0.0.1","127.0.0.1","TCP","1504","33333  >  51944 [ACK] Seq=129872 Ack=645 Win=65024 Len=1460 [TCP segment of a reassembled PDU]"
"126","0.455210","127.0.0.1","127.0.0.1","TCP","1504","33333  >  51944 [ACK] Seq=131332 Ack=645 Win=65024 Len=1460 [TCP segment of a reassembled PDU]"
"127","0.455218","127.0.0.1","127.0.0.1","TCP","1504","33333  >  51944 [ACK] Seq=132792 Ack=645 Win=65024 Len=1460 [TCP segment of a reassembled PDU]"
"128","0.455227","127.0.0.1","127.0.0.1","TCP","1504","33333  >  51944 [ACK] Seq=134252 Ack=645 Win=65024 Len=1460 [TCP segment of a reassembled PDU]"
"129","0.455236","127.0.0.1","127.0.0.1","TCP","1504","33333  >  51944 [ACK] Seq=135712 Ack=645 Win=65024 Len=1460 [TCP segment of a reassembled PDU]"
"130","0.455291","127.0.0.1","127.0.0.1","TCP","44","51944  >  33333 [ACK] Seq=645 Ack=137172 Win=256 Len=0"
"131","0.456978","127.0.0.1","127.0.0.1","TCP","44","[TCP Window Update] 51944  >  33333 [ACK] Seq=645 Ack=137172 Win=65536 Len=0"
"132","0.457333","127.0.0.1","127.0.0.1","TLSv1.2","1504","Application Data [TCP segment of a reassembled PDU]"
"133","0.457344","127.0.0.1","127.0.0.1","TCP","1504","33333  >  51944 [ACK] Seq=138632 Ack=645 Win=65024 Len=1460 [TCP segment of a reassembled PDU]"
"134","0.457356","127.0.0.1","127.0.0.1","TCP","1504","33333  >  51944 [ACK] Seq=140092 Ack=645 Win=65024 Len=1460 [TCP segment of a reassembled PDU]"
"135","0.457367","127.0.0.1","127.0.0.1","TCP","1504","33333  >  51944 [ACK] Seq=141552 Ack=645 Win=65024 Len=1460 [TCP segment of a reassembled PDU]"
"136","0.457382","127.0.0.1","127.0.0.1","TCP","1504","33333  >  51944 [ACK] Seq=143012 Ack=645 Win=65024 Len=1460 [TCP segment of a reassembled PDU]"
"137","0.457393","127.0.0.1","127.0.0.1","TCP","1504","33333  >  51944 [ACK] Seq=144472 Ack=645 Win=65024 Len=1460 [TCP segment of a reassembled PDU]"
"138","0.457404","127.0.0.1","127.0.0.1","TCP","1504","33333  >  51944 [ACK] Seq=145932 Ack=645 Win=65024 Len=1460 [TCP segment of a reassembled PDU]"
"139","0.457416","127.0.0.1","127.0.0.1","TCP","1504","33333  >  51944 [ACK] Seq=147392 Ack=645 Win=65024 Len=1460 [TCP segment of a reassembled PDU]"
"140","0.457427","127.0.0.1","127.0.0.1","TCP","1504","33333  >  51944 [ACK] Seq=148852 Ack=645 Win=65024 Len=1460 [TCP segment of a reassembled PDU]"
"141","0.457439","127.0.0.1","127.0.0.1","TCP","1504","33333  >  51944 [ACK] Seq=150312 Ack=645 Win=65024 Len=1460 [TCP segment of a reassembled PDU]"
"142","0.457451","127.0.0.1","127.0.0.1","TCP","1504","33333  >  51944 [ACK] Seq=151772 Ack=645 Win=65024 Len=1460 [TCP segment of a reassembled PDU]"
"143","0.457467","127.0.0.1","127.0.0.1","TLSv1.2","1504","Application Data [TCP segment of a reassembled PDU]"
"144","0.457479","127.0.0.1","127.0.0.1","TCP","1504","33333  >  51944 [ACK] Seq=154692 Ack=645 Win=65024 Len=1460 [TCP segment of a reassembled PDU]"
"145","0.457491","127.0.0.1","127.0.0.1","TCP","1504","33333  >  51944 [ACK] Seq=156152 Ack=645 Win=65024 Len=1460 [TCP segment of a reassembled PDU]"
"146","0.457501","127.0.0.1","127.0.0.1","TCP","1504","33333  >  51944 [ACK] Seq=157612 Ack=645 Win=65024 Len=1460 [TCP segment of a reassembled PDU]"
"147","0.457512","127.0.0.1","127.0.0.1","TCP","1504","33333  >  51944 [ACK] Seq=159072 Ack=645 Win=65024 Len=1460 [TCP segment of a reassembled PDU]"
"148","0.457525","127.0.0.1","127.0.0.1","TCP","1504","33333  >  51944 [ACK] Seq=160532 Ack=645 Win=65024 Len=1460 [TCP segment of a reassembled PDU]"
"149","0.457540","127.0.0.1","127.0.0.1","TCP","1504","33333  >  51944 [ACK] Seq=161992 Ack=645 Win=65024 Len=1460 [TCP segment of a reassembled PDU]"
"150","0.457554","127.0.0.1","127.0.0.1","TCP","1504","33333  >  51944 [ACK] Seq=163452 Ack=645 Win=65024 Len=1460 [TCP segment of a reassembled PDU]"
"151","0.457568","127.0.0.1","127.0.0.1","TCP","1504","33333  >  51944 [ACK] Seq=164912 Ack=645 Win=65024 Len=1460 [TCP segment of a reassembled PDU]"
"152","0.457583","127.0.0.1","127.0.0.1","TCP","1504","33333  >  51944 [ACK] Seq=166372 Ack=645 Win=65024 Len=1460 [TCP segment of a reassembled PDU]"
"153","0.457595","127.0.0.1","127.0.0.1","TCP","1504","33333  >  51944 [ACK] Seq=167832 Ack=645 Win=65024 Len=1460 [TCP segment of a reassembled PDU]"
"154","0.457606","127.0.0.1","127.0.0.1","TLSv1.2","1504","Application Data [TCP segment of a reassembled PDU]"
"155","0.457617","127.0.0.1","127.0.0.1","TCP","1504","33333  >  51944 [ACK] Seq=170752 Ack=645 Win=65024 Len=1460 [TCP segment of a reassembled PDU]"
"156","0.457628","127.0.0.1","127.0.0.1","TCP","1504","33333  >  51944 [ACK] Seq=172212 Ack=645 Win=65024 Len=1460 [TCP segment of a reassembled PDU]"
"157","0.457638","127.0.0.1","127.0.0.1","TCP","1504","33333  >  51944 [ACK] Seq=173672 Ack=645 Win=65024 Len=1460 [TCP segment of a reassembled PDU]"
"158","0.457649","127.0.0.1","127.0.0.1","TCP","1504","33333  >  51944 [ACK] Seq=175132 Ack=645 Win=65024 Len=1460 [TCP segment of a reassembled PDU]"
"159","0.457660","127.0.0.1","127.0.0.1","TCP","1504","33333  >  51944 [ACK] Seq=176592 Ack=645 Win=65024 Len=1460 [TCP segment of a reassembled PDU]"
"160","0.457671","127.0.0.1","127.0.0.1","TCP","1504","33333  >  51944 [ACK] Seq=178052 Ack=645 Win=65024 Len=1460 [TCP segment of a reassembled PDU]"
"161","0.457681","127.0.0.1","127.0.0.1","TCP","1504","33333  >  51944 [ACK] Seq=179512 Ack=645 Win=65024 Len=1460 [TCP segment of a reassembled PDU]"
"162","0.457691","127.0.0.1","127.0.0.1","TCP","1504","33333  >  51944 [ACK] Seq=180972 Ack=645 Win=65024 Len=1460 [TCP segment of a reassembled PDU]"
"163","0.457702","127.0.0.1","127.0.0.1","TCP","1504","33333  >  51944 [ACK] Seq=182432 Ack=645 Win=65024 Len=1460 [TCP segment of a reassembled PDU]"
"164","0.457809","127.0.0.1","127.0.0.1","TCP","1504","33333  >  51944 [ACK] Seq=183892 Ack=645 Win=65024 Len=1460 [TCP segment of a reassembled PDU]"
"165","0.457819","127.0.0.1","127.0.0.1","TCP","1504","33333  >  51944 [ACK] Seq=185352 Ack=645 Win=65024 Len=1460 [TCP segment of a reassembled PDU]"
"166","0.457830","127.0.0.1","127.0.0.1","TLSv1.2","1504","Application Data [TCP segment of a reassembled PDU]"
"167","0.457840","127.0.0.1","127.0.0.1","TCP","1504","33333  >  51944 [ACK] Seq=188272 Ack=645 Win=65024 Len=1460 [TCP segment of a reassembled PDU]"
"168","0.457850","127.0.0.1","127.0.0.1","TCP","1504","33333  >  51944 [ACK] Seq=189732 Ack=645 Win=65024 Len=1460 [TCP segment of a reassembled PDU]"
"169","0.457862","127.0.0.1","127.0.0.1","TCP","1504","33333  >  51944 [ACK] Seq=191192 Ack=645 Win=65024 Len=1460 [TCP segment of a reassembled PDU]"
"170","0.457874","127.0.0.1","127.0.0.1","TCP","1504","33333  >  51944 [ACK] Seq=192652 Ack=645 Win=65024 Len=1460 [TCP segment of a reassembled PDU]"
"171","0.457887","127.0.0.1","127.0.0.1","TCP","1504","33333  >  51944 [ACK] Seq=194112 Ack=645 Win=65024 Len=1460 [TCP segment of a reassembled PDU]"
"172","0.457900","127.0.0.1","127.0.0.1","TCP","1504","33333  >  51944 [ACK] Seq=195572 Ack=645 Win=65024 Len=1460 [TCP segment of a reassembled PDU]"
"173","0.457912","127.0.0.1","127.0.0.1","TCP","1504","33333  >  51944 [ACK] Seq=197032 Ack=645 Win=65024 Len=1460 [TCP segment of a reassembled PDU]"
"174","0.457924","127.0.0.1","127.0.0.1","TCP","1504","33333  >  51944 [ACK] Seq=198492 Ack=645 Win=65024 Len=1460 [TCP segment of a reassembled PDU]"
"175","0.458041","127.0.0.1","127.0.0.1","TCP","44","51944  >  33333 [ACK] Seq=645 Ack=183892 Win=18944 Len=0"
"176","0.458053","127.0.0.1","127.0.0.1","TCP","44","51944  >  33333 [ACK] Seq=645 Ack=199952 Win=2816 Len=0"
"177","0.458156","127.0.0.1","127.0.0.1","TCP","1504","33333  >  51944 [ACK] Seq=199952 Ack=645 Win=65024 Len=1460 [TCP segment of a reassembled PDU]"
"178","0.458181","127.0.0.1","127.0.0.1","TCP","44","51944  >  33333 [ACK] Seq=645 Ack=201412 Win=1280 Len=0"
"179","0.464138","127.0.0.1","127.0.0.1","TCP","44","[TCP Window Update] 51944  >  33333 [ACK] Seq=645 Ack=201412 Win=4864 Len=0"
"180","0.464199","127.0.0.1","127.0.0.1","TCP","1504","33333  >  51944 [ACK] Seq=201412 Ack=645 Win=65024 Len=1460 [TCP segment of a reassembled PDU]"
"181","0.464214","127.0.0.1","127.0.0.1","TLSv1.2","1504","Application Data [TCP segment of a reassembled PDU]"
"182","0.464224","127.0.0.1","127.0.0.1","TCP","1504","33333  >  51944 [ACK] Seq=204332 Ack=645 Win=65024 Len=1460 [TCP segment of a reassembled PDU]"
"183","0.464287","127.0.0.1","127.0.0.1","TCP","44","51944  >  33333 [ACK] Seq=645 Ack=205792 Win=512 Len=0"
"184","0.466222","127.0.0.1","127.0.0.1","TCP","44","[TCP Window Update] 51944  >  33333 [ACK] Seq=645 Ack=205792 Win=61184 Len=0"
"185","0.466532","127.0.0.1","127.0.0.1","TCP","1504","33333  >  51944 [ACK] Seq=205792 Ack=645 Win=65024 Len=1460 [TCP segment of a reassembled PDU]"
"186","0.466542","127.0.0.1","127.0.0.1","TCP","1504","33333  >  51944 [ACK] Seq=207252 Ack=645 Win=65024 Len=1460 [TCP segment of a reassembled PDU]"
"187","0.466553","127.0.0.1","127.0.0.1","TCP","1504","33333  >  51944 [ACK] Seq=208712 Ack=645 Win=65024 Len=1460 [TCP segment of a reassembled PDU]"
"188","0.466562","127.0.0.1","127.0.0.1","TCP","1504","33333  >  51944 [ACK] Seq=210172 Ack=645 Win=65024 Len=1460 [TCP segment of a reassembled PDU]"
"189","0.466572","127.0.0.1","127.0.0.1","TCP","1504","33333  >  51944 [ACK] Seq=211632 Ack=645 Win=65024 Len=1460 [TCP segment of a reassembled PDU]"
"190","0.466582","127.0.0.1","127.0.0.1","TCP","1504","33333  >  51944 [ACK] Seq=213092 Ack=645 Win=65024 Len=1460 [TCP segment of a reassembled PDU]"
"191","0.466592","127.0.0.1","127.0.0.1","TCP","1504","33333  >  51944 [ACK] Seq=214552 Ack=645 Win=65024 Len=1460 [TCP segment of a reassembled PDU]"
"192","0.466602","127.0.0.1","127.0.0.1","TCP","1504","33333  >  51944 [ACK] Seq=216012 Ack=645 Win=65024 Len=1460 [TCP segment of a reassembled PDU]"
"193","0.466615","127.0.0.1","127.0.0.1","TCP","1504","33333  >  51944 [ACK] Seq=217472 Ack=645 Win=65024 Len=1460 [TCP segment of a reassembled PDU]"
"194","0.466627","127.0.0.1","127.0.0.1","TLSv1.2","1504","Application Data [TCP segment of a reassembled PDU]"
"195","0.466637","127.0.0.1","127.0.0.1","TCP","1504","33333  >  51944 [ACK] Seq=220392 Ack=645 Win=65024 Len=1460 [TCP segment of a reassembled PDU]"
"196","0.466647","127.0.0.1","127.0.0.1","TCP","1504","33333  >  51944 [ACK] Seq=221852 Ack=645 Win=65024 Len=1460 [TCP segment of a reassembled PDU]"
"197","0.466657","127.0.0.1","127.0.0.1","TCP","1504","33333  >  51944 [ACK] Seq=223312 Ack=645 Win=65024 Len=1460 [TCP segment of a reassembled PDU]"
"198","0.466666","127.0.0.1","127.0.0.1","TCP","1504","33333  >  51944 [ACK] Seq=224772 Ack=645 Win=65024 Len=1460 [TCP segment of a reassembled PDU]"
"199","0.466676","127.0.0.1","127.0.0.1","TCP","1504","33333  >  51944 [ACK] Seq=226232 Ack=645 Win=65024 Len=1460 [TCP segment of a reassembled PDU]"
"200","0.466687","127.0.0.1","127.0.0.1","TCP","1504","33333  >  51944 [ACK] Seq=227692 Ack=645 Win=65024 Len=1460 [TCP segment of a reassembled PDU]"
"201","0.466700","127.0.0.1","127.0.0.1","TCP","1504","33333  >  51944 [ACK] Seq=229152 Ack=645 Win=65024 Len=1460 [TCP segment of a reassembled PDU]"
"202","0.466711","127.0.0.1","127.0.0.1","TCP","1504","33333  >  51944 [ACK] Seq=230612 Ack=645 Win=65024 Len=1460 [TCP segment of a reassembled PDU]"
"203","0.466723","127.0.0.1","127.0.0.1","TCP","1504","33333  >  51944 [ACK] Seq=232072 Ack=645 Win=65024 Len=1460 [TCP segment of a reassembled PDU]"
"204","0.466735","127.0.0.1","127.0.0.1","TCP","1504","33333  >  51944 [ACK] Seq=233532 Ack=645 Win=65024 Len=1460 [TCP segment of a reassembled PDU]"
"205","0.466746","127.0.0.1","127.0.0.1","TLSv1.2","1504","Application Data [TCP segment of a reassembled PDU]"
"206","0.466756","127.0.0.1","127.0.0.1","TCP","1504","33333  >  51944 [ACK] Seq=236452 Ack=645 Win=65024 Len=1460 [TCP segment of a reassembled PDU]"
"207","0.466765","127.0.0.1","127.0.0.1","TCP","1504","33333  >  51944 [ACK] Seq=237912 Ack=645 Win=65024 Len=1460 [TCP segment of a reassembled PDU]"
"208","0.466774","127.0.0.1","127.0.0.1","TCP","1504","33333  >  51944 [ACK] Seq=239372 Ack=645 Win=65024 Len=1460 [TCP segment of a reassembled PDU]"
"209","0.466783","127.0.0.1","127.0.0.1","TCP","1504","33333  >  51944 [ACK] Seq=240832 Ack=645 Win=65024 Len=1460 [TCP segment of a reassembled PDU]"
"210","0.466792","127.0.0.1","127.0.0.1","TCP","1504","33333  >  51944 [ACK] Seq=242292 Ack=645 Win=65024 Len=1460 [TCP segment of a reassembled PDU]"
"211","0.466801","127.0.0.1","127.0.0.1","TCP","1504","33333  >  51944 [ACK] Seq=243752 Ack=645 Win=65024 Len=1460 [TCP segment of a reassembled PDU]"
"212","0.466810","127.0.0.1","127.0.0.1","TCP","1504","33333  >  51944 [ACK] Seq=245212 Ack=645 Win=65024 Len=1460 [TCP segment of a reassembled PDU]"
"213","0.466819","127.0.0.1","127.0.0.1","TCP","1504","33333  >  51944 [ACK] Seq=246672 Ack=645 Win=65024 Len=1460 [TCP segment of a reassembled PDU]"
"214","0.466828","127.0.0.1","127.0.0.1","TCP","1504","33333  >  51944 [ACK] Seq=248132 Ack=645 Win=65024 Len=1460 [TCP segment of a reassembled PDU]"
"215","0.466837","127.0.0.1","127.0.0.1","TCP","1504","33333  >  51944 [ACK] Seq=249592 Ack=645 Win=65024 Len=1460 [TCP segment of a reassembled PDU]"
"216","0.466846","127.0.0.1","127.0.0.1","TCP","1504","33333  >  51944 [ACK] Seq=251052 Ack=645 Win=65024 Len=1460 [TCP segment of a reassembled PDU]"
"217","0.466936","127.0.0.1","127.0.0.1","TLSv1.2","1504","Application Data [TCP segment of a reassembled PDU]"
"218","0.466945","127.0.0.1","127.0.0.1","TCP","1504","33333  >  51944 [ACK] Seq=253972 Ack=645 Win=65024 Len=1460 [TCP segment of a reassembled PDU]"
"219","0.466954","127.0.0.1","127.0.0.1","TCP","1504","33333  >  51944 [ACK] Seq=255432 Ack=645 Win=65024 Len=1460 [TCP segment of a reassembled PDU]"
"220","0.466963","127.0.0.1","127.0.0.1","TCP","1504","33333  >  51944 [ACK] Seq=256892 Ack=645 Win=65024 Len=1460 [TCP segment of a reassembled PDU]"
"221","0.466972","127.0.0.1","127.0.0.1","TCP","1504","33333  >  51944 [ACK] Seq=258352 Ack=645 Win=65024 Len=1460 [TCP segment of a reassembled PDU]"
"222","0.466981","127.0.0.1","127.0.0.1","TCP","1504","33333  >  51944 [ACK] Seq=259812 Ack=645 Win=65024 Len=1460 [TCP segment of a reassembled PDU]"
"223","0.466990","127.0.0.1","127.0.0.1","TCP","1504","33333  >  51944 [ACK] Seq=261272 Ack=645 Win=65024 Len=1460 [TCP segment of a reassembled PDU]"
"224","0.466998","127.0.0.1","127.0.0.1","TCP","1504","33333  >  51944 [ACK] Seq=262732 Ack=645 Win=65024 Len=1460 [TCP segment of a reassembled PDU]"
"225","0.467007","127.0.0.1","127.0.0.1","TCP","1504","33333  >  51944 [ACK] Seq=264192 Ack=645 Win=65024 Len=1460 [TCP segment of a reassembled PDU]"
"226","0.467111","127.0.0.1","127.0.0.1","TCP","44","51944  >  33333 [ACK] Seq=645 Ack=252512 Win=14592 Len=0"
"227","0.467128","127.0.0.1","127.0.0.1","TCP","44","51944  >  33333 [ACK] Seq=645 Ack=265652 Win=1280 Len=0"
"228","0.470467","127.0.0.1","127.0.0.1","TCP","44","[TCP Window Update] 51944  >  33333 [ACK] Seq=645 Ack=265652 Win=5632 Len=0"
"229","0.470532","127.0.0.1","127.0.0.1","TCP","1504","33333  >  51944 [ACK] Seq=265652 Ack=645 Win=65024 Len=1460 [TCP segment of a reassembled PDU]"
"230","0.470544","127.0.0.1","127.0.0.1","TCP","1504","33333  >  51944 [ACK] Seq=267112 Ack=645 Win=65024 Len=1460 [TCP segment of a reassembled PDU]"
"231","0.470557","127.0.0.1","127.0.0.1","TLSv1.2","1504","Application Data [TCP segment of a reassembled PDU]"
"232","0.470607","127.0.0.1","127.0.0.1","TCP","44","51944  >  33333 [ACK] Seq=645 Ack=270032 Win=1280 Len=0"
"233","0.471764","127.0.0.1","127.0.0.1","TCP","44","[TCP Window Update] 51944  >  33333 [ACK] Seq=645 Ack=270032 Win=61184 Len=0"
"234","0.472041","127.0.0.1","127.0.0.1","TCP","1504","33333  >  51944 [ACK] Seq=270032 Ack=645 Win=65024 Len=1460 [TCP segment of a reassembled PDU]"
"235","0.472052","127.0.0.1","127.0.0.1","TCP","1504","33333  >  51944 [ACK] Seq=271492 Ack=645 Win=65024 Len=1460 [TCP segment of a reassembled PDU]"
"236","0.472063","127.0.0.1","127.0.0.1","TCP","1504","33333  >  51944 [ACK] Seq=272952 Ack=645 Win=65024 Len=1460 [TCP segment of a reassembled PDU]"
"237","0.472073","127.0.0.1","127.0.0.1","TCP","1504","33333  >  51944 [ACK] Seq=274412 Ack=645 Win=65024 Len=1460 [TCP segment of a reassembled PDU]"
"238","0.472084","127.0.0.1","127.0.0.1","TCP","1504","33333  >  51944 [ACK] Seq=275872 Ack=645 Win=65024 Len=1460 [TCP segment of a reassembled PDU]"
"239","0.472094","127.0.0.1","127.0.0.1","TCP","1504","33333  >  51944 [ACK] Seq=277332 Ack=645 Win=65024 Len=1460 [TCP segment of a reassembled PDU]"
"240","0.472105","127.0.0.1","127.0.0.1","TCP","1504","33333  >  51944 [ACK] Seq=278792 Ack=645 Win=65024 Len=1460 [TCP segment of a reassembled PDU]"
"241","0.472116","127.0.0.1","127.0.0.1","TCP","1504","33333  >  51944 [ACK] Seq=280252 Ack=645 Win=65024 Len=1460 [TCP segment of a reassembled PDU]"
"242","0.472132","127.0.0.1","127.0.0.1","TCP","1504","33333  >  51944 [ACK] Seq=281712 Ack=645 Win=65024 Len=1460 [TCP segment of a reassembled PDU]"
"243","0.472143","127.0.0.1","127.0.0.1","TCP","1504","33333  >  51944 [ACK] Seq=283172 Ack=645 Win=65024 Len=1460 [TCP segment of a reassembled PDU]"
"244","0.472154","127.0.0.1","127.0.0.1","TLSv1.2","1504","Application Data [TCP segment of a reassembled PDU]"
"245","0.472165","127.0.0.1","127.0.0.1","TCP","1504","33333  >  51944 [ACK] Seq=286092 Ack=645 Win=65024 Len=1460 [TCP segment of a reassembled PDU]"
"246","0.472176","127.0.0.1","127.0.0.1","TCP","1504","33333  >  51944 [ACK] Seq=287552 Ack=645 Win=65024 Len=1460 [TCP segment of a reassembled PDU]"
"247","0.472188","127.0.0.1","127.0.0.1","TCP","1504","33333  >  51944 [ACK] Seq=289012 Ack=645 Win=65024 Len=1460 [TCP segment of a reassembled PDU]"
"248","0.472203","127.0.0.1","127.0.0.1","TCP","1504","33333  >  51944 [ACK] Seq=290472 Ack=645 Win=65024 Len=1460 [TCP segment of a reassembled PDU]"
"249","0.472217","127.0.0.1","127.0.0.1","TCP","1504","33333  >  51944 [ACK] Seq=291932 Ack=645 Win=65024 Len=1460 [TCP segment of a reassembled PDU]"
"250","0.472230","127.0.0.1","127.0.0.1","TCP","1504","33333  >  51944 [ACK] Seq=293392 Ack=645 Win=65024 Len=1460 [TCP segment of a reassembled PDU]"
"251","0.472243","127.0.0.1","127.0.0.1","TCP","1504","33333  >  51944 [ACK] Seq=294852 Ack=645 Win=65024 Len=1460 [TCP segment of a reassembled PDU]"
"252","0.472253","127.0.0.1","127.0.0.1","TCP","1504","33333  >  51944 [ACK] Seq=296312 Ack=645 Win=65024 Len=1460 [TCP segment of a reassembled PDU]"
"253","0.472264","127.0.0.1","127.0.0.1","TCP","1504","33333  >  51944 [ACK] Seq=297772 Ack=645 Win=65024 Len=1460 [TCP segment of a reassembled PDU]"
"254","0.472274","127.0.0.1","127.0.0.1","TCP","1504","33333  >  51944 [ACK] Seq=299232 Ack=645 Win=65024 Len=1460 [TCP segment of a reassembled PDU]"
"255","0.472286","127.0.0.1","127.0.0.1","TLSv1.2","1504","Application Data [TCP segment of a reassembled PDU]"
"256","0.472301","127.0.0.1","127.0.0.1","TCP","1504","33333  >  51944 [ACK] Seq=302152 Ack=645 Win=65024 Len=1460 [TCP segment of a reassembled PDU]"
"257","0.472313","127.0.0.1","127.0.0.1","TCP","1504","33333  >  51944 [ACK] Seq=303612 Ack=645 Win=65024 Len=1460 [TCP segment of a reassembled PDU]"
"258","0.472323","127.0.0.1","127.0.0.1","TCP","1504","33333  >  51944 [ACK] Seq=305072 Ack=645 Win=65024 Len=1460 [TCP segment of a reassembled PDU]"
"259","0.472333","127.0.0.1","127.0.0.1","TCP","1504","33333  >  51944 [ACK] Seq=306532 Ack=645 Win=65024 Len=1460 [TCP segment of a reassembled PDU]"
"260","0.472344","127.0.0.1","127.0.0.1","TCP","1504","33333  >  51944 [ACK] Seq=307992 Ack=645 Win=65024 Len=1460 [TCP segment of a reassembled PDU]"
"261","0.472354","127.0.0.1","127.0.0.1","TCP","1504","33333  >  51944 [ACK] Seq=309452 Ack=645 Win=65024 Len=1460 [TCP segment of a reassembled PDU]"
"262","0.472364","127.0.0.1","127.0.0.1","TCP","1504","33333  >  51944 [ACK] Seq=310912 Ack=645 Win=65024 Len=1460 [TCP segment of a reassembled PDU]"
"263","0.472374","127.0.0.1","127.0.0.1","TCP","1504","33333  >  51944 [ACK] Seq=312372 Ack=645 Win=65024 Len=1460 [TCP segment of a reassembled PDU]"
"264","0.472384","127.0.0.1","127.0.0.1","TCP","1504","33333  >  51944 [ACK] Seq=313832 Ack=645 Win=65024 Len=1460 [TCP segment of a reassembled PDU]"
"265","0.472393","127.0.0.1","127.0.0.1","TCP","1504","33333  >  51944 [ACK] Seq=315292 Ack=645 Win=65024 Len=1460 [TCP segment of a reassembled PDU]"
"266","0.472486","127.0.0.1","127.0.0.1","TCP","1504","33333  >  51944 [ACK] Seq=316752 Ack=645 Win=65024 Len=1460 [TCP segment of a reassembled PDU]"
"267","0.472497","127.0.0.1","127.0.0.1","TLSv1.2","1504","Application Data [TCP segment of a reassembled PDU]"
"268","0.472507","127.0.0.1","127.0.0.1","TCP","1504","33333  >  51944 [ACK] Seq=319672 Ack=645 Win=65024 Len=1460 [TCP segment of a reassembled PDU]"
"269","0.472516","127.0.0.1","127.0.0.1","TCP","1504","33333  >  51944 [ACK] Seq=321132 Ack=645 Win=65024 Len=1460 [TCP segment of a reassembled PDU]"
"270","0.472525","127.0.0.1","127.0.0.1","TCP","1504","33333  >  51944 [ACK] Seq=322592 Ack=645 Win=65024 Len=1460 [TCP segment of a reassembled PDU]"
"271","0.472535","127.0.0.1","127.0.0.1","TCP","1504","33333  >  51944 [ACK] Seq=324052 Ack=645 Win=65024 Len=1460 [TCP segment of a reassembled PDU]"
"272","0.472545","127.0.0.1","127.0.0.1","TCP","1504","33333  >  51944 [ACK] Seq=325512 Ack=645 Win=65024 Len=1460 [TCP segment of a reassembled PDU]"
"273","0.472555","127.0.0.1","127.0.0.1","TCP","1504","33333  >  51944 [ACK] Seq=326972 Ack=645 Win=65024 Len=1460 [TCP segment of a reassembled PDU]"
"274","0.472564","127.0.0.1","127.0.0.1","TCP","1504","33333  >  51944 [ACK] Seq=328432 Ack=645 Win=65024 Len=1460 [TCP segment of a reassembled PDU]"
"275","0.472684","127.0.0.1","127.0.0.1","TCP","44","51944  >  33333 [ACK] Seq=645 Ack=316752 Win=14592 Len=0"
"276","0.472695","127.0.0.1","127.0.0.1","TCP","44","51944  >  33333 [ACK] Seq=645 Ack=329892 Win=1280 Len=0"
"277","0.476374","127.0.0.1","127.0.0.1","TCP","44","[TCP Window Update] 51944  >  33333 [ACK] Seq=645 Ack=329892 Win=5632 Len=0"
"278","0.476442","127.0.0.1","127.0.0.1","TCP","1504","33333  >  51944 [ACK] Seq=329892 Ack=645 Win=65024 Len=1460 [TCP segment of a reassembled PDU]"
"279","0.476454","127.0.0.1","127.0.0.1","TCP","1504","33333  >  51944 [ACK] Seq=331352 Ack=645 Win=65024 Len=1460 [TCP segment of a reassembled PDU]"
"280","0.476465","127.0.0.1","127.0.0.1","TCP","1504","33333  >  51944 [ACK] Seq=332812 Ack=645 Win=65024 Len=1460 [TCP segment of a reassembled PDU]"
"281","0.476477","127.0.0.1","127.0.0.1","TLSv1.2","1296","[TCP Window Full] , Application Data [TCP segment of a reassembled PDU]"
"282","0.476553","127.0.0.1","127.0.0.1","TCP","44","[TCP ZeroWindow] 51944  >  33333 [ACK] Seq=645 Ack=335524 Win=0 Len=0"
"283","0.477771","127.0.0.1","127.0.0.1","TCP","44","[TCP Window Update] 51944  >  33333 [ACK] Seq=645 Ack=335524 Win=59904 Len=0"
"284","0.478132","127.0.0.1","127.0.0.1","TCP","1504","33333  >  51944 [ACK] Seq=335524 Ack=645 Win=65024 Len=1460 [TCP segment of a reassembled PDU]"
