No.,Time,Source,Destination,Protocol,Length,Info
3070,389.618457,52.113.194.133,192.168.43.215,TCP,1354,443  >  49262 [ACK] Seq=1965492 Ack=12081 Win=2048 Len=1300 [TCP segment of a reassembled PDU]
3071,389.618582,52.113.194.133,192.168.43.215,TCP,1354,443  >  49262 [ACK] Seq=1966792 Ack=12081 Win=2048 Len=1300 [TCP segment of a reassembled PDU]
3072,389.618628,192.168.43.215,52.113.194.133,TCP,54,49262  >  443 [ACK] Seq=12081 Ack=1968092 Win=258 Len=0
3073,389.618779,52.113.194.133,192.168.43.215,TCP,1354,443  >  49262 [ACK] Seq=1968092 Ack=12081 Win=2048 Len=1300 [TCP segment of a reassembled PDU]
3074,389.619017,52.113.194.133,192.168.43.215,TCP,1354,443  >  49262 [ACK] Seq=1969392 Ack=12081 Win=2048 Len=1300 [TCP segment of a reassembled PDU]
3075,389.619056,192.168.43.215,52.113.194.133,TCP,54,49262  >  443 [ACK] Seq=12081 Ack=1970692 Win=258 Len=0
3076,389.619137,52.113.194.133,192.168.43.215,TLSv1.2,484,Application Data
3077,389.619256,52.113.194.133,192.168.43.215,TCP,1354,443  >  49262 [ACK] Seq=1971122 Ack=12081 Win=2048 Len=1300 [TCP segment of a reassembled PDU]
3078,389.619286,192.168.43.215,52.113.194.133,TCP,54,49262  >  443 [ACK] Seq=12081 Ack=1972422 Win=258 Len=0
3079,389.619403,52.113.194.133,192.168.43.215,TCP,1354,443  >  49262 [ACK] Seq=1972422 Ack=12081 Win=2048 Len=1300 [TCP segment of a reassembled PDU]
3080,389.61952599999995,52.113.194.133,192.168.43.215,TCP,1354,443  >  49262 [ACK] Seq=1973722 Ack=12081 Win=2048 Len=1300 [TCP segment of a reassembled PDU]
3081,389.619552,192.168.43.215,52.113.194.133,TCP,54,49262  >  443 [ACK] Seq=12081 Ack=1975022 Win=258 Len=0
3082,389.619664,52.113.194.133,192.168.43.215,TLSv1.2,343,Application Data
3083,389.61987400000004,52.113.194.133,192.168.43.215,TCP,1354,443  >  49262 [ACK] Seq=1975311 Ack=12081 Win=2048 Len=1300 [TCP segment of a reassembled PDU]
3084,389.619917,192.168.43.215,52.113.194.133,TCP,54,49262  >  443 [ACK] Seq=12081 Ack=1976611 Win=258 Len=0
3085,389.620117,52.113.194.133,192.168.43.215,TCP,1354,443  >  49262 [ACK] Seq=1976611 Ack=12081 Win=2048 Len=1300 [TCP segment of a reassembled PDU]
3086,389.620407,52.113.194.133,192.168.43.215,TCP,1354,443  >  49262 [ACK] Seq=1977911 Ack=12081 Win=2048 Len=1300 [TCP segment of a reassembled PDU]
3087,389.62044199999997,192.168.43.215,52.113.194.133,TCP,54,49262  >  443 [ACK] Seq=12081 Ack=1979211 Win=258 Len=0
3088,389.620569,52.113.194.133,192.168.43.215,TCP,1354,443  >  49262 [ACK] Seq=1979211 Ack=12081 Win=2048 Len=1300 [TCP segment of a reassembled PDU]
3089,389.620802,52.113.194.133,192.168.43.215,TCP,1354,443  >  49262 [ACK] Seq=1980511 Ack=12081 Win=2048 Len=1300 [TCP segment of a reassembled PDU]
3090,389.620831,192.168.43.215,52.113.194.133,TCP,54,49262  >  443 [ACK] Seq=12081 Ack=1981811 Win=258 Len=0
3091,389.620897,52.113.194.133,192.168.43.215,TLSv1.2,141,Application Data
3092,389.621084,52.113.194.133,192.168.43.215,TLSv1.2,92,Application Data
3093,389.621138,192.168.43.215,52.113.194.133,TCP,54,49262  >  443 [ACK] Seq=12081 Ack=1981936 Win=258 Len=0
3094,390.22764,192.168.43.215,52.113.194.133,TLSv1.2,186,Application Data
3095,390.274897,52.113.194.133,192.168.43.215,TCP,54,443  >  49262 [ACK] Seq=1981936 Ack=12213 Win=2047 Len=0
3096,390.31689900000003,52.113.194.133,192.168.43.215,TCP,1354,443  >  49262 [ACK] Seq=1981936 Ack=12213 Win=2047 Len=1300 [TCP segment of a reassembled PDU]
3097,390.31717799999996,52.113.194.133,192.168.43.215,TLSv1.2,337,Application Data
3098,390.31732999999997,192.168.43.215,52.113.194.133,TCP,54,49262  >  443 [ACK] Seq=12213 Ack=1983519 Win=258 Len=0
3099,390.317449,52.113.194.133,192.168.43.215,TCP,1354,443  >  49262 [ACK] Seq=1983519 Ack=12213 Win=2047 Len=1300 [TCP segment of a reassembled PDU]
3100,390.317525,52.113.194.133,192.168.43.215,TCP,1354,443  >  49262 [ACK] Seq=1984819 Ack=12213 Win=2047 Len=1300 [TCP segment of a reassembled PDU]
3101,390.317563,192.168.43.215,52.113.194.133,TCP,54,49262  >  443 [ACK] Seq=12213 Ack=1986119 Win=258 Len=0
3102,390.317612,52.113.194.133,192.168.43.215,TCP,1354,443  >  49262 [ACK] Seq=1986119 Ack=12213 Win=2047 Len=1300 [TCP segment of a reassembled PDU]
3103,390.317693,52.113.194.133,192.168.43.215,TCP,1354,443  >  49262 [ACK] Seq=1987419 Ack=12213 Win=2047 Len=1300 [TCP segment of a reassembled PDU]
3104,390.317721,192.168.43.215,52.113.194.133,TCP,54,49262  >  443 [ACK] Seq=12213 Ack=1988719 Win=258 Len=0
3105,390.31780299999997,52.113.194.133,192.168.43.215,TCP,1354,443  >  49262 [ACK] Seq=1988719 Ack=12213 Win=2047 Len=1300 [TCP segment of a reassembled PDU]
3106,390.31793500000003,52.113.194.133,192.168.43.215,TCP,1354,443  >  49262 [ACK] Seq=1990019 Ack=12213 Win=2047 Len=1300 [TCP segment of a reassembled PDU]
3107,390.317968,192.168.43.215,52.113.194.133,TCP,54,49262  >  443 [ACK] Seq=12213 Ack=1991319 Win=258 Len=0
3108,390.318034,52.113.194.133,192.168.43.215,TLSv1.2,484,Application Data
3109,390.318146,52.113.194.133,192.168.43.215,TCP,1354,443  >  49262 [ACK] Seq=1991749 Ack=12213 Win=2047 Len=1300 [TCP segment of a reassembled PDU]
3110,390.318176,192.168.43.215,52.113.194.133,TCP,54,49262  >  443 [ACK] Seq=12213 Ack=1993049 Win=258 Len=0
3111,390.318423,52.113.194.133,192.168.43.215,TCP,1354,443  >  49262 [ACK] Seq=1993049 Ack=12213 Win=2047 Len=1300 [TCP segment of a reassembled PDU]
3112,390.31856600000003,52.113.194.133,192.168.43.215,TCP,1354,443  >  49262 [ACK] Seq=1994349 Ack=12213 Win=2047 Len=1300 [TCP segment of a reassembled PDU]
3113,390.318599,192.168.43.215,52.113.194.133,TCP,54,49262  >  443 [ACK] Seq=12213 Ack=1995649 Win=258 Len=0
3114,390.31869,52.113.194.133,192.168.43.215,TLSv1.2,343,Application Data
3115,390.318948,52.113.194.133,192.168.43.215,TCP,1354,443  >  49262 [ACK] Seq=1995938 Ack=12213 Win=2047 Len=1300 [TCP segment of a reassembled PDU]
3116,390.319033,192.168.43.215,52.113.194.133,TCP,54,49262  >  443 [ACK] Seq=12213 Ack=1997238 Win=258 Len=0
3117,390.31913199999997,52.113.194.133,192.168.43.215,TCP,1354,443  >  49262 [ACK] Seq=1997238 Ack=12213 Win=2047 Len=1300 [TCP segment of a reassembled PDU]
3118,390.31922099999997,52.113.194.133,192.168.43.215,TCP,1354,443  >  49262 [ACK] Seq=1998538 Ack=12213 Win=2047 Len=1300 [TCP segment of a reassembled PDU]
3119,390.31925,192.168.43.215,52.113.194.133,TCP,54,49262  >  443 [ACK] Seq=12213 Ack=1999838 Win=258 Len=0
3120,390.319471,52.113.194.133,192.168.43.215,TCP,1354,443  >  49262 [ACK] Seq=1999838 Ack=12213 Win=2047 Len=1300 [TCP segment of a reassembled PDU]
3121,390.319594,52.113.194.133,192.168.43.215,TCP,1354,443  >  49262 [ACK] Seq=2001138 Ack=12213 Win=2047 Len=1300 [TCP segment of a reassembled PDU]
3122,390.319627,192.168.43.215,52.113.194.133,TCP,54,49262  >  443 [ACK] Seq=12213 Ack=2002438 Win=258 Len=0
3123,390.319707,52.113.194.133,192.168.43.215,TLSv1.2,141,Application Data
3124,390.32055299999996,52.113.194.133,192.168.43.215,TLSv1.2,92,Application Data
3125,390.320599,192.168.43.215,52.113.194.133,TCP,54,49262  >  443 [ACK] Seq=12213 Ack=2002563 Win=258 Len=0
3126,390.984394,192.168.43.215,52.113.194.133,TLSv1.2,120,Application Data
3127,391.00498500000003,52.113.194.133,192.168.43.215,TCP,54,443  >  49262 [ACK] Seq=2002563 Ack=12279 Win=2047 Len=0
3128,391.04713399999997,52.113.194.133,192.168.43.215,TCP,1354,443  >  49262 [ACK] Seq=2002563 Ack=12279 Win=2047 Len=1300 [TCP segment of a reassembled PDU]
3129,391.047275,52.113.194.133,192.168.43.215,TLSv1.2,458,Application Data
3130,391.047331,192.168.43.215,52.113.194.133,TCP,54,49262  >  443 [ACK] Seq=12279 Ack=2004267 Win=258 Len=0
3131,391.04746600000004,52.113.194.133,192.168.43.215,TCP,1354,443  >  49262 [ACK] Seq=2004267 Ack=12279 Win=2047 Len=1300 [TCP segment of a reassembled PDU]
3132,391.047602,52.113.194.133,192.168.43.215,TCP,1354,443  >  49262 [ACK] Seq=2005567 Ack=12279 Win=2047 Len=1300 [TCP segment of a reassembled PDU]
3133,391.047717,192.168.43.215,52.113.194.133,TCP,54,49262  >  443 [ACK] Seq=12279 Ack=2006867 Win=258 Len=0
3134,391.048181,52.113.194.133,192.168.43.215,TCP,1354,443  >  49262 [ACK] Seq=2006867 Ack=12279 Win=2047 Len=1300 [TCP segment of a reassembled PDU]
3135,391.048454,52.113.194.133,192.168.43.215,TCP,1354,443  >  49262 [ACK] Seq=2008167 Ack=12279 Win=2047 Len=1300 [TCP segment of a reassembled PDU]
3136,391.048496,192.168.43.215,52.113.194.133,TCP,54,49262  >  443 [ACK] Seq=12279 Ack=2009467 Win=258 Len=0
3137,391.056471,52.113.194.133,192.168.43.215,TCP,1354,443  >  49262 [ACK] Seq=2009467 Ack=12279 Win=2047 Len=1300 [TCP segment of a reassembled PDU]
3138,391.056614,52.113.194.133,192.168.43.215,TCP,1354,443  >  49262 [ACK] Seq=2010767 Ack=12279 Win=2047 Len=1300 [TCP segment of a reassembled PDU]
3139,391.056665,192.168.43.215,52.113.194.133,TCP,54,49262  >  443 [ACK] Seq=12279 Ack=2012067 Win=258 Len=0
3140,391.056735,52.113.194.133,192.168.43.215,TLSv1.2,484,Application Data
3141,391.056786,52.113.194.133,192.168.43.215,TCP,1354,443  >  49262 [ACK] Seq=2012497 Ack=12279 Win=2047 Len=1300 [TCP segment of a reassembled PDU]
3142,391.05681200000004,192.168.43.215,52.113.194.133,TCP,54,49262  >  443 [ACK] Seq=12279 Ack=2013797 Win=258 Len=0
3143,391.05699300000003,52.113.194.133,192.168.43.215,TCP,1354,443  >  49262 [ACK] Seq=2013797 Ack=12279 Win=2047 Len=1300 [TCP segment of a reassembled PDU]
3144,391.057126,52.113.194.133,192.168.43.215,TCP,1354,443  >  49262 [ACK] Seq=2015097 Ack=12279 Win=2047 Len=1300 [TCP segment of a reassembled PDU]
3145,391.05715499999997,192.168.43.215,52.113.194.133,TCP,54,49262  >  443 [ACK] Seq=12279 Ack=2016397 Win=258 Len=0
3146,391.057261,52.113.194.133,192.168.43.215,TLSv1.2,343,Application Data
3147,391.057373,52.113.194.133,192.168.43.215,TCP,1354,443  >  49262 [ACK] Seq=2016686 Ack=12279 Win=2047 Len=1300 [TCP segment of a reassembled PDU]
3148,391.057404,192.168.43.215,52.113.194.133,TCP,54,49262  >  443 [ACK] Seq=12279 Ack=2017986 Win=258 Len=0
3149,391.057493,52.113.194.133,192.168.43.215,TCP,1354,443  >  49262 [ACK] Seq=2017986 Ack=12279 Win=2047 Len=1300 [TCP segment of a reassembled PDU]
3150,391.05777,52.113.194.133,192.168.43.215,TCP,1354,443  >  49262 [ACK] Seq=2019286 Ack=12279 Win=2047 Len=1300 [TCP segment of a reassembled PDU]
3151,391.057805,192.168.43.215,52.113.194.133,TCP,54,49262  >  443 [ACK] Seq=12279 Ack=2020586 Win=258 Len=0
3152,391.057938,52.113.194.133,192.168.43.215,TCP,1354,443  >  49262 [ACK] Seq=2020586 Ack=12279 Win=2047 Len=1300 [TCP segment of a reassembled PDU]
3153,391.058197,52.113.194.133,192.168.43.215,TCP,1354,443  >  49262 [ACK] Seq=2021886 Ack=12279 Win=2047 Len=1300 [TCP segment of a reassembled PDU]
3154,391.058231,192.168.43.215,52.113.194.133,TCP,54,49262  >  443 [ACK] Seq=12279 Ack=2023186 Win=258 Len=0
3155,391.058306,52.113.194.133,192.168.43.215,TLSv1.2,141,Application Data
3156,391.058952,52.113.194.133,192.168.43.215,TLSv1.2,92,Application Data
3157,391.05900299999996,192.168.43.215,52.113.194.133,TCP,54,49262  >  443 [ACK] Seq=12279 Ack=2023311 Win=258 Len=0
3158,391.66789500000004,192.168.43.215,52.113.194.133,TLSv1.2,120,Application Data
3159,391.703691,52.113.194.133,192.168.43.215,TCP,54,443  >  49262 [ACK] Seq=2023311 Ack=12345 Win=2047 Len=0
3160,391.735179,52.113.194.133,192.168.43.215,TCP,1354,443  >  49262 [ACK] Seq=2023311 Ack=12345 Win=2047 Len=1300 [TCP segment of a reassembled PDU]
3161,391.73531299999996,52.113.194.133,192.168.43.215,TLSv1.2,313,Application Data
3162,391.735369,192.168.43.215,52.113.194.133,TCP,54,49262  >  443 [ACK] Seq=12345 Ack=2024870 Win=258 Len=0
3163,391.73548999999997,52.113.194.133,192.168.43.215,TCP,1354,443  >  49262 [ACK] Seq=2024870 Ack=12345 Win=2047 Len=1300 [TCP segment of a reassembled PDU]
3164,391.736214,52.113.194.133,192.168.43.215,TCP,1354,443  >  49262 [ACK] Seq=2026170 Ack=12345 Win=2047 Len=1300 [TCP segment of a reassembled PDU]
3165,391.736333,192.168.43.215,52.113.194.133,TCP,54,49262  >  443 [ACK] Seq=12345 Ack=2027470 Win=258 Len=0
3166,391.74400099999997,52.113.194.133,192.168.43.215,TCP,1354,443  >  49262 [ACK] Seq=2027470 Ack=12345 Win=2047 Len=1300 [TCP segment of a reassembled PDU]
3167,391.744135,52.113.194.133,192.168.43.215,TCP,1354,443  >  49262 [ACK] Seq=2028770 Ack=12345 Win=2047 Len=1300 [TCP segment of a reassembled PDU]
3168,391.744183,192.168.43.215,52.113.194.133,TCP,54,49262  >  443 [ACK] Seq=12345 Ack=2030070 Win=258 Len=0
3169,391.744346,52.113.194.133,192.168.43.215,TCP,1354,443  >  49262 [ACK] Seq=2030070 Ack=12345 Win=2047 Len=1300 [TCP segment of a reassembled PDU]
3170,391.74452,52.113.194.133,192.168.43.215,TCP,1354,443  >  49262 [ACK] Seq=2031370 Ack=12345 Win=2047 Len=1300 [TCP segment of a reassembled PDU]
3171,391.744568,192.168.43.215,52.113.194.133,TCP,54,49262  >  443 [ACK] Seq=12345 Ack=2032670 Win=258 Len=0
3172,391.744626,52.113.194.133,192.168.43.215,TLSv1.2,484,Application Data
3173,391.744727,52.113.194.133,192.168.43.215,TCP,1354,443  >  49262 [ACK] Seq=2033100 Ack=12345 Win=2047 Len=1300 [TCP segment of a reassembled PDU]
3174,391.744777,192.168.43.215,52.113.194.133,TCP,54,49262  >  443 [ACK] Seq=12345 Ack=2034400 Win=258 Len=0
3175,391.744846,52.113.194.133,192.168.43.215,TCP,1354,443  >  49262 [ACK] Seq=2034400 Ack=12345 Win=2047 Len=1300 [TCP segment of a reassembled PDU]
3176,391.745077,52.113.194.133,192.168.43.215,TCP,1354,443  >  49262 [ACK] Seq=2035700 Ack=12345 Win=2047 Len=1300 [TCP segment of a reassembled PDU]
3177,391.745112,192.168.43.215,52.113.194.133,TCP,54,49262  >  443 [ACK] Seq=12345 Ack=2037000 Win=258 Len=0
3178,391.7452,52.113.194.133,192.168.43.215,TLSv1.2,343,Application Data
3179,391.746166,52.113.194.133,192.168.43.215,TCP,1354,443  >  49262 [ACK] Seq=2037289 Ack=12345 Win=2047 Len=1300 [TCP segment of a reassembled PDU]
3180,391.746251,192.168.43.215,52.113.194.133,TCP,54,49262  >  443 [ACK] Seq=12345 Ack=2038589 Win=258 Len=0
3181,391.746366,52.113.194.133,192.168.43.215,TCP,1354,443  >  49262 [ACK] Seq=2038589 Ack=12345 Win=2047 Len=1300 [TCP segment of a reassembled PDU]
3182,391.74647999999996,52.113.194.133,192.168.43.215,TCP,1354,443  >  49262 [ACK] Seq=2039889 Ack=12345 Win=2047 Len=1300 [TCP segment of a reassembled PDU]
3183,391.746521,192.168.43.215,52.113.194.133,TCP,54,49262  >  443 [ACK] Seq=12345 Ack=2041189 Win=258 Len=0
3184,391.746719,52.113.194.133,192.168.43.215,TCP,1354,443  >  49262 [ACK] Seq=2041189 Ack=12345 Win=2047 Len=1300 [TCP segment of a reassembled PDU]
3185,391.746872,52.113.194.133,192.168.43.215,TCP,1354,443  >  49262 [ACK] Seq=2042489 Ack=12345 Win=2047 Len=1300 [TCP segment of a reassembled PDU]
3186,391.74690899999996,192.168.43.215,52.113.194.133,TCP,54,49262  >  443 [ACK] Seq=12345 Ack=2043789 Win=258 Len=0
3187,391.746989,52.113.194.133,192.168.43.215,TLSv1.2,141,Application Data
3188,391.747104,52.113.194.133,192.168.43.215,TLSv1.2,92,Application Data
3189,391.74716,192.168.43.215,52.113.194.133,TCP,54,49262  >  443 [ACK] Seq=12345 Ack=2043914 Win=258 Len=0
3190,391.947227,192.168.43.215,52.113.194.133,TLSv1.2,120,Application Data
3191,391.97884,52.113.194.133,192.168.43.215,TCP,54,443  >  49262 [ACK] Seq=2043914 Ack=12411 Win=2046 Len=0
3192,392.018367,52.113.194.133,192.168.43.215,TCP,1354,443  >  49262 [ACK] Seq=2043914 Ack=12411 Win=2046 Len=1300 [TCP segment of a reassembled PDU]
3193,392.018523,52.113.194.133,192.168.43.215,TLSv1.2,336,Application Data
3194,392.01858,192.168.43.215,52.113.194.133,TCP,54,49262  >  443 [ACK] Seq=12411 Ack=2045496 Win=258 Len=0
3195,392.01883599999996,52.113.194.133,192.168.43.215,TCP,1354,443  >  49262 [ACK] Seq=2045496 Ack=12411 Win=2046 Len=1300 [TCP segment of a reassembled PDU]
3196,392.01902,52.113.194.133,192.168.43.215,TCP,1354,443  >  49262 [ACK] Seq=2046796 Ack=12411 Win=2046 Len=1300 [TCP segment of a reassembled PDU]
3197,392.01909,192.168.43.215,52.113.194.133,TCP,54,49262  >  443 [ACK] Seq=12411 Ack=2048096 Win=258 Len=0
3198,392.019304,52.113.194.133,192.168.43.215,TCP,1354,443  >  49262 [ACK] Seq=2048096 Ack=12411 Win=2046 Len=1300 [TCP segment of a reassembled PDU]
3199,392.019362,52.113.194.133,192.168.43.215,TCP,1354,443  >  49262 [ACK] Seq=2049396 Ack=12411 Win=2046 Len=1300 [TCP segment of a reassembled PDU]
3200,392.019425,192.168.43.215,52.113.194.133,TCP,54,49262  >  443 [ACK] Seq=12411 Ack=2050696 Win=258 Len=0
3201,392.019477,52.113.194.133,192.168.43.215,TCP,1354,443  >  49262 [ACK] Seq=2050696 Ack=12411 Win=2046 Len=1300 [TCP segment of a reassembled PDU]
3202,392.019584,52.113.194.133,192.168.43.215,TCP,1354,443  >  49262 [ACK] Seq=2051996 Ack=12411 Win=2046 Len=1300 [TCP segment of a reassembled PDU]
3203,392.01961600000004,192.168.43.215,52.113.194.133,TCP,54,49262  >  443 [ACK] Seq=12411 Ack=2053296 Win=258 Len=0
3204,392.019657,52.113.194.133,192.168.43.215,TLSv1.2,484,Application Data
3205,392.01982200000003,52.113.194.133,192.168.43.215,TCP,1354,443  >  49262 [ACK] Seq=2053726 Ack=12411 Win=2046 Len=1300 [TCP segment of a reassembled PDU]
3206,392.019861,192.168.43.215,52.113.194.133,TCP,54,49262  >  443 [ACK] Seq=12411 Ack=2055026 Win=258 Len=0
3207,392.020104,52.113.194.133,192.168.43.215,TCP,1354,443  >  49262 [ACK] Seq=2055026 Ack=12411 Win=2046 Len=1300 [TCP segment of a reassembled PDU]
3208,392.027198,52.113.194.133,192.168.43.215,TCP,1354,443  >  49262 [ACK] Seq=2056326 Ack=12411 Win=2046 Len=1300 [TCP segment of a reassembled PDU]
3209,392.027315,192.168.43.215,52.113.194.133,TCP,54,49262  >  443 [ACK] Seq=12411 Ack=2057626 Win=258 Len=0
3210,392.027399,52.113.194.133,192.168.43.215,TLSv1.2,343,Application Data
3211,392.027458,52.113.194.133,192.168.43.215,TCP,1354,443  >  49262 [ACK] Seq=2057915 Ack=12411 Win=2046 Len=1300 [TCP segment of a reassembled PDU]
3212,392.02749700000004,192.168.43.215,52.113.194.133,TCP,54,49262  >  443 [ACK] Seq=12411 Ack=2059215 Win=258 Len=0
3213,392.027598,52.113.194.133,192.168.43.215,TCP,1354,443  >  49262 [ACK] Seq=2059215 Ack=12411 Win=2046 Len=1300 [TCP segment of a reassembled PDU]
3214,392.027788,52.113.194.133,192.168.43.215,TCP,1354,443  >  49262 [ACK] Seq=2060515 Ack=12411 Win=2046 Len=1300 [TCP segment of a reassembled PDU]
3215,392.02788799999996,192.168.43.215,52.113.194.133,TCP,54,49262  >  443 [ACK] Seq=12411 Ack=2061815 Win=258 Len=0
3216,392.02797999999996,52.113.194.133,192.168.43.215,TCP,1354,443  >  49262 [ACK] Seq=2061815 Ack=12411 Win=2046 Len=1300 [TCP segment of a reassembled PDU]
3217,392.028152,52.113.194.133,192.168.43.215,TCP,1354,443  >  49262 [ACK] Seq=2063115 Ack=12411 Win=2046 Len=1300 [TCP segment of a reassembled PDU]
3218,392.028181,192.168.43.215,52.113.194.133,TCP,54,49262  >  443 [ACK] Seq=12411 Ack=2064415 Win=258 Len=0
3219,392.028262,52.113.194.133,192.168.43.215,TLSv1.2,141,Application Data
3220,392.028848,52.113.194.133,192.168.43.215,TLSv1.2,92,Application Data
3221,392.0289,192.168.43.215,52.113.194.133,TCP,54,49262  >  443 [ACK] Seq=12411 Ack=2064540 Win=258 Len=0
3222,392.835554,192.168.43.215,52.113.194.133,TLSv1.2,186,Application Data
3223,392.89662599999997,52.113.194.133,192.168.43.215,TCP,54,443  >  49262 [ACK] Seq=2064540 Ack=12543 Win=2051 Len=0
3224,392.906187,52.113.194.133,192.168.43.215,TCP,1354,443  >  49262 [ACK] Seq=2064540 Ack=12543 Win=2051 Len=1300 [TCP segment of a reassembled PDU]
3225,392.9063,52.113.194.133,192.168.43.215,TLSv1.2,314,Application Data
3226,392.906339,192.168.43.215,52.113.194.133,TCP,54,49262  >  443 [ACK] Seq=12543 Ack=2066100 Win=258 Len=0
3227,392.906433,52.113.194.133,192.168.43.215,TCP,1354,443  >  49262 [ACK] Seq=2066100 Ack=12543 Win=2051 Len=1300 [TCP segment of a reassembled PDU]
3228,392.907294,52.113.194.133,192.168.43.215,TCP,1354,443  >  49262 [ACK] Seq=2067400 Ack=12543 Win=2051 Len=1300 [TCP segment of a reassembled PDU]
3229,392.90738999999996,192.168.43.215,52.113.194.133,TCP,54,49262  >  443 [ACK] Seq=12543 Ack=2068700 Win=258 Len=0
3230,392.90750499999996,52.113.194.133,192.168.43.215,TCP,1354,443  >  49262 [ACK] Seq=2068700 Ack=12543 Win=2051 Len=1300 [TCP segment of a reassembled PDU]
3231,392.907603,52.113.194.133,192.168.43.215,TCP,1354,443  >  49262 [ACK] Seq=2070000 Ack=12543 Win=2051 Len=1300 [TCP segment of a reassembled PDU]
3232,392.90763799999996,192.168.43.215,52.113.194.133,TCP,54,49262  >  443 [ACK] Seq=12543 Ack=2071300 Win=258 Len=0
3233,392.907811,52.113.194.133,192.168.43.215,TCP,1354,443  >  49262 [ACK] Seq=2071300 Ack=12543 Win=2051 Len=1300 [TCP segment of a reassembled PDU]
3234,392.907957,52.113.194.133,192.168.43.215,TCP,1354,443  >  49262 [ACK] Seq=2072600 Ack=12543 Win=2051 Len=1300 [TCP segment of a reassembled PDU]
3235,392.90799,192.168.43.215,52.113.194.133,TCP,54,49262  >  443 [ACK] Seq=12543 Ack=2073900 Win=258 Len=0
3236,392.908116,52.113.194.133,192.168.43.215,TLSv1.2,484,Application Data
3237,392.909195,52.113.194.133,192.168.43.215,TCP,1354,443  >  49262 [ACK] Seq=2074330 Ack=12543 Win=2051 Len=1300 [TCP segment of a reassembled PDU]
3238,392.90927400000004,192.168.43.215,52.113.194.133,TCP,54,49262  >  443 [ACK] Seq=12543 Ack=2075630 Win=258 Len=0
3239,392.909423,52.113.194.133,192.168.43.215,TCP,1354,443  >  49262 [ACK] Seq=2075630 Ack=12543 Win=2051 Len=1300 [TCP segment of a reassembled PDU]
3240,392.909573,52.113.194.133,192.168.43.215,TCP,1354,443  >  49262 [ACK] Seq=2076930 Ack=12543 Win=2051 Len=1300 [TCP segment of a reassembled PDU]
3241,392.909611,192.168.43.215,52.113.194.133,TCP,54,49262  >  443 [ACK] Seq=12543 Ack=2078230 Win=258 Len=0
3242,392.909671,52.113.194.133,192.168.43.215,TLSv1.2,343,Application Data
3243,392.909787,52.113.194.133,192.168.43.215,TCP,1354,443  >  49262 [ACK] Seq=2078519 Ack=12543 Win=2051 Len=1300 [TCP segment of a reassembled PDU]
3244,392.909833,192.168.43.215,52.113.194.133,TCP,54,49262  >  443 [ACK] Seq=12543 Ack=2079819 Win=258 Len=0
3245,392.90995699999996,52.113.194.133,192.168.43.215,TCP,1354,443  >  49262 [ACK] Seq=2079819 Ack=12543 Win=2051 Len=1300 [TCP segment of a reassembled PDU]
3246,392.910232,52.113.194.133,192.168.43.215,TCP,1354,443  >  49262 [ACK] Seq=2081119 Ack=12543 Win=2051 Len=1300 [TCP segment of a reassembled PDU]
3247,392.910286,192.168.43.215,52.113.194.133,TCP,54,49262  >  443 [ACK] Seq=12543 Ack=2082419 Win=258 Len=0
3248,392.91042799999997,52.113.194.133,192.168.43.215,TCP,1354,443  >  49262 [ACK] Seq=2082419 Ack=12543 Win=2051 Len=1300 [TCP segment of a reassembled PDU]
3249,392.91065499999996,52.113.194.133,192.168.43.215,TCP,1354,443  >  49262 [ACK] Seq=2083719 Ack=12543 Win=2051 Len=1300 [TCP segment of a reassembled PDU]
3250,392.9107,192.168.43.215,52.113.194.133,TCP,54,49262  >  443 [ACK] Seq=12543 Ack=2085019 Win=258 Len=0
3251,392.910756,52.113.194.133,192.168.43.215,TLSv1.2,141,Application Data
3252,392.91084900000004,52.113.194.133,192.168.43.215,TLSv1.2,92,Application Data
3253,392.91087200000004,192.168.43.215,52.113.194.133,TCP,54,49262  >  443 [ACK] Seq=12543 Ack=2085144 Win=258 Len=0
3254,393.22562999999997,192.168.43.215,52.113.194.133,TLSv1.2,120,Application Data
3255,393.247725,52.113.194.133,192.168.43.215,TCP,54,443  >  49262 [ACK] Seq=2085144 Ack=12609 Win=2051 Len=0
3256,393.30423199999996,52.113.194.133,192.168.43.215,TCP,1354,443  >  49262 [ACK] Seq=2085144 Ack=12609 Win=2051 Len=1300 [TCP segment of a reassembled PDU]
3257,393.304329,52.113.194.133,192.168.43.215,TLSv1.2,349,Application Data
3258,393.304371,192.168.43.215,52.113.194.133,TCP,54,49262  >  443 [ACK] Seq=12609 Ack=2086739 Win=258 Len=0
3259,393.304464,52.113.194.133,192.168.43.215,TCP,1354,443  >  49262 [ACK] Seq=2086739 Ack=12609 Win=2051 Len=1300 [TCP segment of a reassembled PDU]
3260,393.304597,52.113.194.133,192.168.43.215,TCP,1354,443  >  49262 [ACK] Seq=2088039 Ack=12609 Win=2051 Len=1300 [TCP segment of a reassembled PDU]
3261,393.30472000000003,192.168.43.215,52.113.194.133,TCP,54,49262  >  443 [ACK] Seq=12609 Ack=2089339 Win=258 Len=0
3262,393.304862,52.113.194.133,192.168.43.215,TCP,1354,443  >  49262 [ACK] Seq=2089339 Ack=12609 Win=2051 Len=1300 [TCP segment of a reassembled PDU]
3263,393.304932,52.113.194.133,192.168.43.215,TCP,1354,443  >  49262 [ACK] Seq=2090639 Ack=12609 Win=2051 Len=1300 [TCP segment of a reassembled PDU]
3264,393.304965,192.168.43.215,52.113.194.133,TCP,54,49262  >  443 [ACK] Seq=12609 Ack=2091939 Win=258 Len=0
3265,393.30507,52.113.194.133,192.168.43.215,TCP,1354,443  >  49262 [ACK] Seq=2091939 Ack=12609 Win=2051 Len=1300 [TCP segment of a reassembled PDU]
3266,393.30532200000005,52.113.194.133,192.168.43.215,TCP,1354,443  >  49262 [ACK] Seq=2093239 Ack=12609 Win=2051 Len=1300 [TCP segment of a reassembled PDU]
3267,393.305373,192.168.43.215,52.113.194.133,TCP,54,49262  >  443 [ACK] Seq=12609 Ack=2094539 Win=258 Len=0
3268,393.305466,52.113.194.133,192.168.43.215,TLSv1.2,484,Application Data
3269,393.305519,52.113.194.133,192.168.43.215,TCP,1354,443  >  49262 [ACK] Seq=2094969 Ack=12609 Win=2051 Len=1300 [TCP segment of a reassembled PDU]
3270,393.30555,192.168.43.215,52.113.194.133,TCP,54,49262  >  443 [ACK] Seq=12609 Ack=2096269 Win=258 Len=0
3271,393.305695,52.113.194.133,192.168.43.215,TCP,1354,443  >  49262 [ACK] Seq=2096269 Ack=12609 Win=2051 Len=1300 [TCP segment of a reassembled PDU]
3272,393.305837,52.113.194.133,192.168.43.215,TCP,1354,443  >  49262 [ACK] Seq=2097569 Ack=12609 Win=2051 Len=1300 [TCP segment of a reassembled PDU]
3273,393.305865,192.168.43.215,52.113.194.133,TCP,54,49262  >  443 [ACK] Seq=12609 Ack=2098869 Win=258 Len=0
3274,393.305946,52.113.194.133,192.168.43.215,TLSv1.2,343,Application Data
3275,393.30613,52.113.194.133,192.168.43.215,TCP,1354,443  >  49262 [ACK] Seq=2099158 Ack=12609 Win=2051 Len=1300 [TCP segment of a reassembled PDU]
3276,393.30616299999997,192.168.43.215,52.113.194.133,TCP,54,49262  >  443 [ACK] Seq=12609 Ack=2100458 Win=258 Len=0
3277,393.306284,52.113.194.133,192.168.43.215,TCP,1354,443  >  49262 [ACK] Seq=2100458 Ack=12609 Win=2051 Len=1300 [TCP segment of a reassembled PDU]
3278,393.306463,52.113.194.133,192.168.43.215,TCP,1354,443  >  49262 [ACK] Seq=2101758 Ack=12609 Win=2051 Len=1300 [TCP segment of a reassembled PDU]
3279,393.30649900000003,192.168.43.215,52.113.194.133,TCP,54,49262  >  443 [ACK] Seq=12609 Ack=2103058 Win=258 Len=0
3280,393.306781,52.113.194.133,192.168.43.215,TCP,1354,443  >  49262 [ACK] Seq=2103058 Ack=12609 Win=2051 Len=1300 [TCP segment of a reassembled PDU]
3281,393.306883,52.113.194.133,192.168.43.215,TCP,1354,443  >  49262 [ACK] Seq=2104358 Ack=12609 Win=2051 Len=1300 [TCP segment of a reassembled PDU]
3282,393.30691,192.168.43.215,52.113.194.133,TCP,54,49262  >  443 [ACK] Seq=12609 Ack=2105658 Win=258 Len=0
3283,393.306981,52.113.194.133,192.168.43.215,TLSv1.2,141,Application Data
3284,393.307833,52.113.194.133,192.168.43.215,TLSv1.2,92,Application Data
3285,393.307898,192.168.43.215,52.113.194.133,TCP,54,49262  >  443 [ACK] Seq=12609 Ack=2105783 Win=258 Len=0
3286,394.314953,192.168.43.215,52.113.194.133,TLSv1.2,120,Application Data
3287,394.36458500000003,52.113.194.133,192.168.43.215,TCP,54,443  >  49262 [ACK] Seq=2105783 Ack=12675 Win=2051 Len=0
3288,394.402322,52.113.194.133,192.168.43.215,TCP,1354,443  >  49262 [ACK] Seq=2105783 Ack=12675 Win=2051 Len=1300 [TCP segment of a reassembled PDU]
3289,394.403031,52.113.194.133,192.168.43.215,TCP,1354,443  >  49262 [ACK] Seq=2107083 Ack=12675 Win=2051 Len=1300 [TCP segment of a reassembled PDU]
3290,394.403076,192.168.43.215,52.113.194.133,TCP,54,49262  >  443 [ACK] Seq=12675 Ack=2108383 Win=258 Len=0
3291,394.40315699999996,52.113.194.133,192.168.43.215,TLSv1.2,633,Application Data
3292,394.403927,52.113.194.133,192.168.43.215,TCP,1354,443  >  49262 [ACK] Seq=2108962 Ack=12675 Win=2051 Len=1300 [TCP segment of a reassembled PDU]
3293,394.403972,192.168.43.215,52.113.194.133,TCP,54,49262  >  443 [ACK] Seq=12675 Ack=2110262 Win=258 Len=0
3294,394.404038,52.113.194.133,192.168.43.215,TCP,1354,443  >  49262 [ACK] Seq=2110262 Ack=12675 Win=2051 Len=1300 [TCP segment of a reassembled PDU]
3295,394.404185,52.113.194.133,192.168.43.215,TCP,1354,443  >  49262 [ACK] Seq=2111562 Ack=12675 Win=2051 Len=1300 [TCP segment of a reassembled PDU]
3296,394.40421299999997,192.168.43.215,52.113.194.133,TCP,54,49262  >  443 [ACK] Seq=12675 Ack=2112862 Win=258 Len=0
3297,394.40432799999996,52.113.194.133,192.168.43.215,TCP,1354,443  >  49262 [ACK] Seq=2112862 Ack=12675 Win=2051 Len=1300 [TCP segment of a reassembled PDU]
3298,394.4045,52.113.194.133,192.168.43.215,TCP,1354,443  >  49262 [ACK] Seq=2114162 Ack=12675 Win=2051 Len=1300 [TCP segment of a reassembled PDU]
3299,394.40452700000003,192.168.43.215,52.113.194.133,TCP,54,49262  >  443 [ACK] Seq=12675 Ack=2115462 Win=258 Len=0
3300,394.404672,52.113.194.133,192.168.43.215,TCP,1354,443  >  49262 [ACK] Seq=2115462 Ack=12675 Win=2051 Len=1300 [TCP segment of a reassembled PDU]
3301,394.40479700000003,52.113.194.133,192.168.43.215,TLSv1.2,484,Application Data
3302,394.404827,192.168.43.215,52.113.194.133,TCP,54,49262  >  443 [ACK] Seq=12675 Ack=2117192 Win=258 Len=0
3303,394.404958,52.113.194.133,192.168.43.215,TCP,1354,443  >  49262 [ACK] Seq=2117192 Ack=12675 Win=2051 Len=1300 [TCP segment of a reassembled PDU]
3304,394.405134,52.113.194.133,192.168.43.215,TCP,1354,443  >  49262 [ACK] Seq=2118492 Ack=12675 Win=2051 Len=1300 [TCP segment of a reassembled PDU]
3305,394.405168,192.168.43.215,52.113.194.133,TCP,54,49262  >  443 [ACK] Seq=12675 Ack=2119792 Win=258 Len=0
3306,394.405421,52.113.194.133,192.168.43.215,TCP,1354,443  >  49262 [ACK] Seq=2119792 Ack=12675 Win=2051 Len=1300 [TCP segment of a reassembled PDU]
3307,394.405474,52.113.194.133,192.168.43.215,TLSv1.2,343,Application Data
3308,394.405507,192.168.43.215,52.113.194.133,TCP,54,49262  >  443 [ACK] Seq=12675 Ack=2121381 Win=258 Len=0
3309,394.405638,52.113.194.133,192.168.43.215,TCP,1354,443  >  49262 [ACK] Seq=2121381 Ack=12675 Win=2051 Len=1300 [TCP segment of a reassembled PDU]
3310,394.40576400000003,52.113.194.133,192.168.43.215,TCP,1354,443  >  49262 [ACK] Seq=2122681 Ack=12675 Win=2051 Len=1300 [TCP segment of a reassembled PDU]
3311,394.405814,192.168.43.215,52.113.194.133,TCP,54,49262  >  443 [ACK] Seq=12675 Ack=2123981 Win=258 Len=0
3312,394.406021,52.113.194.133,192.168.43.215,TCP,1354,443  >  49262 [ACK] Seq=2123981 Ack=12675 Win=2051 Len=1300 [TCP segment of a reassembled PDU]
3313,394.406171,52.113.194.133,192.168.43.215,TCP,1354,443  >  49262 [ACK] Seq=2125281 Ack=12675 Win=2051 Len=1300 [TCP segment of a reassembled PDU]
3314,394.406208,192.168.43.215,52.113.194.133,TCP,54,49262  >  443 [ACK] Seq=12675 Ack=2126581 Win=258 Len=0
3315,394.406454,52.113.194.133,192.168.43.215,TCP,1354,443  >  49262 [ACK] Seq=2126581 Ack=12675 Win=2051 Len=1300 [TCP segment of a reassembled PDU]
3316,394.406544,52.113.194.133,192.168.43.215,TLSv1.2,141,Application Data
3317,394.406587,192.168.43.215,52.113.194.133,TCP,54,49262  >  443 [ACK] Seq=12675 Ack=2127968 Win=258 Len=0
3318,394.406668,52.113.194.133,192.168.43.215,TLSv1.2,92,Application Data
3319,394.48262900000003,192.168.43.215,52.113.194.133,TCP,54,49262  >  443 [ACK] Seq=12675 Ack=2128006 Win=258 Len=0
3320,394.99495099999996,192.168.43.215,52.113.194.133,TLSv1.2,186,Application Data
3321,395.014471,52.113.194.133,192.168.43.215,TCP,54,443  >  49262 [ACK] Seq=2128006 Ack=12807 Win=2050 Len=0
3322,395.056176,52.113.194.133,192.168.43.215,TCP,1354,443  >  49262 [ACK] Seq=2128006 Ack=12807 Win=2050 Len=1300 [TCP segment of a reassembled PDU]
3323,395.05627999999996,52.113.194.133,192.168.43.215,TLSv1.2,337,Application Data
3324,395.056319,192.168.43.215,52.113.194.133,TCP,54,49262  >  443 [ACK] Seq=12807 Ack=2129589 Win=258 Len=0
3325,395.05645899999996,52.113.194.133,192.168.43.215,TCP,1354,443  >  49262 [ACK] Seq=2129589 Ack=12807 Win=2050 Len=1300 [TCP segment of a reassembled PDU]
3326,395.056585,52.113.194.133,192.168.43.215,TCP,1354,443  >  49262 [ACK] Seq=2130889 Ack=12807 Win=2050 Len=1300 [TCP segment of a reassembled PDU]
3327,395.056622,192.168.43.215,52.113.194.133,TCP,54,49262  >  443 [ACK] Seq=12807 Ack=2132189 Win=258 Len=0
3328,395.056737,52.113.194.133,192.168.43.215,TCP,1354,443  >  49262 [ACK] Seq=2132189 Ack=12807 Win=2050 Len=1300 [TCP segment of a reassembled PDU]
3329,395.056867,52.113.194.133,192.168.43.215,TCP,1354,443  >  49262 [ACK] Seq=2133489 Ack=12807 Win=2050 Len=1300 [TCP segment of a reassembled PDU]
3330,395.056906,192.168.43.215,52.113.194.133,TCP,54,49262  >  443 [ACK] Seq=12807 Ack=2134789 Win=258 Len=0
3331,395.057033,52.113.194.133,192.168.43.215,TCP,1354,443  >  49262 [ACK] Seq=2134789 Ack=12807 Win=2050 Len=1300 [TCP segment of a reassembled PDU]
3332,395.057177,52.113.194.133,192.168.43.215,TCP,1354,443  >  49262 [ACK] Seq=2136089 Ack=12807 Win=2050 Len=1300 [TCP segment of a reassembled PDU]
3333,395.057206,192.168.43.215,52.113.194.133,TCP,54,49262  >  443 [ACK] Seq=12807 Ack=2137389 Win=258 Len=0
3334,395.05731099999997,52.113.194.133,192.168.43.215,TLSv1.2,484,Application Data
3335,395.05751200000003,52.113.194.133,192.168.43.215,TCP,1354,443  >  49262 [ACK] Seq=2137819 Ack=12807 Win=2050 Len=1300 [TCP segment of a reassembled PDU]
3336,395.057549,192.168.43.215,52.113.194.133,TCP,54,49262  >  443 [ACK] Seq=12807 Ack=2139119 Win=258 Len=0
3337,395.05778399999997,52.113.194.133,192.168.43.215,TCP,1354,443  >  49262 [ACK] Seq=2139119 Ack=12807 Win=2050 Len=1300 [TCP segment of a reassembled PDU]
3338,395.057928,52.113.194.133,192.168.43.215,TCP,1354,443  >  49262 [ACK] Seq=2140419 Ack=12807 Win=2050 Len=1300 [TCP segment of a reassembled PDU]
3339,395.057969,192.168.43.215,52.113.194.133,TCP,54,49262  >  443 [ACK] Seq=12807 Ack=2141719 Win=258 Len=0
3340,395.05801,52.113.194.133,192.168.43.215,TLSv1.2,343,Application Data
3341,395.058104,52.113.194.133,192.168.43.215,TCP,1354,443  >  49262 [ACK] Seq=2142008 Ack=12807 Win=2050 Len=1300 [TCP segment of a reassembled PDU]
3342,395.05815099999995,192.168.43.215,52.113.194.133,TCP,54,49262  >  443 [ACK] Seq=12807 Ack=2143308 Win=258 Len=0
3343,395.05829900000003,52.113.194.133,192.168.43.215,TCP,1354,443  >  49262 [ACK] Seq=2143308 Ack=12807 Win=2050 Len=1300 [TCP segment of a reassembled PDU]
3344,395.05855499999996,52.113.194.133,192.168.43.215,TCP,1354,443  >  49262 [ACK] Seq=2144608 Ack=12807 Win=2050 Len=1300 [TCP segment of a reassembled PDU]
3345,395.058592,192.168.43.215,52.113.194.133,TCP,54,49262  >  443 [ACK] Seq=12807 Ack=2145908 Win=258 Len=0
3346,395.05872,52.113.194.133,192.168.43.215,TCP,1354,443  >  49262 [ACK] Seq=2145908 Ack=12807 Win=2050 Len=1300 [TCP segment of a reassembled PDU]
3347,395.058953,52.113.194.133,192.168.43.215,TCP,1354,443  >  49262 [ACK] Seq=2147208 Ack=12807 Win=2050 Len=1300 [TCP segment of a reassembled PDU]
3348,395.05898199999996,192.168.43.215,52.113.194.133,TCP,54,49262  >  443 [ACK] Seq=12807 Ack=2148508 Win=258 Len=0
3349,395.059049,52.113.194.133,192.168.43.215,TLSv1.2,141,Application Data
3350,395.059909,52.113.194.133,192.168.43.215,TLSv1.2,92,Application Data
3351,395.059967,192.168.43.215,52.113.194.133,TCP,54,49262  >  443 [ACK] Seq=12807 Ack=2148633 Win=258 Len=0
3352,395.47596,192.168.43.215,52.113.194.133,TLSv1.2,186,Application Data
3353,395.535073,52.113.194.133,192.168.43.215,TCP,54,443  >  49262 [ACK] Seq=2148633 Ack=12939 Win=2050 Len=0
3354,395.548,52.113.194.133,192.168.43.215,TCP,1354,443  >  49262 [ACK] Seq=2148633 Ack=12939 Win=2050 Len=1300 [TCP segment of a reassembled PDU]
3355,395.548185,52.113.194.133,192.168.43.215,TLSv1.2,315,Application Data
3356,395.548276,192.168.43.215,52.113.194.133,TCP,54,49262  >  443 [ACK] Seq=12939 Ack=2150194 Win=258 Len=0
3357,395.549036,52.113.194.133,192.168.43.215,TCP,1354,443  >  49262 [ACK] Seq=2150194 Ack=12939 Win=2050 Len=1300 [TCP segment of a reassembled PDU]
3358,395.557358,52.113.194.133,192.168.43.215,TCP,1354,443  >  49262 [ACK] Seq=2151494 Ack=12939 Win=2050 Len=1300 [TCP segment of a reassembled PDU]
3359,395.557458,192.168.43.215,52.113.194.133,TCP,54,49262  >  443 [ACK] Seq=12939 Ack=2152794 Win=258 Len=0
3360,395.557596,52.113.194.133,192.168.43.215,TCP,1354,443  >  49262 [ACK] Seq=2152794 Ack=12939 Win=2050 Len=1300 [TCP segment of a reassembled PDU]
3361,395.557726,52.113.194.133,192.168.43.215,TCP,1354,443  >  49262 [ACK] Seq=2154094 Ack=12939 Win=2050 Len=1300 [TCP segment of a reassembled PDU]
3362,395.557765,192.168.43.215,52.113.194.133,TCP,54,49262  >  443 [ACK] Seq=12939 Ack=2155394 Win=258 Len=0
3363,395.557859,52.113.194.133,192.168.43.215,TCP,1354,443  >  49262 [ACK] Seq=2155394 Ack=12939 Win=2050 Len=1300 [TCP segment of a reassembled PDU]
3364,395.55791,52.113.194.133,192.168.43.215,TCP,1354,443  >  49262 [ACK] Seq=2156694 Ack=12939 Win=2050 Len=1300 [TCP segment of a reassembled PDU]
3365,395.557936,192.168.43.215,52.113.194.133,TCP,54,49262  >  443 [ACK] Seq=12939 Ack=2157994 Win=258 Len=0
3366,395.55804,52.113.194.133,192.168.43.215,TLSv1.2,484,Application Data
3367,395.558238,52.113.194.133,192.168.43.215,TCP,1354,443  >  49262 [ACK] Seq=2158424 Ack=12939 Win=2050 Len=1300 [TCP segment of a reassembled PDU]
3368,395.558291,192.168.43.215,52.113.194.133,TCP,54,49262  >  443 [ACK] Seq=12939 Ack=2159724 Win=258 Len=0
3369,395.558488,52.113.194.133,192.168.43.215,TCP,1354,443  >  49262 [ACK] Seq=2159724 Ack=12939 Win=2050 Len=1300 [TCP segment of a reassembled PDU]
3370,395.558657,52.113.194.133,192.168.43.215,TCP,1354,443  >  49262 [ACK] Seq=2161024 Ack=12939 Win=2050 Len=1300 [TCP segment of a reassembled PDU]
3371,395.558712,192.168.43.215,52.113.194.133,TCP,54,49262  >  443 [ACK] Seq=12939 Ack=2162324 Win=258 Len=0
3372,395.558782,52.113.194.133,192.168.43.215,TLSv1.2,343,Application Data
3373,395.558856,52.113.194.133,192.168.43.215,TCP,1354,443  >  49262 [ACK] Seq=2162613 Ack=12939 Win=2050 Len=1300 [TCP segment of a reassembled PDU]
3374,395.558899,192.168.43.215,52.113.194.133,TCP,54,49262  >  443 [ACK] Seq=12939 Ack=2163913 Win=258 Len=0
3375,395.55900299999996,52.113.194.133,192.168.43.215,TCP,1354,443  >  49262 [ACK] Seq=2163913 Ack=12939 Win=2050 Len=1300 [TCP segment of a reassembled PDU]
3376,395.559271,52.113.194.133,192.168.43.215,TCP,1354,443  >  49262 [ACK] Seq=2165213 Ack=12939 Win=2050 Len=1300 [TCP segment of a reassembled PDU]
3377,395.55931,192.168.43.215,52.113.194.133,TCP,54,49262  >  443 [ACK] Seq=12939 Ack=2166513 Win=258 Len=0
3378,395.559439,52.113.194.133,192.168.43.215,TCP,1354,443  >  49262 [ACK] Seq=2166513 Ack=12939 Win=2050 Len=1300 [TCP segment of a reassembled PDU]
3379,395.559698,52.113.194.133,192.168.43.215,TCP,1354,443  >  49262 [ACK] Seq=2167813 Ack=12939 Win=2050 Len=1300 [TCP segment of a reassembled PDU]
3380,395.559737,192.168.43.215,52.113.194.133,TCP,54,49262  >  443 [ACK] Seq=12939 Ack=2169113 Win=258 Len=0
3381,395.559814,52.113.194.133,192.168.43.215,TLSv1.2,141,Application Data
3382,395.55990099999997,52.113.194.133,192.168.43.215,TLSv1.2,92,Application Data
3383,395.559933,192.168.43.215,52.113.194.133,TCP,54,49262  >  443 [ACK] Seq=12939 Ack=2169238 Win=258 Len=0
3384,396.17114399999997,192.168.43.215,52.113.194.133,TLSv1.2,120,Application Data
3385,396.214789,52.113.194.133,192.168.43.215,TCP,54,443  >  49262 [ACK] Seq=2169238 Ack=13005 Win=2049 Len=0
3386,396.25601,52.113.194.133,192.168.43.215,TCP,1354,443  >  49262 [ACK] Seq=2169238 Ack=13005 Win=2049 Len=1300 [TCP segment of a reassembled PDU]
3387,396.25611499999997,52.113.194.133,192.168.43.215,TLSv1.2,459,Application Data
3388,396.256168,192.168.43.215,52.113.194.133,TCP,54,49262  >  443 [ACK] Seq=13005 Ack=2170943 Win=258 Len=0
3389,396.25633999999997,52.113.194.133,192.168.43.215,TCP,1354,443  >  49262 [ACK] Seq=2170943 Ack=13005 Win=2049 Len=1300 [TCP segment of a reassembled PDU]
3390,396.256469,52.113.194.133,192.168.43.215,TCP,1354,443  >  49262 [ACK] Seq=2172243 Ack=13005 Win=2049 Len=1300 [TCP segment of a reassembled PDU]
3391,396.256511,192.168.43.215,52.113.194.133,TCP,54,49262  >  443 [ACK] Seq=13005 Ack=2173543 Win=258 Len=0
3392,396.25664,52.113.194.133,192.168.43.215,TCP,1354,443  >  49262 [ACK] Seq=2173543 Ack=13005 Win=2049 Len=1300 [TCP segment of a reassembled PDU]
3393,396.25675,52.113.194.133,192.168.43.215,TCP,1354,443  >  49262 [ACK] Seq=2174843 Ack=13005 Win=2049 Len=1300 [TCP segment of a reassembled PDU]
3394,396.256781,192.168.43.215,52.113.194.133,TCP,54,49262  >  443 [ACK] Seq=13005 Ack=2176143 Win=258 Len=0
3395,396.25690299999997,52.113.194.133,192.168.43.215,TCP,1354,443  >  49262 [ACK] Seq=2176143 Ack=13005 Win=2049 Len=1300 [TCP segment of a reassembled PDU]
3396,396.257071,52.113.194.133,192.168.43.215,TCP,1354,443  >  49262 [ACK] Seq=2177443 Ack=13005 Win=2049 Len=1300 [TCP segment of a reassembled PDU]
3397,396.257106,192.168.43.215,52.113.194.133,TCP,54,49262  >  443 [ACK] Seq=13005 Ack=2178743 Win=258 Len=0
3398,396.257198,52.113.194.133,192.168.43.215,TLSv1.2,484,Application Data
3399,396.25741,52.113.194.133,192.168.43.215,TCP,1354,443  >  49262 [ACK] Seq=2179173 Ack=13005 Win=2049 Len=1300 [TCP segment of a reassembled PDU]
3400,396.257456,192.168.43.215,52.113.194.133,TCP,54,49262  >  443 [ACK] Seq=13005 Ack=2180473 Win=258 Len=0
3401,396.258194,52.113.194.133,192.168.43.215,TCP,1354,443  >  49262 [ACK] Seq=2180473 Ack=13005 Win=2049 Len=1300 [TCP segment of a reassembled PDU]
3402,396.258348,52.113.194.133,192.168.43.215,TCP,1354,443  >  49262 [ACK] Seq=2181773 Ack=13005 Win=2049 Len=1300 [TCP segment of a reassembled PDU]
3403,396.258417,192.168.43.215,52.113.194.133,TCP,54,49262  >  443 [ACK] Seq=13005 Ack=2183073 Win=258 Len=0
3404,396.25847200000004,52.113.194.133,192.168.43.215,TLSv1.2,343,Application Data
3405,396.258627,52.113.194.133,192.168.43.215,TCP,1354,443  >  49262 [ACK] Seq=2183362 Ack=13005 Win=2049 Len=1300 [TCP segment of a reassembled PDU]
3406,396.25868399999996,192.168.43.215,52.113.194.133,TCP,54,49262  >  443 [ACK] Seq=13005 Ack=2184662 Win=258 Len=0
3407,396.258823,52.113.194.133,192.168.43.215,TCP,1354,443  >  49262 [ACK] Seq=2184662 Ack=13005 Win=2049 Len=1300 [TCP segment of a reassembled PDU]
3408,396.25906000000003,52.113.194.133,192.168.43.215,TCP,1354,443  >  49262 [ACK] Seq=2185962 Ack=13005 Win=2049 Len=1300 [TCP segment of a reassembled PDU]
3409,396.259093,192.168.43.215,52.113.194.133,TCP,54,49262  >  443 [ACK] Seq=13005 Ack=2187262 Win=258 Len=0
3410,396.259337,52.113.194.133,192.168.43.215,TCP,1354,443  >  49262 [ACK] Seq=2187262 Ack=13005 Win=2049 Len=1300 [TCP segment of a reassembled PDU]
3411,396.25957200000005,52.113.194.133,192.168.43.215,TCP,1354,443  >  49262 [ACK] Seq=2188562 Ack=13005 Win=2049 Len=1300 [TCP segment of a reassembled PDU]
3412,396.25960699999996,192.168.43.215,52.113.194.133,TCP,54,49262  >  443 [ACK] Seq=13005 Ack=2189862 Win=258 Len=0
3413,396.259687,52.113.194.133,192.168.43.215,TLSv1.2,141,Application Data
3414,396.259801,52.113.194.133,192.168.43.215,TLSv1.2,92,Application Data
3415,396.25984500000004,192.168.43.215,52.113.194.133,TCP,54,49262  >  443 [ACK] Seq=13005 Ack=2189987 Win=258 Len=0
3416,396.645739,192.168.43.215,52.113.194.133,TLSv1.2,186,Application Data
3417,396.67868599999997,52.113.194.133,192.168.43.215,TCP,54,443  >  49262 [ACK] Seq=2189987 Ack=13137 Win=2049 Len=0
3418,396.735135,52.113.194.133,192.168.43.215,TCP,1354,443  >  49262 [ACK] Seq=2189987 Ack=13137 Win=2049 Len=1300 [TCP segment of a reassembled PDU]
3419,396.735295,52.113.194.133,192.168.43.215,TLSv1.2,314,Application Data
3420,396.73535400000003,192.168.43.215,52.113.194.133,TCP,54,49262  >  443 [ACK] Seq=13137 Ack=2191547 Win=258 Len=0
3421,396.735499,52.113.194.133,192.168.43.215,TCP,1354,443  >  49262 [ACK] Seq=2191547 Ack=13137 Win=2049 Len=1300 [TCP segment of a reassembled PDU]
3422,396.735564,52.113.194.133,192.168.43.215,TCP,1354,443  >  49262 [ACK] Seq=2192847 Ack=13137 Win=2049 Len=1300 [TCP segment of a reassembled PDU]
3423,396.735596,192.168.43.215,52.113.194.133,TCP,54,49262  >  443 [ACK] Seq=13137 Ack=2194147 Win=258 Len=0
3424,396.73578,52.113.194.133,192.168.43.215,TCP,1354,443  >  49262 [ACK] Seq=2194147 Ack=13137 Win=2049 Len=1300 [TCP segment of a reassembled PDU]
3425,396.736003,52.113.194.133,192.168.43.215,TCP,1354,443  >  49262 [ACK] Seq=2195447 Ack=13137 Win=2049 Len=1300 [TCP segment of a reassembled PDU]
3426,396.736036,192.168.43.215,52.113.194.133,TCP,54,49262  >  443 [ACK] Seq=13137 Ack=2196747 Win=258 Len=0
3427,396.74287799999996,52.113.194.133,192.168.43.215,TCP,1354,443  >  49262 [ACK] Seq=2196747 Ack=13137 Win=2049 Len=1300 [TCP segment of a reassembled PDU]
3428,396.74307400000004,52.113.194.133,192.168.43.215,TCP,1354,443  >  49262 [ACK] Seq=2198047 Ack=13137 Win=2049 Len=1300 [TCP segment of a reassembled PDU]
3429,396.743158,192.168.43.215,52.113.194.133,TCP,54,49262  >  443 [ACK] Seq=13137 Ack=2199347 Win=258 Len=0
3430,396.743227,52.113.194.133,192.168.43.215,TLSv1.2,484,Application Data
3431,396.743292,52.113.194.133,192.168.43.215,TCP,1354,443  >  49262 [ACK] Seq=2199777 Ack=13137 Win=2049 Len=1300 [TCP segment of a reassembled PDU]
3432,396.743317,192.168.43.215,52.113.194.133,TCP,54,49262  >  443 [ACK] Seq=13137 Ack=2201077 Win=258 Len=0
3433,396.743427,52.113.194.133,192.168.43.215,TCP,1354,443  >  49262 [ACK] Seq=2201077 Ack=13137 Win=2049 Len=1300 [TCP segment of a reassembled PDU]
3434,396.743645,52.113.194.133,192.168.43.215,TCP,1354,443  >  49262 [ACK] Seq=2202377 Ack=13137 Win=2049 Len=1300 [TCP segment of a reassembled PDU]
3435,396.743681,192.168.43.215,52.113.194.133,TCP,54,49262  >  443 [ACK] Seq=13137 Ack=2203677 Win=258 Len=0
3436,396.743761,52.113.194.133,192.168.43.215,TLSv1.2,343,Application Data
3437,396.751734,52.113.194.133,192.168.43.215,TCP,1354,443  >  49262 [ACK] Seq=2203966 Ack=13137 Win=2049 Len=1300 [TCP segment of a reassembled PDU]
3438,396.751881,192.168.43.215,52.113.194.133,TCP,54,49262  >  443 [ACK] Seq=13137 Ack=2205266 Win=258 Len=0
3439,396.752021,52.113.194.133,192.168.43.215,TCP,1354,443  >  49262 [ACK] Seq=2205266 Ack=13137 Win=2049 Len=1300 [TCP segment of a reassembled PDU]
3440,396.765851,52.113.194.133,192.168.43.215,TCP,1354,443  >  49262 [ACK] Seq=2206566 Ack=13137 Win=2049 Len=1300 [TCP segment of a reassembled PDU]
3441,396.76595,192.168.43.215,52.113.194.133,TCP,54,49262  >  443 [ACK] Seq=13137 Ack=2207866 Win=258 Len=0
3442,396.766091,52.113.194.133,192.168.43.215,TCP,1354,443  >  49262 [ACK] Seq=2207866 Ack=13137 Win=2049 Len=1300 [TCP segment of a reassembled PDU]
3443,396.76625099999995,52.113.194.133,192.168.43.215,TCP,1354,443  >  49262 [ACK] Seq=2209166 Ack=13137 Win=2049 Len=1300 [TCP segment of a reassembled PDU]
3444,396.766304,192.168.43.215,52.113.194.133,TCP,54,49262  >  443 [ACK] Seq=13137 Ack=2210466 Win=258 Len=0
3445,396.766881,52.113.194.133,192.168.43.215,TLSv1.2,141,Application Data
3446,396.76696200000004,52.113.194.133,192.168.43.215,TLSv1.2,92,Application Data
3447,396.766994,192.168.43.215,52.113.194.133,TCP,54,49262  >  443 [ACK] Seq=13137 Ack=2210591 Win=258 Len=0
3448,397.13784100000004,192.168.43.215,52.113.194.133,TLSv1.2,120,Application Data
3449,397.177802,52.113.194.133,192.168.43.215,TCP,54,443  >  49262 [ACK] Seq=2210591 Ack=13203 Win=2048 Len=0
3450,397.217251,52.113.194.133,192.168.43.215,TCP,1354,443  >  49262 [ACK] Seq=2210591 Ack=13203 Win=2048 Len=1300 [TCP segment of a reassembled PDU]
3451,397.21738,52.113.194.133,192.168.43.215,TLSv1.2,337,Application Data
3452,397.217432,192.168.43.215,52.113.194.133,TCP,54,49262  >  443 [ACK] Seq=13203 Ack=2212174 Win=258 Len=0
3453,397.217537,52.113.194.133,192.168.43.215,TCP,1354,443  >  49262 [ACK] Seq=2212174 Ack=13203 Win=2048 Len=1300 [TCP segment of a reassembled PDU]
3454,397.217581,52.113.194.133,192.168.43.215,TCP,1354,443  >  49262 [ACK] Seq=2213474 Ack=13203 Win=2048 Len=1300 [TCP segment of a reassembled PDU]
3455,397.217609,192.168.43.215,52.113.194.133,TCP,54,49262  >  443 [ACK] Seq=13203 Ack=2214774 Win=258 Len=0
3456,397.217715,52.113.194.133,192.168.43.215,TCP,1354,443  >  49262 [ACK] Seq=2214774 Ack=13203 Win=2048 Len=1300 [TCP segment of a reassembled PDU]
3457,397.217848,52.113.194.133,192.168.43.215,TCP,1354,443  >  49262 [ACK] Seq=2216074 Ack=13203 Win=2048 Len=1300 [TCP segment of a reassembled PDU]
3458,397.21788300000003,192.168.43.215,52.113.194.133,TCP,54,49262  >  443 [ACK] Seq=13203 Ack=2217374 Win=258 Len=0
3459,397.218022,52.113.194.133,192.168.43.215,TCP,1354,443  >  49262 [ACK] Seq=2217374 Ack=13203 Win=2048 Len=1300 [TCP segment of a reassembled PDU]
3460,397.218143,52.113.194.133,192.168.43.215,TCP,1354,443  >  49262 [ACK] Seq=2218674 Ack=13203 Win=2048 Len=1300 [TCP segment of a reassembled PDU]
3461,397.218181,192.168.43.215,52.113.194.133,TCP,54,49262  >  443 [ACK] Seq=13203 Ack=2219974 Win=258 Len=0
3462,397.218268,52.113.194.133,192.168.43.215,TLSv1.2,484,Application Data
3463,397.218439,52.113.194.133,192.168.43.215,TCP,1354,443  >  49262 [ACK] Seq=2220404 Ack=13203 Win=2048 Len=1300 [TCP segment of a reassembled PDU]
3464,397.218501,192.168.43.215,52.113.194.133,TCP,54,49262  >  443 [ACK] Seq=13203 Ack=2221704 Win=258 Len=0
3465,397.218616,52.113.194.133,192.168.43.215,TCP,1354,443  >  49262 [ACK] Seq=2221704 Ack=13203 Win=2048 Len=1300 [TCP segment of a reassembled PDU]
3466,397.21887799999996,52.113.194.133,192.168.43.215,TCP,1354,443  >  49262 [ACK] Seq=2223004 Ack=13203 Win=2048 Len=1300 [TCP segment of a reassembled PDU]
3467,397.218912,192.168.43.215,52.113.194.133,TCP,54,49262  >  443 [ACK] Seq=13203 Ack=2224304 Win=258 Len=0
3468,397.218948,52.113.194.133,192.168.43.215,TLSv1.2,343,Application Data
3469,397.219045,52.113.194.133,192.168.43.215,TCP,1354,443  >  49262 [ACK] Seq=2224593 Ack=13203 Win=2048 Len=1300 [TCP segment of a reassembled PDU]
3470,397.21909,192.168.43.215,52.113.194.133,TCP,54,49262  >  443 [ACK] Seq=13203 Ack=2225893 Win=258 Len=0
3471,397.219248,52.113.194.133,192.168.43.215,TCP,1354,443  >  49262 [ACK] Seq=2225893 Ack=13203 Win=2048 Len=1300 [TCP segment of a reassembled PDU]
3472,397.21946,52.113.194.133,192.168.43.215,TCP,1354,443  >  49262 [ACK] Seq=2227193 Ack=13203 Win=2048 Len=1300 [TCP segment of a reassembled PDU]
3473,397.219489,192.168.43.215,52.113.194.133,TCP,54,49262  >  443 [ACK] Seq=13203 Ack=2228493 Win=258 Len=0
3474,397.21963,52.113.194.133,192.168.43.215,TCP,1354,443  >  49262 [ACK] Seq=2228493 Ack=13203 Win=2048 Len=1300 [TCP segment of a reassembled PDU]
3475,397.21991299999996,52.113.194.133,192.168.43.215,TCP,1354,443  >  49262 [ACK] Seq=2229793 Ack=13203 Win=2048 Len=1300 [TCP segment of a reassembled PDU]
3476,397.21995400000003,192.168.43.215,52.113.194.133,TCP,54,49262  >  443 [ACK] Seq=13203 Ack=2231093 Win=258 Len=0
3477,397.220006,52.113.194.133,192.168.43.215,TLSv1.2,141,Application Data
3478,397.221003,52.113.194.133,192.168.43.215,TLSv1.2,92,Application Data
3479,397.221075,192.168.43.215,52.113.194.133,TCP,54,49262  >  443 [ACK] Seq=13203 Ack=2231218 Win=258 Len=0
3480,397.640141,192.168.43.215,52.113.194.133,TLSv1.2,186,Application Data
3481,397.694439,52.113.194.133,192.168.43.215,TCP,54,443  >  49262 [ACK] Seq=2231218 Ack=13335 Win=2048 Len=0
3482,397.716106,52.113.194.133,192.168.43.215,TCP,1354,443  >  49262 [ACK] Seq=2231218 Ack=13335 Win=2048 Len=1300 [TCP segment of a reassembled PDU]
3483,397.716225,52.113.194.133,192.168.43.215,TLSv1.2,313,Application Data
3484,397.716267,192.168.43.215,52.113.194.133,TCP,54,49262  >  443 [ACK] Seq=13335 Ack=2232777 Win=258 Len=0
3485,397.716448,52.113.194.133,192.168.43.215,TCP,1354,443  >  49262 [ACK] Seq=2232777 Ack=13335 Win=2048 Len=1300 [TCP segment of a reassembled PDU]
3486,397.716593,52.113.194.133,192.168.43.215,TCP,1354,443  >  49262 [ACK] Seq=2234077 Ack=13335 Win=2048 Len=1300 [TCP segment of a reassembled PDU]
3487,397.716654,192.168.43.215,52.113.194.133,TCP,54,49262  >  443 [ACK] Seq=13335 Ack=2235377 Win=258 Len=0
3488,397.716806,52.113.194.133,192.168.43.215,TCP,1354,443  >  49262 [ACK] Seq=2235377 Ack=13335 Win=2048 Len=1300 [TCP segment of a reassembled PDU]
3489,397.716841,52.113.194.133,192.168.43.215,TCP,1354,443  >  49262 [ACK] Seq=2236677 Ack=13335 Win=2048 Len=1300 [TCP segment of a reassembled PDU]
3490,397.716864,192.168.43.215,52.113.194.133,TCP,54,49262  >  443 [ACK] Seq=13335 Ack=2237977 Win=258 Len=0
3491,397.717084,52.113.194.133,192.168.43.215,TCP,1354,443  >  49262 [ACK] Seq=2237977 Ack=13335 Win=2048 Len=1300 [TCP segment of a reassembled PDU]
3492,397.717347,52.113.194.133,192.168.43.215,TCP,1354,443  >  49262 [ACK] Seq=2239277 Ack=13335 Win=2048 Len=1300 [TCP segment of a reassembled PDU]
3493,397.717416,192.168.43.215,52.113.194.133,TCP,54,49262  >  443 [ACK] Seq=13335 Ack=2240577 Win=258 Len=0
3494,397.71750099999997,52.113.194.133,192.168.43.215,TLSv1.2,484,Application Data
3495,397.71758900000003,52.113.194.133,192.168.43.215,TCP,1354,443  >  49262 [ACK] Seq=2241007 Ack=13335 Win=2048 Len=1300 [TCP segment of a reassembled PDU]
3496,397.717675,192.168.43.215,52.113.194.133,TCP,54,49262  >  443 [ACK] Seq=13335 Ack=2242307 Win=258 Len=0
3497,397.717853,52.113.194.133,192.168.43.215,TCP,1354,443  >  49262 [ACK] Seq=2242307 Ack=13335 Win=2048 Len=1300 [TCP segment of a reassembled PDU]
3498,397.71797799999996,52.113.194.133,192.168.43.215,TCP,1354,443  >  49262 [ACK] Seq=2243607 Ack=13335 Win=2048 Len=1300 [TCP segment of a reassembled PDU]
3499,397.718035,192.168.43.215,52.113.194.133,TCP,54,49262  >  443 [ACK] Seq=13335 Ack=2244907 Win=258 Len=0
3500,397.718103,52.113.194.133,192.168.43.215,TLSv1.2,343,Application Data
3501,397.718263,52.113.194.133,192.168.43.215,TCP,1354,443  >  49262 [ACK] Seq=2245196 Ack=13335 Win=2048 Len=1300 [TCP segment of a reassembled PDU]
3502,397.71834900000005,192.168.43.215,52.113.194.133,TCP,54,49262  >  443 [ACK] Seq=13335 Ack=2246496 Win=258 Len=0
3503,397.718457,52.113.194.133,192.168.43.215,TCP,1354,443  >  49262 [ACK] Seq=2246496 Ack=13335 Win=2048 Len=1300 [TCP segment of a reassembled PDU]
3504,397.718707,52.113.194.133,192.168.43.215,TCP,1354,443  >  49262 [ACK] Seq=2247796 Ack=13335 Win=2048 Len=1300 [TCP segment of a reassembled PDU]
3505,397.718766,192.168.43.215,52.113.194.133,TCP,54,49262  >  443 [ACK] Seq=13335 Ack=2249096 Win=258 Len=0
3506,397.718987,52.113.194.133,192.168.43.215,TCP,1354,443  >  49262 [ACK] Seq=2249096 Ack=13335 Win=2048 Len=1300 [TCP segment of a reassembled PDU]
3507,397.719235,52.113.194.133,192.168.43.215,TCP,1354,443  >  49262 [ACK] Seq=2250396 Ack=13335 Win=2048 Len=1300 [TCP segment of a reassembled PDU]
3508,397.71928399999996,192.168.43.215,52.113.194.133,TCP,54,49262  >  443 [ACK] Seq=13335 Ack=2251696 Win=258 Len=0
3509,397.719332,52.113.194.133,192.168.43.215,TLSv1.2,141,Application Data
3510,397.719403,52.113.194.133,192.168.43.215,TLSv1.2,92,Application Data
3511,397.719433,192.168.43.215,52.113.194.133,TCP,54,49262  >  443 [ACK] Seq=13335 Ack=2251821 Win=258 Len=0
3512,398.372747,192.168.43.215,52.113.194.133,TLSv1.2,120,Application Data
3513,398.414715,52.113.194.133,192.168.43.215,TCP,54,443  >  49262 [ACK] Seq=2251821 Ack=13401 Win=2048 Len=0
3514,398.45684900000003,52.113.194.133,192.168.43.215,TCP,1354,443  >  49262 [ACK] Seq=2251821 Ack=13401 Win=2048 Len=1300 [TCP segment of a reassembled PDU]
3515,398.456936,52.113.194.133,192.168.43.215,TLSv1.2,350,Application Data
3516,398.456968,192.168.43.215,52.113.194.133,TCP,54,49262  >  443 [ACK] Seq=13401 Ack=2253417 Win=258 Len=0
3517,398.457061,52.113.194.133,192.168.43.215,TCP,1354,443  >  49262 [ACK] Seq=2253417 Ack=13401 Win=2048 Len=1300 [TCP segment of a reassembled PDU]
3518,398.457235,52.113.194.133,192.168.43.215,TCP,1354,443  >  49262 [ACK] Seq=2254717 Ack=13401 Win=2048 Len=1300 [TCP segment of a reassembled PDU]
3519,398.45729500000004,192.168.43.215,52.113.194.133,TCP,54,49262  >  443 [ACK] Seq=13401 Ack=2256017 Win=258 Len=0
3520,398.457418,52.113.194.133,192.168.43.215,TCP,1354,443  >  49262 [ACK] Seq=2256017 Ack=13401 Win=2048 Len=1300 [TCP segment of a reassembled PDU]
3521,398.457542,52.113.194.133,192.168.43.215,TCP,1354,443  >  49262 [ACK] Seq=2257317 Ack=13401 Win=2048 Len=1300 [TCP segment of a reassembled PDU]
3522,398.457573,192.168.43.215,52.113.194.133,TCP,54,49262  >  443 [ACK] Seq=13401 Ack=2258617 Win=258 Len=0
3523,398.457832,52.113.194.133,192.168.43.215,TCP,1354,443  >  49262 [ACK] Seq=2258617 Ack=13401 Win=2048 Len=1300 [TCP segment of a reassembled PDU]
3524,398.458094,52.113.194.133,192.168.43.215,TCP,1354,443  >  49262 [ACK] Seq=2259917 Ack=13401 Win=2048 Len=1300 [TCP segment of a reassembled PDU]
3525,398.458129,192.168.43.215,52.113.194.133,TCP,54,49262  >  443 [ACK] Seq=13401 Ack=2261217 Win=258 Len=0
3526,398.458769,52.113.194.133,192.168.43.215,TLSv1.2,484,Application Data
3527,398.458902,52.113.194.133,192.168.43.215,TCP,1354,443  >  49262 [ACK] Seq=2261647 Ack=13401 Win=2048 Len=1300 [TCP segment of a reassembled PDU]
3528,398.458935,192.168.43.215,52.113.194.133,TCP,54,49262  >  443 [ACK] Seq=13401 Ack=2262947 Win=258 Len=0
3529,398.459081,52.113.194.133,192.168.43.215,TCP,1354,443  >  49262 [ACK] Seq=2262947 Ack=13401 Win=2048 Len=1300 [TCP segment of a reassembled PDU]
3530,398.459203,52.113.194.133,192.168.43.215,TCP,1354,443  >  49262 [ACK] Seq=2264247 Ack=13401 Win=2048 Len=1300 [TCP segment of a reassembled PDU]
3531,398.459236,192.168.43.215,52.113.194.133,TCP,54,49262  >  443 [ACK] Seq=13401 Ack=2265547 Win=258 Len=0
3532,398.45933199999996,52.113.194.133,192.168.43.215,TLSv1.2,343,Application Data
3533,398.459428,52.113.194.133,192.168.43.215,TCP,1354,443  >  49262 [ACK] Seq=2265836 Ack=13401 Win=2048 Len=1300 [TCP segment of a reassembled PDU]
3534,398.459457,192.168.43.215,52.113.194.133,TCP,54,49262  >  443 [ACK] Seq=13401 Ack=2267136 Win=258 Len=0
3535,398.459674,52.113.194.133,192.168.43.215,TCP,1354,443  >  49262 [ACK] Seq=2267136 Ack=13401 Win=2048 Len=1300 [TCP segment of a reassembled PDU]
3536,398.459852,52.113.194.133,192.168.43.215,TCP,1354,443  >  49262 [ACK] Seq=2268436 Ack=13401 Win=2048 Len=1300 [TCP segment of a reassembled PDU]
3537,398.459891,192.168.43.215,52.113.194.133,TCP,54,49262  >  443 [ACK] Seq=13401 Ack=2269736 Win=258 Len=0
3538,398.46002000000004,52.113.194.133,192.168.43.215,TCP,1354,443  >  49262 [ACK] Seq=2269736 Ack=13401 Win=2048 Len=1300 [TCP segment of a reassembled PDU]
3539,398.46027799999996,52.113.194.133,192.168.43.215,TCP,1354,443  >  49262 [ACK] Seq=2271036 Ack=13401 Win=2048 Len=1300 [TCP segment of a reassembled PDU]
3540,398.460321,192.168.43.215,52.113.194.133,TCP,54,49262  >  443 [ACK] Seq=13401 Ack=2272336 Win=258 Len=0
3541,398.460418,52.113.194.133,192.168.43.215,TLSv1.2,141,Application Data
3542,398.46050099999997,52.113.194.133,192.168.43.215,TLSv1.2,92,Application Data
3543,398.46052799999995,192.168.43.215,52.113.194.133,TCP,54,49262  >  443 [ACK] Seq=13401 Ack=2272461 Win=258 Len=0
3544,398.803985,192.168.43.215,52.113.194.133,TLSv1.2,186,Application Data
3545,398.829743,52.113.194.133,192.168.43.215,TCP,54,443  >  49262 [ACK] Seq=2272461 Ack=13533 Win=2047 Len=0
3546,398.894947,52.113.194.133,192.168.43.215,TCP,1354,443  >  49262 [ACK] Seq=2272461 Ack=13533 Win=2047 Len=1300 [TCP segment of a reassembled PDU]
3547,398.89505,52.113.194.133,192.168.43.215,TCP,1354,443  >  49262 [ACK] Seq=2273761 Ack=13533 Win=2047 Len=1300 [TCP segment of a reassembled PDU]
3548,398.89508,192.168.43.215,52.113.194.133,TCP,54,49262  >  443 [ACK] Seq=13533 Ack=2275061 Win=258 Len=0
3549,398.895128,52.113.194.133,192.168.43.215,TLSv1.2,610,Application Data
3550,398.895355,52.113.194.133,192.168.43.215,TCP,1354,443  >  49262 [ACK] Seq=2275617 Ack=13533 Win=2047 Len=1300 [TCP segment of a reassembled PDU]
3551,398.895384,192.168.43.215,52.113.194.133,TCP,54,49262  >  443 [ACK] Seq=13533 Ack=2276917 Win=258 Len=0
3552,398.895529,52.113.194.133,192.168.43.215,TCP,1354,443  >  49262 [ACK] Seq=2276917 Ack=13533 Win=2047 Len=1300 [TCP segment of a reassembled PDU]
3553,398.895782,52.113.194.133,192.168.43.215,TCP,1354,443  >  49262 [ACK] Seq=2278217 Ack=13533 Win=2047 Len=1300 [TCP segment of a reassembled PDU]
3554,398.89581,192.168.43.215,52.113.194.133,TCP,54,49262  >  443 [ACK] Seq=13533 Ack=2279517 Win=258 Len=0
3555,398.89603999999997,52.113.194.133,192.168.43.215,TCP,1354,443  >  49262 [ACK] Seq=2279517 Ack=13533 Win=2047 Len=1300 [TCP segment of a reassembled PDU]
3556,398.896184,52.113.194.133,192.168.43.215,TCP,1354,443  >  49262 [ACK] Seq=2280817 Ack=13533 Win=2047 Len=1300 [TCP segment of a reassembled PDU]
3557,398.89621600000004,192.168.43.215,52.113.194.133,TCP,54,49262  >  443 [ACK] Seq=13533 Ack=2282117 Win=258 Len=0
3558,398.896335,52.113.194.133,192.168.43.215,TCP,1354,443  >  49262 [ACK] Seq=2282117 Ack=13533 Win=2047 Len=1300 [TCP segment of a reassembled PDU]
3559,398.896406,52.113.194.133,192.168.43.215,TLSv1.2,484,Application Data
3560,398.896434,192.168.43.215,52.113.194.133,TCP,54,49262  >  443 [ACK] Seq=13533 Ack=2283847 Win=258 Len=0
3561,398.896665,52.113.194.133,192.168.43.215,TCP,1354,443  >  49262 [ACK] Seq=2283847 Ack=13533 Win=2047 Len=1300 [TCP segment of a reassembled PDU]
3562,398.896818,52.113.194.133,192.168.43.215,TCP,1354,443  >  49262 [ACK] Seq=2285147 Ack=13533 Win=2047 Len=1300 [TCP segment of a reassembled PDU]
3563,398.896852,192.168.43.215,52.113.194.133,TCP,54,49262  >  443 [ACK] Seq=13533 Ack=2286447 Win=258 Len=0
3564,398.89710099999996,52.113.194.133,192.168.43.215,TCP,1354,443  >  49262 [ACK] Seq=2286447 Ack=13533 Win=2047 Len=1300 [TCP segment of a reassembled PDU]
3565,398.897939,52.113.194.133,192.168.43.215,TLSv1.2,343,Application Data
3566,398.897999,192.168.43.215,52.113.194.133,TCP,54,49262  >  443 [ACK] Seq=13533 Ack=2288036 Win=258 Len=0
3567,398.898111,52.113.194.133,192.168.43.215,TCP,1354,443  >  49262 [ACK] Seq=2288036 Ack=13533 Win=2047 Len=1300 [TCP segment of a reassembled PDU]
3568,398.89825,52.113.194.133,192.168.43.215,TCP,1354,443  >  49262 [ACK] Seq=2289336 Ack=13533 Win=2047 Len=1300 [TCP segment of a reassembled PDU]
3569,398.898275,192.168.43.215,52.113.194.133,TCP,54,49262  >  443 [ACK] Seq=13533 Ack=2290636 Win=258 Len=0
3570,398.89839,52.113.194.133,192.168.43.215,TCP,1354,443  >  49262 [ACK] Seq=2290636 Ack=13533 Win=2047 Len=1300 [TCP segment of a reassembled PDU]
3571,398.898644,52.113.194.133,192.168.43.215,TCP,1354,443  >  49262 [ACK] Seq=2291936 Ack=13533 Win=2047 Len=1300 [TCP segment of a reassembled PDU]
3572,398.89869300000004,192.168.43.215,52.113.194.133,TCP,54,49262  >  443 [ACK] Seq=13533 Ack=2293236 Win=258 Len=0
3573,398.898845,52.113.194.133,192.168.43.215,TCP,1354,443  >  49262 [ACK] Seq=2293236 Ack=13533 Win=2047 Len=1300 [TCP segment of a reassembled PDU]
3574,398.898925,52.113.194.133,192.168.43.215,TLSv1.2,141,Application Data
3575,398.898956,192.168.43.215,52.113.194.133,TCP,54,49262  >  443 [ACK] Seq=13533 Ack=2294623 Win=258 Len=0
3576,398.899536,52.113.194.133,192.168.43.215,TLSv1.2,92,Application Data
3577,398.982645,192.168.43.215,52.113.194.133,TCP,54,49262  >  443 [ACK] Seq=13533 Ack=2294661 Win=258 Len=0
3578,399.40053,192.168.43.215,52.113.194.133,TLSv1.2,120,Application Data
3579,399.438044,52.113.194.133,192.168.43.215,TCP,54,443  >  49262 [ACK] Seq=2294661 Ack=13599 Win=2047 Len=0
3580,399.490369,52.113.194.133,192.168.43.215,TCP,1354,443  >  49262 [ACK] Seq=2294661 Ack=13599 Win=2047 Len=1300 [TCP segment of a reassembled PDU]
3581,399.49046400000003,52.113.194.133,192.168.43.215,TLSv1.2,336,Application Data
3582,399.490505,192.168.43.215,52.113.194.133,TCP,54,49262  >  443 [ACK] Seq=13599 Ack=2296243 Win=258 Len=0
3583,399.4906,52.113.194.133,192.168.43.215,TCP,1354,443  >  49262 [ACK] Seq=2296243 Ack=13599 Win=2047 Len=1300 [TCP segment of a reassembled PDU]
3584,399.490767,52.113.194.133,192.168.43.215,TCP,1354,443  >  49262 [ACK] Seq=2297543 Ack=13599 Win=2047 Len=1300 [TCP segment of a reassembled PDU]
3585,399.490804,192.168.43.215,52.113.194.133,TCP,54,49262  >  443 [ACK] Seq=13599 Ack=2298843 Win=258 Len=0
3586,399.490945,52.113.194.133,192.168.43.215,TCP,1354,443  >  49262 [ACK] Seq=2298843 Ack=13599 Win=2047 Len=1300 [TCP segment of a reassembled PDU]
3587,399.49123,52.113.194.133,192.168.43.215,TCP,1354,443  >  49262 [ACK] Seq=2300143 Ack=13599 Win=2047 Len=1300 [TCP segment of a reassembled PDU]
3588,399.491264,192.168.43.215,52.113.194.133,TCP,54,49262  >  443 [ACK] Seq=13599 Ack=2301443 Win=258 Len=0
3589,399.4914,52.113.194.133,192.168.43.215,TCP,1354,443  >  49262 [ACK] Seq=2301443 Ack=13599 Win=2047 Len=1300 [TCP segment of a reassembled PDU]
3590,399.491514,52.113.194.133,192.168.43.215,TCP,1354,443  >  49262 [ACK] Seq=2302743 Ack=13599 Win=2047 Len=1300 [TCP segment of a reassembled PDU]
3591,399.49154100000004,192.168.43.215,52.113.194.133,TCP,54,49262  >  443 [ACK] Seq=13599 Ack=2304043 Win=258 Len=0
3592,399.491673,52.113.194.133,192.168.43.215,TLSv1.2,484,Application Data
3593,399.491823,52.113.194.133,192.168.43.215,TCP,1354,443  >  49262 [ACK] Seq=2304473 Ack=13599 Win=2047 Len=1300 [TCP segment of a reassembled PDU]
3594,399.491853,192.168.43.215,52.113.194.133,TCP,54,49262  >  443 [ACK] Seq=13599 Ack=2305773 Win=258 Len=0
3595,399.492119,52.113.194.133,192.168.43.215,TCP,1354,443  >  49262 [ACK] Seq=2305773 Ack=13599 Win=2047 Len=1300 [TCP segment of a reassembled PDU]
3596,399.49279,52.113.194.133,192.168.43.215,TCP,1354,443  >  49262 [ACK] Seq=2307073 Ack=13599 Win=2047 Len=1300 [TCP segment of a reassembled PDU]
3597,399.49282900000003,192.168.43.215,52.113.194.133,TCP,54,49262  >  443 [ACK] Seq=13599 Ack=2308373 Win=258 Len=0
3598,399.49287000000004,52.113.194.133,192.168.43.215,TLSv1.2,343,Application Data
3599,399.493021,52.113.194.133,192.168.43.215,TCP,1354,443  >  49262 [ACK] Seq=2308662 Ack=13599 Win=2047 Len=1300 [TCP segment of a reassembled PDU]
3600,399.49313,192.168.43.215,52.113.194.133,TCP,54,49262  >  443 [ACK] Seq=13599 Ack=2309962 Win=258 Len=0
3601,399.493228,52.113.194.133,192.168.43.215,TCP,1354,443  >  49262 [ACK] Seq=2309962 Ack=13599 Win=2047 Len=1300 [TCP segment of a reassembled PDU]
3602,399.49337599999996,52.113.194.133,192.168.43.215,TCP,1354,443  >  49262 [ACK] Seq=2311262 Ack=13599 Win=2047 Len=1300 [TCP segment of a reassembled PDU]
3603,399.49341200000003,192.168.43.215,52.113.194.133,TCP,54,49262  >  443 [ACK] Seq=13599 Ack=2312562 Win=258 Len=0
3604,399.49354700000004,52.113.194.133,192.168.43.215,TCP,1354,443  >  49262 [ACK] Seq=2312562 Ack=13599 Win=2047 Len=1300 [TCP segment of a reassembled PDU]
3605,399.493783,52.113.194.133,192.168.43.215,TCP,1354,443  >  49262 [ACK] Seq=2313862 Ack=13599 Win=2047 Len=1300 [TCP segment of a reassembled PDU]
3606,399.493819,192.168.43.215,52.113.194.133,TCP,54,49262  >  443 [ACK] Seq=13599 Ack=2315162 Win=258 Len=0
3607,399.493897,52.113.194.133,192.168.43.215,TLSv1.2,141,Application Data
3608,399.495541,52.113.194.133,192.168.43.215,TLSv1.2,92,Application Data
3609,399.495649,192.168.43.215,52.113.194.133,TCP,54,49262  >  443 [ACK] Seq=13599 Ack=2315287 Win=258 Len=0
3610,399.912869,192.168.43.215,52.113.194.133,TLSv1.2,186,Application Data
3611,399.949229,52.113.194.133,192.168.43.215,TCP,54,443  >  49262 [ACK] Seq=2315287 Ack=13731 Win=2046 Len=0
3612,400.02304399999997,52.113.194.133,192.168.43.215,TCP,1354,443  >  49262 [ACK] Seq=2315287 Ack=13731 Win=2046 Len=1300 [TCP segment of a reassembled PDU]
3613,400.023121,52.113.194.133,192.168.43.215,TLSv1.2,314,Application Data
3614,400.023153,192.168.43.215,52.113.194.133,TCP,54,49262  >  443 [ACK] Seq=13731 Ack=2316847 Win=258 Len=0
3615,400.023225,52.113.194.133,192.168.43.215,TCP,1354,443  >  49262 [ACK] Seq=2316847 Ack=13731 Win=2046 Len=1300 [TCP segment of a reassembled PDU]
3616,400.023344,52.113.194.133,192.168.43.215,TCP,1354,443  >  49262 [ACK] Seq=2318147 Ack=13731 Win=2046 Len=1300 [TCP segment of a reassembled PDU]
3617,400.02340899999996,192.168.43.215,52.113.194.133,TCP,54,49262  >  443 [ACK] Seq=13731 Ack=2319447 Win=258 Len=0
3618,400.023515,52.113.194.133,192.168.43.215,TCP,1354,443  >  49262 [ACK] Seq=2319447 Ack=13731 Win=2046 Len=1300 [TCP segment of a reassembled PDU]
3619,400.023608,52.113.194.133,192.168.43.215,TCP,1354,443  >  49262 [ACK] Seq=2320747 Ack=13731 Win=2046 Len=1300 [TCP segment of a reassembled PDU]
3620,400.023635,192.168.43.215,52.113.194.133,TCP,54,49262  >  443 [ACK] Seq=13731 Ack=2322047 Win=258 Len=0
3621,400.023841,52.113.194.133,192.168.43.215,TCP,1354,443  >  49262 [ACK] Seq=2322047 Ack=13731 Win=2046 Len=1300 [TCP segment of a reassembled PDU]
3622,400.024014,52.113.194.133,192.168.43.215,TCP,1354,443  >  49262 [ACK] Seq=2323347 Ack=13731 Win=2046 Len=1300 [TCP segment of a reassembled PDU]
3623,400.02404,192.168.43.215,52.113.194.133,TCP,54,49262  >  443 [ACK] Seq=13731 Ack=2324647 Win=258 Len=0
3624,400.02409900000004,52.113.194.133,192.168.43.215,TLSv1.2,484,Application Data
3625,400.024213,52.113.194.133,192.168.43.215,TCP,1354,443  >  49262 [ACK] Seq=2325077 Ack=13731 Win=2046 Len=1300 [TCP segment of a reassembled PDU]
3626,400.02425,192.168.43.215,52.113.194.133,TCP,54,49262  >  443 [ACK] Seq=13731 Ack=2326377 Win=258 Len=0
3627,400.024362,52.113.194.133,192.168.43.215,TCP,1354,443  >  49262 [ACK] Seq=2326377 Ack=13731 Win=2046 Len=1300 [TCP segment of a reassembled PDU]
3628,400.02454,52.113.194.133,192.168.43.215,TCP,1354,443  >  49262 [ACK] Seq=2327677 Ack=13731 Win=2046 Len=1300 [TCP segment of a reassembled PDU]
3629,400.02456800000004,192.168.43.215,52.113.194.133,TCP,54,49262  >  443 [ACK] Seq=13731 Ack=2328977 Win=258 Len=0
3630,400.024602,52.113.194.133,192.168.43.215,TLSv1.2,343,Application Data
3631,400.024906,52.113.194.133,192.168.43.215,TCP,1354,443  >  49262 [ACK] Seq=2329266 Ack=13731 Win=2046 Len=1300 [TCP segment of a reassembled PDU]
3632,400.024969,192.168.43.215,52.113.194.133,TCP,54,49262  >  443 [ACK] Seq=13731 Ack=2330566 Win=258 Len=0
3633,400.02504700000003,52.113.194.133,192.168.43.215,TCP,1354,443  >  49262 [ACK] Seq=2330566 Ack=13731 Win=2046 Len=1300 [TCP segment of a reassembled PDU]
3634,400.025156,52.113.194.133,192.168.43.215,TCP,1354,443  >  49262 [ACK] Seq=2331866 Ack=13731 Win=2046 Len=1300 [TCP segment of a reassembled PDU]
3635,400.02518399999997,192.168.43.215,52.113.194.133,TCP,54,49262  >  443 [ACK] Seq=13731 Ack=2333166 Win=258 Len=0
3636,400.02544,52.113.194.133,192.168.43.215,TCP,1354,443  >  49262 [ACK] Seq=2333166 Ack=13731 Win=2046 Len=1300 [TCP segment of a reassembled PDU]
3637,400.02556,52.113.194.133,192.168.43.215,TCP,1354,443  >  49262 [ACK] Seq=2334466 Ack=13731 Win=2046 Len=1300 [TCP segment of a reassembled PDU]
3638,400.025597,192.168.43.215,52.113.194.133,TCP,54,49262  >  443 [ACK] Seq=13731 Ack=2335766 Win=258 Len=0
3639,400.02567400000004,52.113.194.133,192.168.43.215,TLSv1.2,141,Application Data
3640,400.025768,52.113.194.133,192.168.43.215,TLSv1.2,92,Application Data
3641,400.025807,192.168.43.215,52.113.194.133,TCP,54,49262  >  443 [ACK] Seq=13731 Ack=2335891 Win=258 Len=0
3642,400.492793,192.168.43.215,52.113.194.133,TLSv1.2,120,Application Data
3643,400.518499,52.113.194.133,192.168.43.215,TCP,54,443  >  49262 [ACK] Seq=2335891 Ack=13797 Win=2046 Len=0
3644,400.575475,52.113.194.133,192.168.43.215,TCP,1354,443  >  49262 [ACK] Seq=2335891 Ack=13797 Win=2046 Len=1300 [TCP segment of a reassembled PDU]
3645,400.57555099999996,52.113.194.133,192.168.43.215,TLSv1.2,459,Application Data
3646,400.575586,192.168.43.215,52.113.194.133,TCP,54,49262  >  443 [ACK] Seq=13797 Ack=2337596 Win=258 Len=0
3647,400.575694,52.113.194.133,192.168.43.215,TCP,1354,443  >  49262 [ACK] Seq=2337596 Ack=13797 Win=2046 Len=1300 [TCP segment of a reassembled PDU]
3648,400.575867,52.113.194.133,192.168.43.215,TCP,1354,443  >  49262 [ACK] Seq=2338896 Ack=13797 Win=2046 Len=1300 [TCP segment of a reassembled PDU]
3649,400.575896,192.168.43.215,52.113.194.133,TCP,54,49262  >  443 [ACK] Seq=13797 Ack=2340196 Win=258 Len=0
3650,400.576911,52.113.194.133,192.168.43.215,TCP,1354,443  >  49262 [ACK] Seq=2340196 Ack=13797 Win=2046 Len=1300 [TCP segment of a reassembled PDU]
3651,400.57721499999997,52.113.194.133,192.168.43.215,TCP,1354,443  >  49262 [ACK] Seq=2341496 Ack=13797 Win=2046 Len=1300 [TCP segment of a reassembled PDU]
3652,400.57728,192.168.43.215,52.113.194.133,TCP,54,49262  >  443 [ACK] Seq=13797 Ack=2342796 Win=258 Len=0
3653,400.583979,52.113.194.133,192.168.43.215,TCP,1354,443  >  49262 [ACK] Seq=2342796 Ack=13797 Win=2046 Len=1300 [TCP segment of a reassembled PDU]
3654,400.584108,52.113.194.133,192.168.43.215,TCP,1354,443  >  49262 [ACK] Seq=2344096 Ack=13797 Win=2046 Len=1300 [TCP segment of a reassembled PDU]
3655,400.58414799999997,192.168.43.215,52.113.194.133,TCP,54,49262  >  443 [ACK] Seq=13797 Ack=2345396 Win=258 Len=0
3656,400.584283,52.113.194.133,192.168.43.215,TLSv1.2,484,Application Data
3657,400.58442599999995,52.113.194.133,192.168.43.215,TCP,1354,443  >  49262 [ACK] Seq=2345826 Ack=13797 Win=2046 Len=1300 [TCP segment of a reassembled PDU]
3658,400.58448799999996,192.168.43.215,52.113.194.133,TCP,54,49262  >  443 [ACK] Seq=13797 Ack=2347126 Win=258 Len=0
3659,400.584672,52.113.194.133,192.168.43.215,TCP,1354,443  >  49262 [ACK] Seq=2347126 Ack=13797 Win=2046 Len=1300 [TCP segment of a reassembled PDU]
3660,400.5848,52.113.194.133,192.168.43.215,TCP,1354,443  >  49262 [ACK] Seq=2348426 Ack=13797 Win=2046 Len=1300 [TCP segment of a reassembled PDU]
3661,400.584832,192.168.43.215,52.113.194.133,TCP,54,49262  >  443 [ACK] Seq=13797 Ack=2349726 Win=258 Len=0
3662,400.584875,52.113.194.133,192.168.43.215,TLSv1.2,343,Application Data
3663,400.58493,52.113.194.133,192.168.43.215,TCP,1354,443  >  49262 [ACK] Seq=2350015 Ack=13797 Win=2046 Len=1300 [TCP segment of a reassembled PDU]
3664,400.584968,192.168.43.215,52.113.194.133,TCP,54,49262  >  443 [ACK] Seq=13797 Ack=2351315 Win=258 Len=0
3665,400.585152,52.113.194.133,192.168.43.215,TCP,1354,443  >  49262 [ACK] Seq=2351315 Ack=13797 Win=2046 Len=1300 [TCP segment of a reassembled PDU]
3666,400.585333,52.113.194.133,192.168.43.215,TCP,1354,443  >  49262 [ACK] Seq=2352615 Ack=13797 Win=2046 Len=1300 [TCP segment of a reassembled PDU]
3667,400.585377,192.168.43.215,52.113.194.133,TCP,54,49262  >  443 [ACK] Seq=13797 Ack=2353915 Win=258 Len=0
3668,400.585488,52.113.194.133,192.168.43.215,TCP,1354,443  >  49262 [ACK] Seq=2353915 Ack=13797 Win=2046 Len=1300 [TCP segment of a reassembled PDU]
3669,400.58574300000004,52.113.194.133,192.168.43.215,TCP,1354,443  >  49262 [ACK] Seq=2355215 Ack=13797 Win=2046 Len=1300 [TCP segment of a reassembled PDU]
3670,400.585773,192.168.43.215,52.113.194.133,TCP,54,49262  >  443 [ACK] Seq=13797 Ack=2356515 Win=258 Len=0
3671,400.585826,52.113.194.133,192.168.43.215,TLSv1.2,141,Application Data
3672,400.585958,52.113.194.133,192.168.43.215,TLSv1.2,92,Application Data
3673,400.586003,192.168.43.215,52.113.194.133,TCP,54,49262  >  443 [ACK] Seq=13797 Ack=2356640 Win=258 Len=0
3674,400.979455,192.168.43.215,52.113.194.133,TLSv1.2,120,Application Data
3675,401.018944,52.113.194.133,192.168.43.215,TCP,54,443  >  49262 [ACK] Seq=2356640 Ack=13863 Win=2051 Len=0
3676,401.06795800000003,52.113.194.133,192.168.43.215,TCP,1354,443  >  49262 [ACK] Seq=2356640 Ack=13863 Win=2051 Len=1300 [TCP segment of a reassembled PDU]
3677,401.06806800000004,52.113.194.133,192.168.43.215,TLSv1.2,337,Application Data
3678,401.06811,192.168.43.215,52.113.194.133,TCP,54,49262  >  443 [ACK] Seq=13863 Ack=2358223 Win=258 Len=0
3679,401.068216,52.113.194.133,192.168.43.215,TCP,1354,443  >  49262 [ACK] Seq=2358223 Ack=13863 Win=2051 Len=1300 [TCP segment of a reassembled PDU]
3680,401.068401,52.113.194.133,192.168.43.215,TCP,1354,443  >  49262 [ACK] Seq=2359523 Ack=13863 Win=2051 Len=1300 [TCP segment of a reassembled PDU]
3681,401.06852000000003,192.168.43.215,52.113.194.133,TCP,54,49262  >  443 [ACK] Seq=13863 Ack=2360823 Win=258 Len=0
3682,401.068709,52.113.194.133,192.168.43.215,TCP,1354,443  >  49262 [ACK] Seq=2360823 Ack=13863 Win=2051 Len=1300 [TCP segment of a reassembled PDU]
3683,401.06875,52.113.194.133,192.168.43.215,TCP,1354,443  >  49262 [ACK] Seq=2362123 Ack=13863 Win=2051 Len=1300 [TCP segment of a reassembled PDU]
3684,401.068786,192.168.43.215,52.113.194.133,TCP,54,49262  >  443 [ACK] Seq=13863 Ack=2363423 Win=258 Len=0
3685,401.06886299999996,52.113.194.133,192.168.43.215,TCP,1354,443  >  49262 [ACK] Seq=2363423 Ack=13863 Win=2051 Len=1300 [TCP segment of a reassembled PDU]
3686,401.06900299999995,52.113.194.133,192.168.43.215,TCP,1354,443  >  49262 [ACK] Seq=2364723 Ack=13863 Win=2051 Len=1300 [TCP segment of a reassembled PDU]
3687,401.069068,192.168.43.215,52.113.194.133,TCP,54,49262  >  443 [ACK] Seq=13863 Ack=2366023 Win=258 Len=0
3688,401.06912,52.113.194.133,192.168.43.215,TLSv1.2,484,Application Data
3689,401.06928,52.113.194.133,192.168.43.215,TCP,1354,443  >  49262 [ACK] Seq=2366453 Ack=13863 Win=2051 Len=1300 [TCP segment of a reassembled PDU]
3690,401.069319,192.168.43.215,52.113.194.133,TCP,54,49262  >  443 [ACK] Seq=13863 Ack=2367753 Win=258 Len=0
3691,401.069467,52.113.194.133,192.168.43.215,TCP,1354,443  >  49262 [ACK] Seq=2367753 Ack=13863 Win=2051 Len=1300 [TCP segment of a reassembled PDU]
3692,401.069581,52.113.194.133,192.168.43.215,TCP,1354,443  >  49262 [ACK] Seq=2369053 Ack=13863 Win=2051 Len=1300 [TCP segment of a reassembled PDU]
3693,401.069621,192.168.43.215,52.113.194.133,TCP,54,49262  >  443 [ACK] Seq=13863 Ack=2370353 Win=258 Len=0
3694,401.06970099999995,52.113.194.133,192.168.43.215,TLSv1.2,343,Application Data
3695,401.06979,52.113.194.133,192.168.43.215,TCP,1354,443  >  49262 [ACK] Seq=2370642 Ack=13863 Win=2051 Len=1300 [TCP segment of a reassembled PDU]
3696,401.069826,192.168.43.215,52.113.194.133,TCP,54,49262  >  443 [ACK] Seq=13863 Ack=2371942 Win=258 Len=0
3697,401.070086,52.113.194.133,192.168.43.215,TCP,1354,443  >  49262 [ACK] Seq=2371942 Ack=13863 Win=2051 Len=1300 [TCP segment of a reassembled PDU]
3698,401.07021000000003,52.113.194.133,192.168.43.215,TCP,1354,443  >  49262 [ACK] Seq=2373242 Ack=13863 Win=2051 Len=1300 [TCP segment of a reassembled PDU]
3699,401.070255,192.168.43.215,52.113.194.133,TCP,54,49262  >  443 [ACK] Seq=13863 Ack=2374542 Win=258 Len=0
3700,401.07038700000004,52.113.194.133,192.168.43.215,TCP,1354,443  >  49262 [ACK] Seq=2374542 Ack=13863 Win=2051 Len=1300 [TCP segment of a reassembled PDU]
3701,401.07066299999997,52.113.194.133,192.168.43.215,TCP,1354,443  >  49262 [ACK] Seq=2375842 Ack=13863 Win=2051 Len=1300 [TCP segment of a reassembled PDU]
3702,401.070717,192.168.43.215,52.113.194.133,TCP,54,49262  >  443 [ACK] Seq=13863 Ack=2377142 Win=258 Len=0
3703,401.070789,52.113.194.133,192.168.43.215,TLSv1.2,141,Application Data
3704,401.070891,52.113.194.133,192.168.43.215,TLSv1.2,92,Application Data
3705,401.070941,192.168.43.215,52.113.194.133,TCP,54,49262  >  443 [ACK] Seq=13863 Ack=2377267 Win=258 Len=0
3706,401.432596,192.168.43.215,52.113.194.133,TLSv1.2,120,Application Data
3707,401.468672,52.113.194.133,192.168.43.215,TCP,54,443  >  49262 [ACK] Seq=2377267 Ack=13929 Win=2051 Len=0
3708,401.535486,52.113.194.133,192.168.43.215,TCP,1354,443  >  49262 [ACK] Seq=2377267 Ack=13929 Win=2051 Len=1300 [TCP segment of a reassembled PDU]
3709,401.535635,52.113.194.133,192.168.43.215,TLSv1.2,313,Application Data
3710,401.535694,192.168.43.215,52.113.194.133,TCP,54,49262  >  443 [ACK] Seq=13929 Ack=2378826 Win=258 Len=0
3711,401.5358,52.113.194.133,192.168.43.215,TCP,1354,443  >  49262 [ACK] Seq=2378826 Ack=13929 Win=2051 Len=1300 [TCP segment of a reassembled PDU]
3712,401.535933,52.113.194.133,192.168.43.215,TCP,1354,443  >  49262 [ACK] Seq=2380126 Ack=13929 Win=2051 Len=1300 [TCP segment of a reassembled PDU]
3713,401.535961,192.168.43.215,52.113.194.133,TCP,54,49262  >  443 [ACK] Seq=13929 Ack=2381426 Win=258 Len=0
3714,401.54306099999997,52.113.194.133,192.168.43.215,TCP,1354,443  >  49262 [ACK] Seq=2381426 Ack=13929 Win=2051 Len=1300 [TCP segment of a reassembled PDU]
3715,401.543203,52.113.194.133,192.168.43.215,TCP,1354,443  >  49262 [ACK] Seq=2382726 Ack=13929 Win=2051 Len=1300 [TCP segment of a reassembled PDU]
3716,401.543245,192.168.43.215,52.113.194.133,TCP,54,49262  >  443 [ACK] Seq=13929 Ack=2384026 Win=258 Len=0
3717,401.543382,52.113.194.133,192.168.43.215,TCP,1354,443  >  49262 [ACK] Seq=2384026 Ack=13929 Win=2051 Len=1300 [TCP segment of a reassembled PDU]
3718,401.54352,52.113.194.133,192.168.43.215,TCP,1354,443  >  49262 [ACK] Seq=2385326 Ack=13929 Win=2051 Len=1300 [TCP segment of a reassembled PDU]
3719,401.543562,192.168.43.215,52.113.194.133,TCP,54,49262  >  443 [ACK] Seq=13929 Ack=2386626 Win=258 Len=0
3720,401.54364100000004,52.113.194.133,192.168.43.215,TLSv1.2,484,Application Data
3721,401.543726,52.113.194.133,192.168.43.215,TCP,1354,443  >  49262 [ACK] Seq=2387056 Ack=13929 Win=2051 Len=1300 [TCP segment of a reassembled PDU]
3722,401.543754,192.168.43.215,52.113.194.133,TCP,54,49262  >  443 [ACK] Seq=13929 Ack=2388356 Win=258 Len=0
3723,401.543875,52.113.194.133,192.168.43.215,TCP,1354,443  >  49262 [ACK] Seq=2388356 Ack=13929 Win=2051 Len=1300 [TCP segment of a reassembled PDU]
3724,401.544044,52.113.194.133,192.168.43.215,TCP,1354,443  >  49262 [ACK] Seq=2389656 Ack=13929 Win=2051 Len=1300 [TCP segment of a reassembled PDU]
3725,401.54407599999996,192.168.43.215,52.113.194.133,TCP,54,49262  >  443 [ACK] Seq=13929 Ack=2390956 Win=258 Len=0
3726,401.54414199999997,52.113.194.133,192.168.43.215,TLSv1.2,343,Application Data
3727,401.54436200000004,52.113.194.133,192.168.43.215,TCP,1354,443  >  49262 [ACK] Seq=2391245 Ack=13929 Win=2051 Len=1300 [TCP segment of a reassembled PDU]
3728,401.544402,192.168.43.215,52.113.194.133,TCP,54,49262  >  443 [ACK] Seq=13929 Ack=2392545 Win=258 Len=0
3729,401.544536,52.113.194.133,192.168.43.215,TCP,1354,443  >  49262 [ACK] Seq=2392545 Ack=13929 Win=2051 Len=1300 [TCP segment of a reassembled PDU]
3730,401.544654,52.113.194.133,192.168.43.215,TCP,1354,443  >  49262 [ACK] Seq=2393845 Ack=13929 Win=2051 Len=1300 [TCP segment of a reassembled PDU]
3731,401.54468399999996,192.168.43.215,52.113.194.133,TCP,54,49262  >  443 [ACK] Seq=13929 Ack=2395145 Win=258 Len=0
3732,401.544923,52.113.194.133,192.168.43.215,TCP,1354,443  >  49262 [ACK] Seq=2395145 Ack=13929 Win=2051 Len=1300 [TCP segment of a reassembled PDU]
3733,401.54508500000003,52.113.194.133,192.168.43.215,TCP,1354,443  >  49262 [ACK] Seq=2396445 Ack=13929 Win=2051 Len=1300 [TCP segment of a reassembled PDU]
3734,401.545122,192.168.43.215,52.113.194.133,TCP,54,49262  >  443 [ACK] Seq=13929 Ack=2397745 Win=258 Len=0
3735,401.54520499999995,52.113.194.133,192.168.43.215,TLSv1.2,141,Application Data
3736,401.545314,52.113.194.133,192.168.43.215,TLSv1.2,92,Application Data
3737,401.545346,192.168.43.215,52.113.194.133,TCP,54,49262  >  443 [ACK] Seq=13929 Ack=2397870 Win=258 Len=0
3738,402.522618,192.168.43.215,52.113.194.133,TLSv1.2,120,Application Data
3739,402.574677,52.113.194.133,192.168.43.215,TCP,54,443  >  49262 [ACK] Seq=2397870 Ack=13995 Win=2051 Len=0
3740,402.61593500000004,52.113.194.133,192.168.43.215,TCP,1354,443  >  49262 [ACK] Seq=2397870 Ack=13995 Win=2051 Len=1300 [TCP segment of a reassembled PDU]
3741,402.61605,52.113.194.133,192.168.43.215,TLSv1.2,336,Application Data
3742,402.61609300000003,192.168.43.215,52.113.194.133,TCP,54,49262  >  443 [ACK] Seq=13995 Ack=2399452 Win=258 Len=0
3743,402.616243,52.113.194.133,192.168.43.215,TCP,1354,443  >  49262 [ACK] Seq=2399452 Ack=13995 Win=2051 Len=1300 [TCP segment of a reassembled PDU]
3744,402.616399,52.113.194.133,192.168.43.215,TCP,1354,443  >  49262 [ACK] Seq=2400752 Ack=13995 Win=2051 Len=1300 [TCP segment of a reassembled PDU]
3745,402.616455,192.168.43.215,52.113.194.133,TCP,54,49262  >  443 [ACK] Seq=13995 Ack=2402052 Win=258 Len=0
3746,402.616549,52.113.194.133,192.168.43.215,TCP,1354,443  >  49262 [ACK] Seq=2402052 Ack=13995 Win=2051 Len=1300 [TCP segment of a reassembled PDU]
3747,402.616616,52.113.194.133,192.168.43.215,TCP,1354,443  >  49262 [ACK] Seq=2403352 Ack=13995 Win=2051 Len=1300 [TCP segment of a reassembled PDU]
3748,402.616644,192.168.43.215,52.113.194.133,TCP,54,49262  >  443 [ACK] Seq=13995 Ack=2404652 Win=258 Len=0
3749,402.617471,52.113.194.133,192.168.43.215,TCP,1354,443  >  49262 [ACK] Seq=2404652 Ack=13995 Win=2051 Len=1300 [TCP segment of a reassembled PDU]
3750,402.61765099999997,52.113.194.133,192.168.43.215,TCP,1354,443  >  49262 [ACK] Seq=2405952 Ack=13995 Win=2051 Len=1300 [TCP segment of a reassembled PDU]
3751,402.61769300000003,192.168.43.215,52.113.194.133,TCP,54,49262  >  443 [ACK] Seq=13995 Ack=2407252 Win=258 Len=0
3752,402.61783399999996,52.113.194.133,192.168.43.215,TLSv1.2,484,Application Data
3753,402.618588,52.113.194.133,192.168.43.215,TCP,1354,443  >  49262 [ACK] Seq=2407682 Ack=13995 Win=2051 Len=1300 [TCP segment of a reassembled PDU]
3754,402.618661,192.168.43.215,52.113.194.133,TCP,54,49262  >  443 [ACK] Seq=13995 Ack=2408982 Win=258 Len=0
3755,402.618768,52.113.194.133,192.168.43.215,TCP,1354,443  >  49262 [ACK] Seq=2408982 Ack=13995 Win=2051 Len=1300 [TCP segment of a reassembled PDU]
3756,402.618856,52.113.194.133,192.168.43.215,TCP,1354,443  >  49262 [ACK] Seq=2410282 Ack=13995 Win=2051 Len=1300 [TCP segment of a reassembled PDU]
3757,402.618881,192.168.43.215,52.113.194.133,TCP,54,49262  >  443 [ACK] Seq=13995 Ack=2411582 Win=258 Len=0
3758,402.618919,52.113.194.133,192.168.43.215,TLSv1.2,343,Application Data
3759,402.61919700000004,52.113.194.133,192.168.43.215,TCP,1354,443  >  49262 [ACK] Seq=2411871 Ack=13995 Win=2051 Len=1300 [TCP segment of a reassembled PDU]
3760,402.619299,192.168.43.215,52.113.194.133,TCP,54,49262  >  443 [ACK] Seq=13995 Ack=2413171 Win=258 Len=0
3761,402.619401,52.113.194.133,192.168.43.215,TCP,1354,443  >  49262 [ACK] Seq=2413171 Ack=13995 Win=2051 Len=1300 [TCP segment of a reassembled PDU]
3762,402.619543,52.113.194.133,192.168.43.215,TCP,1354,443  >  49262 [ACK] Seq=2414471 Ack=13995 Win=2051 Len=1300 [TCP segment of a reassembled PDU]
3763,402.619579,192.168.43.215,52.113.194.133,TCP,54,49262  >  443 [ACK] Seq=13995 Ack=2415771 Win=258 Len=0
3764,402.61969300000004,52.113.194.133,192.168.43.215,TCP,1354,443  >  49262 [ACK] Seq=2415771 Ack=13995 Win=2051 Len=1300 [TCP segment of a reassembled PDU]
3765,402.619988,52.113.194.133,192.168.43.215,TCP,1354,443  >  49262 [ACK] Seq=2417071 Ack=13995 Win=2051 Len=1300 [TCP segment of a reassembled PDU]
3766,402.620063,192.168.43.215,52.113.194.133,TCP,54,49262  >  443 [ACK] Seq=13995 Ack=2418371 Win=258 Len=0
3767,402.622209,52.113.194.133,192.168.43.215,TLSv1.2,141,Application Data
3768,402.622461,52.113.194.133,192.168.43.215,TLSv1.2,92,Application Data
3769,402.622581,192.168.43.215,52.113.194.133,TCP,54,49262  >  443 [ACK] Seq=13995 Ack=2418496 Win=258 Len=0
3770,403.577927,192.168.43.215,52.113.194.133,TLSv1.2,120,Application Data
3771,403.634128,52.113.194.133,192.168.43.215,TCP,54,443  >  49262 [ACK] Seq=2418496 Ack=14061 Win=2050 Len=0
3772,403.67141200000003,52.113.194.133,192.168.43.215,TCP,1354,443  >  49262 [ACK] Seq=2418496 Ack=14061 Win=2050 Len=1300 [TCP segment of a reassembled PDU]
3773,403.67152400000003,52.113.194.133,192.168.43.215,TLSv1.2,350,Application Data
3774,403.671572,192.168.43.215,52.113.194.133,TCP,54,49262  >  443 [ACK] Seq=14061 Ack=2420092 Win=258 Len=0
3775,403.671744,52.113.194.133,192.168.43.215,TCP,1354,443  >  49262 [ACK] Seq=2420092 Ack=14061 Win=2050 Len=1300 [TCP segment of a reassembled PDU]
3776,403.671922,52.113.194.133,192.168.43.215,TCP,1354,443  >  49262 [ACK] Seq=2421392 Ack=14061 Win=2050 Len=1300 [TCP segment of a reassembled PDU]
3777,403.671975,192.168.43.215,52.113.194.133,TCP,54,49262  >  443 [ACK] Seq=14061 Ack=2422692 Win=258 Len=0
3778,403.672101,52.113.194.133,192.168.43.215,TCP,1354,443  >  49262 [ACK] Seq=2422692 Ack=14061 Win=2050 Len=1300 [TCP segment of a reassembled PDU]
3779,403.672201,52.113.194.133,192.168.43.215,TCP,1354,443  >  49262 [ACK] Seq=2423992 Ack=14061 Win=2050 Len=1300 [TCP segment of a reassembled PDU]
3780,403.672231,192.168.43.215,52.113.194.133,TCP,54,49262  >  443 [ACK] Seq=14061 Ack=2425292 Win=258 Len=0
3781,403.672322,52.113.194.133,192.168.43.215,TCP,1354,443  >  49262 [ACK] Seq=2425292 Ack=14061 Win=2050 Len=1300 [TCP segment of a reassembled PDU]
3782,403.672426,52.113.194.133,192.168.43.215,TCP,1354,443  >  49262 [ACK] Seq=2426592 Ack=14061 Win=2050 Len=1300 [TCP segment of a reassembled PDU]
3783,403.672464,192.168.43.215,52.113.194.133,TCP,54,49262  >  443 [ACK] Seq=14061 Ack=2427892 Win=258 Len=0
3784,403.67253700000003,52.113.194.133,192.168.43.215,TLSv1.2,484,Application Data
3785,403.67263399999996,52.113.194.133,192.168.43.215,TCP,1354,443  >  49262 [ACK] Seq=2428322 Ack=14061 Win=2050 Len=1300 [TCP segment of a reassembled PDU]
3786,403.67265699999996,192.168.43.215,52.113.194.133,TCP,54,49262  >  443 [ACK] Seq=14061 Ack=2429622 Win=258 Len=0
3787,403.672774,52.113.194.133,192.168.43.215,TCP,1354,443  >  49262 [ACK] Seq=2429622 Ack=14061 Win=2050 Len=1300 [TCP segment of a reassembled PDU]
3788,403.673092,52.113.194.133,192.168.43.215,TCP,1354,443  >  49262 [ACK] Seq=2430922 Ack=14061 Win=2050 Len=1300 [TCP segment of a reassembled PDU]
3789,403.67312799999996,192.168.43.215,52.113.194.133,TCP,54,49262  >  443 [ACK] Seq=14061 Ack=2432222 Win=258 Len=0
3790,403.673204,52.113.194.133,192.168.43.215,TLSv1.2,343,Application Data
3791,403.673276,52.113.194.133,192.168.43.215,TCP,1354,443  >  49262 [ACK] Seq=2432511 Ack=14061 Win=2050 Len=1300 [TCP segment of a reassembled PDU]
3792,403.67332000000005,192.168.43.215,52.113.194.133,TCP,54,49262  >  443 [ACK] Seq=14061 Ack=2433811 Win=258 Len=0
3793,403.67341400000004,52.113.194.133,192.168.43.215,TCP,1354,443  >  49262 [ACK] Seq=2433811 Ack=14061 Win=2050 Len=1300 [TCP segment of a reassembled PDU]
3794,403.673709,52.113.194.133,192.168.43.215,TCP,1354,443  >  49262 [ACK] Seq=2435111 Ack=14061 Win=2050 Len=1300 [TCP segment of a reassembled PDU]
3795,403.673753,192.168.43.215,52.113.194.133,TCP,54,49262  >  443 [ACK] Seq=14061 Ack=2436411 Win=258 Len=0
3796,403.673881,52.113.194.133,192.168.43.215,TCP,1354,443  >  49262 [ACK] Seq=2436411 Ack=14061 Win=2050 Len=1300 [TCP segment of a reassembled PDU]
3797,403.674086,52.113.194.133,192.168.43.215,TCP,1354,443  >  49262 [ACK] Seq=2437711 Ack=14061 Win=2050 Len=1300 [TCP segment of a reassembled PDU]
3798,403.67411699999997,192.168.43.215,52.113.194.133,TCP,54,49262  >  443 [ACK] Seq=14061 Ack=2439011 Win=258 Len=0
3799,403.674205,52.113.194.133,192.168.43.215,TLSv1.2,141,Application Data
3800,403.674311,52.113.194.133,192.168.43.215,TLSv1.2,92,Application Data
3801,403.674343,192.168.43.215,52.113.194.133,TCP,54,49262  >  443 [ACK] Seq=14061 Ack=2439136 Win=258 Len=0
3802,404.244827,192.168.43.215,52.113.194.133,TLSv1.2,186,Application Data
3803,404.294563,52.113.194.133,192.168.43.215,TCP,54,443  >  49262 [ACK] Seq=2439136 Ack=14193 Win=2050 Len=0
3804,404.334907,52.113.194.133,192.168.43.215,TCP,1354,443  >  49262 [ACK] Seq=2439136 Ack=14193 Win=2050 Len=1300 [TCP segment of a reassembled PDU]
3805,404.335074,52.113.194.133,192.168.43.215,TCP,1354,443  >  49262 [ACK] Seq=2440436 Ack=14193 Win=2050 Len=1300 [TCP segment of a reassembled PDU]
3806,404.33516000000003,192.168.43.215,52.113.194.133,TCP,54,49262  >  443 [ACK] Seq=14193 Ack=2441736 Win=258 Len=0
3807,404.335252,52.113.194.133,192.168.43.215,TLSv1.2,633,Application Data
3808,404.335338,52.113.194.133,192.168.43.215,TCP,1354,443  >  49262 [ACK] Seq=2442315 Ack=14193 Win=2050 Len=1300 [TCP segment of a reassembled PDU]
3809,404.335377,192.168.43.215,52.113.194.133,TCP,54,49262  >  443 [ACK] Seq=14193 Ack=2443615 Win=258 Len=0
3810,404.33549700000003,52.113.194.133,192.168.43.215,TCP,1354,443  >  49262 [ACK] Seq=2443615 Ack=14193 Win=2050 Len=1300 [TCP segment of a reassembled PDU]
3811,404.335677,52.113.194.133,192.168.43.215,TCP,1354,443  >  49262 [ACK] Seq=2444915 Ack=14193 Win=2050 Len=1300 [TCP segment of a reassembled PDU]
3812,404.33571,192.168.43.215,52.113.194.133,TCP,54,49262  >  443 [ACK] Seq=14193 Ack=2446215 Win=258 Len=0
3813,404.335824,52.113.194.133,192.168.43.215,TCP,1354,443  >  49262 [ACK] Seq=2446215 Ack=14193 Win=2050 Len=1300 [TCP segment of a reassembled PDU]
3814,404.33612999999997,52.113.194.133,192.168.43.215,TCP,1354,443  >  49262 [ACK] Seq=2447515 Ack=14193 Win=2050 Len=1300 [TCP segment of a reassembled PDU]
3815,404.336156,192.168.43.215,52.113.194.133,TCP,54,49262  >  443 [ACK] Seq=14193 Ack=2448815 Win=258 Len=0
3816,404.336404,52.113.194.133,192.168.43.215,TCP,1354,443  >  49262 [ACK] Seq=2448815 Ack=14193 Win=2050 Len=1300 [TCP segment of a reassembled PDU]
3817,404.3365,52.113.194.133,192.168.43.215,TLSv1.2,484,Application Data
3818,404.336535,192.168.43.215,52.113.194.133,TCP,54,49262  >  443 [ACK] Seq=14193 Ack=2450545 Win=258 Len=0
3819,404.342616,52.113.194.133,192.168.43.215,TCP,1354,443  >  49262 [ACK] Seq=2450545 Ack=14193 Win=2050 Len=1300 [TCP segment of a reassembled PDU]
3820,404.34279,52.113.194.133,192.168.43.215,TCP,1354,443  >  49262 [ACK] Seq=2451845 Ack=14193 Win=2050 Len=1300 [TCP segment of a reassembled PDU]
3821,404.342865,192.168.43.215,52.113.194.133,TCP,54,49262  >  443 [ACK] Seq=14193 Ack=2453145 Win=258 Len=0
3822,404.34295499999996,52.113.194.133,192.168.43.215,TCP,1354,443  >  49262 [ACK] Seq=2453145 Ack=14193 Win=2050 Len=1300 [TCP segment of a reassembled PDU]
3823,404.34299,52.113.194.133,192.168.43.215,TLSv1.2,343,Application Data
3824,404.343015,192.168.43.215,52.113.194.133,TCP,54,49262  >  443 [ACK] Seq=14193 Ack=2454734 Win=258 Len=0
3825,404.343127,52.113.194.133,192.168.43.215,TCP,1354,443  >  49262 [ACK] Seq=2454734 Ack=14193 Win=2050 Len=1300 [TCP segment of a reassembled PDU]
3826,404.343308,52.113.194.133,192.168.43.215,TCP,1354,443  >  49262 [ACK] Seq=2456034 Ack=14193 Win=2050 Len=1300 [TCP segment of a reassembled PDU]
3827,404.34333599999997,192.168.43.215,52.113.194.133,TCP,54,49262  >  443 [ACK] Seq=14193 Ack=2457334 Win=258 Len=0
3828,404.343479,52.113.194.133,192.168.43.215,TCP,1354,443  >  49262 [ACK] Seq=2457334 Ack=14193 Win=2050 Len=1300 [TCP segment of a reassembled PDU]
3829,404.343652,52.113.194.133,192.168.43.215,TCP,1354,443  >  49262 [ACK] Seq=2458634 Ack=14193 Win=2050 Len=1300 [TCP segment of a reassembled PDU]
3830,404.34368,192.168.43.215,52.113.194.133,TCP,54,49262  >  443 [ACK] Seq=14193 Ack=2459934 Win=258 Len=0
3831,404.343913,52.113.194.133,192.168.43.215,TCP,1354,443  >  49262 [ACK] Seq=2459934 Ack=14193 Win=2050 Len=1300 [TCP segment of a reassembled PDU]
3832,404.343993,52.113.194.133,192.168.43.215,TLSv1.2,141,Application Data
3833,404.344017,192.168.43.215,52.113.194.133,TCP,54,49262  >  443 [ACK] Seq=14193 Ack=2461321 Win=258 Len=0
3834,404.344104,52.113.194.133,192.168.43.215,TLSv1.2,92,Application Data
3835,404.483413,192.168.43.215,52.113.194.133,TCP,54,49262  >  443 [ACK] Seq=14193 Ack=2461359 Win=258 Len=0
3836,449.351988,192.168.43.215,52.113.194.133,TCP,55,[TCP Keep-Alive] 49262  >  443 [ACK] Seq=14192 Ack=2461359 Win=258 Len=1
3837,449.403145,52.113.194.133,192.168.43.215,TCP,66,[TCP Keep-Alive ACK] 443  >  49262 [ACK] Seq=2461359 Ack=14193 Win=2050 Len=0 SLE=14192 SRE=14193
