No.,Time,Source,Destination,Protocol,Length,Info
2000,312.643487,192.168.43.215,52.113.194.133,TCP,66,58946  >  443 [SYN] Seq=0 Win=8192 Len=0 MSS=1460 WS=256 SACK_PERM=1
2001,312.70239,52.113.194.133,192.168.43.215,TCP,66,"443  >  58946 [SYN, ACK] Seq=0 Ack=1 Win=65535 Len=0 MSS=1300 WS=256 SACK_PERM=1"
2002,312.70262599999995,192.168.43.215,52.113.194.133,TCP,54,58946  >  443 [ACK] Seq=1 Ack=1 Win=66048 Len=0
2003,312.703356,192.168.43.215,52.113.194.133,TLSv1.2,620,Client Hello
2004,312.748698,52.113.194.133,192.168.43.215,TCP,54,443  >  58946 [ACK] Seq=1 Ack=567 Win=261888 Len=0
2005,312.748963,52.113.194.133,192.168.43.215,TLSv1.2,208,"Server Hello, Change Cipher Spec, Encrypted Handshake Message"
2006,312.752375,192.168.43.215,52.113.194.133,TLSv1.2,105,"Change Cipher Spec, Encrypted Handshake Message"
2007,312.75287099999997,192.168.43.215,52.113.194.133,TLSv1.2,153,Application Data
2008,312.75348399999996,192.168.43.215,52.113.194.133,TLSv1.2,648,Application Data
2009,312.79160099999996,52.113.194.133,192.168.43.215,TCP,54,443  >  58946 [ACK] Seq=155 Ack=717 Win=261632 Len=0
2010,312.791719,52.113.194.133,192.168.43.215,TLSv1.2,123,Application Data
2011,312.79178199999996,52.113.194.133,192.168.43.215,TLSv1.2,92,Application Data
2012,312.79184,192.168.43.215,52.113.194.133,TCP,54,58946  >  443 [ACK] Seq=1311 Ack=262 Win=65792 Len=0
2013,312.792119,192.168.43.215,52.113.194.133,TLSv1.2,92,Application Data
2014,312.832933,52.113.194.133,192.168.43.215,TCP,1354,443  >  58946 [ACK] Seq=262 Ack=1311 Win=262400 Len=1300 [TCP segment of a reassembled PDU]
2015,312.833044,192.168.43.215,52.113.194.133,TCP,54,58946  >  443 [ACK] Seq=1349 Ack=1562 Win=66048 Len=0
2016,312.833112,52.113.194.133,192.168.43.215,TCP,1354,443  >  58946 [ACK] Seq=1562 Ack=1311 Win=262400 Len=1300 [TCP segment of a reassembled PDU]
2017,312.833154,192.168.43.215,52.113.194.133,TCP,54,58946  >  443 [ACK] Seq=1349 Ack=2862 Win=66048 Len=0
2018,312.833206,52.113.194.133,192.168.43.215,TLSv1.2,781,Application Data
2019,312.833258,52.113.194.133,192.168.43.215,TCP,1354,443  >  58946 [ACK] Seq=3589 Ack=1311 Win=262400 Len=1300 [TCP segment of a reassembled PDU]
2020,312.833297,192.168.43.215,52.113.194.133,TCP,54,58946  >  443 [ACK] Seq=1349 Ack=4889 Win=66048 Len=0
2021,312.833352,52.113.194.133,192.168.43.215,TCP,1354,443  >  58946 [ACK] Seq=4889 Ack=1311 Win=262400 Len=1300 [TCP segment of a reassembled PDU]
2022,312.833388,192.168.43.215,52.113.194.133,TCP,54,58946  >  443 [ACK] Seq=1349 Ack=6189 Win=66048 Len=0
2023,312.833442,52.113.194.133,192.168.43.215,TCP,1354,443  >  58946 [ACK] Seq=6189 Ack=1311 Win=262400 Len=1300 [TCP segment of a reassembled PDU]
2024,312.83347599999996,192.168.43.215,52.113.194.133,TCP,54,58946  >  443 [ACK] Seq=1349 Ack=7489 Win=66048 Len=0
2025,312.83532,52.113.194.133,192.168.43.215,TCP,1354,443  >  58946 [ACK] Seq=7489 Ack=1311 Win=262400 Len=1300 [TCP segment of a reassembled PDU]
2026,312.83539,192.168.43.215,52.113.194.133,TCP,54,58946  >  443 [ACK] Seq=1349 Ack=8789 Win=66048 Len=0
2027,312.835464,52.113.194.133,192.168.43.215,TCP,1354,443  >  58946 [ACK] Seq=8789 Ack=1311 Win=262400 Len=1300 [TCP segment of a reassembled PDU]
2028,312.835502,192.168.43.215,52.113.194.133,TCP,54,58946  >  443 [ACK] Seq=1349 Ack=10089 Win=66048 Len=0
2029,312.83555099999995,52.113.194.133,192.168.43.215,TCP,1354,443  >  58946 [ACK] Seq=10089 Ack=1311 Win=262400 Len=1300 [TCP segment of a reassembled PDU]
2030,312.835586,192.168.43.215,52.113.194.133,TCP,54,58946  >  443 [ACK] Seq=1349 Ack=11389 Win=66048 Len=0
2031,312.83563599999997,52.113.194.133,192.168.43.215,TLSv1.2,484,Application Data
2032,312.83567,192.168.43.215,52.113.194.133,TCP,54,58946  >  443 [ACK] Seq=1349 Ack=11819 Win=65792 Len=0
2033,312.835724,52.113.194.133,192.168.43.215,TCP,1354,443  >  58946 [ACK] Seq=11819 Ack=1311 Win=262400 Len=1300 [TCP segment of a reassembled PDU]
2034,312.835758,192.168.43.215,52.113.194.133,TCP,54,58946  >  443 [ACK] Seq=1349 Ack=13119 Win=66048 Len=0
2035,312.835813,52.113.194.133,192.168.43.215,TCP,1354,443  >  58946 [ACK] Seq=13119 Ack=1311 Win=262400 Len=1300 [TCP segment of a reassembled PDU]
2036,312.83585899999997,192.168.43.215,52.113.194.133,TCP,54,58946  >  443 [ACK] Seq=1349 Ack=14419 Win=66048 Len=0
2037,312.835914,52.113.194.133,192.168.43.215,TCP,1354,443  >  58946 [ACK] Seq=14419 Ack=1311 Win=262400 Len=1300 [TCP segment of a reassembled PDU]
2038,312.835964,192.168.43.215,52.113.194.133,TCP,54,58946  >  443 [ACK] Seq=1349 Ack=15719 Win=66048 Len=0
2039,312.836023,52.113.194.133,192.168.43.215,TLSv1.2,343,Application Data
2040,312.836059,192.168.43.215,52.113.194.133,TCP,54,58946  >  443 [ACK] Seq=1349 Ack=16008 Win=65792 Len=0
2041,312.836114,52.113.194.133,192.168.43.215,TCP,1354,443  >  58946 [ACK] Seq=16008 Ack=1311 Win=262400 Len=1300 [TCP segment of a reassembled PDU]
2042,312.83615,192.168.43.215,52.113.194.133,TCP,54,58946  >  443 [ACK] Seq=1349 Ack=17308 Win=66048 Len=0
2043,312.836205,52.113.194.133,192.168.43.215,TCP,1354,443  >  58946 [ACK] Seq=17308 Ack=1311 Win=262400 Len=1300 [TCP segment of a reassembled PDU]
2044,312.83624199999997,192.168.43.215,52.113.194.133,TCP,54,58946  >  443 [ACK] Seq=1349 Ack=18608 Win=66048 Len=0
2045,312.836297,52.113.194.133,192.168.43.215,TCP,1354,443  >  58946 [ACK] Seq=18608 Ack=1311 Win=262400 Len=1300 [TCP segment of a reassembled PDU]
2046,312.83633399999997,192.168.43.215,52.113.194.133,TCP,54,58946  >  443 [ACK] Seq=1349 Ack=19908 Win=66048 Len=0
2047,312.836389,52.113.194.133,192.168.43.215,TCP,1354,443  >  58946 [ACK] Seq=19908 Ack=1311 Win=262400 Len=1300 [TCP segment of a reassembled PDU]
2048,312.836425,192.168.43.215,52.113.194.133,TCP,54,58946  >  443 [ACK] Seq=1349 Ack=21208 Win=66048 Len=0
2049,312.838906,52.113.194.133,192.168.43.215,TCP,54,443  >  58946 [ACK] Seq=21208 Ack=1349 Win=262400 Len=0
2050,312.87904,52.113.194.133,192.168.43.215,TCP,1354,443  >  58946 [ACK] Seq=21208 Ack=1349 Win=262400 Len=1300 [TCP segment of a reassembled PDU]
2051,312.879275,52.113.194.133,192.168.43.215,TLSv1.2,218,"Application Data, Application Data"
2052,312.879389,192.168.43.215,52.113.194.133,TCP,54,58946  >  443 [ACK] Seq=1349 Ack=22672 Win=66048 Len=0
2053,317.41441000000003,192.168.43.215,52.113.194.133,TLSv1.2,224,Application Data
2054,317.46667,52.113.194.133,192.168.43.215,TCP,54,443  >  58946 [ACK] Seq=22672 Ack=1519 Win=262144 Len=0
2055,317.50305,52.113.194.133,192.168.43.215,TCP,1354,443  >  58946 [ACK] Seq=22672 Ack=1519 Win=262144 Len=1300 [TCP segment of a reassembled PDU]
2056,317.504437,52.113.194.133,192.168.43.215,TLSv1.2,337,Application Data
2057,317.504546,192.168.43.215,52.113.194.133,TCP,54,58946  >  443 [ACK] Seq=1519 Ack=24255 Win=66048 Len=0
2058,317.50465299999996,52.113.194.133,192.168.43.215,TCP,1354,443  >  58946 [ACK] Seq=24255 Ack=1519 Win=262144 Len=1300 [TCP segment of a reassembled PDU]
2059,317.504694,52.113.194.133,192.168.43.215,TCP,1354,443  >  58946 [ACK] Seq=25555 Ack=1519 Win=262144 Len=1300 [TCP segment of a reassembled PDU]
2060,317.504719,192.168.43.215,52.113.194.133,TCP,54,58946  >  443 [ACK] Seq=1519 Ack=26855 Win=66048 Len=0
2061,317.504755,52.113.194.133,192.168.43.215,TCP,1354,443  >  58946 [ACK] Seq=26855 Ack=1519 Win=262144 Len=1300 [TCP segment of a reassembled PDU]
2062,317.504789,52.113.194.133,192.168.43.215,TCP,1354,443  >  58946 [ACK] Seq=28155 Ack=1519 Win=262144 Len=1300 [TCP segment of a reassembled PDU]
2063,317.504818,192.168.43.215,52.113.194.133,TCP,54,58946  >  443 [ACK] Seq=1519 Ack=29455 Win=66048 Len=0
2064,317.511081,52.113.194.133,192.168.43.215,TCP,1354,443  >  58946 [ACK] Seq=29455 Ack=1519 Win=262144 Len=1300 [TCP segment of a reassembled PDU]
2065,317.511711,52.113.194.133,192.168.43.215,TCP,1354,443  >  58946 [ACK] Seq=30755 Ack=1519 Win=262144 Len=1300 [TCP segment of a reassembled PDU]
2066,317.511789,192.168.43.215,52.113.194.133,TCP,54,58946  >  443 [ACK] Seq=1519 Ack=32055 Win=66048 Len=0
2067,317.51188199999996,52.113.194.133,192.168.43.215,TLSv1.2,484,Application Data
2068,317.51192799999995,52.113.194.133,192.168.43.215,TCP,1354,443  >  58946 [ACK] Seq=32485 Ack=1519 Win=262144 Len=1300 [TCP segment of a reassembled PDU]
2069,317.51196200000004,192.168.43.215,52.113.194.133,TCP,54,58946  >  443 [ACK] Seq=1519 Ack=33785 Win=66048 Len=0
2070,317.512008,52.113.194.133,192.168.43.215,TCP,1354,443  >  58946 [ACK] Seq=33785 Ack=1519 Win=262144 Len=1300 [TCP segment of a reassembled PDU]
2071,317.520444,52.113.194.133,192.168.43.215,TCP,1354,443  >  58946 [ACK] Seq=35085 Ack=1519 Win=262144 Len=1300 [TCP segment of a reassembled PDU]
2072,317.52054,192.168.43.215,52.113.194.133,TCP,54,58946  >  443 [ACK] Seq=1519 Ack=36385 Win=66048 Len=0
2073,317.520621,52.113.194.133,192.168.43.215,TLSv1.2,343,Application Data
2074,317.52066,52.113.194.133,192.168.43.215,TCP,1354,443  >  58946 [ACK] Seq=36674 Ack=1519 Win=262144 Len=1300 [TCP segment of a reassembled PDU]
2075,317.520701,192.168.43.215,52.113.194.133,TCP,54,58946  >  443 [ACK] Seq=1519 Ack=37974 Win=66048 Len=0
2076,317.52074500000003,52.113.194.133,192.168.43.215,TLSv1.2,823,Application Data
2077,317.520782,52.113.194.133,192.168.43.215,TLSv1.2,92,Application Data
2078,317.52081400000003,192.168.43.215,52.113.194.133,TCP,54,58946  >  443 [ACK] Seq=1519 Ack=38781 Win=65280 Len=0
2079,321.503878,192.168.43.215,52.113.194.133,TCP,54,"58946  >  443 [FIN, ACK] Seq=1519 Ack=38781 Win=65280 Len=0"
2080,321.513932,192.168.43.215,52.113.194.133,TCP,66,59102  >  443 [SYN] Seq=0 Win=8192 Len=0 MSS=1460 WS=256 SACK_PERM=1
2081,321.584221,52.113.194.133,192.168.43.215,TCP,54,443  >  58946 [ACK] Seq=38781 Ack=1520 Win=262144 Len=0
2082,321.584279,52.113.194.133,192.168.43.215,TCP,54,"443  >  58946 [FIN, ACK] Seq=38781 Ack=1520 Win=262144 Len=0"
2083,321.58437799999996,192.168.43.215,52.113.194.133,TCP,54,58946  >  443 [ACK] Seq=1520 Ack=38782 Win=65280 Len=0
2084,321.584536,52.113.194.133,192.168.43.215,TCP,66,"443  >  59102 [SYN, ACK] Seq=0 Ack=1 Win=65535 Len=0 MSS=1300 WS=256 SACK_PERM=1"
2085,321.58474,192.168.43.215,52.113.194.133,TCP,54,59102  >  443 [ACK] Seq=1 Ack=1 Win=66048 Len=0
2086,321.58579199999997,192.168.43.215,52.113.194.133,TLSv1.2,620,Client Hello
2087,321.637058,52.113.194.133,192.168.43.215,TCP,54,443  >  59102 [ACK] Seq=1 Ack=567 Win=261888 Len=0
2088,321.63715299999996,52.113.194.133,192.168.43.215,TLSv1.2,208,"Server Hello, Change Cipher Spec, Encrypted Handshake Message"
2089,321.64003399999996,192.168.43.215,52.113.194.133,TLSv1.2,105,"Change Cipher Spec, Encrypted Handshake Message"
2090,321.64043300000003,192.168.43.215,52.113.194.133,TLSv1.2,153,Application Data
2091,321.640937,192.168.43.215,52.113.194.133,TLSv1.2,676,Application Data
2092,321.693455,52.113.194.133,192.168.43.215,TCP,54,443  >  59102 [ACK] Seq=155 Ack=618 Win=261888 Len=0
2093,321.693593,52.113.194.133,192.168.43.215,TLSv1.2,123,Application Data
2094,321.69365600000003,52.113.194.133,192.168.43.215,TCP,54,443  >  59102 [ACK] Seq=224 Ack=1339 Win=262400 Len=0
2095,321.694231,192.168.43.215,52.113.194.133,TLSv1.2,92,Application Data
2096,321.743735,52.113.194.133,192.168.43.215,TLSv1.2,92,Application Data
2097,321.77547200000004,192.168.43.215,52.113.194.133,TCP,54,59102  >  443 [ACK] Seq=1377 Ack=262 Win=65792 Len=0
2098,321.86413999999996,52.113.194.133,192.168.43.215,TCP,1354,443  >  59102 [ACK] Seq=262 Ack=1377 Win=262400 Len=1300 [TCP segment of a reassembled PDU]
2099,321.864303,52.113.194.133,192.168.43.215,TCP,1354,443  >  59102 [ACK] Seq=1562 Ack=1377 Win=262400 Len=1300 [TCP segment of a reassembled PDU]
2100,321.86436000000003,192.168.43.215,52.113.194.133,TCP,54,59102  >  443 [ACK] Seq=1377 Ack=2862 Win=66048 Len=0
2101,321.86449,52.113.194.133,192.168.43.215,TLSv1.2,789,Application Data
2102,321.867454,52.113.194.133,192.168.43.215,TCP,1354,443  >  59102 [ACK] Seq=3597 Ack=1377 Win=262400 Len=1300 [TCP segment of a reassembled PDU]
2103,321.86758,192.168.43.215,52.113.194.133,TCP,54,59102  >  443 [ACK] Seq=1377 Ack=4897 Win=66048 Len=0
2104,321.867684,52.113.194.133,192.168.43.215,TCP,1354,443  >  59102 [ACK] Seq=4897 Ack=1377 Win=262400 Len=1300 [TCP segment of a reassembled PDU]
2105,321.867727,52.113.194.133,192.168.43.215,TCP,1354,443  >  59102 [ACK] Seq=6197 Ack=1377 Win=262400 Len=1300 [TCP segment of a reassembled PDU]
2106,321.867757,192.168.43.215,52.113.194.133,TCP,54,59102  >  443 [ACK] Seq=1377 Ack=7497 Win=66048 Len=0
2107,321.86779900000005,52.113.194.133,192.168.43.215,TCP,1354,443  >  59102 [ACK] Seq=7497 Ack=1377 Win=262400 Len=1300 [TCP segment of a reassembled PDU]
2108,321.868423,52.113.194.133,192.168.43.215,TCP,1354,443  >  59102 [ACK] Seq=8797 Ack=1377 Win=262400 Len=1300 [TCP segment of a reassembled PDU]
2109,321.868483,192.168.43.215,52.113.194.133,TCP,54,59102  >  443 [ACK] Seq=1377 Ack=10097 Win=66048 Len=0
2110,321.868559,52.113.194.133,192.168.43.215,TCP,1354,443  >  59102 [ACK] Seq=10097 Ack=1377 Win=262400 Len=1300 [TCP segment of a reassembled PDU]
2111,321.868603,52.113.194.133,192.168.43.215,TLSv1.2,484,Application Data
2112,321.868634,192.168.43.215,52.113.194.133,TCP,54,59102  >  443 [ACK] Seq=1377 Ack=11827 Win=66048 Len=0
2113,321.868681,52.113.194.133,192.168.43.215,TCP,1354,443  >  59102 [ACK] Seq=11827 Ack=1377 Win=262400 Len=1300 [TCP segment of a reassembled PDU]
2114,321.86872200000005,52.113.194.133,192.168.43.215,TCP,1354,443  >  59102 [ACK] Seq=13127 Ack=1377 Win=262400 Len=1300 [TCP segment of a reassembled PDU]
2115,321.86875299999997,192.168.43.215,52.113.194.133,TCP,54,59102  >  443 [ACK] Seq=1377 Ack=14427 Win=66048 Len=0
2116,321.86879799999997,52.113.194.133,192.168.43.215,TCP,1354,443  >  59102 [ACK] Seq=14427 Ack=1377 Win=262400 Len=1300 [TCP segment of a reassembled PDU]
2117,321.86974,52.113.194.133,192.168.43.215,TLSv1.2,336,Application Data
2118,321.869824,192.168.43.215,52.113.194.133,TCP,54,59102  >  443 [ACK] Seq=1377 Ack=16009 Win=66048 Len=0
2119,321.869896,52.113.194.133,192.168.43.215,TCP,1354,443  >  59102 [ACK] Seq=16009 Ack=1377 Win=262400 Len=1300 [TCP segment of a reassembled PDU]
2120,321.869937,52.113.194.133,192.168.43.215,TLSv1.2,823,Application Data
2121,321.86997,192.168.43.215,52.113.194.133,TCP,54,59102  >  443 [ACK] Seq=1377 Ack=18078 Win=66048 Len=0
2122,321.870018,52.113.194.133,192.168.43.215,TLSv1.2,92,Application Data
2123,321.896514,192.168.43.215,52.113.194.133,TCP,54,59102  >  443 [ACK] Seq=1377 Ack=18116 Win=66048 Len=0
2124,327.56561899999997,192.168.43.215,52.113.194.133,TLSv1.2,194,Application Data
2125,327.622863,52.113.194.133,192.168.43.215,TCP,54,443  >  59102 [ACK] Seq=18116 Ack=1517 Win=262400 Len=0
2126,327.643349,52.113.194.133,192.168.43.215,TCP,1354,443  >  59102 [ACK] Seq=18116 Ack=1517 Win=262400 Len=1300 [TCP segment of a reassembled PDU]
2127,327.643418,52.113.194.133,192.168.43.215,TLSv1.2,337,Application Data
2128,327.64345,192.168.43.215,52.113.194.133,TCP,54,59102  >  443 [ACK] Seq=1517 Ack=19699 Win=66048 Len=0
2129,327.643735,52.113.194.133,192.168.43.215,TCP,1354,443  >  59102 [ACK] Seq=19699 Ack=1517 Win=262400 Len=1300 [TCP segment of a reassembled PDU]
2130,327.644075,52.113.194.133,192.168.43.215,TCP,1354,443  >  59102 [ACK] Seq=20999 Ack=1517 Win=262400 Len=1300 [TCP segment of a reassembled PDU]
2131,327.644117,192.168.43.215,52.113.194.133,TCP,54,59102  >  443 [ACK] Seq=1517 Ack=22299 Win=66048 Len=0
2132,327.644171,52.113.194.133,192.168.43.215,TCP,1354,443  >  59102 [ACK] Seq=22299 Ack=1517 Win=262400 Len=1300 [TCP segment of a reassembled PDU]
2133,327.644222,52.113.194.133,192.168.43.215,TCP,1354,443  >  59102 [ACK] Seq=23599 Ack=1517 Win=262400 Len=1300 [TCP segment of a reassembled PDU]
2134,327.644246,192.168.43.215,52.113.194.133,TCP,54,59102  >  443 [ACK] Seq=1517 Ack=24899 Win=66048 Len=0
2135,327.64545699999996,52.113.194.133,192.168.43.215,TCP,1354,443  >  59102 [ACK] Seq=24899 Ack=1517 Win=262400 Len=1300 [TCP segment of a reassembled PDU]
2136,327.64551,52.113.194.133,192.168.43.215,TCP,1354,443  >  59102 [ACK] Seq=26199 Ack=1517 Win=262400 Len=1300 [TCP segment of a reassembled PDU]
2137,327.645542,192.168.43.215,52.113.194.133,TCP,54,59102  >  443 [ACK] Seq=1517 Ack=27499 Win=66048 Len=0
2138,327.64559199999997,52.113.194.133,192.168.43.215,TLSv1.2,484,Application Data
2139,327.646369,52.113.194.133,192.168.43.215,TCP,1354,443  >  59102 [ACK] Seq=27929 Ack=1517 Win=262400 Len=1300 [TCP segment of a reassembled PDU]
2140,327.64649,192.168.43.215,52.113.194.133,TCP,54,59102  >  443 [ACK] Seq=1517 Ack=29229 Win=66048 Len=0
2141,327.646575,52.113.194.133,192.168.43.215,TCP,1354,443  >  59102 [ACK] Seq=29229 Ack=1517 Win=262400 Len=1300 [TCP segment of a reassembled PDU]
2142,327.64660699999996,52.113.194.133,192.168.43.215,TCP,1354,443  >  59102 [ACK] Seq=30529 Ack=1517 Win=262400 Len=1300 [TCP segment of a reassembled PDU]
2143,327.64662999999996,192.168.43.215,52.113.194.133,TCP,54,59102  >  443 [ACK] Seq=1517 Ack=31829 Win=66048 Len=0
2144,327.646696,52.113.194.133,192.168.43.215,TLSv1.2,343,Application Data
2145,327.648376,52.113.194.133,192.168.43.215,TCP,1354,443  >  59102 [ACK] Seq=32118 Ack=1517 Win=262400 Len=1300 [TCP segment of a reassembled PDU]
2146,327.648498,192.168.43.215,52.113.194.133,TCP,54,59102  >  443 [ACK] Seq=1517 Ack=33418 Win=66048 Len=0
2147,327.64858599999997,52.113.194.133,192.168.43.215,TLSv1.2,823,Application Data
2148,327.648619,52.113.194.133,192.168.43.215,TLSv1.2,92,Application Data
2149,327.64864700000004,192.168.43.215,52.113.194.133,TCP,54,59102  >  443 [ACK] Seq=1517 Ack=34225 Win=65280 Len=0
2150,331.501312,192.168.43.215,52.113.194.133,TCP,54,"59102  >  443 [FIN, ACK] Seq=1517 Ack=34225 Win=65280 Len=0"
2151,331.58305099999995,52.113.194.133,192.168.43.215,TCP,54,443  >  59102 [ACK] Seq=34225 Ack=1518 Win=262400 Len=0
2152,331.583096,52.113.194.133,192.168.43.215,TCP,54,"443  >  59102 [FIN, ACK] Seq=34225 Ack=1518 Win=262400 Len=0"
2153,331.583162,192.168.43.215,52.113.194.133,TCP,54,59102  >  443 [ACK] Seq=1518 Ack=34226 Win=65280 Len=0
2154,335.435267,192.168.43.215,52.113.194.133,TCP,66,59342  >  443 [SYN] Seq=0 Win=8192 Len=0 MSS=1460 WS=256 SACK_PERM=1
2155,335.501889,52.113.194.133,192.168.43.215,TCP,66,"443  >  59342 [SYN, ACK] Seq=0 Ack=1 Win=65535 Len=0 MSS=1300 WS=256 SACK_PERM=1"
2156,335.502112,192.168.43.215,52.113.194.133,TCP,54,59342  >  443 [ACK] Seq=1 Ack=1 Win=66048 Len=0
2157,335.502932,192.168.43.215,52.113.194.133,TLSv1.2,620,Client Hello
2158,335.54672400000004,52.113.194.133,192.168.43.215,TCP,54,443  >  59342 [ACK] Seq=1 Ack=567 Win=524544 Len=0
2159,335.54681800000003,52.113.194.133,192.168.43.215,TLSv1.2,208,"Server Hello, Change Cipher Spec, Encrypted Handshake Message"
2160,335.550654,192.168.43.215,52.113.194.133,TLSv1.2,105,"Change Cipher Spec, Encrypted Handshake Message"
2161,335.551191,192.168.43.215,52.113.194.133,TLSv1.2,153,Application Data
2162,335.55245,192.168.43.215,52.113.194.133,TLSv1.2,647,Application Data
2163,335.613718,52.113.194.133,192.168.43.215,TCP,54,443  >  59342 [ACK] Seq=155 Ack=618 Win=524544 Len=0
2164,335.614037,52.113.194.133,192.168.43.215,TLSv1.2,123,Application Data
2165,335.615202,52.113.194.133,192.168.43.215,TCP,54,443  >  59342 [ACK] Seq=224 Ack=1310 Win=525056 Len=0
2166,335.61526200000003,192.168.43.215,52.113.194.133,TLSv1.2,92,Application Data
2167,335.661945,52.113.194.133,192.168.43.215,TLSv1.2,1354,Application Data
2168,335.66204700000003,192.168.43.215,52.113.194.133,TCP,54,59342  >  443 [ACK] Seq=1348 Ack=1524 Win=66048 Len=0
2169,335.66218599999996,52.113.194.133,192.168.43.215,TCP,1354,443  >  59342 [ACK] Seq=1524 Ack=1310 Win=525056 Len=1300 [TCP segment of a reassembled PDU]
2170,335.662225,192.168.43.215,52.113.194.133,TCP,54,59342  >  443 [ACK] Seq=1348 Ack=2824 Win=66048 Len=0
2171,335.66227599999996,52.113.194.133,192.168.43.215,TLSv1.2,819,Application Data
2172,335.66326499999997,52.113.194.133,192.168.43.215,TCP,1354,443  >  59342 [ACK] Seq=3589 Ack=1310 Win=525056 Len=1300 [TCP segment of a reassembled PDU]
2173,335.663346,192.168.43.215,52.113.194.133,TCP,54,59342  >  443 [ACK] Seq=1348 Ack=4889 Win=66048 Len=0
2174,335.663411,52.113.194.133,192.168.43.215,TCP,1354,443  >  59342 [ACK] Seq=4889 Ack=1310 Win=525056 Len=1300 [TCP segment of a reassembled PDU]
2175,335.663448,192.168.43.215,52.113.194.133,TCP,54,59342  >  443 [ACK] Seq=1348 Ack=6189 Win=66048 Len=0
2176,335.663504,52.113.194.133,192.168.43.215,TCP,1354,443  >  59342 [ACK] Seq=6189 Ack=1310 Win=525056 Len=1300 [TCP segment of a reassembled PDU]
2177,335.663543,192.168.43.215,52.113.194.133,TCP,54,59342  >  443 [ACK] Seq=1348 Ack=7489 Win=66048 Len=0
2178,335.663586,52.113.194.133,192.168.43.215,TCP,1354,443  >  59342 [ACK] Seq=7489 Ack=1310 Win=525056 Len=1300 [TCP segment of a reassembled PDU]
2179,335.663624,192.168.43.215,52.113.194.133,TCP,54,59342  >  443 [ACK] Seq=1348 Ack=8789 Win=66048 Len=0
2180,335.663671,52.113.194.133,192.168.43.215,TCP,1354,443  >  59342 [ACK] Seq=8789 Ack=1310 Win=525056 Len=1300 [TCP segment of a reassembled PDU]
2181,335.663704,192.168.43.215,52.113.194.133,TCP,54,59342  >  443 [ACK] Seq=1348 Ack=10089 Win=66048 Len=0
2182,335.664226,52.113.194.133,192.168.43.215,TCP,1354,443  >  59342 [ACK] Seq=10089 Ack=1310 Win=525056 Len=1300 [TCP segment of a reassembled PDU]
2183,335.664365,192.168.43.215,52.113.194.133,TCP,54,59342  >  443 [ACK] Seq=1348 Ack=11389 Win=66048 Len=0
2184,335.66447400000004,52.113.194.133,192.168.43.215,TLSv1.2,484,Application Data
2185,335.664523,192.168.43.215,52.113.194.133,TCP,54,59342  >  443 [ACK] Seq=1348 Ack=11819 Win=65792 Len=0
2186,335.664579,52.113.194.133,192.168.43.215,TCP,1354,443  >  59342 [ACK] Seq=11819 Ack=1310 Win=525056 Len=1300 [TCP segment of a reassembled PDU]
2187,335.66461499999997,192.168.43.215,52.113.194.133,TCP,54,59342  >  443 [ACK] Seq=1348 Ack=13119 Win=66048 Len=0
2188,335.66466,52.113.194.133,192.168.43.215,TCP,1354,443  >  59342 [ACK] Seq=13119 Ack=1310 Win=525056 Len=1300 [TCP segment of a reassembled PDU]
2189,335.66469,192.168.43.215,52.113.194.133,TCP,54,59342  >  443 [ACK] Seq=1348 Ack=14419 Win=66048 Len=0
2190,335.67425299999996,52.113.194.133,192.168.43.215,TCP,1354,443  >  59342 [ACK] Seq=14419 Ack=1310 Win=525056 Len=1300 [TCP segment of a reassembled PDU]
2191,335.67440899999997,192.168.43.215,52.113.194.133,TCP,54,59342  >  443 [ACK] Seq=1348 Ack=15719 Win=66048 Len=0
2192,335.674527,52.113.194.133,192.168.43.215,TLSv1.2,343,Application Data
2193,335.674559,192.168.43.215,52.113.194.133,TCP,54,59342  >  443 [ACK] Seq=1348 Ack=16008 Win=65792 Len=0
2194,335.67461000000003,52.113.194.133,192.168.43.215,TCP,1354,443  >  59342 [ACK] Seq=16008 Ack=1310 Win=525056 Len=1300 [TCP segment of a reassembled PDU]
2195,335.674646,192.168.43.215,52.113.194.133,TCP,54,59342  >  443 [ACK] Seq=1348 Ack=17308 Win=66048 Len=0
2196,335.675436,52.113.194.133,192.168.43.215,TCP,1354,443  >  59342 [ACK] Seq=17308 Ack=1310 Win=525056 Len=1300 [TCP segment of a reassembled PDU]
2197,335.675565,192.168.43.215,52.113.194.133,TCP,54,59342  >  443 [ACK] Seq=1348 Ack=18608 Win=66048 Len=0
2198,335.675679,52.113.194.133,192.168.43.215,TCP,1354,443  >  59342 [ACK] Seq=18608 Ack=1310 Win=525056 Len=1300 [TCP segment of a reassembled PDU]
2199,335.67572,192.168.43.215,52.113.194.133,TCP,54,59342  >  443 [ACK] Seq=1348 Ack=19908 Win=66048 Len=0
2200,335.675772,52.113.194.133,192.168.43.215,TCP,1354,443  >  59342 [ACK] Seq=19908 Ack=1348 Win=525056 Len=1300 [TCP segment of a reassembled PDU]
2201,335.675815,192.168.43.215,52.113.194.133,TCP,54,59342  >  443 [ACK] Seq=1348 Ack=21208 Win=66048 Len=0
2202,335.742215,52.113.194.133,192.168.43.215,TCP,1354,443  >  59342 [ACK] Seq=21208 Ack=1348 Win=525056 Len=1300 [TCP segment of a reassembled PDU]
2203,335.742387,52.113.194.133,192.168.43.215,TLSv1.2,221,"Application Data, Application Data"
2204,335.742438,192.168.43.215,52.113.194.133,TCP,54,59342  >  443 [ACK] Seq=1348 Ack=22675 Win=66048 Len=0
2205,341.503128,192.168.43.215,52.113.194.133,TCP,54,"59342  >  443 [FIN, ACK] Seq=1348 Ack=22675 Win=66048 Len=0"
2206,341.58255499999996,52.113.194.133,192.168.43.215,TCP,54,443  >  59342 [ACK] Seq=22675 Ack=1349 Win=525056 Len=0
2207,341.582915,52.113.194.133,192.168.43.215,TCP,54,"443  >  59342 [FIN, ACK] Seq=22675 Ack=1349 Win=525056 Len=0"
2208,341.58297000000005,192.168.43.215,52.113.194.133,TCP,54,59342  >  443 [ACK] Seq=1349 Ack=22676 Win=66048 Len=0
2209,347.210508,192.168.43.215,52.113.194.133,TCP,66,59443  >  443 [SYN] Seq=0 Win=8192 Len=0 MSS=1460 WS=256 SACK_PERM=1
2210,347.26140699999996,52.113.194.133,192.168.43.215,TCP,66,"443  >  59443 [SYN, ACK] Seq=0 Ack=1 Win=65535 Len=0 MSS=1300 WS=256 SACK_PERM=1"
2211,347.261578,192.168.43.215,52.113.194.133,TCP,54,59443  >  443 [ACK] Seq=1 Ack=1 Win=66048 Len=0
2212,347.262283,192.168.43.215,52.113.194.133,TLSv1.2,620,Client Hello
2213,347.316584,52.113.194.133,192.168.43.215,TCP,54,443  >  59443 [ACK] Seq=1 Ack=567 Win=524544 Len=0
2214,347.316686,52.113.194.133,192.168.43.215,TLSv1.2,208,"Server Hello, Change Cipher Spec, Encrypted Handshake Message"
2215,347.31982200000004,192.168.43.215,52.113.194.133,TLSv1.2,105,"Change Cipher Spec, Encrypted Handshake Message"
2216,347.320861,192.168.43.215,52.113.194.133,TLSv1.2,153,Application Data
2217,347.321818,192.168.43.215,52.113.194.133,TLSv1.2,669,Application Data
2218,347.36749,52.113.194.133,192.168.43.215,TCP,54,443  >  59443 [ACK] Seq=155 Ack=717 Win=524288 Len=0
2219,347.367536,52.113.194.133,192.168.43.215,TLSv1.2,123,Application Data
2220,347.367578,52.113.194.133,192.168.43.215,TLSv1.2,92,Application Data
2221,347.367623,192.168.43.215,52.113.194.133,TCP,54,59443  >  443 [ACK] Seq=1332 Ack=262 Win=65792 Len=0
2222,347.371356,192.168.43.215,52.113.194.133,TLSv1.2,92,Application Data
2223,347.425046,52.113.194.133,192.168.43.215,TCP,1354,443  >  59443 [ACK] Seq=262 Ack=1332 Win=525056 Len=1300 [TCP segment of a reassembled PDU]
2224,347.42517599999996,192.168.43.215,52.113.194.133,TCP,54,59443  >  443 [ACK] Seq=1370 Ack=1562 Win=66048 Len=0
2225,347.425275,52.113.194.133,192.168.43.215,TCP,1354,443  >  59443 [ACK] Seq=1562 Ack=1332 Win=525056 Len=1300 [TCP segment of a reassembled PDU]
2226,347.42531,192.168.43.215,52.113.194.133,TCP,54,59443  >  443 [ACK] Seq=1370 Ack=2862 Win=66048 Len=0
2227,347.42535499999997,52.113.194.133,192.168.43.215,TLSv1.2,781,Application Data
2228,347.425399,52.113.194.133,192.168.43.215,TCP,1354,443  >  59443 [ACK] Seq=3589 Ack=1332 Win=525056 Len=1300 [TCP segment of a reassembled PDU]
2229,347.42543,192.168.43.215,52.113.194.133,TCP,54,59443  >  443 [ACK] Seq=1370 Ack=4889 Win=66048 Len=0
2230,347.425475,52.113.194.133,192.168.43.215,TCP,1354,443  >  59443 [ACK] Seq=4889 Ack=1332 Win=525056 Len=1300 [TCP segment of a reassembled PDU]
2231,347.425506,192.168.43.215,52.113.194.133,TCP,54,59443  >  443 [ACK] Seq=1370 Ack=6189 Win=66048 Len=0
2232,347.425546,52.113.194.133,192.168.43.215,TCP,1354,443  >  59443 [ACK] Seq=6189 Ack=1332 Win=525056 Len=1300 [TCP segment of a reassembled PDU]
2233,347.425578,192.168.43.215,52.113.194.133,TCP,54,59443  >  443 [ACK] Seq=1370 Ack=7489 Win=66048 Len=0
2234,347.425633,52.113.194.133,192.168.43.215,TCP,1354,443  >  59443 [ACK] Seq=7489 Ack=1332 Win=525056 Len=1300 [TCP segment of a reassembled PDU]
2235,347.42566600000004,192.168.43.215,52.113.194.133,TCP,54,59443  >  443 [ACK] Seq=1370 Ack=8789 Win=66048 Len=0
2236,347.42571499999997,52.113.194.133,192.168.43.215,TCP,1354,443  >  59443 [ACK] Seq=8789 Ack=1332 Win=525056 Len=1300 [TCP segment of a reassembled PDU]
2237,347.425748,192.168.43.215,52.113.194.133,TCP,54,59443  >  443 [ACK] Seq=1370 Ack=10089 Win=66048 Len=0
2238,347.425798,52.113.194.133,192.168.43.215,TCP,1354,443  >  59443 [ACK] Seq=10089 Ack=1332 Win=525056 Len=1300 [TCP segment of a reassembled PDU]
2239,347.425831,192.168.43.215,52.113.194.133,TCP,54,59443  >  443 [ACK] Seq=1370 Ack=11389 Win=66048 Len=0
2240,347.425882,52.113.194.133,192.168.43.215,TLSv1.2,484,Application Data
2241,347.425918,192.168.43.215,52.113.194.133,TCP,54,59443  >  443 [ACK] Seq=1370 Ack=11819 Win=65792 Len=0
2242,347.425971,52.113.194.133,192.168.43.215,TCP,1354,443  >  59443 [ACK] Seq=11819 Ack=1332 Win=525056 Len=1300 [TCP segment of a reassembled PDU]
2243,347.426014,192.168.43.215,52.113.194.133,TCP,54,59443  >  443 [ACK] Seq=1370 Ack=13119 Win=66048 Len=0
2244,347.42606800000004,52.113.194.133,192.168.43.215,TCP,1354,443  >  59443 [ACK] Seq=13119 Ack=1332 Win=525056 Len=1300 [TCP segment of a reassembled PDU]
2245,347.426106,192.168.43.215,52.113.194.133,TCP,54,59443  >  443 [ACK] Seq=1370 Ack=14419 Win=66048 Len=0
2246,347.426356,52.113.194.133,192.168.43.215,TCP,1354,443  >  59443 [ACK] Seq=14419 Ack=1332 Win=525056 Len=1300 [TCP segment of a reassembled PDU]
2247,347.42647400000004,192.168.43.215,52.113.194.133,TCP,54,59443  >  443 [ACK] Seq=1370 Ack=15719 Win=66048 Len=0
2248,347.426567,52.113.194.133,192.168.43.215,TLSv1.2,343,Application Data
2249,347.426604,192.168.43.215,52.113.194.133,TCP,54,59443  >  443 [ACK] Seq=1370 Ack=16008 Win=65792 Len=0
2250,347.426659,52.113.194.133,192.168.43.215,TCP,1354,443  >  59443 [ACK] Seq=16008 Ack=1332 Win=525056 Len=1300 [TCP segment of a reassembled PDU]
2251,347.426692,192.168.43.215,52.113.194.133,TCP,54,59443  >  443 [ACK] Seq=1370 Ack=17308 Win=66048 Len=0
2252,347.426744,52.113.194.133,192.168.43.215,TLSv1.2,823,Application Data
2253,347.426779,192.168.43.215,52.113.194.133,TCP,54,59443  >  443 [ACK] Seq=1370 Ack=18077 Win=65280 Len=0
2254,347.426831,52.113.194.133,192.168.43.215,TLSv1.2,92,Application Data
2255,347.426868,52.113.194.133,192.168.43.215,TCP,54,443  >  59443 [ACK] Seq=18115 Ack=1370 Win=525056 Len=0
2256,347.448926,192.168.43.215,52.113.194.133,TCP,54,59443  >  443 [ACK] Seq=1370 Ack=18115 Win=65280 Len=0
2257,351.505751,192.168.43.215,52.113.194.133,TCP,54,"59443  >  443 [FIN, ACK] Seq=1370 Ack=18115 Win=65280 Len=0"
2258,351.582813,52.113.194.133,192.168.43.215,TCP,54,443  >  59443 [ACK] Seq=18115 Ack=1371 Win=525056 Len=0
2259,351.58285,52.113.194.133,192.168.43.215,TCP,54,"443  >  59443 [FIN, ACK] Seq=18115 Ack=1371 Win=525056 Len=0"
2260,351.582901,192.168.43.215,52.113.194.133,TCP,54,59443  >  443 [ACK] Seq=1371 Ack=18116 Win=65280 Len=0
2261,351.726558,192.168.43.215,52.113.194.133,TCP,66,59518  >  443 [SYN] Seq=0 Win=8192 Len=0 MSS=1460 WS=256 SACK_PERM=1
2262,351.781226,52.113.194.133,192.168.43.215,TCP,66,"443  >  59518 [SYN, ACK] Seq=0 Ack=1 Win=65535 Len=0 MSS=1300 WS=256 SACK_PERM=1"
2263,351.78142599999995,192.168.43.215,52.113.194.133,TCP,54,59518  >  443 [ACK] Seq=1 Ack=1 Win=66048 Len=0
2264,351.782042,192.168.43.215,52.113.194.133,TLSv1.2,620,Client Hello
2265,351.843061,52.113.194.133,192.168.43.215,TCP,54,443  >  59518 [ACK] Seq=1 Ack=567 Win=261888 Len=0
2266,351.843156,52.113.194.133,192.168.43.215,TLSv1.2,208,"Server Hello, Change Cipher Spec, Encrypted Handshake Message"
2267,351.84561,192.168.43.215,52.113.194.133,TLSv1.2,105,"Change Cipher Spec, Encrypted Handshake Message"
2268,351.84617099999997,192.168.43.215,52.113.194.133,TLSv1.2,153,Application Data
2269,351.84701,192.168.43.215,52.113.194.133,TLSv1.2,678,Application Data
2270,351.90222400000005,52.113.194.133,192.168.43.215,TCP,54,443  >  59518 [ACK] Seq=155 Ack=618 Win=261888 Len=0
2271,351.902353,52.113.194.133,192.168.43.215,TLSv1.2,123,Application Data
2272,351.90241000000003,52.113.194.133,192.168.43.215,TCP,54,443  >  59518 [ACK] Seq=224 Ack=1341 Win=262400 Len=0
2273,351.902874,192.168.43.215,52.113.194.133,TLSv1.2,92,Application Data
2274,351.963119,52.113.194.133,192.168.43.215,TLSv1.2,92,Application Data
2275,351.98314,192.168.43.215,52.113.194.133,TCP,54,59518  >  443 [ACK] Seq=1379 Ack=262 Win=65792 Len=0
2276,352.05105499999996,52.113.194.133,192.168.43.215,TCP,1354,443  >  59518 [ACK] Seq=262 Ack=1379 Win=262400 Len=1300 [TCP segment of a reassembled PDU]
2277,352.05134100000004,52.113.194.133,192.168.43.215,TCP,1354,443  >  59518 [ACK] Seq=1562 Ack=1379 Win=262400 Len=1300 [TCP segment of a reassembled PDU]
2278,352.051442,192.168.43.215,52.113.194.133,TCP,54,59518  >  443 [ACK] Seq=1379 Ack=2862 Win=66048 Len=0
2279,352.051515,52.113.194.133,192.168.43.215,TLSv1.2,788,Application Data
2280,352.052908,52.113.194.133,192.168.43.215,TCP,1354,443  >  59518 [ACK] Seq=3596 Ack=1379 Win=262400 Len=1300 [TCP segment of a reassembled PDU]
2281,352.052978,192.168.43.215,52.113.194.133,TCP,54,59518  >  443 [ACK] Seq=1379 Ack=4896 Win=66048 Len=0
2282,352.053109,52.113.194.133,192.168.43.215,TCP,1354,443  >  59518 [ACK] Seq=4896 Ack=1379 Win=262400 Len=1300 [TCP segment of a reassembled PDU]
2283,352.054423,52.113.194.133,192.168.43.215,TCP,1354,443  >  59518 [ACK] Seq=6196 Ack=1379 Win=262400 Len=1300 [TCP segment of a reassembled PDU]
2284,352.054508,192.168.43.215,52.113.194.133,TCP,54,59518  >  443 [ACK] Seq=1379 Ack=7496 Win=66048 Len=0
2285,352.05489900000003,52.113.194.133,192.168.43.215,TCP,1354,443  >  59518 [ACK] Seq=7496 Ack=1379 Win=262400 Len=1300 [TCP segment of a reassembled PDU]
2286,352.05526000000003,52.113.194.133,192.168.43.215,TCP,1354,443  >  59518 [ACK] Seq=8796 Ack=1379 Win=262400 Len=1300 [TCP segment of a reassembled PDU]
2287,352.055312,192.168.43.215,52.113.194.133,TCP,54,59518  >  443 [ACK] Seq=1379 Ack=10096 Win=66048 Len=0
2288,352.055414,52.113.194.133,192.168.43.215,TCP,1354,443  >  59518 [ACK] Seq=10096 Ack=1379 Win=262400 Len=1300 [TCP segment of a reassembled PDU]
2289,352.055769,52.113.194.133,192.168.43.215,TLSv1.2,484,Application Data
2290,352.055829,192.168.43.215,52.113.194.133,TCP,54,59518  >  443 [ACK] Seq=1379 Ack=11826 Win=66048 Len=0
2291,352.05659199999997,52.113.194.133,192.168.43.215,TCP,1354,443  >  59518 [ACK] Seq=11826 Ack=1379 Win=262400 Len=1300 [TCP segment of a reassembled PDU]
2292,352.057032,52.113.194.133,192.168.43.215,TCP,1354,443  >  59518 [ACK] Seq=13126 Ack=1379 Win=262400 Len=1300 [TCP segment of a reassembled PDU]
2293,352.057095,192.168.43.215,52.113.194.133,TCP,54,59518  >  443 [ACK] Seq=1379 Ack=14426 Win=66048 Len=0
2294,352.059575,52.113.194.133,192.168.43.215,TCP,1354,443  >  59518 [ACK] Seq=14426 Ack=1379 Win=262400 Len=1300 [TCP segment of a reassembled PDU]
2295,352.059702,52.113.194.133,192.168.43.215,TLSv1.2,336,Application Data
2296,352.059759,192.168.43.215,52.113.194.133,TCP,54,59518  >  443 [ACK] Seq=1379 Ack=16008 Win=66048 Len=0
2297,352.059846,52.113.194.133,192.168.43.215,TCP,1354,443  >  59518 [ACK] Seq=16008 Ack=1379 Win=262400 Len=1300 [TCP segment of a reassembled PDU]
2298,352.059886,52.113.194.133,192.168.43.215,TLSv1.2,820,Application Data
2299,352.059917,192.168.43.215,52.113.194.133,TCP,54,59518  >  443 [ACK] Seq=1379 Ack=18074 Win=66048 Len=0
2300,352.059954,52.113.194.133,192.168.43.215,TLSv1.2,92,Application Data
2301,352.071394,192.168.43.215,52.113.194.133,TCP,54,59518  >  443 [ACK] Seq=1379 Ack=18112 Win=66048 Len=0
2302,358.26317,192.168.43.215,52.113.194.133,TLSv1.2,221,Application Data
2303,358.34155699999997,52.113.194.133,192.168.43.215,TCP,54,443  >  59518 [ACK] Seq=18112 Ack=1546 Win=262144 Len=0
2304,358.343455,52.113.194.133,192.168.43.215,TCP,1354,443  >  59518 [ACK] Seq=18112 Ack=1546 Win=262144 Len=1300 [TCP segment of a reassembled PDU]
2305,358.34358399999996,52.113.194.133,192.168.43.215,TLSv1.2,336,Application Data
2306,358.343639,192.168.43.215,52.113.194.133,TCP,54,59518  >  443 [ACK] Seq=1546 Ack=19694 Win=66048 Len=0
2307,358.343756,52.113.194.133,192.168.43.215,TCP,1354,443  >  59518 [ACK] Seq=19694 Ack=1546 Win=262144 Len=1300 [TCP segment of a reassembled PDU]
2308,358.344052,52.113.194.133,192.168.43.215,TCP,1354,443  >  59518 [ACK] Seq=20994 Ack=1546 Win=262144 Len=1300 [TCP segment of a reassembled PDU]
2309,358.344162,192.168.43.215,52.113.194.133,TCP,54,59518  >  443 [ACK] Seq=1546 Ack=22294 Win=66048 Len=0
2310,358.345978,52.113.194.133,192.168.43.215,TCP,1354,443  >  59518 [ACK] Seq=22294 Ack=1546 Win=262144 Len=1300 [TCP segment of a reassembled PDU]
2311,358.34608199999997,52.113.194.133,192.168.43.215,TCP,1354,443  >  59518 [ACK] Seq=23594 Ack=1546 Win=262144 Len=1300 [TCP segment of a reassembled PDU]
2312,358.346131,192.168.43.215,52.113.194.133,TCP,54,59518  >  443 [ACK] Seq=1546 Ack=24894 Win=66048 Len=0
2313,358.346184,52.113.194.133,192.168.43.215,TCP,1354,443  >  59518 [ACK] Seq=24894 Ack=1546 Win=262144 Len=1300 [TCP segment of a reassembled PDU]
2314,358.34621699999997,52.113.194.133,192.168.43.215,TCP,1354,443  >  59518 [ACK] Seq=26194 Ack=1546 Win=262144 Len=1300 [TCP segment of a reassembled PDU]
2315,358.34623999999997,192.168.43.215,52.113.194.133,TCP,54,59518  >  443 [ACK] Seq=1546 Ack=27494 Win=66048 Len=0
2316,358.346287,52.113.194.133,192.168.43.215,TLSv1.2,484,Application Data
2317,358.346323,52.113.194.133,192.168.43.215,TCP,1354,443  >  59518 [ACK] Seq=27924 Ack=1546 Win=262144 Len=1300 [TCP segment of a reassembled PDU]
2318,358.346356,192.168.43.215,52.113.194.133,TCP,54,59518  >  443 [ACK] Seq=1546 Ack=29224 Win=66048 Len=0
2319,358.34641,52.113.194.133,192.168.43.215,TCP,1354,443  >  59518 [ACK] Seq=29224 Ack=1546 Win=262144 Len=1300 [TCP segment of a reassembled PDU]
2320,358.346451,52.113.194.133,192.168.43.215,TCP,1354,443  >  59518 [ACK] Seq=30524 Ack=1546 Win=262144 Len=1300 [TCP segment of a reassembled PDU]
2321,358.34648300000003,192.168.43.215,52.113.194.133,TCP,54,59518  >  443 [ACK] Seq=1546 Ack=31824 Win=66048 Len=0
2322,358.346528,52.113.194.133,192.168.43.215,TLSv1.2,343,Application Data
2323,358.34747999999996,52.113.194.133,192.168.43.215,TCP,1354,443  >  59518 [ACK] Seq=32113 Ack=1546 Win=262144 Len=1300 [TCP segment of a reassembled PDU]
2324,358.34756600000003,192.168.43.215,52.113.194.133,TCP,54,59518  >  443 [ACK] Seq=1546 Ack=33413 Win=66048 Len=0
2325,358.34763399999997,52.113.194.133,192.168.43.215,TLSv1.2,820,Application Data
2326,358.34767200000005,52.113.194.133,192.168.43.215,TLSv1.2,92,Application Data
2327,358.347706,192.168.43.215,52.113.194.133,TCP,54,59518  >  443 [ACK] Seq=1546 Ack=34217 Win=65280 Len=0
2328,361.512387,192.168.43.215,52.113.194.133,TCP,54,"59518  >  443 [FIN, ACK] Seq=1546 Ack=34217 Win=65280 Len=0"
2329,361.566877,52.113.194.133,192.168.43.215,TCP,54,443  >  59518 [ACK] Seq=34217 Ack=1547 Win=262144 Len=0
2330,361.567043,52.113.194.133,192.168.43.215,TCP,54,"443  >  59518 [FIN, ACK] Seq=34217 Ack=1547 Win=262144 Len=0"
2331,361.567103,192.168.43.215,52.113.194.133,TCP,54,59518  >  443 [ACK] Seq=1547 Ack=34218 Win=65280 Len=0
2332,362.33033900000004,192.168.43.215,52.113.194.133,TCP,66,59666  >  443 [SYN] Seq=0 Win=8192 Len=0 MSS=1460 WS=256 SACK_PERM=1
2333,362.421621,52.113.194.133,192.168.43.215,TCP,66,"443  >  59666 [SYN, ACK] Seq=0 Ack=1 Win=65535 Len=0 MSS=1300 WS=256 SACK_PERM=1"
2334,362.421869,192.168.43.215,52.113.194.133,TCP,54,59666  >  443 [ACK] Seq=1 Ack=1 Win=66048 Len=0
2335,362.422756,192.168.43.215,52.113.194.133,TLSv1.2,620,Client Hello
2336,362.46613199999996,52.113.194.133,192.168.43.215,TCP,54,443  >  59666 [ACK] Seq=1 Ack=567 Win=261888 Len=0
2337,362.466228,52.113.194.133,192.168.43.215,TLSv1.2,208,"Server Hello, Change Cipher Spec, Encrypted Handshake Message"
2338,362.468912,192.168.43.215,52.113.194.133,TLSv1.2,105,"Change Cipher Spec, Encrypted Handshake Message"
2339,362.469276,192.168.43.215,52.113.194.133,TLSv1.2,153,Application Data
2340,362.47026,192.168.43.215,52.113.194.133,TLSv1.2,685,Application Data
2341,362.50802999999996,52.113.194.133,192.168.43.215,TCP,54,443  >  59666 [ACK] Seq=155 Ack=618 Win=261888 Len=0
2342,362.508282,52.113.194.133,192.168.43.215,TLSv1.2,123,Application Data
2343,362.508552,192.168.43.215,52.113.194.133,TLSv1.2,92,Application Data
2344,362.517177,52.113.194.133,192.168.43.215,TCP,54,443  >  59666 [ACK] Seq=224 Ack=717 Win=261632 Len=0
2345,362.518838,52.113.194.133,192.168.43.215,TLSv1.2,92,Application Data
2346,362.549243,192.168.43.215,52.113.194.133,TCP,54,59666  >  443 [ACK] Seq=1386 Ack=262 Win=65792 Len=0
2347,362.577224,52.113.194.133,192.168.43.215,TCP,54,443  >  59666 [ACK] Seq=262 Ack=1386 Win=262400 Len=0
2348,362.661927,52.113.194.133,192.168.43.215,TCP,1354,443  >  59666 [ACK] Seq=262 Ack=1386 Win=262400 Len=1300 [TCP segment of a reassembled PDU]
2349,362.662263,52.113.194.133,192.168.43.215,TCP,1354,443  >  59666 [ACK] Seq=1562 Ack=1386 Win=262400 Len=1300 [TCP segment of a reassembled PDU]
2350,362.66231400000004,192.168.43.215,52.113.194.133,TCP,54,59666  >  443 [ACK] Seq=1386 Ack=2862 Win=66048 Len=0
2351,362.662374,52.113.194.133,192.168.43.215,TLSv1.2,788,Application Data
2352,362.662456,52.113.194.133,192.168.43.215,TCP,1354,443  >  59666 [ACK] Seq=3596 Ack=1386 Win=262400 Len=1300 [TCP segment of a reassembled PDU]
2353,362.66247999999996,192.168.43.215,52.113.194.133,TCP,54,59666  >  443 [ACK] Seq=1386 Ack=4896 Win=66048 Len=0
2354,362.662554,52.113.194.133,192.168.43.215,TCP,1354,443  >  59666 [ACK] Seq=4896 Ack=1386 Win=262400 Len=1300 [TCP segment of a reassembled PDU]
2355,362.662799,52.113.194.133,192.168.43.215,TCP,1354,443  >  59666 [ACK] Seq=6196 Ack=1386 Win=262400 Len=1300 [TCP segment of a reassembled PDU]
2356,362.662821,192.168.43.215,52.113.194.133,TCP,54,59666  >  443 [ACK] Seq=1386 Ack=7496 Win=66048 Len=0
2357,362.66315,52.113.194.133,192.168.43.215,TCP,1354,443  >  59666 [ACK] Seq=7496 Ack=1386 Win=262400 Len=1300 [TCP segment of a reassembled PDU]
2358,362.663514,52.113.194.133,192.168.43.215,TCP,1354,443  >  59666 [ACK] Seq=8796 Ack=1386 Win=262400 Len=1300 [TCP segment of a reassembled PDU]
2359,362.663552,192.168.43.215,52.113.194.133,TCP,54,59666  >  443 [ACK] Seq=1386 Ack=10096 Win=66048 Len=0
2360,362.663627,52.113.194.133,192.168.43.215,TCP,1354,443  >  59666 [ACK] Seq=10096 Ack=1386 Win=262400 Len=1300 [TCP segment of a reassembled PDU]
2361,362.664359,52.113.194.133,192.168.43.215,TLSv1.2,484,Application Data
2362,362.66441000000003,192.168.43.215,52.113.194.133,TCP,54,59666  >  443 [ACK] Seq=1386 Ack=11826 Win=66048 Len=0
2363,362.66445899999997,52.113.194.133,192.168.43.215,TCP,1354,443  >  59666 [ACK] Seq=11826 Ack=1386 Win=262400 Len=1300 [TCP segment of a reassembled PDU]
2364,362.667817,52.113.194.133,192.168.43.215,TCP,1354,443  >  59666 [ACK] Seq=13126 Ack=1386 Win=262400 Len=1300 [TCP segment of a reassembled PDU]
2365,362.66795099999996,192.168.43.215,52.113.194.133,TCP,54,59666  >  443 [ACK] Seq=1386 Ack=14426 Win=66048 Len=0
2366,362.676739,52.113.194.133,192.168.43.215,TCP,1354,443  >  59666 [ACK] Seq=14426 Ack=1386 Win=262400 Len=1300 [TCP segment of a reassembled PDU]
2367,362.676868,52.113.194.133,192.168.43.215,TLSv1.2,336,Application Data
2368,362.676921,192.168.43.215,52.113.194.133,TCP,54,59666  >  443 [ACK] Seq=1386 Ack=16008 Win=66048 Len=0
2369,362.677004,52.113.194.133,192.168.43.215,TCP,1354,443  >  59666 [ACK] Seq=16008 Ack=1386 Win=262400 Len=1300 [TCP segment of a reassembled PDU]
2370,362.67704,52.113.194.133,192.168.43.215,TLSv1.2,820,Application Data
2371,362.67706499999997,192.168.43.215,52.113.194.133,TCP,54,59666  >  443 [ACK] Seq=1386 Ack=18074 Win=66048 Len=0
2372,362.677104,52.113.194.133,192.168.43.215,TLSv1.2,92,Application Data
2373,362.701498,192.168.43.215,52.113.194.133,TCP,54,59666  >  443 [ACK] Seq=1386 Ack=18112 Win=66048 Len=0
2374,371.509453,192.168.43.215,52.113.194.133,TCP,54,"59666  >  443 [FIN, ACK] Seq=1386 Ack=18112 Win=66048 Len=0"
2375,371.581499,52.113.194.133,192.168.43.215,TCP,54,443  >  59666 [ACK] Seq=18112 Ack=1387 Win=262400 Len=0
2376,371.582161,52.113.194.133,192.168.43.215,TCP,54,"443  >  59666 [FIN, ACK] Seq=18112 Ack=1387 Win=262400 Len=0"
2377,371.58223300000003,192.168.43.215,52.113.194.133,TCP,54,59666  >  443 [ACK] Seq=1387 Ack=18113 Win=66048 Len=0
2378,373.483112,192.168.43.215,52.113.194.133,TCP,66,59773  >  443 [SYN] Seq=0 Win=8192 Len=0 MSS=1460 WS=256 SACK_PERM=1
2379,373.545672,52.113.194.133,192.168.43.215,TCP,66,"443  >  59773 [SYN, ACK] Seq=0 Ack=1 Win=65535 Len=0 MSS=1300 WS=256 SACK_PERM=1"
2380,373.545858,192.168.43.215,52.113.194.133,TCP,54,59773  >  443 [ACK] Seq=1 Ack=1 Win=66048 Len=0
2381,373.546564,192.168.43.215,52.113.194.133,TLSv1.2,620,Client Hello
2382,373.602389,52.113.194.133,192.168.43.215,TCP,54,443  >  59773 [ACK] Seq=1 Ack=567 Win=524544 Len=0
2383,373.602581,52.113.194.133,192.168.43.215,TLSv1.2,208,"Server Hello, Change Cipher Spec, Encrypted Handshake Message"
2384,373.605981,192.168.43.215,52.113.194.133,TLSv1.2,105,"Change Cipher Spec, Encrypted Handshake Message"
2385,373.606687,192.168.43.215,52.113.194.133,TLSv1.2,153,Application Data
2386,373.608077,192.168.43.215,52.113.194.133,TLSv1.2,684,Application Data
2387,373.66266,52.113.194.133,192.168.43.215,TCP,54,443  >  59773 [ACK] Seq=155 Ack=618 Win=524544 Len=0
2388,373.662704,52.113.194.133,192.168.43.215,TLSv1.2,123,Application Data
2389,373.66274300000003,52.113.194.133,192.168.43.215,TCP,54,443  >  59773 [ACK] Seq=224 Ack=1347 Win=525056 Len=0
2390,373.670927,192.168.43.215,52.113.194.133,TLSv1.2,92,Application Data
2391,373.691669,52.113.194.133,192.168.43.215,TLSv1.2,1354,Application Data
2392,373.691797,192.168.43.215,52.113.194.133,TCP,54,59773  >  443 [ACK] Seq=1385 Ack=1524 Win=66048 Len=0
2393,373.69208599999996,52.113.194.133,192.168.43.215,TCP,1354,443  >  59773 [ACK] Seq=1524 Ack=1347 Win=525056 Len=1300 [TCP segment of a reassembled PDU]
2394,373.692126,192.168.43.215,52.113.194.133,TCP,54,59773  >  443 [ACK] Seq=1385 Ack=2824 Win=66048 Len=0
2395,373.692181,52.113.194.133,192.168.43.215,TLSv1.2,820,Application Data
2396,373.692222,52.113.194.133,192.168.43.215,TCP,1354,443  >  59773 [ACK] Seq=3590 Ack=1347 Win=525056 Len=1300 [TCP segment of a reassembled PDU]
2397,373.692256,192.168.43.215,52.113.194.133,TCP,54,59773  >  443 [ACK] Seq=1385 Ack=4890 Win=66048 Len=0
2398,373.69237200000003,52.113.194.133,192.168.43.215,TCP,1354,443  >  59773 [ACK] Seq=4890 Ack=1347 Win=525056 Len=1300 [TCP segment of a reassembled PDU]
2399,373.692408,192.168.43.215,52.113.194.133,TCP,54,59773  >  443 [ACK] Seq=1385 Ack=6190 Win=66048 Len=0
2400,373.692453,52.113.194.133,192.168.43.215,TCP,1354,443  >  59773 [ACK] Seq=6190 Ack=1347 Win=525056 Len=1300 [TCP segment of a reassembled PDU]
2401,373.692481,192.168.43.215,52.113.194.133,TCP,54,59773  >  443 [ACK] Seq=1385 Ack=7490 Win=66048 Len=0
2402,373.692579,52.113.194.133,192.168.43.215,TCP,1354,443  >  59773 [ACK] Seq=7490 Ack=1347 Win=525056 Len=1300 [TCP segment of a reassembled PDU]
2403,373.692616,192.168.43.215,52.113.194.133,TCP,54,59773  >  443 [ACK] Seq=1385 Ack=8790 Win=66048 Len=0
2404,373.693033,52.113.194.133,192.168.43.215,TCP,1354,443  >  59773 [ACK] Seq=8790 Ack=1347 Win=525056 Len=1300 [TCP segment of a reassembled PDU]
2405,373.693167,192.168.43.215,52.113.194.133,TCP,54,59773  >  443 [ACK] Seq=1385 Ack=10090 Win=66048 Len=0
2406,373.693267,52.113.194.133,192.168.43.215,TCP,1354,443  >  59773 [ACK] Seq=10090 Ack=1347 Win=525056 Len=1300 [TCP segment of a reassembled PDU]
2407,373.693302,192.168.43.215,52.113.194.133,TCP,54,59773  >  443 [ACK] Seq=1385 Ack=11390 Win=66048 Len=0
2408,373.693588,52.113.194.133,192.168.43.215,TLSv1.2,484,Application Data
2409,373.693648,192.168.43.215,52.113.194.133,TCP,54,59773  >  443 [ACK] Seq=1385 Ack=11820 Win=65792 Len=0
2410,373.69371,52.113.194.133,192.168.43.215,TCP,1354,443  >  59773 [ACK] Seq=11820 Ack=1347 Win=525056 Len=1300 [TCP segment of a reassembled PDU]
2411,373.693749,192.168.43.215,52.113.194.133,TCP,54,59773  >  443 [ACK] Seq=1385 Ack=13120 Win=66048 Len=0
2412,373.693875,52.113.194.133,192.168.43.215,TCP,1354,443  >  59773 [ACK] Seq=13120 Ack=1347 Win=525056 Len=1300 [TCP segment of a reassembled PDU]
2413,373.693913,192.168.43.215,52.113.194.133,TCP,54,59773  >  443 [ACK] Seq=1385 Ack=14420 Win=66048 Len=0
2414,373.69532000000004,52.113.194.133,192.168.43.215,TCP,1354,443  >  59773 [ACK] Seq=14420 Ack=1347 Win=525056 Len=1300 [TCP segment of a reassembled PDU]
2415,373.69541499999997,192.168.43.215,52.113.194.133,TCP,54,59773  >  443 [ACK] Seq=1385 Ack=15720 Win=66048 Len=0
2416,373.695494,52.113.194.133,192.168.43.215,TLSv1.2,343,Application Data
2417,373.695542,192.168.43.215,52.113.194.133,TCP,54,59773  >  443 [ACK] Seq=1385 Ack=16009 Win=65792 Len=0
2418,373.695592,52.113.194.133,192.168.43.215,TCP,1354,443  >  59773 [ACK] Seq=16009 Ack=1347 Win=525056 Len=1300 [TCP segment of a reassembled PDU]
2419,373.695625,192.168.43.215,52.113.194.133,TCP,54,59773  >  443 [ACK] Seq=1385 Ack=17309 Win=66048 Len=0
2420,373.696341,52.113.194.133,192.168.43.215,TLSv1.2,823,Application Data
2421,373.696479,192.168.43.215,52.113.194.133,TCP,54,59773  >  443 [ACK] Seq=1385 Ack=18078 Win=65280 Len=0
2422,373.696579,52.113.194.133,192.168.43.215,TLSv1.2,92,Application Data
2423,373.71735099999995,192.168.43.215,52.113.194.133,TCP,54,59773  >  443 [ACK] Seq=1385 Ack=18116 Win=65280 Len=0
2424,373.721177,52.113.194.133,192.168.43.215,TCP,54,443  >  59773 [ACK] Seq=18116 Ack=1385 Win=525056 Len=0
2425,381.510019,192.168.43.215,52.113.194.133,TCP,54,"59773  >  443 [FIN, ACK] Seq=1385 Ack=18116 Win=65280 Len=0"
2426,381.582557,52.113.194.133,192.168.43.215,TCP,54,443  >  59773 [ACK] Seq=18116 Ack=1386 Win=525056 Len=0
2427,381.582603,52.113.194.133,192.168.43.215,TCP,54,"443  >  59773 [FIN, ACK] Seq=18116 Ack=1386 Win=525056 Len=0"
2428,381.582646,192.168.43.215,52.113.194.133,TCP,54,59773  >  443 [ACK] Seq=1386 Ack=18117 Win=65280 Len=0
2429,381.891467,192.168.43.215,52.113.194.133,TCP,66,59915  >  443 [SYN] Seq=0 Win=8192 Len=0 MSS=1460 WS=256 SACK_PERM=1
2430,381.940264,52.113.194.133,192.168.43.215,TCP,66,"443  >  59915 [SYN, ACK] Seq=0 Ack=1 Win=65535 Len=0 MSS=1300 WS=256 SACK_PERM=1"
2431,381.940424,192.168.43.215,52.113.194.133,TCP,54,59915  >  443 [ACK] Seq=1 Ack=1 Win=66048 Len=0
2432,381.94106,192.168.43.215,52.113.194.133,TLSv1.2,620,Client Hello
2433,381.985141,52.113.194.133,192.168.43.215,TCP,54,443  >  59915 [ACK] Seq=1 Ack=567 Win=261888 Len=0
2434,381.98546699999997,52.113.194.133,192.168.43.215,TLSv1.2,208,"Server Hello, Change Cipher Spec, Encrypted Handshake Message"
2435,381.988167,192.168.43.215,52.113.194.133,TLSv1.2,105,"Change Cipher Spec, Encrypted Handshake Message"
2436,381.988491,192.168.43.215,52.113.194.133,TLSv1.2,153,Application Data
2437,381.989012,192.168.43.215,52.113.194.133,TLSv1.2,647,Application Data
2438,382.034853,52.113.194.133,192.168.43.215,TCP,54,443  >  59915 [ACK] Seq=155 Ack=618 Win=261888 Len=0
2439,382.03494700000005,52.113.194.133,192.168.43.215,TLSv1.2,123,Application Data
2440,382.035004,52.113.194.133,192.168.43.215,TCP,54,443  >  59915 [ACK] Seq=224 Ack=717 Win=261632 Len=0
2441,382.035167,52.113.194.133,192.168.43.215,TCP,54,443  >  59915 [ACK] Seq=224 Ack=1310 Win=262400 Len=0
2442,382.035402,192.168.43.215,52.113.194.133,TLSv1.2,92,Application Data
2443,382.09522200000004,52.113.194.133,192.168.43.215,TLSv1.2,92,Application Data
2444,382.097736,52.113.194.133,192.168.43.215,TCP,1354,443  >  59915 [ACK] Seq=262 Ack=1348 Win=262400 Len=1300 [TCP segment of a reassembled PDU]
2445,382.097781,192.168.43.215,52.113.194.133,TCP,54,59915  >  443 [ACK] Seq=1348 Ack=1562 Win=66048 Len=0
2446,382.097817,52.113.194.133,192.168.43.215,TCP,1354,443  >  59915 [ACK] Seq=1562 Ack=1348 Win=262400 Len=1300 [TCP segment of a reassembled PDU]
2447,382.097844,52.113.194.133,192.168.43.215,TLSv1.2,781,Application Data
2448,382.097865,192.168.43.215,52.113.194.133,TCP,54,59915  >  443 [ACK] Seq=1348 Ack=3589 Win=66048 Len=0
2449,382.097898,52.113.194.133,192.168.43.215,TCP,1354,443  >  59915 [ACK] Seq=3589 Ack=1348 Win=262400 Len=1300 [TCP segment of a reassembled PDU]
2450,382.097939,52.113.194.133,192.168.43.215,TCP,1354,443  >  59915 [ACK] Seq=4889 Ack=1348 Win=262400 Len=1300 [TCP segment of a reassembled PDU]
2451,382.097961,192.168.43.215,52.113.194.133,TCP,54,59915  >  443 [ACK] Seq=1348 Ack=6189 Win=66048 Len=0
2452,382.097996,52.113.194.133,192.168.43.215,TCP,1354,443  >  59915 [ACK] Seq=6189 Ack=1348 Win=262400 Len=1300 [TCP segment of a reassembled PDU]
2453,382.098024,52.113.194.133,192.168.43.215,TCP,1354,443  >  59915 [ACK] Seq=7489 Ack=1348 Win=262400 Len=1300 [TCP segment of a reassembled PDU]
2454,382.098046,192.168.43.215,52.113.194.133,TCP,54,59915  >  443 [ACK] Seq=1348 Ack=8789 Win=66048 Len=0
2455,382.09808300000003,52.113.194.133,192.168.43.215,TCP,1354,443  >  59915 [ACK] Seq=8789 Ack=1348 Win=262400 Len=1300 [TCP segment of a reassembled PDU]
2456,382.098113,52.113.194.133,192.168.43.215,TCP,1354,443  >  59915 [ACK] Seq=10089 Ack=1348 Win=262400 Len=1300 [TCP segment of a reassembled PDU]
2457,382.098137,192.168.43.215,52.113.194.133,TCP,54,59915  >  443 [ACK] Seq=1348 Ack=11389 Win=66048 Len=0
2458,382.09817000000004,52.113.194.133,192.168.43.215,TLSv1.2,484,Application Data
2459,382.09828799999997,52.113.194.133,192.168.43.215,TCP,1354,443  >  59915 [ACK] Seq=11819 Ack=1348 Win=262400 Len=1300 [TCP segment of a reassembled PDU]
2460,382.098327,192.168.43.215,52.113.194.133,TCP,54,59915  >  443 [ACK] Seq=1348 Ack=13119 Win=66048 Len=0
2461,382.098371,52.113.194.133,192.168.43.215,TCP,1354,443  >  59915 [ACK] Seq=13119 Ack=1348 Win=262400 Len=1300 [TCP segment of a reassembled PDU]
2462,382.098429,52.113.194.133,192.168.43.215,TCP,1354,443  >  59915 [ACK] Seq=14419 Ack=1348 Win=262400 Len=1300 [TCP segment of a reassembled PDU]
2463,382.09846600000003,192.168.43.215,52.113.194.133,TCP,54,59915  >  443 [ACK] Seq=1348 Ack=15719 Win=66048 Len=0
2464,382.098514,52.113.194.133,192.168.43.215,TLSv1.2,343,Application Data
2465,382.099246,52.113.194.133,192.168.43.215,TCP,1354,443  >  59915 [ACK] Seq=16008 Ack=1348 Win=262400 Len=1300 [TCP segment of a reassembled PDU]
2466,382.09929500000004,192.168.43.215,52.113.194.133,TCP,54,59915  >  443 [ACK] Seq=1348 Ack=17308 Win=66048 Len=0
2467,382.099342,52.113.194.133,192.168.43.215,TCP,1354,443  >  59915 [ACK] Seq=17308 Ack=1348 Win=262400 Len=1300 [TCP segment of a reassembled PDU]
2468,382.099383,52.113.194.133,192.168.43.215,TCP,1354,443  >  59915 [ACK] Seq=18608 Ack=1348 Win=262400 Len=1300 [TCP segment of a reassembled PDU]
2469,382.09941200000003,192.168.43.215,52.113.194.133,TCP,54,59915  >  443 [ACK] Seq=1348 Ack=19908 Win=66048 Len=0
2470,382.099996,52.113.194.133,192.168.43.215,TCP,1354,443  >  59915 [ACK] Seq=19908 Ack=1348 Win=262400 Len=1300 [TCP segment of a reassembled PDU]
2471,382.118943,192.168.43.215,52.113.194.133,TCP,54,59915  >  443 [ACK] Seq=1348 Ack=21208 Win=66048 Len=0
2472,382.13883300000003,52.113.194.133,192.168.43.215,TCP,1354,443  >  59915 [ACK] Seq=21208 Ack=1348 Win=262400 Len=1300 [TCP segment of a reassembled PDU]
2473,382.138975,52.113.194.133,192.168.43.215,TLSv1.2,221,"Application Data, Application Data"
2474,382.139032,192.168.43.215,52.113.194.133,TCP,54,59915  >  443 [ACK] Seq=1348 Ack=22675 Win=66048 Len=0
2475,386.840359,192.168.43.215,52.113.194.133,TLSv1.2,224,Application Data
2476,386.900192,52.113.194.133,192.168.43.215,TCP,54,443  >  59915 [ACK] Seq=22675 Ack=1518 Win=262144 Len=0
2477,386.93169,52.113.194.133,192.168.43.215,TCP,1354,443  >  59915 [ACK] Seq=22675 Ack=1518 Win=262144 Len=1300 [TCP segment of a reassembled PDU]
2478,386.932084,52.113.194.133,192.168.43.215,TLSv1.2,336,Application Data
2479,386.932141,192.168.43.215,52.113.194.133,TCP,54,59915  >  443 [ACK] Seq=1518 Ack=24257 Win=66048 Len=0
2480,386.932229,52.113.194.133,192.168.43.215,TCP,1354,443  >  59915 [ACK] Seq=24257 Ack=1518 Win=262144 Len=1300 [TCP segment of a reassembled PDU]
2481,386.93269,52.113.194.133,192.168.43.215,TCP,1354,443  >  59915 [ACK] Seq=25557 Ack=1518 Win=262144 Len=1300 [TCP segment of a reassembled PDU]
2482,386.932729,192.168.43.215,52.113.194.133,TCP,54,59915  >  443 [ACK] Seq=1518 Ack=26857 Win=66048 Len=0
2483,386.932772,52.113.194.133,192.168.43.215,TCP,1354,443  >  59915 [ACK] Seq=26857 Ack=1518 Win=262144 Len=1300 [TCP segment of a reassembled PDU]
2484,386.932925,52.113.194.133,192.168.43.215,TCP,1354,443  >  59915 [ACK] Seq=28157 Ack=1518 Win=262144 Len=1300 [TCP segment of a reassembled PDU]
2485,386.93304700000004,192.168.43.215,52.113.194.133,TCP,54,59915  >  443 [ACK] Seq=1518 Ack=29457 Win=66048 Len=0
2486,386.934235,52.113.194.133,192.168.43.215,TCP,1354,443  >  59915 [ACK] Seq=29457 Ack=1518 Win=262144 Len=1300 [TCP segment of a reassembled PDU]
2487,386.93510299999997,52.113.194.133,192.168.43.215,TCP,1354,443  >  59915 [ACK] Seq=30757 Ack=1518 Win=262144 Len=1300 [TCP segment of a reassembled PDU]
2488,386.935158,192.168.43.215,52.113.194.133,TCP,54,59915  >  443 [ACK] Seq=1518 Ack=32057 Win=66048 Len=0
2489,386.935222,52.113.194.133,192.168.43.215,TLSv1.2,484,Application Data
2490,386.935262,52.113.194.133,192.168.43.215,TCP,1354,443  >  59915 [ACK] Seq=32487 Ack=1518 Win=262144 Len=1300 [TCP segment of a reassembled PDU]
2491,386.935292,192.168.43.215,52.113.194.133,TCP,54,59915  >  443 [ACK] Seq=1518 Ack=33787 Win=66048 Len=0
2492,386.93533199999996,52.113.194.133,192.168.43.215,TCP,1354,443  >  59915 [ACK] Seq=33787 Ack=1518 Win=262144 Len=1300 [TCP segment of a reassembled PDU]
2493,386.93551099999996,52.113.194.133,192.168.43.215,TCP,1354,443  >  59915 [ACK] Seq=35087 Ack=1518 Win=262144 Len=1300 [TCP segment of a reassembled PDU]
2494,386.93554900000004,192.168.43.215,52.113.194.133,TCP,54,59915  >  443 [ACK] Seq=1518 Ack=36387 Win=66048 Len=0
2495,386.93559700000003,52.113.194.133,192.168.43.215,TLSv1.2,343,Application Data
2496,386.93651600000004,52.113.194.133,192.168.43.215,TCP,1354,443  >  59915 [ACK] Seq=36676 Ack=1518 Win=262144 Len=1300 [TCP segment of a reassembled PDU]
2497,386.93656200000004,192.168.43.215,52.113.194.133,TCP,54,59915  >  443 [ACK] Seq=1518 Ack=37976 Win=66048 Len=0
2498,386.936679,52.113.194.133,192.168.43.215,TLSv1.2,820,Application Data
2499,386.936796,52.113.194.133,192.168.43.215,TLSv1.2,92,Application Data
