No.,Time,Source,Destination,Length,Info
583,281.316402,192.168.43.215,52.113.194.133,54,52004  >  443 [ACK] Seq=5224 Ack=333506 Win=65536 Len=0
1812,877.645576,192.168.43.215,52.113.194.133,92,Application Data
2250,1125.140915,192.168.43.215,52.113.194.133,54,59555  >  443 [ACK] Seq=1471 Ack=21416 Win=66048 Len=0
1653,821.227535,52.113.194.133,192.168.43.215,1406,443  >  57614 [ACK] Seq=3596 Ack=1447 Win=524288 Len=1352 [TCP segment of a reassembled PDU]
668,301.79132000000004,52.113.194.133,192.168.43.215,1406,443  >  52004 [ACK] Seq=383953 Ack=5787 Win=524288 Len=1352 [TCP segment of a reassembled PDU]
515,270.49332999999996,192.168.43.215,52.113.194.133,54,52004  >  443 [ACK] Seq=4601 Ack=289116 Win=66048 Len=0
619,296.35181,52.113.194.133,192.168.43.215,1406,443  >  52004 [ACK] Seq=352697 Ack=5574 Win=524544 Len=1352 [TCP segment of a reassembled PDU]
2692,1253.650298,52.113.194.133,192.168.43.215,54,443  >  60776 [ACK] Seq=155 Ack=618 Win=523776 Len=0
2491,1177.792812,192.168.43.215,52.113.194.133,54,59999  >  443 [ACK] Seq=2177 Ack=39149 Win=65792 Len=0
937,505.22958099999994,52.113.194.133,192.168.43.215,92,Application Data
850,388.377611,52.113.194.133,192.168.43.215,54,443  >  54764 [ACK] Seq=6135 Ack=676 Win=523776 Len=0
307,104.958555,192.168.43.215,52.113.194.133,54,52004  >  443 [ACK] Seq=3163 Ack=174553 Win=66048 Len=0
2806,1338.1579800000002,192.168.43.215,52.113.194.133,105,"Change Cipher Spec, Encrypted Handshake Message"
792,372.824092,52.113.194.133,192.168.43.215,1406,443  >  52004 [ACK] Seq=453136 Ack=6407 Win=523520 Len=1352 [TCP segment of a reassembled PDU]
249,81.978822,52.113.194.133,192.168.43.215,1406,443  >  52004 [ACK] Seq=141918 Ack=2721 Win=524544 Len=1352 [TCP segment of a reassembled PDU]
924,505.05800899999997,52.113.194.133,192.168.43.215,54,443  >  52004 [ACK] Seq=494513 Ack=6857 Win=523264 Len=0
1088,650.2123650000001,52.113.194.133,192.168.43.215,1406,443  >  52004 [ACK] Seq=563829 Ack=8245 Win=523264 Len=1352 [TCP segment of a reassembled PDU]
1223,666.7643969999999,52.113.194.133,192.168.43.215,1406,443  >  56194 [ACK] Seq=36070 Ack=1627 Win=261888 Len=1352 [TCP segment of a reassembled PDU]
2525,1184.219034,52.113.194.133,192.168.43.215,1406,443  >  60197 [ACK] Seq=10159 Ack=1578 Win=262144 Len=1352 [TCP segment of a reassembled PDU]
464,217.80165,192.168.43.215,52.113.194.133,54,52004  >  443 [ACK] Seq=4178 Ack=263508 Win=66048 Len=0
23,0.179979,52.113.194.133,192.168.43.215,1406,443  >  52004 [ACK] Seq=6459 Ack=1328 Win=523008 Len=1352 [TCP segment of a reassembled PDU]
1238,668.7453320000001,52.113.194.133,192.168.43.215,330,Application Data
1855,904.1879349999999,192.168.43.215,52.113.194.133,153,Application Data
312,104.95914499999999,52.113.194.133,192.168.43.215,1406,443  >  52004 [ACK] Seq=178609 Ack=3163 Win=524032 Len=1352 [TCP segment of a reassembled PDU]
419,172.605086,192.168.43.215,52.113.194.133,54,52004  >  443 [ACK] Seq=3969 Ack=236524 Win=66048 Len=0
118,50.039640000000006,192.168.43.215,52.113.194.133,54,52004  >  443 [ACK] Seq=1844 Ack=64012 Win=66048 Len=0
780,368.380961,52.113.194.133,192.168.43.215,1406,443  >  52004 [ACK] Seq=450648 Ack=6192 Win=523776 Len=1352 [TCP segment of a reassembled PDU]
296,96.286502,192.168.43.215,52.113.194.133,54,52004  >  443 [ACK] Seq=2941 Ack=169010 Win=66048 Len=0
2429,1171.742984,52.113.194.133,192.168.43.215,54,443  >  59999 [ACK] Seq=821 Ack=1591 Win=262144 Len=0
183,76.151792,52.113.194.133,192.168.43.215,1406,443  >  52004 [ACK] Seq=98346 Ack=2407 Win=523520 Len=1352 [TCP segment of a reassembled PDU]
935,505.22950499999996,52.113.194.133,192.168.43.215,729,Application Data
598,284.355842,52.113.194.133,192.168.43.215,1406,443  >  52004 [ACK] Seq=343796 Ack=5374 Win=523264 Len=1352 [TCP segment of a reassembled PDU]
508,270.25502,192.168.43.215,52.113.194.133,208,Application Data
601,284.355931,52.113.194.133,192.168.43.215,172,Application Data
1524,793.530249,192.168.43.215,52.113.194.133,54,56560  >  443 [ACK] Seq=2555 Ack=87726 Win=66048 Len=0
2588,1197.920832,192.168.43.215,52.113.194.133,153,Application Data
2557,1189.835583,52.113.194.133,192.168.43.215,1406,443  >  60197 [ACK] Seq=27678 Ack=1860 Win=261632 Len=1352 [TCP segment of a reassembled PDU]
2145,1087.926197,192.168.43.215,52.113.194.133,54,59340  >  443 [ACK] Seq=1475 Ack=2966 Win=66048 Len=0
2840,1338.394787,52.113.194.133,192.168.43.215,92,Application Data
1188,661.581312,52.113.194.133,192.168.43.215,1406,443  >  56194 [ACK] Seq=13241 Ack=1453 Win=262144 Len=1352 [TCP segment of a reassembled PDU]
2317,1151.5766230000002,192.168.43.215,52.113.194.133,153,Application Data
1301,682.078455,192.168.43.215,52.113.194.133,54,56451  >  443 [ACK] Seq=1446 Ack=14529 Win=66048 Len=0
911,434.58027699999997,52.113.194.133,192.168.43.215,1272,Application Data
1474,789.5642650000001,52.113.194.133,192.168.43.215,1406,443  >  56560 [ACK] Seq=55373 Ack=2348 Win=523520 Len=1352 [TCP segment of a reassembled PDU]
1084,650.208442,192.168.43.215,52.113.194.133,54,52004  >  443 [ACK] Seq=8245 Ack=561882 Win=66048 Len=0
2332,1151.959059,52.113.194.133,192.168.43.215,1406,443  >  59744 [ACK] Seq=4938 Ack=1468 Win=262144 Len=1352 [TCP segment of a reassembled PDU]
2093,1044.120252,192.168.43.215,52.113.194.133,54,58495  >  443 [ACK] Seq=2420 Ack=105097 Win=66048 Len=0
1977,1017.7921859999999,192.168.43.215,52.113.194.133,54,58495  >  443 [ACK] Seq=2001 Ack=39861 Win=66048 Len=0
303,104.95823500000002,52.113.194.133,192.168.43.215,1406,443  >  52004 [ACK] Seq=171417 Ack=3163 Win=524032 Len=1352 [TCP segment of a reassembled PDU]
2866,1365.636139,52.113.194.133,192.168.43.215,54,443  >  61336 [ACK] Seq=28866 Ack=1832 Win=524032 Len=0
119,50.039685,52.113.194.133,192.168.43.215,817,Application Data
2753,1300.360244,52.113.194.133,192.168.43.215,1406,443  >  61034 [ACK] Seq=12153 Ack=1589 Win=524288 Len=1352 [TCP segment of a reassembled PDU]
1243,668.745489,192.168.43.215,52.113.194.133,54,56194  >  443 [ACK] Seq=1874 Ack=45617 Win=66048 Len=0
1115,655.856635,52.113.194.133,192.168.43.215,1406,443  >  52004 [ACK] Seq=582441 Ack=8399 Win=524544 Len=1352 [TCP segment of a reassembled PDU]
807,372.839599,52.113.194.133,192.168.43.215,1406,443  >  52004 [ACK] Seq=464346 Ack=6407 Win=523520 Len=1352 [TCP segment of a reassembled PDU]
1683,830.972271,52.113.194.133,192.168.43.215,285,Application Data
532,274.68553199999997,52.113.194.133,192.168.43.215,1406,443  >  52004 [ACK] Seq=298920 Ack=4966 Win=523776 Len=1352 [TCP segment of a reassembled PDU]
2882,1366.400413,52.113.194.133,192.168.43.215,92,Application Data
1062,618.0891389999999,192.168.43.215,52.113.194.133,100,Application Data
1175,661.580531,52.113.194.133,192.168.43.215,1406,443  >  56194 [ACK] Seq=2966 Ack=1453 Win=262144 Len=1352 [TCP segment of a reassembled PDU]
1963,996.2926550000001,52.113.194.133,192.168.43.215,54,443  >  58495 [ACK] Seq=29525 Ack=2001 Win=523776 Len=0
2674,1229.707661,192.168.43.215,52.113.194.133,54,60643  >  443 [ACK] Seq=1 Ack=1 Win=66048 Len=0
2905,1367.754058,192.168.43.215,52.113.194.133,54,61582  >  443 [ACK] Seq=1589 Ack=11037 Win=66048 Len=0
1688,830.972858,52.113.194.133,192.168.43.215,1406,443  >  57614 [ACK] Seq=26959 Ack=1627 Win=524288 Len=1352 [TCP segment of a reassembled PDU]
93,30.230134000000003,192.168.43.215,52.113.194.133,54,52004  >  443 [ACK] Seq=1625 Ack=49964 Win=66048 Len=0
2182,1102.387824,52.113.194.133,192.168.43.215,92,Application Data
423,172.614138,52.113.194.133,192.168.43.215,1406,443  >  52004 [ACK] Seq=239228 Ack=3969 Win=523264 Len=1352 [TCP segment of a reassembled PDU]
1328,684.353154,52.113.194.133,192.168.43.215,172,Application Data
2113,1073.25288,52.113.194.133,192.168.43.215,1406,443  >  58495 [ACK] Seq=112737 Ack=2728 Win=523264 Len=1352 [TCP segment of a reassembled PDU]
299,96.286625,192.168.43.215,52.113.194.133,54,52004  >  443 [ACK] Seq=2941 Ack=170065 Win=65024 Len=0
2002,1038.330683,192.168.43.215,52.113.194.133,54,58495  >  443 [ACK] Seq=2203 Ack=48860 Win=65536 Len=0
567,281.313314,52.113.194.133,192.168.43.215,172,Application Data
1780,866.324843,52.113.194.133,192.168.43.215,1406,443  >  58011 [ACK] Seq=6297 Ack=1491 Win=262144 Len=1352 [TCP segment of a reassembled PDU]
34,0.274608,52.113.194.133,192.168.43.215,453,Application Data
105,50.032238,52.113.194.133,192.168.43.215,1406,443  >  52004 [ACK] Seq=54297 Ack=1844 Win=524032 Len=1352 [TCP segment of a reassembled PDU]
978,527.886088,52.113.194.133,192.168.43.215,1406,443  >  52004 [ACK] Seq=519042 Ack=7347 Win=524032 Len=1352 [TCP segment of a reassembled PDU]
1743,849.7097289999999,192.168.43.215,52.113.194.133,54,57916  >  443 [ACK] Seq=1479 Ack=14530 Win=66048 Len=0
2125,1075.4946539999999,52.113.194.133,192.168.43.215,54,"443  >  58495 [FIN, ACK] Seq=117864 Ack=2729 Win=523264 Len=0"
1281,681.8982129999999,52.113.194.133,192.168.43.215,92,Application Data
1919,934.258942,192.168.43.215,52.113.194.133,54,58495  >  443 [ACK] Seq=1484 Ack=6770 Win=66048 Len=0
1060,600.320109,192.168.43.215,52.113.194.133,54,52004  >  443 [ACK] Seq=7982 Ack=554753 Win=66048 Len=0
2438,1172.0583980000001,192.168.43.215,52.113.194.133,54,59999  >  443 [ACK] Seq=1591 Ack=8831 Win=66048 Len=0
411,169.219392,192.168.43.215,52.113.194.133,54,52004  >  443 [ACK] Seq=3796 Ack=232202 Win=65024 Len=0
1099,650.223483,192.168.43.215,52.113.194.133,54,52004  >  443 [ACK] Seq=8245 Ack=573411 Win=66048 Len=0
1204,666.736935,52.113.194.133,192.168.43.215,1406,443  >  56194 [ACK] Seq=22068 Ack=1627 Win=261888 Len=1352 [TCP segment of a reassembled PDU]
1582,812.29098,52.113.194.133,192.168.43.215,172,Application Data
1016,553.719918,192.168.43.215,52.113.194.133,54,52004  >  443 [ACK] Seq=7660 Ack=535505 Win=66048 Len=0
1760,861.8382119999999,52.113.194.133,192.168.43.215,54,443  >  58011 [ACK] Seq=1 Ack=567 Win=261632 Len=0
1006,543.6078809999999,192.168.43.215,52.113.194.133,54,52004  >  443 [ACK] Seq=7571 Ack=531172 Win=66048 Len=0
1477,789.564406,52.113.194.133,192.168.43.215,1406,443  >  56560 [ACK] Seq=58077 Ack=2348 Win=523520 Len=1352 [TCP segment of a reassembled PDU]
913,434.580366,52.113.194.133,192.168.43.215,92,Application Data
318,104.96083999999999,52.113.194.133,192.168.43.215,1406,443  >  52004 [ACK] Seq=182783 Ack=3163 Win=524032 Len=1352 [TCP segment of a reassembled PDU]
2456,1177.243125,192.168.43.215,52.113.194.133,325,Application Data
2691,1253.5962849999999,192.168.43.215,52.113.194.133,105,"Change Cipher Spec, Encrypted Handshake Message"
2014,1038.361025,192.168.43.215,52.113.194.133,54,58495  >  443 [ACK] Seq=2203 Ack=58037 Win=66048 Len=0
1561,812.151654,52.113.194.133,192.168.43.215,54,443  >  57519 [ACK] Seq=155 Ack=618 Win=261632 Len=0
1288,682.065774,52.113.194.133,192.168.43.215,1406,443  >  56451 [ACK] Seq=3595 Ack=1446 Win=262144 Len=1352 [TCP segment of a reassembled PDU]
1940,971.0033080000001,52.113.194.133,192.168.43.215,1406,443  >  58495 [ACK] Seq=15926 Ack=1773 Win=524032 Len=1352 [TCP segment of a reassembled PDU]
2721,1300.090965,192.168.43.215,52.113.194.133,54,61034  >  443 [ACK] Seq=1 Ack=1 Win=66048 Len=0
1191,661.583397,52.113.194.133,192.168.43.215,118,Application Data
1198,661.591504,192.168.43.215,52.113.194.133,54,56194  >  443 [ACK] Seq=1453 Ack=21417 Win=66048 Len=0
139,71.304234,52.113.194.133,192.168.43.215,54,443  >  52004 [ACK] Seq=71339 Ack=2246 Win=523520 Len=0
1670,821.228323,52.113.194.133,192.168.43.215,1406,443  >  57614 [ACK] Seq=16008 Ack=1447 Win=524288 Len=1352 [TCP segment of a reassembled PDU]
2061,1044.010696,52.113.194.133,192.168.43.215,188,Application Data
629,296.354294,52.113.194.133,192.168.43.215,1406,443  >  52004 [ACK] Seq=360520 Ack=5574 Win=524544 Len=1352 [TCP segment of a reassembled PDU]
548,274.686512,52.113.194.133,192.168.43.215,500,Application Data
1913,934.2124369999999,52.113.194.133,192.168.43.215,1406,443  >  58495 [ACK] Seq=3336 Ack=1484 Win=524288 Len=1352 [TCP segment of a reassembled PDU]
989,539.1910730000001,52.113.194.133,192.168.43.215,100,Application Data
466,217.803631,52.113.194.133,192.168.43.215,1406,443  >  52004 [ACK] Seq=264860 Ack=4178 Win=524544 Len=1352 [TCP segment of a reassembled PDU]
228,78.568027,192.168.43.215,52.113.194.133,54,52004  >  443 [ACK] Seq=2551 Ack=130002 Win=66048 Len=0
839,388.321898,52.113.194.133,192.168.43.215,1406,443  >  54765 [ACK] Seq=1353 Ack=518 Win=524032 Len=1352 [TCP segment of a reassembled PDU]
2195,1110.632433,52.113.194.133,192.168.43.215,54,443  >  59415 [ACK] Seq=11052 Ack=1605 Win=524288 Len=0
1534,795.137089,192.168.43.215,52.113.194.133,54,"56560  >  443 [FIN, ACK] Seq=2555 Ack=94390 Win=64768 Len=0"
1587,812.291599,192.168.43.215,52.113.194.133,54,57518  >  443 [ACK] Seq=1474 Ack=17827 Win=66048 Len=0
1873,904.563276,52.113.194.133,192.168.43.215,1406,443  >  58330 [ACK] Seq=8993 Ack=1509 Win=524544 Len=1352 [TCP segment of a reassembled PDU]
1846,903.754707,52.113.194.133,192.168.43.215,66,"443  >  58330 [SYN, ACK] Seq=0 Ack=1 Win=65535 Len=0 MSS=1352 WS=256 SACK_PERM=1"
2616,1198.138963,192.168.43.215,52.113.194.133,54,60432  >  443 [ACK] Seq=1485 Ack=16008 Win=66048 Len=0
2482,1177.790499,192.168.43.215,52.113.194.133,54,59999  >  443 [ACK] Seq=2177 Ack=34565 Win=66048 Len=0
1866,904.56244,52.113.194.133,192.168.43.215,673,Application Data
1130,658.3794690000001,52.113.194.133,192.168.43.215,615,Application Data
437,172.62207,192.168.43.215,52.113.194.133,54,52004  >  443 [ACK] Seq=3969 Ack=250295 Win=66048 Len=0
1647,821.001741,52.113.194.133,192.168.43.215,54,443  >  57614 [ACK] Seq=262 Ack=1447 Win=524288 Len=0
196,76.152288,52.113.194.133,192.168.43.215,1406,443  >  52004 [ACK] Seq=107985 Ack=2407 Win=523520 Len=1352 [TCP segment of a reassembled PDU]
2852,1343.1765599999999,192.168.43.215,52.113.194.133,54,61336  >  443 [ACK] Seq=1640 Ack=24495 Win=66048 Len=0
2742,1300.359612,52.113.194.133,192.168.43.215,1406,443  >  61034 [ACK] Seq=3642 Ack=1589 Win=524288 Len=1352 [TCP segment of a reassembled PDU]
925,505.05812099999997,52.113.194.133,192.168.43.215,100,Application Data
1255,668.749311,192.168.43.215,52.113.194.133,54,56194  >  443 [ACK] Seq=1874 Ack=53911 Win=66048 Len=0
2319,1151.621523,52.113.194.133,192.168.43.215,54,443  >  59744 [ACK] Seq=155 Ack=618 Win=261632 Len=0
2365,1166.19929,192.168.43.215,52.113.194.133,105,"Change Cipher Spec, Encrypted Handshake Message"
2316,1151.576112,192.168.43.215,52.113.194.133,105,"Change Cipher Spec, Encrypted Handshake Message"
2655,1223.447565,52.113.194.133,192.168.43.215,172,Application Data
2067,1044.011146,52.113.194.133,192.168.43.215,1406,443  >  58495 [ACK] Seq=87227 Ack=2293 Win=523520 Len=1352 [TCP segment of a reassembled PDU]
1854,903.9545699999999,192.168.43.215,52.113.194.133,54,58330  >  443 [ACK] Seq=618 Ack=224 Win=65792 Len=0
837,388.320604,52.113.194.133,192.168.43.215,54,443  >  54765 [ACK] Seq=1 Ack=518 Win=524032 Len=0
1100,650.227029,52.113.194.133,192.168.43.215,1406,443  >  52004 [ACK] Seq=573411 Ack=8245 Win=523264 Len=1352 [TCP segment of a reassembled PDU]
2310,1151.427792,192.168.43.215,52.113.194.133,66,59744  >  443 [SYN] Seq=0 Win=8192 Len=0 MSS=1460 WS=256 SACK_PERM=1
732,330.4451,192.168.43.215,52.113.194.133,54,52004  >  443 [ACK] Seq=5998 Ack=422186 Win=66048 Len=0
884,434.469704,52.113.194.133,192.168.43.215,100,Application Data
2576,1190.5371089999999,52.113.194.133,192.168.43.215,54,"443  >  60197 [FIN, ACK] Seq=38174 Ack=1861 Win=261632 Len=0"
723,330.399098,52.113.194.133,192.168.43.215,54,443  >  52004 [ACK] Seq=414926 Ack=5998 Win=524032 Len=0
2564,1189.8478599999999,52.113.194.133,192.168.43.215,757,Application Data
1078,649.9444110000001,192.168.43.215,52.113.194.133,100,Application Data
2545,1189.716589,192.168.43.215,52.113.194.133,54,60197  >  443 [ACK] Seq=1772 Ack=19893 Win=65792 Len=0
875,405.731218,192.168.43.215,52.113.194.133,54,54764  >  443 [ACK] Seq=1626 Ack=10702 Win=66048 Len=0
2822,1338.386612,52.113.194.133,192.168.43.215,1406,443  >  61336 [ACK] Seq=4948 Ack=1457 Win=524288 Len=1352 [TCP segment of a reassembled PDU]
2797,1320.554062,192.168.43.215,52.113.194.133,54,"61124  >  443 [FIN, ACK] Seq=618 Ack=224 Win=65792 Len=0"
1536,795.197425,52.113.194.133,192.168.43.215,54,"443  >  56560 [FIN, ACK] Seq=94390 Ack=2556 Win=523264 Len=0"
1053,600.25404,52.113.194.133,192.168.43.215,328,Application Data
998,539.312798,192.168.43.215,52.113.194.133,54,52004  >  443 [ACK] Seq=7482 Ack=526842 Win=66048 Len=0
481,267.881995,52.113.194.133,192.168.43.215,100,Application Data
11,0.08761000000000001,192.168.43.215,52.113.194.133,54,52004  >  443 [ACK] Seq=518 Ack=5409 Win=66048 Len=0
1828,877.9201220000001,192.168.43.215,52.113.194.133,54,58198  >  443 [ACK] Seq=1476 Ack=10345 Win=66048 Len=0
1607,817.5747190000001,192.168.43.215,52.113.194.133,54,57518  >  443 [ACK] Seq=1649 Ack=31076 Win=66048 Len=0
1757,861.7644230000001,52.113.194.133,192.168.43.215,66,"443  >  58011 [SYN, ACK] Seq=0 Ack=1 Win=65535 Len=0 MSS=1352 WS=256 SACK_PERM=1"
2234,1125.139334,52.113.194.133,192.168.43.215,1406,443  >  59555 [ACK] Seq=9004 Ack=1471 Win=524288 Len=1352 [TCP segment of a reassembled PDU]
2000,1038.283137,52.113.194.133,192.168.43.215,54,443  >  58495 [ACK] Seq=48814 Ack=2203 Win=523776 Len=0
990,539.24106,192.168.43.215,52.113.194.133,54,52004  >  443 [ACK] Seq=7482 Ack=522522 Win=66048 Len=0
554,281.305453,52.113.194.133,192.168.43.215,1406,443  >  52004 [ACK] Seq=311831 Ack=5224 Win=523520 Len=1352 [TCP segment of a reassembled PDU]
1531,793.533856,52.113.194.133,192.168.43.215,1272,Application Data
225,78.567799,192.168.43.215,52.113.194.133,54,52004  >  443 [ACK] Seq=2551 Ack=128517 Win=66048 Len=0
1080,650.0332860000001,52.113.194.133,192.168.43.215,100,Application Data
386,168.91829099999998,52.113.194.133,192.168.43.215,100,Application Data
1520,793.528724,52.113.194.133,192.168.43.215,1406,443  >  56560 [ACK] Seq=84958 Ack=2555 Win=523264 Len=1352 [TCP segment of a reassembled PDU]
1094,650.212728,52.113.194.133,192.168.43.215,1406,443  >  52004 [ACK] Seq=569237 Ack=8245 Win=523264 Len=1352 [TCP segment of a reassembled PDU]
71,30.170464000000003,52.113.194.133,192.168.43.215,1406,443  >  52004 [ACK] Seq=33585 Ack=1625 Win=524288 Len=1352 [TCP segment of a reassembled PDU]
1711,849.406149,52.113.194.133,192.168.43.215,66,"443  >  57916 [SYN, ACK] Seq=0 Ack=1 Win=65535 Len=0 MSS=1352 WS=256 SACK_PERM=1"
892,434.565685,52.113.194.133,192.168.43.215,1406,443  >  52004 [ACK] Seq=478134 Ack=6638 Win=523264 Len=1352 [TCP segment of a reassembled PDU]
254,81.982656,192.168.43.215,52.113.194.133,54,52004  >  443 [ACK] Seq=2721 Ack=146107 Win=66048 Len=0
16,0.139725,52.113.194.133,192.168.43.215,54,443  >  52004 [ACK] Seq=6026 Ack=676 Win=523776 Len=0
2522,1184.217402,52.113.194.133,192.168.43.215,1406,443  >  60197 [ACK] Seq=7455 Ack=1578 Win=262144 Len=1352 [TCP segment of a reassembled PDU]
702,327.583465,52.113.194.133,192.168.43.215,1406,443  >  52004 [ACK] Seq=402022 Ack=5917 Win=524032 Len=1352 [TCP segment of a reassembled PDU]
869,388.581548,192.168.43.215,52.113.194.133,54,54764  >  443 [ACK] Seq=1383 Ack=9304 Win=66048 Len=0
724,330.43222099999997,52.113.194.133,192.168.43.215,1406,443  >  52004 [ACK] Seq=414926 Ack=5998 Win=524032 Len=1352 [TCP segment of a reassembled PDU]
1956,971.0069300000001,52.113.194.133,192.168.43.215,1272,Application Data
642,296.354912,192.168.43.215,52.113.194.133,54,52004  >  443 [ACK] Seq=5574 Ack=370236 Win=66048 Len=0
2904,1367.7044460000002,52.113.194.133,192.168.43.215,92,Application Data
2734,1300.261883,52.113.194.133,192.168.43.215,1406,443  >  61034 [ACK] Seq=262 Ack=1447 Win=524288 Len=1352 [TCP segment of a reassembled PDU]
1261,668.749502,192.168.43.215,52.113.194.133,54,56194  >  443 [ACK] Seq=1874 Ack=59185 Win=66048 Len=0
2256,1130.5025380000002,52.113.194.133,192.168.43.215,54,443  >  59555 [ACK] Seq=22067 Ack=1472 Win=524288 Len=0
2631,1223.291688,52.113.194.133,192.168.43.215,208,"Server Hello, Change Cipher Spec, Encrypted Handshake Message"
447,217.737606,52.113.194.133,192.168.43.215,54,443  >  52004 [ACK] Seq=252298 Ack=4178 Win=524544 Len=0
563,281.30836800000003,52.113.194.133,192.168.43.215,1406,443  >  52004 [ACK] Seq=319091 Ack=5224 Win=523520 Len=1352 [TCP segment of a reassembled PDU]
1231,668.635001,192.168.43.215,52.113.194.133,96,Application Data
1213,666.7638,52.113.194.133,192.168.43.215,1406,443  >  56194 [ACK] Seq=29059 Ack=1627 Win=261888 Len=1352 [TCP segment of a reassembled PDU]
1574,812.286998,52.113.194.133,192.168.43.215,1406,443  >  57518 [ACK] Seq=8111 Ack=1474 Win=262144 Len=1352 [TCP segment of a reassembled PDU]
617,296.248546,52.113.194.133,192.168.43.215,100,Application Data
1795,866.326877,52.113.194.133,192.168.43.215,92,Application Data
720,327.586269,52.113.194.133,192.168.43.215,92,Application Data
2423,1171.671075,52.113.194.133,192.168.43.215,92,Application Data
2362,1166.146201,192.168.43.215,52.113.194.133,620,Client Hello
180,76.151658,52.113.194.133,192.168.43.215,446,Application Data
334,110.53986599999999,52.113.194.133,192.168.43.215,54,443  >  52004 [ACK] Seq=188221 Ack=3407 Win=523776 Len=0
747,330.449696,192.168.43.215,52.113.194.133,54,52004  >  443 [ACK] Seq=5998 Ack=433246 Win=66048 Len=0
218,78.563568,52.113.194.133,192.168.43.215,1406,443  >  52004 [ACK] Seq=122991 Ack=2551 Win=523264 Len=1352 [TCP segment of a reassembled PDU]
1899,933.976007,192.168.43.215,52.113.194.133,105,"Change Cipher Spec, Encrypted Handshake Message"
2679,1229.8071029999999,52.113.194.133,192.168.43.215,54,443  >  60643 [ACK] Seq=155 Ack=618 Win=261632 Len=0
2184,1107.085853,192.168.43.215,52.113.194.133,180,Application Data
1698,830.974473,52.113.194.133,192.168.43.215,1406,443  >  57614 [ACK] Seq=35189 Ack=1627 Win=524288 Len=1352 [TCP segment of a reassembled PDU]
2831,1338.391767,52.113.194.133,192.168.43.215,1406,443  >  61336 [ACK] Seq=11826 Ack=1457 Win=524288 Len=1352 [TCP segment of a reassembled PDU]
1738,849.7079460000001,52.113.194.133,192.168.43.215,1406,443  >  57916 [ACK] Seq=10356 Ack=1479 Win=524288 Len=1352 [TCP segment of a reassembled PDU]
362,110.597059,52.113.194.133,192.168.43.215,92,Application Data
253,81.982558,52.113.194.133,192.168.43.215,1406,443  >  52004 [ACK] Seq=144755 Ack=2721 Win=524544 Len=1352 [TCP segment of a reassembled PDU]
713,327.584505,52.113.194.133,192.168.43.215,1406,443  >  52004 [ACK] Seq=409034 Ack=5917 Win=524032 Len=1352 [TCP segment of a reassembled PDU]
1769,865.9767609999999,52.113.194.133,192.168.43.215,54,443  >  58011 [ACK] Seq=224 Ack=755 Win=261376 Len=0
2689,1253.58857,52.113.194.133,192.168.43.215,54,443  >  60776 [ACK] Seq=1 Ack=567 Win=523776 Len=0
2168,1102.203415,52.113.194.133,192.168.43.215,123,Application Data
2709,1278.716833,192.168.43.215,52.113.194.133,92,Application Data
2815,1338.2627220000002,192.168.43.215,52.113.194.133,54,61336  >  443 [ACK] Seq=1457 Ack=262 Win=65792 Len=0
1071,619.143617,192.168.43.215,52.113.194.133,54,52004  >  443 [ACK] Seq=8118 Ack=557052 Win=66048 Len=0
673,301.791791,52.113.194.133,192.168.43.215,172,Application Data
1212,666.754493,192.168.43.215,52.113.194.133,54,56194  >  443 [ACK] Seq=1627 Ack=29059 Win=66048 Len=0
2431,1172.046378,52.113.194.133,192.168.43.215,1304,Application Data
24,0.180115,192.168.43.215,52.113.194.133,54,52004  >  443 [ACK] Seq=1366 Ack=7811 Win=66048 Len=0
2469,1177.785269,52.113.194.133,192.168.43.215,1406,443  >  59999 [ACK] Seq=23631 Ack=2177 Win=261376 Len=1352 [TCP segment of a reassembled PDU]
664,301.79093900000004,52.113.194.133,192.168.43.215,1406,443  >  52004 [ACK] Seq=379897 Ack=5787 Win=524288 Len=1352 [TCP segment of a reassembled PDU]
125,64.862434,52.113.194.133,192.168.43.215,100,Application Data
900,434.56988499999994,192.168.43.215,52.113.194.133,54,52004  >  443 [ACK] Seq=6638 Ack=485012 Win=66048 Len=0
2148,1087.928302,192.168.43.215,52.113.194.133,54,59340  >  443 [ACK] Seq=1475 Ack=4685 Win=66048 Len=0
2018,1038.364915,52.113.194.133,192.168.43.215,1406,443  >  58495 [ACK] Seq=60741 Ack=2203 Win=523776 Len=1352 [TCP segment of a reassembled PDU]
934,505.229457,52.113.194.133,192.168.43.215,1406,443  >  52004 [ACK] Seq=498935 Ack=6857 Win=523264 Len=1352 [TCP segment of a reassembled PDU]
1605,817.574567,52.113.194.133,192.168.43.215,1406,443  >  57518 [ACK] Seq=28372 Ack=1649 Win=261888 Len=1352 [TCP segment of a reassembled PDU]
1052,600.253878,192.168.43.215,52.113.194.133,54,52004  >  443 [ACK] Seq=7982 Ack=551046 Win=66048 Len=0
2029,1038.367473,192.168.43.215,52.113.194.133,54,58495  >  443 [ACK] Seq=2203 Ack=69105 Win=66048 Len=0
2414,1171.5794529999998,52.113.194.133,192.168.43.215,54,443  >  59999 [ACK] Seq=1 Ack=567 Win=261632 Len=0
559,281.30641,192.168.43.215,52.113.194.133,54,52004  >  443 [ACK] Seq=5224 Ack=316387 Win=66048 Len=0
2144,1087.926067,52.113.194.133,192.168.43.215,1406,443  >  59340 [ACK] Seq=1614 Ack=1475 Win=524288 Len=1352 [TCP segment of a reassembled PDU]
1048,599.9647679999999,192.168.43.215,52.113.194.133,143,Application Data
2800,1338.084774,192.168.43.215,52.113.194.133,66,61336  >  443 [SYN] Seq=0 Win=8192 Len=0 MSS=1460 WS=256 SACK_PERM=1
1853,903.895698,52.113.194.133,192.168.43.215,123,Application Data
1239,668.745366,52.113.194.133,192.168.43.215,1406,443  >  56194 [ACK] Seq=41561 Ack=1874 Win=261632 Len=1352 [TCP segment of a reassembled PDU]
1628,820.2037809999999,52.113.194.133,192.168.43.215,54,443  >  57518 [ACK] Seq=42928 Ack=1650 Win=261888 Len=0
333,110.50051,192.168.43.215,52.113.194.133,124,Application Data
2135,1087.7067439999998,192.168.43.215,52.113.194.133,774,Application Data
1868,904.5626619999999,192.168.43.215,52.113.194.133,54,58330  >  443 [ACK] Seq=1509 Ack=4937 Win=66048 Len=0
2617,1198.1390789999998,52.113.194.133,192.168.43.215,1406,443  >  60432 [ACK] Seq=16008 Ack=1485 Win=524544 Len=1352 [TCP segment of a reassembled PDU]
381,157.510519,52.113.194.133,192.168.43.215,92,Application Data
600,284.355899,192.168.43.215,52.113.194.133,54,52004  >  443 [ACK] Seq=5374 Ack=346500 Win=66048 Len=0
462,217.80111000000002,52.113.194.133,192.168.43.215,172,Application Data
2589,1197.9220050000001,192.168.43.215,52.113.194.133,92,Application Data
1236,668.745216,52.113.194.133,192.168.43.215,1406,443  >  56194 [ACK] Seq=39933 Ack=1874 Win=261632 Len=1352 [TCP segment of a reassembled PDU]
2530,1184.221924,52.113.194.133,192.168.43.215,1406,443  >  60197 [ACK] Seq=12981 Ack=1578 Win=262144 Len=1352 [TCP segment of a reassembled PDU]
1807,877.604148,192.168.43.215,52.113.194.133,105,"Change Cipher Spec, Encrypted Handshake Message"
157,71.442814,192.168.43.215,52.113.194.133,54,52004  >  443 [ACK] Seq=2246 Ack=85954 Win=66048 Len=0
2114,1073.252946,192.168.43.215,52.113.194.133,54,58495  >  443 [ACK] Seq=2728 Ack=114089 Win=66048 Len=0
193,76.15217,52.113.194.133,192.168.43.215,1406,443  >  52004 [ACK] Seq=106576 Ack=2407 Win=523520 Len=1352 [TCP segment of a reassembled PDU]
2744,1300.359768,52.113.194.133,192.168.43.215,453,Application Data
2455,1172.106074,192.168.43.215,52.113.194.133,54,59999  >  443 [ACK] Seq=1591 Ack=20418 Win=66048 Len=0
2684,1235.645851,52.113.194.133,192.168.43.215,54,"443  >  60643 [RST, ACK] Seq=224 Ack=619 Win=0 Len=0"
10,0.08755299999999999,52.113.194.133,192.168.43.215,1406,443  >  52004 [ACK] Seq=4057 Ack=518 Win=524032 Len=1352 [TCP segment of a reassembled PDU]
1010,543.611124,52.113.194.133,192.168.43.215,92,Application Data
1152,658.439901,192.168.43.215,52.113.194.133,54,52004  >  443 [ACK] Seq=8547 Ack=605170 Win=66048 Len=0
2488,1177.7924189999999,192.168.43.215,52.113.194.133,54,59999  >  443 [ACK] Seq=2177 Ack=38805 Win=66048 Len=0
2478,1177.788518,52.113.194.133,192.168.43.215,172,Application Data
779,368.380829,52.113.194.133,192.168.43.215,187,Application Data
687,327.334773,192.168.43.215,52.113.194.133,184,"[TCP Retransmission] 52004  >  443 [PSH, ACK] Seq=5787 Ack=394153 Win=65536 Len=130"
31,0.274253,52.113.194.133,192.168.43.215,1406,443  >  52004 [ACK] Seq=8487 Ack=1435 Win=524288 Len=1352 [TCP segment of a reassembled PDU]
2636,1223.339554,52.113.194.133,192.168.43.215,123,Application Data
70,30.169144,192.168.43.215,52.113.194.133,54,52004  >  443 [ACK] Seq=1625 Ack=33585 Win=66048 Len=0
970,519.5441400000001,52.113.194.133,192.168.43.215,92,Application Data
2202,1124.7957720000002,192.168.43.215,52.113.194.133,620,Client Hello
264,82.129594,192.168.43.215,52.113.194.133,66,[TCP Dup ACK 262#1] 52004  >  443 [ACK] Seq=2721 Ack=150814 Win=66048 Len=0 SLE=149462 SRE=150814
1056,600.258431,52.113.194.133,192.168.43.215,1406,443  >  52004 [ACK] Seq=552672 Ack=7982 Win=523520 Len=1352 [TCP segment of a reassembled PDU]
2641,1223.382518,192.168.43.215,52.113.194.133,54,60565  >  443 [ACK] Seq=1484 Ack=262 Win=65792 Len=0
2199,1124.62175,192.168.43.215,52.113.194.133,66,59561  >  443 [SYN] Seq=0 Win=8192 Len=0 MSS=1460 WS=256 SACK_PERM=1
544,274.68627299999997,52.113.194.133,192.168.43.215,1406,443  >  52004 [ACK] Seq=307291 Ack=4966 Win=523776 Len=1352 [TCP segment of a reassembled PDU]
899,434.569744,52.113.194.133,192.168.43.215,1406,443  >  52004 [ACK] Seq=483660 Ack=6638 Win=523264 Len=1352 [TCP segment of a reassembled PDU]
1556,812.0748990000001,192.168.43.215,52.113.194.133,92,Application Data
260,81.999808,192.168.43.215,52.113.194.133,54,52004  >  443 [ACK] Seq=2721 Ack=150776 Win=66048 Len=0
2078,1044.105984,192.168.43.215,52.113.194.133,54,58495  >  443 [ACK] Seq=2420 Ack=93217 Win=66048 Len=0
197,76.15231899999999,192.168.43.215,52.113.194.133,54,52004  >  443 [ACK] Seq=2407 Ack=109337 Win=66048 Len=0
1263,668.772896,192.168.43.215,52.113.194.133,54,56194  >  443 [ACK] Seq=1874 Ack=59223 Win=66048 Len=0
2375,1166.399169,52.113.194.133,192.168.43.215,580,Application Data
2634,1223.295349,192.168.43.215,52.113.194.133,783,Application Data
785,372.61935,192.168.43.215,52.113.194.133,195,Application Data
717,327.585532,52.113.194.133,192.168.43.215,1406,443  >  52004 [ACK] Seq=413090 Ack=5917 Win=524032 Len=1352 [TCP segment of a reassembled PDU]
277,96.28168199999999,52.113.194.133,192.168.43.215,1406,443  >  52004 [ACK] Seq=153887 Ack=2941 Win=524288 Len=1352 [TCP segment of a reassembled PDU]
1923,970.706089,52.113.194.133,192.168.43.215,100,Application Data
2133,1087.70559,192.168.43.215,52.113.194.133,105,"Change Cipher Spec, Encrypted Handshake Message"
2165,1102.136308,192.168.43.215,52.113.194.133,153,Application Data
149,71.439925,52.113.194.133,192.168.43.215,1406,443  >  52004 [ACK] Seq=79076 Ack=2246 Win=523520 Len=1352 [TCP segment of a reassembled PDU]
497,267.959699,52.113.194.133,192.168.43.215,1406,443  >  52004 [ACK] Seq=278421 Ack=4447 Win=524288 Len=1352 [TCP segment of a reassembled PDU]
2027,1038.367133,52.113.194.133,192.168.43.215,1406,443  >  58495 [ACK] Seq=66401 Ack=2203 Win=523776 Len=1352 [TCP segment of a reassembled PDU]
671,301.791677,52.113.194.133,192.168.43.215,1406,443  >  52004 [ACK] Seq=386657 Ack=5787 Win=524288 Len=1352 [TCP segment of a reassembled PDU]
2780,1304.350682,192.168.43.215,52.113.194.133,54,61034  >  443 [ACK] Seq=1765 Ack=29462 Win=66048 Len=0
2615,1198.138917,52.113.194.133,192.168.43.215,180,Application Data
1386,706.505008,192.168.43.215,52.113.194.133,54,56560  >  443 [ACK] Seq=1715 Ack=10403 Win=66048 Len=0
2705,1257.994495,52.113.194.133,192.168.43.215,54,443  >  60806 [ACK] Seq=155 Ack=618 Win=523776 Len=0
662,301.79068,52.113.194.133,192.168.43.215,1097,Application Data
397,169.21269099999998,52.113.194.133,192.168.43.215,1406,443  >  52004 [ACK] Seq=222804 Ack=3796 Win=523264 Len=1352 [TCP segment of a reassembled PDU]
1427,740.602196,192.168.43.215,52.113.194.133,54,56560  >  443 [ACK] Seq=1934 Ack=33705 Win=66048 Len=0
2006,1038.3585150000001,52.113.194.133,192.168.43.215,1406,443  >  58495 [ACK] Seq=51564 Ack=2203 Win=523776 Len=1352 [TCP segment of a reassembled PDU]
2435,1172.057842,192.168.43.215,52.113.194.133,54,59999  >  443 [ACK] Seq=1591 Ack=6127 Win=66048 Len=0
1885,904.566007,52.113.194.133,192.168.43.215,1056,Application Data
2528,1184.219599,52.113.194.133,192.168.43.215,1406,443  >  60197 [ACK] Seq=11629 Ack=1578 Win=262144 Len=1352 [TCP segment of a reassembled PDU]
2064,1044.010786,192.168.43.215,52.113.194.133,54,58495  >  443 [ACK] Seq=2420 Ack=85875 Win=66048 Len=0
1774,866.3092550000001,52.113.194.133,192.168.43.215,1406,443  >  58011 [ACK] Seq=1614 Ack=1491 Win=262144 Len=1352 [TCP segment of a reassembled PDU]
353,110.589956,52.113.194.133,192.168.43.215,118,Application Data
2818,1338.383359,192.168.43.215,52.113.194.133,54,61336  >  443 [ACK] Seq=1457 Ack=2966 Win=66048 Len=0
2460,1177.416786,52.113.194.133,192.168.43.215,439,Application Data
546,274.68638,192.168.43.215,52.113.194.133,54,52004  >  443 [ACK] Seq=4966 Ack=309995 Win=66048 Len=0
2698,1257.818128,192.168.43.215,52.113.194.133,66,60806  >  443 [SYN] Seq=0 Win=8192 Len=0 MSS=1460 WS=256 SACK_PERM=1
492,267.958186,192.168.43.215,52.113.194.133,54,52004  >  443 [ACK] Seq=4447 Ack=275599 Win=66048 Len=0
1725,849.580017,192.168.43.215,52.113.194.133,54,57916  >  443 [ACK] Seq=1479 Ack=262 Win=65792 Len=0
1028,589.649886,52.113.194.133,192.168.43.215,1406,443  >  52004 [ACK] Seq=538972 Ack=7804 Win=523776 Len=1352 [TCP segment of a reassembled PDU]
246,81.978678,52.113.194.133,192.168.43.215,172,Application Data
1455,745.241563,192.168.43.215,52.113.194.133,54,56560  >  443 [ACK] Seq=2090 Ack=50551 Win=66048 Len=0
2792,1308.052605,52.113.194.133,192.168.43.215,208,"Server Hello, Change Cipher Spec, Encrypted Handshake Message"
2750,1300.359989,52.113.194.133,192.168.43.215,1406,443  >  61034 [ACK] Seq=9449 Ack=1589 Win=524288 Len=1352 [TCP segment of a reassembled PDU]
1727,849.7000019999999,52.113.194.133,192.168.43.215,1406,443  >  57916 [ACK] Seq=1614 Ack=1479 Win=524288 Len=1352 [TCP segment of a reassembled PDU]
992,539.264723,52.113.194.133,192.168.43.215,1406,443  >  52004 [ACK] Seq=523423 Ack=7482 Win=524032 Len=1352 [TCP segment of a reassembled PDU]
1761,861.842868,52.113.194.133,192.168.43.215,208,"Server Hello, Change Cipher Spec, Encrypted Handshake Message"
2286,1141.506128,52.113.194.133,192.168.43.215,1406,443  >  59658 [ACK] Seq=6294 Ack=1461 Win=524544 Len=1352 [TCP segment of a reassembled PDU]
1549,812.0340160000001,192.168.43.215,52.113.194.133,153,Application Data
2630,1223.2915990000001,52.113.194.133,192.168.43.215,54,443  >  60565 [ACK] Seq=1 Ack=567 Win=523776 Len=0
570,281.313477,52.113.194.133,192.168.43.215,1406,443  >  52004 [ACK] Seq=324617 Ack=5224 Win=523520 Len=1352 [TCP segment of a reassembled PDU]
54,0.28167,192.168.43.215,52.113.194.133,54,52004  >  443 [ACK] Seq=1435 Ack=26644 Win=66048 Len=0
2605,1198.138021,52.113.194.133,192.168.43.215,1406,443  >  60432 [ACK] Seq=7652 Ack=1485 Win=524544 Len=1352 [TCP segment of a reassembled PDU]
2774,1304.35031,192.168.43.215,52.113.194.133,54,61034  >  443 [ACK] Seq=1765 Ack=25759 Win=66048 Len=0
2347,1151.961172,52.113.194.133,192.168.43.215,1406,443  >  59744 [ACK] Seq=16005 Ack=1468 Win=262144 Len=1352 [TCP segment of a reassembled PDU]
473,217.80399500000001,192.168.43.215,52.113.194.133,54,52004  >  443 [ACK] Seq=4178 Ack=268563 Win=65280 Len=0
945,511.23170999999996,52.113.194.133,192.168.43.215,734,Application Data
2189,1107.338283,52.113.194.133,192.168.43.215,1406,443  >  59415 [ACK] Seq=8984 Ack=1604 Win=524288 Len=1352 [TCP segment of a reassembled PDU]
879,417.91477599999996,52.113.194.133,192.168.43.215,66,[TCP Keep-Alive ACK] 443  >  52004 [ACK] Seq=473778 Ack=6407 Win=523520 Len=0 SLE=6406 SRE=6407
1953,971.0065460000001,52.113.194.133,192.168.43.215,1406,443  >  58495 [ACK] Seq=25565 Ack=1773 Win=524032 Len=1352 [TCP segment of a reassembled PDU]
2627,1223.241975,52.113.194.133,192.168.43.215,66,"443  >  60565 [SYN, ACK] Seq=0 Ack=1 Win=65535 Len=0 MSS=1352 WS=256 SACK_PERM=1"
1817,877.91381,52.113.194.133,192.168.43.215,1406,443  >  58198 [ACK] Seq=262 Ack=1476 Win=524288 Len=1352 [TCP segment of a reassembled PDU]
883,434.46775,52.113.194.133,192.168.43.215,54,443  >  52004 [ACK] Seq=473778 Ack=6638 Win=523264 Len=0
2287,1141.506259,192.168.43.215,52.113.194.133,54,59658  >  443 [ACK] Seq=1461 Ack=7646 Win=66048 Len=0
2284,1141.504402,192.168.43.215,52.113.194.133,54,59658  >  443 [ACK] Seq=1461 Ack=4942 Win=66048 Len=0
1148,658.384394,52.113.194.133,192.168.43.215,1406,443  >  52004 [ACK] Seq=603184 Ack=8547 Win=524288 Len=1352 [TCP segment of a reassembled PDU]
321,104.96102900000001,52.113.194.133,192.168.43.215,187,Application Data
2242,1125.140142,52.113.194.133,192.168.43.215,1406,443  >  59555 [ACK] Seq=14530 Ack=1471 Win=524288 Len=1352 [TCP segment of a reassembled PDU]
1612,817.582821,52.113.194.133,192.168.43.215,1406,443  >  57518 [ACK] Seq=33898 Ack=1649 Win=261888 Len=1352 [TCP segment of a reassembled PDU]
2736,1300.269567,192.168.43.215,52.113.194.133,54,61034  >  443 [ACK] Seq=1447 Ack=2252 Win=66048 Len=0
2039,1043.993876,52.113.194.133,192.168.43.215,1406,443  >  58495 [ACK] Seq=72391 Ack=2293 Win=523520 Len=1352 [TCP segment of a reassembled PDU]
2446,1172.061078,52.113.194.133,192.168.43.215,1406,443  >  59999 [ACK] Seq=14357 Ack=1591 Win=262144 Len=1352 [TCP segment of a reassembled PDU]
2294,1141.513678,52.113.194.133,192.168.43.215,1406,443  >  59658 [ACK] Seq=11820 Ack=1461 Win=524544 Len=1352 [TCP segment of a reassembled PDU]
2855,1347.406828,192.168.43.215,52.113.194.133,245,Application Data
99,50.030252000000004,52.113.194.133,192.168.43.215,1406,443  >  52004 [ACK] Seq=50010 Ack=1844 Win=524032 Len=1352 [TCP segment of a reassembled PDU]
616,296.248444,52.113.194.133,192.168.43.215,54,443  >  52004 [ACK] Seq=352651 Ack=5574 Win=524544 Len=0
676,301.79511099999996,52.113.194.133,192.168.43.215,1406,443  >  52004 [ACK] Seq=388261 Ack=5787 Win=524288 Len=1352 [TCP segment of a reassembled PDU]
1003,543.606129,192.168.43.215,52.113.194.133,54,52004  >  443 [ACK] Seq=7571 Ack=529546 Win=66048 Len=0
297,96.28655400000001,52.113.194.133,192.168.43.215,1071,Application Data
400,169.21864399999998,52.113.194.133,192.168.43.215,1406,443  >  52004 [ACK] Seq=225508 Ack=3796 Win=523264 Len=1352 [TCP segment of a reassembled PDU]
203,76.15257700000001,192.168.43.215,52.113.194.133,54,52004  >  443 [ACK] Seq=2407 Ack=114611 Win=66048 Len=0
2417,1171.585032,192.168.43.215,52.113.194.133,153,Application Data
2884,1366.450141,192.168.43.215,52.113.194.133,54,61582  >  443 [ACK] Seq=1473 Ack=262 Win=65792 Len=0
2716,1285.634967,192.168.43.215,52.113.194.133,883,"[TCP Retransmission] 60806  >  443 [PSH, ACK] Seq=618 Ack=224 Win=65792 Len=829"
842,388.322408,52.113.194.133,192.168.43.215,1406,443  >  54765 [ACK] Seq=4057 Ack=518 Win=524032 Len=1352 [TCP segment of a reassembled PDU]
794,372.824322,192.168.43.215,52.113.194.133,54,52004  >  443 [ACK] Seq=6407 Ack=455840 Win=66048 Len=0
910,434.580226,52.113.194.133,192.168.43.215,1406,443  >  52004 [ACK] Seq=491905 Ack=6638 Win=523264 Len=1352 [TCP segment of a reassembled PDU]
649,301.455818,192.168.43.215,52.113.194.133,142,Application Data
622,296.352254,52.113.194.133,192.168.43.215,1406,443  >  52004 [ACK] Seq=355401 Ack=5574 Win=524544 Len=1352 [TCP segment of a reassembled PDU]
868,388.518631,52.113.194.133,192.168.43.215,86,Application Data
1500,793.417884,52.113.194.133,192.168.43.215,92,Application Data
1573,812.286783,52.113.194.133,192.168.43.215,1406,443  >  57518 [ACK] Seq=6759 Ack=1474 Win=262144 Len=1352 [TCP segment of a reassembled PDU]
2623,1200.562132,52.113.194.133,192.168.43.215,54,443  >  60432 [ACK] Seq=18226 Ack=1486 Win=524544 Len=0
1676,821.252058,52.113.194.133,192.168.43.215,1406,"[TCP Out-Of-Order] 443  >  57614 [PSH, ACK] Seq=21320 Ack=1447 Win=524288 Len=1352"
2217,1124.930469,52.113.194.133,192.168.43.215,54,443  >  59555 [ACK] Seq=224 Ack=717 Win=523776 Len=0
354,110.593088,52.113.194.133,192.168.43.215,1406,443  >  52004 [ACK] Seq=202285 Ack=3407 Win=523776 Len=1352 [TCP segment of a reassembled PDU]
1932,971.002627,52.113.194.133,192.168.43.215,1406,443  >  58495 [ACK] Seq=10112 Ack=1773 Win=524032 Len=1352 [TCP segment of a reassembled PDU]
528,274.685236,192.168.43.215,52.113.194.133,54,52004  >  443 [ACK] Seq=4966 Ack=296532 Win=66048 Len=0
1026,589.63023,192.168.43.215,52.113.194.133,54,52004  >  443 [ACK] Seq=7804 Ack=537620 Win=66048 Len=0
2214,1124.923149,52.113.194.133,192.168.43.215,54,443  >  59555 [ACK] Seq=155 Ack=618 Win=523776 Len=0
170,76.01933299999999,52.113.194.133,192.168.43.215,54,443  >  52004 [ACK] Seq=91987 Ack=2337 Win=523520 Len=0
77,30.171546000000003,52.113.194.133,192.168.43.215,172,Application Data
2381,1166.744338,52.113.194.133,192.168.43.215,1280,Application Data
2726,1300.139353,192.168.43.215,52.113.194.133,153,Application Data
705,327.583616,52.113.194.133,192.168.43.215,1406,443  >  52004 [ACK] Seq=404726 Ack=5917 Win=524032 Len=1352 [TCP segment of a reassembled PDU]
1495,789.566328,52.113.194.133,192.168.43.215,92,Application Data
290,96.283958,192.168.43.215,52.113.194.133,54,52004  >  443 [ACK] Seq=2941 Ack=164821 Win=66048 Len=0
1599,817.567587,52.113.194.133,192.168.43.215,553,Application Data
2572,1189.848681,52.113.194.133,192.168.43.215,92,Application Data
1969,1017.7870529999999,52.113.194.133,192.168.43.215,1406,443  >  58495 [ACK] Seq=32275 Ack=2001 Win=523776 Len=1352 [TCP segment of a reassembled PDU]
1666,821.228104,192.168.43.215,52.113.194.133,54,57614  >  443 [ACK] Seq=1447 Ack=14530 Win=66048 Len=0
1225,666.764501,52.113.194.133,192.168.43.215,768,Application Data
728,330.443829,52.113.194.133,192.168.43.215,1406,443  >  52004 [ACK] Seq=418130 Ack=5998 Win=524032 Len=1352 [TCP segment of a reassembled PDU]
2350,1151.961558,52.113.194.133,192.168.43.215,1406,443  >  59744 [ACK] Seq=18709 Ack=1468 Win=262144 Len=1352 [TCP segment of a reassembled PDU]
2676,1229.756886,52.113.194.133,192.168.43.215,54,443  >  60643 [ACK] Seq=1 Ack=567 Win=261632 Len=0
2781,1304.3507550000002,52.113.194.133,192.168.43.215,92,Application Data
484,267.955848,52.113.194.133,192.168.43.215,1406,443  >  52004 [ACK] Seq=268609 Ack=4447 Win=524288 Len=1352 [TCP segment of a reassembled PDU]
2839,1338.394622,192.168.43.215,52.113.194.133,54,61336  >  443 [ACK] Seq=1457 Ack=18074 Win=66048 Len=0
2569,1189.848524,52.113.194.133,192.168.43.215,1406,443  >  60197 [ACK] Seq=36611 Ack=1860 Win=261632 Len=1352 [TCP segment of a reassembled PDU]
1982,1017.793431,52.113.194.133,192.168.43.215,195,Application Data
906,434.57091900000006,192.168.43.215,52.113.194.133,54,52004  >  443 [ACK] Seq=6638 Ack=489201 Win=66048 Len=0
1674,821.228543,52.113.194.133,192.168.43.215,1406,443  >  57614 [ACK] Seq=20064 Ack=1447 Win=524288 Len=1352 [TCP segment of a reassembled PDU]
1915,934.212698,52.113.194.133,192.168.43.215,1406,443  >  58495 [ACK] Seq=4688 Ack=1484 Win=524288 Len=1352 [TCP segment of a reassembled PDU]
1506,793.5202320000001,192.168.43.215,52.113.194.133,54,56560  >  443 [ACK] Seq=2555 Ack=74718 Win=66048 Len=0
2539,1184.223651,52.113.194.133,192.168.43.215,92,Application Data
138,71.1715,192.168.43.215,52.113.194.133,234,Application Data
2801,1338.117162,52.113.194.133,192.168.43.215,66,"443  >  61336 [SYN, ACK] Seq=0 Ack=1 Win=65535 Len=0 MSS=1352 WS=256 SACK_PERM=1"
1627,820.132756,192.168.43.215,52.113.194.133,54,"57518  >  443 [FIN, ACK] Seq=1649 Ack=42928 Win=65280 Len=0"
1545,812.024394,192.168.43.215,52.113.194.133,620,Client Hello
2863,1347.500056,52.113.194.133,192.168.43.215,92,Application Data
2146,1087.926381,52.113.194.133,192.168.43.215,421,Application Data
1211,666.754431,52.113.194.133,192.168.43.215,1406,443  >  56194 [ACK] Seq=27707 Ack=1627 Win=261888 Len=1352 [TCP segment of a reassembled PDU]
2143,1087.924148,52.113.194.133,192.168.43.215,1406,443  >  59340 [ACK] Seq=262 Ack=1475 Win=524288 Len=1352 [TCP segment of a reassembled PDU]
2226,1125.135487,192.168.43.215,52.113.194.133,54,59555  >  443 [ACK] Seq=1471 Ack=2966 Win=66048 Len=0
914,434.632357,192.168.43.215,52.113.194.133,54,52004  >  443 [ACK] Seq=6638 Ack=494513 Win=66048 Len=0
1344,684.3969400000001,192.168.43.215,52.113.194.133,54,56451  >  443 [ACK] Seq=1619 Ack=42127 Win=66048 Len=0
1667,821.2281519999999,52.113.194.133,192.168.43.215,1406,443  >  57614 [ACK] Seq=14530 Ack=1447 Win=524288 Len=1352 [TCP segment of a reassembled PDU]
2040,1043.993927,192.168.43.215,52.113.194.133,54,58495  >  443 [ACK] Seq=2335 Ack=73743 Win=66048 Len=0
1538,811.892354,192.168.43.215,52.113.194.133,66,57518  >  443 [SYN] Seq=0 Win=8192 Len=0 MSS=1460 WS=256 SACK_PERM=1
2454,1172.062068,52.113.194.133,192.168.43.215,92,Application Data
1096,650.212837,192.168.43.215,52.113.194.133,54,52004  >  443 [ACK] Seq=8245 Ack=570707 Win=66048 Len=0
602,284.355957,52.113.194.133,192.168.43.215,195,Application Data
896,434.567709,52.113.194.133,192.168.43.215,1406,443  >  52004 [ACK] Seq=482190 Ack=6638 Win=523264 Len=1352 [TCP segment of a reassembled PDU]
2862,1347.4999810000002,192.168.43.215,52.113.194.133,54,61336  >  443 [ACK] Seq=1831 Ack=28828 Win=66048 Len=0
2459,1177.346736,52.113.194.133,192.168.43.215,54,443  >  59999 [ACK] Seq=20418 Ack=2088 Win=261632 Len=0
2769,1300.381947,192.168.43.215,52.113.194.133,54,61034  >  443 [ACK] Seq=1589 Ack=23055 Win=66048 Len=0
1604,817.572482,192.168.43.215,52.113.194.133,54,57518  >  443 [ACK] Seq=1649 Ack=28372 Win=66048 Len=0
1192,661.58345,192.168.43.215,52.113.194.133,54,56194  >  443 [ACK] Seq=1453 Ack=16009 Win=66048 Len=0
243,81.977586,52.113.194.133,192.168.43.215,1406,443  >  52004 [ACK] Seq=137744 Ack=2721 Win=524544 Len=1352 [TCP segment of a reassembled PDU]
1042,596.231893,192.168.43.215,52.113.194.133,54,52004  >  443 [ACK] Seq=7893 Ack=546260 Win=66048 Len=0
2516,1184.213635,52.113.194.133,192.168.43.215,1281,Application Data
1505,793.520132,52.113.194.133,192.168.43.215,1406,443  >  56560 [ACK] Seq=73366 Ack=2555 Win=523264 Len=1352 [TCP segment of a reassembled PDU]
1104,650.22736,52.113.194.133,192.168.43.215,1406,443  >  52004 [ACK] Seq=576241 Ack=8245 Win=523264 Len=1352 [TCP segment of a reassembled PDU]
1488,789.565392,192.168.43.215,52.113.194.133,54,56560  >  443 [ACK] Seq=2348 Ack=66371 Win=66048 Len=0
1514,793.52632,52.113.194.133,192.168.43.215,1406,443  >  56560 [ACK] Seq=80784 Ack=2555 Win=523264 Len=1352 [TCP segment of a reassembled PDU]
1637,820.9016839999999,52.113.194.133,192.168.43.215,54,443  >  57614 [ACK] Seq=1 Ack=567 Win=523776 Len=0
1459,789.1661809999999,192.168.43.215,52.113.194.133,100,Application Data
114,50.039351,52.113.194.133,192.168.43.215,1406,443  >  52004 [ACK] Seq=61175 Ack=1844 Win=524032 Len=1352 [TCP segment of a reassembled PDU]
1478,789.5645089999999,52.113.194.133,192.168.43.215,1406,443  >  56560 [ACK] Seq=59429 Ack=2348 Win=523520 Len=1352 [TCP segment of a reassembled PDU]
749,330.45058900000004,52.113.194.133,192.168.43.215,1406,443  >  52004 [ACK] Seq=434598 Ack=5998 Win=524032 Len=1352 [TCP segment of a reassembled PDU]
291,96.28401099999999,52.113.194.133,192.168.43.215,187,Application Data
746,330.449617,52.113.194.133,192.168.43.215,1406,443  >  52004 [ACK] Seq=431894 Ack=5998 Win=524032 Len=1352 [TCP segment of a reassembled PDU]
821,388.04104900000004,192.168.43.215,52.113.194.133,66,54764  >  443 [SYN] Seq=0 Win=8192 Len=0 MSS=1460 WS=256 SACK_PERM=1
455,217.798462,192.168.43.215,52.113.194.133,54,52004  >  443 [ACK] Seq=4178 Ack=256630 Win=66048 Len=0
2892,1366.5466509999999,52.113.194.133,192.168.43.215,707,Application Data
2437,1172.05834,52.113.194.133,192.168.43.215,1406,443  >  59999 [ACK] Seq=7479 Ack=1591 Win=262144 Len=1352 [TCP segment of a reassembled PDU]
2880,1366.393241,192.168.43.215,52.113.194.133,92,Application Data
489,267.956546,192.168.43.215,52.113.194.133,54,52004  >  443 [ACK] Seq=4447 Ack=272895 Win=66048 Len=0
2394,1166.74756,192.168.43.215,52.113.194.133,54,59929  >  443 [ACK] Seq=1582 Ack=12986 Win=66048 Len=0
494,267.959478,52.113.194.133,192.168.43.215,1406,443  >  52004 [ACK] Seq=276951 Ack=4447 Win=524288 Len=1352 [TCP segment of a reassembled PDU]
399,169.213409,192.168.43.215,52.113.194.133,54,52004  >  443 [ACK] Seq=3796 Ack=225508 Win=66048 Len=0
2013,1038.360919,52.113.194.133,192.168.43.215,1406,443  >  58495 [ACK] Seq=56685 Ack=2203 Win=523776 Len=1352 [TCP segment of a reassembled PDU]
2775,1304.35041,52.113.194.133,192.168.43.215,373,Application Data
1517,793.5283730000001,52.113.194.133,192.168.43.215,1406,443  >  56560 [ACK] Seq=83488 Ack=2555 Win=523264 Len=1352 [TCP segment of a reassembled PDU]
15,0.106672,192.168.43.215,52.113.194.133,607,Application Data
530,274.685422,52.113.194.133,192.168.43.215,1406,443  >  52004 [ACK] Seq=297568 Ack=4966 Win=523776 Len=1352 [TCP segment of a reassembled PDU]
486,267.95603700000004,192.168.43.215,52.113.194.133,54,52004  >  443 [ACK] Seq=4447 Ack=270191 Win=66048 Len=0
2652,1223.445453,52.113.194.133,192.168.43.215,1406,443  >  60565 [ACK] Seq=8998 Ack=1484 Win=524288 Len=1352 [TCP segment of a reassembled PDU]
1550,812.03543,192.168.43.215,52.113.194.133,773,Application Data
1699,830.974517,192.168.43.215,52.113.194.133,54,57614  >  443 [ACK] Seq=1627 Ack=36541 Win=66048 Len=0
1302,682.078526,52.113.194.133,192.168.43.215,1406,443  >  56451 [ACK] Seq=14529 Ack=1446 Win=262144 Len=1352 [TCP segment of a reassembled PDU]
1162,661.4628809999999,52.113.194.133,192.168.43.215,208,"Server Hello, Change Cipher Spec, Encrypted Handshake Message"
2602,1198.1376480000001,52.113.194.133,192.168.43.215,1406,443  >  60432 [ACK] Seq=4948 Ack=1485 Win=524544 Len=1352 [TCP segment of a reassembled PDU]
503,267.960479,52.113.194.133,192.168.43.215,1406,443  >  52004 [ACK] Seq=282610 Ack=4447 Win=524288 Len=1352 [TCP segment of a reassembled PDU]
573,281.31363999999996,52.113.194.133,192.168.43.215,180,Application Data
782,368.381153,52.113.194.133,192.168.43.215,768,Application Data
2016,1038.3628509999999,52.113.194.133,192.168.43.215,1406,443  >  58495 [ACK] Seq=59389 Ack=2203 Win=523776 Len=1352 [TCP segment of a reassembled PDU]
490,267.956785,52.113.194.133,192.168.43.215,1406,443  >  52004 [ACK] Seq=272895 Ack=4447 Win=524288 Len=1352 [TCP segment of a reassembled PDU]
2428,1171.7031470000002,192.168.43.215,52.113.194.133,152,Application Data
229,78.568084,52.113.194.133,192.168.43.215,768,Application Data
853,388.38170299999996,192.168.43.215,52.113.194.133,54,54764  >  443 [ACK] Seq=1345 Ack=6530 Win=65024 Len=0
2387,1166.7471380000002,52.113.194.133,192.168.43.215,1406,443  >  59929 [ACK] Seq=7460 Ack=1582 Win=524288 Len=1352 [TCP segment of a reassembled PDU]
1247,668.748872,52.113.194.133,192.168.43.215,1406,443  >  56194 [ACK] Seq=48321 Ack=1874 Win=261632 Len=1352 [TCP segment of a reassembled PDU]
571,281.31352200000003,192.168.43.215,52.113.194.133,54,52004  >  443 [ACK] Seq=5224 Ack=325969 Win=66048 Len=0
832,388.318509,192.168.43.215,52.113.194.133,54,54764  >  443 [ACK] Seq=518 Ack=2705 Win=66048 Len=0
1548,812.033672,192.168.43.215,52.113.194.133,105,"Change Cipher Spec, Encrypted Handshake Message"
579,281.316034,52.113.194.133,192.168.43.215,1406,443  >  52004 [ACK] Seq=331503 Ack=5224 Win=523520 Len=1352 [TCP segment of a reassembled PDU]
2318,1151.577537,192.168.43.215,52.113.194.133,767,Application Data
458,217.8,192.168.43.215,52.113.194.133,54,52004  >  443 [ACK] Seq=4178 Ack=259334 Win=66048 Len=0
483,267.932999,192.168.43.215,52.113.194.133,54,52004  >  443 [ACK] Seq=4447 Ack=268609 Win=65280 Len=0
428,172.614358,192.168.43.215,52.113.194.133,54,52004  >  443 [ACK] Seq=3969 Ack=243402 Win=66048 Len=0
2494,1180.536228,52.113.194.133,192.168.43.215,54,"443  >  59999 [FIN, ACK] Seq=39149 Ack=2178 Win=261376 Len=0"
568,281.31336,192.168.43.215,52.113.194.133,54,52004  >  443 [ACK] Seq=5224 Ack=323265 Win=66048 Len=0
1324,684.352986,192.168.43.215,52.113.194.133,54,56451  >  443 [ACK] Seq=1619 Ack=29057 Win=66048 Len=0
347,110.58735300000001,52.113.194.133,192.168.43.215,1406,443  >  52004 [ACK] Seq=198047 Ack=3407 Win=523776 Len=1352 [TCP segment of a reassembled PDU]
235,81.975854,52.113.194.133,192.168.43.215,284,Application Data
2370,1166.250476,192.168.43.215,52.113.194.133,92,Application Data
350,110.589289,52.113.194.133,192.168.43.215,1406,443  >  52004 [ACK] Seq=199517 Ack=3407 Win=523776 Len=1352 [TCP segment of a reassembled PDU]
2179,1102.387674,52.113.194.133,192.168.43.215,1406,443  >  59415 [ACK] Seq=4686 Ack=1478 Win=524288 Len=1352 [TCP segment of a reassembled PDU]
1276,681.8387290000001,192.168.43.215,52.113.194.133,745,Application Data
1258,668.749408,192.168.43.215,52.113.194.133,54,56194  >  443 [ACK] Seq=1874 Ack=56615 Win=66048 Len=0
1111,650.2277,192.168.43.215,52.113.194.133,54,52004  >  443 [ACK] Seq=8245 Ack=581089 Win=65280 Len=0
142,71.43800999999999,192.168.43.215,52.113.194.133,54,52004  >  443 [ACK] Seq=2246 Ack=74043 Win=66048 Len=0
2838,1338.394518,52.113.194.133,192.168.43.215,768,Application Data
729,330.44389,192.168.43.215,52.113.194.133,54,52004  >  443 [ACK] Seq=5998 Ack=419482 Win=66048 Len=0
675,301.795031,192.168.43.215,52.113.194.133,54,52004  >  443 [ACK] Seq=5787 Ack=388261 Win=65792 Len=0
502,267.960008,52.113.194.133,192.168.43.215,187,Application Data
2479,1177.788618,192.168.43.215,52.113.194.133,54,59999  >  443 [ACK] Seq=2177 Ack=31861 Win=66048 Len=0
2666,1223.453948,52.113.194.133,192.168.43.215,92,Application Data
2166,1102.1371390000002,192.168.43.215,52.113.194.133,777,Application Data
1265,670.241294,52.113.194.133,192.168.43.215,54,443  >  56194 [ACK] Seq=59223 Ack=1875 Win=261632 Len=0
2883,1366.422286,52.113.194.133,192.168.43.215,54,443  >  61582 [ACK] Seq=262 Ack=1473 Win=524288 Len=0
1644,820.968873,192.168.43.215,52.113.194.133,92,Application Data
1650,821.223016,52.113.194.133,192.168.43.215,1406,443  >  57614 [ACK] Seq=1614 Ack=1447 Win=524288 Len=1352 [TCP segment of a reassembled PDU]
2111,1073.161655,192.168.43.215,52.113.194.133,54,58495  >  443 [ACK] Seq=2728 Ack=111385 Win=65536 Len=0
1400,740.414626,192.168.43.215,52.113.194.133,100,Application Data
2421,1171.6318390000001,192.168.43.215,52.113.194.133,92,Application Data
176,76.102834,52.113.194.133,192.168.43.215,54,443  >  52004 [ACK] Seq=93898 Ack=2407 Win=523520 Len=0
122,64.78591899999999,192.168.43.215,52.113.194.133,230,Application Data
1570,812.2852190000001,52.113.194.133,192.168.43.215,1406,443  >  57518 [ACK] Seq=4364 Ack=1474 Win=262144 Len=1352 [TCP segment of a reassembled PDU]
2026,1038.366991,192.168.43.215,52.113.194.133,54,58495  >  443 [ACK] Seq=2203 Ack=66401 Win=66048 Len=0
2330,1151.958774,52.113.194.133,192.168.43.215,1406,443  >  59744 [ACK] Seq=3586 Ack=1468 Win=262144 Len=1352 [TCP segment of a reassembled PDU]
2823,1338.3876779999998,52.113.194.133,192.168.43.215,1406,443  >  61336 [ACK] Seq=6300 Ack=1457 Win=524288 Len=1352 [TCP segment of a reassembled PDU]
848,388.35127,192.168.43.215,52.113.194.133,153,Application Data
1119,655.861489,192.168.43.215,52.113.194.133,54,52004  >  443 [ACK] Seq=8399 Ack=585419 Win=66048 Len=0
1394,706.505395,52.113.194.133,192.168.43.215,180,Application Data
2439,1172.058467,52.113.194.133,192.168.43.215,1406,443  >  59999 [ACK] Seq=8831 Ack=1591 Win=262144 Len=1352 [TCP segment of a reassembled PDU]
965,519.5416230000001,52.113.194.133,192.168.43.215,1406,443  >  52004 [ACK] Seq=512634 Ack=7258 Win=524288 Len=1352 [TCP segment of a reassembled PDU]
327,105.017908,192.168.43.215,52.113.194.133,54,52004  >  443 [ACK] Seq=3163 Ack=187838 Win=66048 Len=0
1980,1017.793299,192.168.43.215,52.113.194.133,54,58495  >  443 [ACK] Seq=2001 Ack=42565 Win=66048 Len=0
1181,661.5810339999999,52.113.194.133,192.168.43.215,1406,443  >  56194 [ACK] Seq=7715 Ack=1453 Win=262144 Len=1352 [TCP segment of a reassembled PDU]
1907,934.0607269999999,52.113.194.133,192.168.43.215,54,443  >  58495 [ACK] Seq=262 Ack=1484 Win=524288 Len=0
1057,600.258471,52.113.194.133,192.168.43.215,745,Application Data
1593,812.293225,192.168.43.215,52.113.194.133,54,57518  >  443 [ACK] Seq=1474 Ack=21113 Win=65536 Len=0
566,281.31325699999996,52.113.194.133,192.168.43.215,1406,443  >  52004 [ACK] Seq=321795 Ack=5224 Win=523520 Len=1352 [TCP segment of a reassembled PDU]
2599,1198.13737,52.113.194.133,192.168.43.215,684,Application Data
1541,811.985772,192.168.43.215,52.113.194.133,54,57518  >  443 [ACK] Seq=1 Ack=1 Win=66048 Len=0
2486,1177.792217,52.113.194.133,192.168.43.215,1406,443  >  59999 [ACK] Seq=36101 Ack=2177 Win=261376 Len=1352 [TCP segment of a reassembled PDU]
2059,1044.01063,192.168.43.215,52.113.194.133,54,58495  >  443 [ACK] Seq=2420 Ack=84271 Win=66048 Len=0
2876,1366.36453,192.168.43.215,52.113.194.133,153,Application Data
777,368.37838,52.113.194.133,192.168.43.215,1406,443  >  52004 [ACK] Seq=449163 Ack=6192 Win=523776 Len=1352 [TCP segment of a reassembled PDU]
537,274.685827,192.168.43.215,52.113.194.133,54,52004  >  443 [ACK] Seq=4966 Ack=304328 Win=66048 Len=0
136,65.022623,52.113.194.133,192.168.43.215,92,Application Data
65,30.167358,52.113.194.133,192.168.43.215,1406,443  >  52004 [ACK] Seq=29298 Ack=1625 Win=524288 Len=1352 [TCP segment of a reassembled PDU]
1591,812.293152,52.113.194.133,192.168.43.215,598,Application Data
1929,970.900708,192.168.43.215,52.113.194.133,130,Application Data
769,368.377157,192.168.43.215,52.113.194.133,54,52004  >  443 [ACK] Seq=6192 Ack=443637 Win=66048 Len=0
1992,1017.794668,192.168.43.215,52.113.194.133,54,58495  >  443 [ACK] Seq=2001 Ack=48814 Win=65536 Len=0
684,301.795448,192.168.43.215,52.113.194.133,54,52004  >  443 [ACK] Seq=5787 Ack=394153 Win=65536 Len=0
639,296.354752,192.168.43.215,52.113.194.133,54,52004  >  443 [ACK] Seq=5574 Ack=367532 Win=65792 Len=0
915,450.727642,192.168.43.215,52.113.194.133,55,[TCP Keep-Alive] 54764  >  443 [ACK] Seq=1625 Ack=12014 Win=64768 Len=1
2276,1141.441981,52.113.194.133,192.168.43.215,54,443  >  59658 [ACK] Seq=262 Ack=755 Win=523776 Len=0
1886,904.5660529999999,192.168.43.215,52.113.194.133,54,58330  >  443 [ACK] Seq=1509 Ack=18358 Win=66048 Len=0
2185,1107.2922449999999,52.113.194.133,192.168.43.215,54,443  >  59415 [ACK] Seq=6753 Ack=1604 Win=524288 Len=0
813,372.839806,52.113.194.133,192.168.43.215,1406,443  >  52004 [ACK] Seq=468466 Ack=6407 Win=523520 Len=1352 [TCP segment of a reassembled PDU]
272,96.050792,192.168.43.215,52.113.194.133,54,52004  >  443 [ACK] Seq=2941 Ack=150860 Win=66048 Len=0
1888,904.6315289999999,192.168.43.215,52.113.194.133,54,58330  >  443 [ACK] Seq=1509 Ack=18396 Win=66048 Len=0
370,157.318651,52.113.194.133,192.168.43.215,100,Application Data
689,327.500158,52.113.194.133,192.168.43.215,100,Application Data
1158,661.383311,52.113.194.133,192.168.43.215,66,"443  >  56194 [SYN, ACK] Seq=0 Ack=1 Win=65535 Len=0 MSS=1352 WS=256 SACK_PERM=1"
2035,1043.9918949999999,52.113.194.133,192.168.43.215,1406,443  >  58495 [ACK] Seq=69687 Ack=2293 Win=523520 Len=1352 [TCP segment of a reassembled PDU]
2887,1366.545811,192.168.43.215,52.113.194.133,54,61582  >  443 [ACK] Seq=1473 Ack=2966 Win=66048 Len=0
2873,1366.3607,52.113.194.133,192.168.43.215,54,443  >  61582 [ACK] Seq=1 Ack=567 Win=523776 Len=0
1360,686.359083,52.113.194.133,192.168.43.215,54,443  >  56560 [ACK] Seq=224 Ack=717 Win=523776 Len=0
2212,1124.914253,52.113.194.133,192.168.43.215,208,"Server Hello, Change Cipher Spec, Encrypted Handshake Message"
110,50.037206,52.113.194.133,192.168.43.215,1406,443  >  52004 [ACK] Seq=58353 Ack=1844 Win=524032 Len=1352 [TCP segment of a reassembled PDU]
1159,661.3834519999999,192.168.43.215,52.113.194.133,54,56194  >  443 [ACK] Seq=1 Ack=1 Win=66048 Len=0
1377,706.5045190000001,192.168.43.215,52.113.194.133,54,56560  >  443 [ACK] Seq=1715 Ack=3012 Win=66048 Len=0
683,301.795415,52.113.194.133,192.168.43.215,92,Application Data
1264,670.032772,192.168.43.215,52.113.194.133,54,"56194  >  443 [FIN, ACK] Seq=1874 Ack=59223 Win=66048 Len=0"
2470,1177.785361,192.168.43.215,52.113.194.133,54,59999  >  443 [ACK] Seq=2177 Ack=24983 Win=66048 Len=0
2893,1366.5466900000001,192.168.43.215,52.113.194.133,54,61582  >  443 [ACK] Seq=1473 Ack=6690 Win=66048 Len=0
120,50.039731,52.113.194.133,192.168.43.215,92,Application Data
1613,817.582856,192.168.43.215,52.113.194.133,54,57518  >  443 [ACK] Seq=1649 Ack=35250 Win=66048 Len=0
2789,1308.011185,192.168.43.215,52.113.194.133,54,61124  >  443 [ACK] Seq=1 Ack=1 Win=66048 Len=0
2613,1198.138713,192.168.43.215,52.113.194.133,54,60432  >  443 [ACK] Seq=1485 Ack=14530 Win=66048 Len=0
2836,1338.392508,192.168.43.215,52.113.194.133,54,61336  >  443 [ACK] Seq=1457 Ack=16008 Win=66048 Len=0
2442,1172.060491,52.113.194.133,192.168.43.215,172,Application Data
2366,1166.199769,192.168.43.215,52.113.194.133,153,Application Data
1413,740.60092,52.113.194.133,192.168.43.215,1406,443  >  56560 [ACK] Seq=23888 Ack=1934 Win=524032 Len=1352 [TCP segment of a reassembled PDU]
2400,1166.7484029999998,192.168.43.215,52.113.194.133,54,59929  >  443 [ACK] Seq=1582 Ack=17772 Win=66048 Len=0
703,327.583504,192.168.43.215,52.113.194.133,54,52004  >  443 [ACK] Seq=5917 Ack=403374 Win=66048 Len=0
1107,650.2275179999999,52.113.194.133,192.168.43.215,1406,443  >  52004 [ACK] Seq=578945 Ack=8245 Win=523264 Len=1352 [TCP segment of a reassembled PDU]
216,78.56005,192.168.43.215,52.113.194.133,54,52004  >  443 [ACK] Seq=2551 Ack=121639 Win=66048 Len=0
1043,596.232071,52.113.194.133,192.168.43.215,1406,443  >  52004 [ACK] Seq=546260 Ack=7893 Win=523520 Len=1352 [TCP segment of a reassembled PDU]
393,169.209578,192.168.43.215,52.113.194.133,54,52004  >  443 [ACK] Seq=3796 Ack=220100 Win=66048 Len=0
28,0.183542,52.113.194.133,192.168.43.215,54,443  >  52004 [ACK] Seq=8487 Ack=1366 Win=524544 Len=0
644,296.358927,52.113.194.133,192.168.43.215,1406,443  >  52004 [ACK] Seq=371588 Ack=5574 Win=524544 Len=1352 [TCP segment of a reassembled PDU]
1063,618.629292,192.168.43.215,52.113.194.133,190,"[TCP Retransmission] 52004  >  443 [PSH, ACK] Seq=7982 Ack=554753 Win=66048 Len=136"
479,267.88176,52.113.194.133,192.168.43.215,54,443  >  52004 [ACK] Seq=268563 Ack=4401 Win=524288 Len=0
2766,1300.363685,52.113.194.133,192.168.43.215,1272,Application Data
767,368.375806,52.113.194.133,192.168.43.215,1406,443  >  52004 [ACK] Seq=440933 Ack=6192 Win=523776 Len=1352 [TCP segment of a reassembled PDU]
1184,661.581154,52.113.194.133,192.168.43.215,1406,443  >  56194 [ACK] Seq=10419 Ack=1453 Win=262144 Len=1352 [TCP segment of a reassembled PDU]
667,301.791106,52.113.194.133,192.168.43.215,1406,443  >  52004 [ACK] Seq=382601 Ack=5787 Win=524288 Len=1352 [TCP segment of a reassembled PDU]
2618,1198.139238,52.113.194.133,192.168.43.215,882,Application Data
1375,706.5043450000001,52.113.194.133,192.168.43.215,1406,443  >  56560 [ACK] Seq=308 Ack=1715 Win=524032 Len=1352 [TCP segment of a reassembled PDU]
1453,745.241375,52.113.194.133,192.168.43.215,1406,443  >  56560 [ACK] Seq=49097 Ack=2090 Win=523776 Len=1352 [TCP segment of a reassembled PDU]
952,515.7459610000001,52.113.194.133,192.168.43.215,1406,443  >  52004 [ACK] Seq=506674 Ack=7169 Win=524288 Len=1352 [TCP segment of a reassembled PDU]
1555,812.074732,52.113.194.133,192.168.43.215,208,"Server Hello, Change Cipher Spec, Encrypted Handshake Message"
1952,971.006485,52.113.194.133,192.168.43.215,1406,443  >  58495 [ACK] Seq=24213 Ack=1773 Win=524032 Len=1352 [TCP segment of a reassembled PDU]
1319,684.343799,52.113.194.133,192.168.43.215,1406,443  >  56451 [ACK] Seq=23649 Ack=1619 Win=261888 Len=1352 [TCP segment of a reassembled PDU]
1833,877.9224009999999,52.113.194.133,192.168.43.215,1406,443  >  58198 [ACK] Seq=13167 Ack=1476 Win=524288 Len=1352 [TCP segment of a reassembled PDU]
688,327.500047,52.113.194.133,192.168.43.215,54,443  >  52004 [ACK] Seq=394153 Ack=5917 Win=524032 Len=0
891,434.56557300000003,192.168.43.215,52.113.194.133,54,52004  >  443 [ACK] Seq=6638 Ack=478134 Win=66048 Len=0
1993,1017.795484,52.113.194.133,192.168.43.215,1406,"[TCP Spurious Retransmission] 443  >  58495 [PSH, ACK] Seq=47462 Ack=2001 Win=523776 Len=1352[Reassembly error, protocol TCP: New fragment overlaps old data (retransmission?)]"
564,281.313038,52.113.194.133,192.168.43.215,1406,443  >  52004 [ACK] Seq=320443 Ack=5224 Win=523520 Len=1352 [TCP segment of a reassembled PDU]
1245,668.745566,52.113.194.133,192.168.43.215,1406,443  >  56194 [ACK] Seq=46969 Ack=1874 Win=261632 Len=1352 [TCP segment of a reassembled PDU]
