No.,Time,Source,Destination,Length,Info
2632,1223.294482,192.168.43.215,52.113.194.133,105,"Change Cipher Spec, Encrypted Handshake Message"
189,76.15203100000001,52.113.194.133,192.168.43.215,1406,443  >  52004 [ACK] Seq=103754 Ack=2407 Win=523520 Len=1352 [TCP segment of a reassembled PDU]
901,434.57069299999995,52.113.194.133,192.168.43.215,1406,443  >  52004 [ACK] Seq=485012 Ack=6638 Win=523264 Len=1352 [TCP segment of a reassembled PDU]
2073,1044.011757,192.168.43.215,52.113.194.133,54,58495  >  443 [ACK] Seq=2420 Ack=90513 Win=65536 Len=0
2398,1166.747998,52.113.194.133,192.168.43.215,784,Application Data
655,301.785648,52.113.194.133,192.168.43.215,1406,443  >  52004 [ACK] Seq=373424 Ack=5787 Win=524288 Len=1352 [TCP segment of a reassembled PDU]
2021,1038.3653539999998,52.113.194.133,192.168.43.215,172,Application Data
841,388.322193,52.113.194.133,192.168.43.215,1406,443  >  54765 [ACK] Seq=2705 Ack=518 Win=524032 Len=1352 [TCP segment of a reassembled PDU]
2309,1151.021277,52.113.194.133,192.168.43.215,54,[TCP Dup ACK 2307#1] 443  >  59658 [ACK] Seq=17996 Ack=1462 Win=524544 Len=0
2490,1177.792764,52.113.194.133,192.168.43.215,92,Application Data
1513,793.526111,52.113.194.133,192.168.43.215,1406,443  >  56560 [ACK] Seq=79432 Ack=2555 Win=523264 Len=1352 [TCP segment of a reassembled PDU]
881,434.333812,192.168.43.215,52.113.194.133,100,Application Data
2668,1225.511836,192.168.43.215,52.113.194.133,54,"60565  >  443 [FIN, ACK] Seq=1484 Ack=18113 Win=66048 Len=0"
315,104.95966899999999,52.113.194.133,192.168.43.215,172,Application Data
1648,821.0233099999999,192.168.43.215,52.113.194.133,54,57614  >  443 [ACK] Seq=1447 Ack=262 Win=65792 Len=0
38,0.27769,52.113.194.133,192.168.43.215,1406,443  >  52004 [ACK] Seq=14294 Ack=1435 Win=524288 Len=1352 [TCP segment of a reassembled PDU]
426,172.614281,52.113.194.133,192.168.43.215,172,Application Data
2704,1257.955716,192.168.43.215,52.113.194.133,105,"Change Cipher Spec, Encrypted Handshake Message"
1858,904.2634119999999,52.113.194.133,192.168.43.215,54,443  >  58330 [ACK] Seq=224 Ack=717 Win=523776 Len=0
620,296.35202200000003,52.113.194.133,192.168.43.215,1406,443  >  52004 [ACK] Seq=354049 Ack=5574 Win=524544 Len=1352 [TCP segment of a reassembled PDU]
1456,745.241655,52.113.194.133,192.168.43.215,92,Application Data
300,104.795575,192.168.43.215,52.113.194.133,276,Application Data
444,217.666783,52.113.194.133,192.168.43.215,66,[TCP Keep-Alive ACK] 443  >  52004 [ACK] Seq=252298 Ack=3969 Win=523264 Len=0 SLE=3968 SRE=3969
1805,877.5761449999999,52.113.194.133,192.168.43.215,54,443  >  58198 [ACK] Seq=1 Ack=567 Win=523776 Len=0
2048,1044.009485,52.113.194.133,192.168.43.215,1406,443  >  58495 [ACK] Seq=76159 Ack=2293 Win=523520 Len=1352 [TCP segment of a reassembled PDU]
597,284.35579900000005,192.168.43.215,52.113.194.133,54,52004  >  443 [ACK] Seq=5374 Ack=343796 Win=66048 Len=0
2259,1130.503064,52.113.194.133,192.168.43.215,54,443  >  59561 [ACK] Seq=224 Ack=619 Win=523776 Len=0
2683,1235.6456640000001,52.113.194.133,192.168.43.215,54,443  >  60643 [ACK] Seq=224 Ack=619 Win=261632 Len=0
2105,1044.12197,192.168.43.215,52.113.194.133,54,58495  >  443 [ACK] Seq=2420 Ack=111339 Win=65536 Len=0
2681,1229.8401099999999,192.168.43.215,52.113.194.133,54,60643  >  443 [ACK] Seq=618 Ack=224 Win=65792 Len=0
1342,684.362686,192.168.43.215,52.113.194.133,54,56451  >  443 [ACK] Seq=1619 Ack=42089 Win=66048 Len=0
547,274.68645,52.113.194.133,192.168.43.215,1406,443  >  52004 [ACK] Seq=309995 Ack=4966 Win=523776 Len=1352 [TCP segment of a reassembled PDU]
1418,740.601667,192.168.43.215,52.113.194.133,54,56560  >  443 [ACK] Seq=1934 Ack=28062 Win=66048 Len=0
2159,1102.070851,52.113.194.133,192.168.43.215,66,"443  >  59415 [SYN, ACK] Seq=0 Ack=1 Win=65535 Len=0 MSS=1352 WS=256 SACK_PERM=1"
2334,1151.959167,192.168.43.215,52.113.194.133,54,59744  >  443 [ACK] Seq=1468 Ack=7642 Win=66048 Len=0
795,372.836844,52.113.194.133,192.168.43.215,330,Application Data
1876,904.563564,52.113.194.133,192.168.43.215,172,Application Data
192,76.152132,52.113.194.133,192.168.43.215,1406,443  >  52004 [ACK] Seq=105224 Ack=2407 Win=523520 Len=1352 [TCP segment of a reassembled PDU]
2119,1073.2535050000001,52.113.194.133,192.168.43.215,730,Application Data
2328,1151.9585550000002,192.168.43.215,52.113.194.133,54,59744  >  443 [ACK] Seq=1468 Ack=2966 Win=66048 Len=0
519,270.493495,52.113.194.133,192.168.43.215,92,Application Data
2650,1223.443782,192.168.43.215,52.113.194.133,54,60565  >  443 [ACK] Seq=1484 Ack=7646 Win=66048 Len=0
2176,1102.387466,52.113.194.133,192.168.43.215,422,Application Data
1024,589.579117,52.113.194.133,192.168.43.215,54,443  >  52004 [ACK] Seq=537574 Ack=7804 Win=523776 Len=0
352,110.589858,192.168.43.215,52.113.194.133,54,52004  >  443 [ACK] Seq=3407 Ack=202221 Win=66048 Len=0
693,327.582853,52.113.194.133,192.168.43.215,1406,443  >  52004 [ACK] Seq=395551 Ack=5917 Win=524032 Len=1352 [TCP segment of a reassembled PDU]
1622,817.587538,192.168.43.215,52.113.194.133,54,57518  >  443 [ACK] Seq=1649 Ack=42136 Win=66048 Len=0
2661,1223.4520289999998,52.113.194.133,192.168.43.215,187,Application Data
2581,1197.65752,192.168.43.215,52.113.194.133,620,Client Hello
565,281.313148,192.168.43.215,52.113.194.133,54,52004  >  443 [ACK] Seq=5224 Ack=321795 Win=66048 Len=0
1487,789.565347,52.113.194.133,192.168.43.215,1406,443  >  56560 [ACK] Seq=65019 Ack=2348 Win=523520 Len=1352 [TCP segment of a reassembled PDU]
1365,689.970038,192.168.43.215,52.113.194.133,96,Application Data
2034,1043.981033,192.168.43.215,52.113.194.133,96,Application Data
721,327.58633,192.168.43.215,52.113.194.133,54,52004  >  443 [ACK] Seq=5917 Ack=414926 Win=65536 Len=0
406,169.219121,52.113.194.133,192.168.43.215,1406,443  >  52004 [ACK] Seq=229682 Ack=3796 Win=523264 Len=1352 [TCP segment of a reassembled PDU]
919,495.92870899999997,192.168.43.215,52.113.194.133,55,[TCP Keep-Alive] 54764  >  443 [ACK] Seq=1625 Ack=12014 Win=64768 Len=1
58,0.281896,52.113.194.133,192.168.43.215,92,Application Data
1109,650.227613,52.113.194.133,192.168.43.215,808,Application Data
1781,866.3248880000001,192.168.43.215,52.113.194.133,54,58011  >  443 [ACK] Seq=1491 Ack=7649 Win=66048 Len=0
2590,1197.922459,192.168.43.215,52.113.194.133,784,Application Data
239,81.9762,192.168.43.215,52.113.194.133,54,52004  >  443 [ACK] Seq=2721 Ack=135040 Win=66048 Len=0
1762,861.846417,192.168.43.215,52.113.194.133,105,"Change Cipher Spec, Encrypted Handshake Message"
2794,1308.08311,52.113.194.133,192.168.43.215,54,443  >  61124 [ACK] Seq=155 Ack=618 Win=261632 Len=0
897,434.567772,192.168.43.215,52.113.194.133,54,52004  >  443 [ACK] Seq=6638 Ack=483542 Win=66048 Len=0
653,301.63023,52.113.194.133,192.168.43.215,54,443  >  52004 [ACK] Seq=373424 Ack=5704 Win=524288 Len=0
403,169.21895700000002,52.113.194.133,192.168.43.215,1406,443  >  52004 [ACK] Seq=226978 Ack=3796 Win=523264 Len=1352 [TCP segment of a reassembled PDU]
1920,970.59409,192.168.43.215,52.113.194.133,221,Application Data
2197,1110.633213,192.168.43.215,52.113.194.133,54,59415  >  443 [ACK] Seq=1605 Ack=11053 Win=66048 Len=0
2837,1338.394294,52.113.194.133,192.168.43.215,1406,443  >  61336 [ACK] Seq=16008 Ack=1457 Win=524288 Len=1352 [TCP segment of a reassembled PDU]
2124,1075.494606,52.113.194.133,192.168.43.215,54,443  >  58495 [ACK] Seq=117864 Ack=2729 Win=523264 Len=0
453,217.798296,52.113.194.133,192.168.43.215,1406,443  >  52004 [ACK] Seq=253926 Ack=4178 Win=524544 Len=1352 [TCP segment of a reassembled PDU]
1902,934.012566,52.113.194.133,192.168.43.215,54,443  >  58495 [ACK] Seq=155 Ack=618 Win=523776 Len=0
1257,668.749381,52.113.194.133,192.168.43.215,1406,443  >  56194 [ACK] Seq=55263 Ack=1874 Win=261632 Len=1352 [TCP segment of a reassembled PDU]
1262,668.749538,52.113.194.133,192.168.43.215,92,Application Data
2755,1300.360312,192.168.43.215,52.113.194.133,54,61034  >  443 [ACK] Seq=1589 Ack=13623 Win=66048 Len=0
2481,1177.7904429999999,52.113.194.133,192.168.43.215,1406,443  >  59999 [ACK] Seq=33213 Ack=2177 Win=261376 Len=1352 [TCP segment of a reassembled PDU]
488,267.956417,52.113.194.133,192.168.43.215,1406,443  >  52004 [ACK] Seq=271543 Ack=4447 Win=524288 Len=1352 [TCP segment of a reassembled PDU]
1551,812.071942,52.113.194.133,192.168.43.215,54,443  >  57518 [ACK] Seq=155 Ack=618 Win=261632 Len=0
439,172.622225,52.113.194.133,192.168.43.215,667,Application Data
2266,1141.162351,52.113.194.133,192.168.43.215,208,"Server Hello, Change Cipher Spec, Encrypted Handshake Message"
1123,655.864487,52.113.194.133,192.168.43.215,92,Application Data
2752,1300.3602,192.168.43.215,52.113.194.133,54,61034  >  443 [ACK] Seq=1589 Ack=12153 Win=66048 Len=0
1465,789.463382,192.168.43.215,52.113.194.133,54,56560  >  443 [ACK] Seq=2273 Ack=51041 Win=65536 Len=0
1304,682.078631,192.168.43.215,52.113.194.133,54,56451  >  443 [ACK] Seq=1446 Ack=16007 Win=66048 Len=0
1464,789.4633200000001,52.113.194.133,192.168.43.215,92,Application Data
1701,830.974626,52.113.194.133,192.168.43.215,1406,443  >  57614 [ACK] Seq=36674 Ack=1627 Win=524288 Len=1352 [TCP segment of a reassembled PDU]
2083,1044.117867,52.113.194.133,192.168.43.215,1097,Application Data
1374,706.3844280000001,192.168.43.215,52.113.194.133,54,56560  >  443 [ACK] Seq=1715 Ack=308 Win=65792 Len=0
331,110.481807,52.113.194.133,192.168.43.215,92,Application Data
2541,1189.623632,192.168.43.215,52.113.194.133,248,Application Data
2236,1125.139535,52.113.194.133,192.168.43.215,1406,443  >  59555 [ACK] Seq=10356 Ack=1471 Win=524288 Len=1352 [TCP segment of a reassembled PDU]
2899,1367.70406,52.113.194.133,192.168.43.215,1406,443  >  61582 [ACK] Seq=7605 Ack=1589 Win=524288 Len=1352 [TCP segment of a reassembled PDU]
2673,1229.707453,52.113.194.133,192.168.43.215,66,"443  >  60643 [SYN, ACK] Seq=0 Ack=1 Win=65535 Len=0 MSS=1352 WS=256 SACK_PERM=1"
1629,820.206096,52.113.194.133,192.168.43.215,54,"443  >  57518 [FIN, ACK] Seq=42928 Ack=1650 Win=261888 Len=0"
2762,1300.362387,52.113.194.133,192.168.43.215,1406,443  >  61034 [ACK] Seq=17743 Ack=1589 Win=524288 Len=1352 [TCP segment of a reassembled PDU]
2560,1189.835824,52.113.194.133,192.168.43.215,1406,443  >  60197 [ACK] Seq=29148 Ack=1860 Win=261632 Len=1352 [TCP segment of a reassembled PDU]
1232,668.636808,52.113.194.133,192.168.43.215,92,Application Data
1069,619.143368,52.113.194.133,192.168.43.215,955,Application Data
518,270.49345,192.168.43.215,52.113.194.133,54,52004  >  443 [ACK] Seq=4601 Ack=291146 Win=66048 Len=0
1367,706.030893,192.168.43.215,52.113.194.133,226,Application Data
1859,904.263685,52.113.194.133,192.168.43.215,92,Application Data
939,510.985648,192.168.43.215,52.113.194.133,242,Application Data
582,281.316358,52.113.194.133,192.168.43.215,92,Application Data
460,217.800137,52.113.194.133,192.168.43.215,1406,443  >  52004 [ACK] Seq=260686 Ack=4178 Win=524544 Len=1352 [TCP segment of a reassembled PDU]
1877,904.563605,192.168.43.215,52.113.194.133,54,58330  >  443 [ACK] Seq=1509 Ack=11815 Win=66048 Len=0
304,104.95829499999999,192.168.43.215,52.113.194.133,54,52004  >  443 [ACK] Seq=3163 Ack=172769 Win=66048 Len=0
133,65.022362,52.113.194.133,192.168.43.215,1406,443  >  52004 [ACK] Seq=69260 Ack=2066 Win=523776 Len=1352 [TCP segment of a reassembled PDU]
1802,877.5182289999999,52.113.194.133,192.168.43.215,66,"443  >  58198 [SYN, ACK] Seq=0 Ack=1 Win=65535 Len=0 MSS=1352 WS=256 SACK_PERM=1"
1820,877.91431,52.113.194.133,192.168.43.215,673,Application Data
527,274.685075,52.113.194.133,192.168.43.215,1406,443  >  52004 [ACK] Seq=295180 Ack=4966 Win=523776 Len=1352 [TCP segment of a reassembled PDU]
2444,1172.060634,192.168.43.215,52.113.194.133,54,59999  >  443 [ACK] Seq=1591 Ack=13005 Win=66048 Len=0
145,71.438265,192.168.43.215,52.113.194.133,54,52004  >  443 [ACK] Seq=2246 Ack=76688 Win=66048 Len=0
862,388.425973,52.113.194.133,192.168.43.215,54,443  >  54765 [ACK] Seq=6530 Ack=677 Win=523776 Len=0
1490,789.565717,52.113.194.133,192.168.43.215,1406,443  >  56560 [ACK] Seq=67723 Ack=2348 Win=523520 Len=1352 [TCP segment of a reassembled PDU]
2206,1124.871582,52.113.194.133,192.168.43.215,54,443  >  59555 [ACK] Seq=1 Ack=567 Win=523776 Len=0
205,76.199552,192.168.43.215,52.113.194.133,54,52004  >  443 [ACK] Seq=2407 Ack=114649 Win=66048 Len=0
42,0.281042,192.168.43.215,52.113.194.133,54,52004  >  443 [ACK] Seq=1435 Ack=18350 Win=66048 Len=0
2773,1304.350248,52.113.194.133,192.168.43.215,1406,443  >  61034 [ACK] Seq=24407 Ack=1765 Win=524032 Len=1352 [TCP segment of a reassembled PDU]
851,388.38151,52.113.194.133,192.168.43.215,380,"New Session Ticket, Change Cipher Spec, Encrypted Handshake Message"
1197,661.591333,52.113.194.133,192.168.43.215,1406,443  >  56194 [ACK] Seq=20065 Ack=1453 Win=262144 Len=1352 [TCP segment of a reassembled PDU]
752,330.450774,52.113.194.133,192.168.43.215,92,Application Data
2830,1338.391529,192.168.43.215,52.113.194.133,54,61336  >  443 [ACK] Seq=1457 Ack=11826 Win=66048 Len=0
2654,1223.447376,52.113.194.133,192.168.43.215,1406,443  >  60565 [ACK] Seq=10350 Ack=1484 Win=524288 Len=1352 [TCP segment of a reassembled PDU]
5,0.071357,52.113.194.133,192.168.43.215,54,443  >  52004 [ACK] Seq=1 Ack=518 Win=524032 Len=0
1267,670.241384,192.168.43.215,52.113.194.133,54,56194  >  443 [ACK] Seq=1875 Ack=59224 Win=66048 Len=0
962,519.435701,192.168.43.215,52.113.194.133,143,Application Data
2269,1141.201949,52.113.194.133,192.168.43.215,123,Application Data
2138,1087.740003,192.168.43.215,52.113.194.133,92,Application Data
2757,1300.3611460000002,52.113.194.133,192.168.43.215,1406,443  >  61034 [ACK] Seq=14975 Ack=1589 Win=524288 Len=1352 [TCP segment of a reassembled PDU]
1857,904.1889869999999,192.168.43.215,52.113.194.133,808,Application Data
2379,1166.4632609999999,52.113.194.133,192.168.43.215,54,443  >  59929 [ACK] Seq=826 Ack=1582 Win=524288 Len=0
1014,553.715077,52.113.194.133,192.168.43.215,955,Application Data
391,169.20918899999998,52.113.194.133,192.168.43.215,589,Application Data
1277,681.8764610000001,52.113.194.133,192.168.43.215,54,443  >  56451 [ACK] Seq=155 Ack=618 Win=261632 Len=0
1233,668.652582,192.168.43.215,52.113.194.133,128,Application Data
252,81.978953,52.113.194.133,192.168.43.215,187,Application Data
1664,821.228028,52.113.194.133,192.168.43.215,1406,443  >  57614 [ACK] Seq=11826 Ack=1447 Win=524288 Len=1352 [TCP segment of a reassembled PDU]
358,110.596768,192.168.43.215,52.113.194.133,54,52004  >  443 [ACK] Seq=3407 Ack=206341 Win=66048 Len=0
1380,706.504716,192.168.43.215,52.113.194.133,54,56560  >  443 [ACK] Seq=1715 Ack=4995 Win=66048 Len=0
1391,706.5052469999999,52.113.194.133,192.168.43.215,1406,443  >  56560 [ACK] Seq=13225 Ack=1715 Win=524032 Len=1352 [TCP segment of a reassembled PDU]
818,372.839968,192.168.43.215,52.113.194.133,54,52004  >  443 [ACK] Seq=6407 Ack=473740 Win=66048 Len=0
1734,849.705805,192.168.43.215,52.113.194.133,54,57916  >  443 [ACK] Seq=1479 Ack=7652 Win=66048 Len=0
880,434.33368600000006,192.168.43.215,52.113.194.133,239,Application Data
529,274.68536,52.113.194.133,192.168.43.215,1090,Application Data
233,81.950526,52.113.194.133,192.168.43.215,54,443  >  52004 [ACK] Seq=130754 Ack=2721 Win=524544 Len=0
611,284.356252,52.113.194.133,192.168.43.215,92,Application Data
1364,686.397065,192.168.43.215,52.113.194.133,54,56560  >  443 [ACK] Seq=1455 Ack=262 Win=65792 Len=0
2820,1338.386452,52.113.194.133,192.168.43.215,1406,443  >  61336 [ACK] Seq=3596 Ack=1457 Win=524288 Len=1352 [TCP segment of a reassembled PDU]
1079,650.03305,52.113.194.133,192.168.43.215,54,443  >  52004 [ACK] Seq=559132 Ack=8245 Win=523264 Len=0
1960,996.148132,192.168.43.215,52.113.194.133,236,Application Data
654,301.672131,52.113.194.133,192.168.43.215,54,443  >  52004 [ACK] Seq=373424 Ack=5787 Win=524288 Len=0
1371,706.3604349999999,52.113.194.133,192.168.43.215,54,443  >  56560 [ACK] Seq=262 Ack=1715 Win=524032 Len=0
1881,904.5654949999999,52.113.194.133,192.168.43.215,1406,443  >  58330 [ACK] Seq=14519 Ack=1509 Win=524544 Len=1352 [TCP segment of a reassembled PDU]
677,301.795156,52.113.194.133,192.168.43.215,1406,443  >  52004 [ACK] Seq=389613 Ack=5787 Win=524288 Len=1352 [TCP segment of a reassembled PDU]
1161,661.46277,52.113.194.133,192.168.43.215,54,443  >  56194 [ACK] Seq=1 Ack=567 Win=261632 Len=0
1740,849.708159,192.168.43.215,52.113.194.133,54,57916  >  443 [ACK] Seq=1479 Ack=11826 Win=66048 Len=0
1415,740.60103,192.168.43.215,52.113.194.133,54,56560  >  443 [ACK] Seq=1934 Ack=26592 Win=66048 Len=0
972,527.674363,192.168.43.215,52.113.194.133,143,Application Data
2626,1223.197445,192.168.43.215,52.113.194.133,66,60565  >  443 [SYN] Seq=0 Win=8192 Len=0 MSS=1460 WS=256 SACK_PERM=1
1703,830.9751650000001,52.113.194.133,192.168.43.215,650,Application Data
1958,971.0070939999999,52.113.194.133,192.168.43.215,92,Application Data
776,368.378322,52.113.194.133,192.168.43.215,1406,443  >  52004 [ACK] Seq=447811 Ack=6192 Win=523776 Len=1352 [TCP segment of a reassembled PDU]
1602,817.570396,52.113.194.133,192.168.43.215,1406,443  >  57518 [ACK] Seq=25668 Ack=1649 Win=261888 Len=1352 [TCP segment of a reassembled PDU]
1996,1017.822484,192.168.43.215,52.113.194.133,66,[TCP Dup ACK 1992#2] 58495  >  443 [ACK] Seq=2001 Ack=48814 Win=65536 Len=0 SLE=29571 SRE=30923
2227,1125.135536,52.113.194.133,192.168.43.215,684,Application Data
763,368.375214,192.168.43.215,52.113.194.133,54,52004  >  443 [ACK] Seq=6192 Ack=438229 Win=66048 Len=0
1064,619.084783,52.113.194.133,192.168.43.215,54,443  >  52004 [ACK] Seq=554753 Ack=8072 Win=523520 Len=0
2567,1189.848393,52.113.194.133,192.168.43.215,1406,443  >  60197 [ACK] Seq=35259 Ack=1860 Win=261632 Len=1352 [TCP segment of a reassembled PDU]
637,296.35466,52.113.194.133,192.168.43.215,172,Application Data
1450,745.2394320000001,52.113.194.133,192.168.43.215,187,Application Data
523,274.677485,52.113.194.133,192.168.43.215,1406,443  >  52004 [ACK] Seq=291184 Ack=4966 Win=523776 Len=1352 [TCP segment of a reassembled PDU]
284,96.283211,192.168.43.215,52.113.194.133,54,52004  >  443 [ACK] Seq=2941 Ack=160647 Win=66048 Len=0
1291,682.066094,52.113.194.133,192.168.43.215,1406,443  >  56451 [ACK] Seq=6299 Ack=1446 Win=262144 Len=1352 [TCP segment of a reassembled PDU]
2628,1223.2421470000002,192.168.43.215,52.113.194.133,54,60565  >  443 [ACK] Seq=1 Ack=1 Win=66048 Len=0
984,527.936612,192.168.43.215,52.113.194.133,54,52004  >  443 [ACK] Seq=7347 Ack=522476 Win=66048 Len=0
2860,1347.499718,52.113.194.133,192.168.43.215,1406,443  >  61336 [ACK] Seq=26786 Ack=1831 Win=524032 Len=1352 [TCP segment of a reassembled PDU]
2519,1184.215382,52.113.194.133,192.168.43.215,1406,443  >  60197 [ACK] Seq=4751 Ack=1578 Win=262144 Len=1352 [TCP segment of a reassembled PDU]
2861,1347.499925,52.113.194.133,192.168.43.215,744,Application Data
1282,681.910253,52.113.194.133,192.168.43.215,54,443  >  56451 [ACK] Seq=262 Ack=1446 Win=262144 Len=0
1329,684.3568650000001,52.113.194.133,192.168.43.215,1406,443  >  56451 [ACK] Seq=31879 Ack=1619 Win=261888 Len=1352 [TCP segment of a reassembled PDU]
1539,811.9742669999999,192.168.43.215,52.113.194.133,66,57519  >  443 [SYN] Seq=0 Win=8192 Len=0 MSS=1460 WS=256 SACK_PERM=1
1102,650.2272230000001,192.168.43.215,52.113.194.133,54,52004  >  443 [ACK] Seq=8245 Ack=574889 Win=66048 Len=0
2391,1166.7474,192.168.43.215,52.113.194.133,54,59929  >  443 [ACK] Seq=1582 Ack=11516 Win=66048 Len=0
2786,1305.600624,192.168.43.215,52.113.194.133,54,61034  >  443 [ACK] Seq=1766 Ack=29501 Win=66048 Len=0
1918,934.2129269999999,52.113.194.133,192.168.43.215,92,Application Data
146,71.438428,52.113.194.133,192.168.43.215,1090,Application Data
1889,910.249865,192.168.43.215,52.113.194.133,54,"58330  >  443 [FIN, ACK] Seq=1509 Ack=18396 Win=66048 Len=0"
1428,740.602263,52.113.194.133,192.168.43.215,92,Application Data
1327,684.353122,192.168.43.215,52.113.194.133,54,56451  >  443 [ACK] Seq=1619 Ack=31761 Win=66048 Len=0
1568,812.284983,52.113.194.133,192.168.43.215,100,Application Data
163,71.444715,192.168.43.215,52.113.194.133,54,52004  >  443 [ACK] Seq=2246 Ack=90151 Win=66048 Len=0
1928,970.882192,52.113.194.133,192.168.43.215,92,Application Data
1331,684.357017,52.113.194.133,192.168.43.215,1406,443  >  56451 [ACK] Seq=33231 Ack=1619 Win=261888 Len=1352 [TCP segment of a reassembled PDU]
1713,849.4072359999999,192.168.43.215,52.113.194.133,620,Client Hello
1271,681.791579,192.168.43.215,52.113.194.133,620,Client Hello
2353,1151.9619890000001,52.113.194.133,192.168.43.215,92,Application Data
360,110.59693200000001,52.113.194.133,192.168.43.215,1272,Application Data
2314,1151.571267,52.113.194.133,192.168.43.215,54,443  >  59744 [ACK] Seq=1 Ack=567 Win=261632 Len=0
487,267.95617599999997,52.113.194.133,192.168.43.215,1406,443  >  52004 [ACK] Seq=270191 Ack=4447 Win=524288 Len=1352 [TCP segment of a reassembled PDU]
2554,1189.8342949999999,52.113.194.133,192.168.43.215,1406,443  >  60197 [ACK] Seq=24974 Ack=1860 Win=261632 Len=1352 [TCP segment of a reassembled PDU]
2216,1124.923655,192.168.43.215,52.113.194.133,92,Application Data
2718,1300.038073,192.168.43.215,52.113.194.133,54,"60806  >  443 [RST, ACK] Seq=1447 Ack=224 Win=0 Len=0"
2115,1073.253037,52.113.194.133,192.168.43.215,411,Application Data
1356,686.284654,192.168.43.215,52.113.194.133,153,Application Data
380,157.510252,192.168.43.215,52.113.194.133,54,52004  >  443 [ACK] Seq=3603 Ack=215425 Win=66048 Len=0
983,527.886804,52.113.194.133,192.168.43.215,92,Application Data
1241,668.745427,52.113.194.133,192.168.43.215,1406,443  >  56194 [ACK] Seq=42913 Ack=1874 Win=261632 Len=1352 [TCP segment of a reassembled PDU]
1268,681.707627,192.168.43.215,52.113.194.133,66,56451  >  443 [SYN] Seq=0 Win=8192 Len=0 MSS=1460 WS=256 SACK_PERM=1
2033,1043.933489,52.113.194.133,192.168.43.215,54,443  >  58495 [ACK] Seq=69687 Ack=2293 Win=523520 Len=0
758,368.287202,52.113.194.133,192.168.43.215,100,Application Data
40,0.277827,52.113.194.133,192.168.43.215,1406,443  >  52004 [ACK] Seq=15646 Ack=1435 Win=524288 Len=1352 [TCP segment of a reassembled PDU]
938,505.27857300000005,192.168.43.215,52.113.194.133,54,52004  >  443 [ACK] Seq=6857 Ack=501000 Win=66048 Len=0
2036,1043.992043,192.168.43.215,52.113.194.133,54,58495  >  443 [ACK] Seq=2335 Ack=71039 Win=66048 Len=0
2371,1166.251119,52.113.194.133,192.168.43.215,54,443  >  59929 [ACK] Seq=224 Ack=717 Win=523776 Len=0
2213,1124.918316,192.168.43.215,52.113.194.133,105,"Change Cipher Spec, Encrypted Handshake Message"
1085,650.208561,52.113.194.133,192.168.43.215,649,Application Data
1684,830.9723290000001,192.168.43.215,52.113.194.133,54,57614  >  443 [ACK] Seq=1627 Ack=24255 Win=66048 Len=0
1227,666.764586,192.168.43.215,52.113.194.133,54,56194  >  443 [ACK] Seq=1627 Ack=38174 Win=65280 Len=0
1663,821.227984,192.168.43.215,52.113.194.133,54,57614  >  443 [ACK] Seq=1447 Ack=11826 Win=66048 Len=0
2209,1124.877263,192.168.43.215,52.113.194.133,153,Application Data
2247,1125.140527,192.168.43.215,52.113.194.133,54,59555  >  443 [ACK] Seq=1471 Ack=18712 Win=66048 Len=0
60,29.923626000000002,192.168.43.215,52.113.194.133,198,Application Data
2466,1177.784878,52.113.194.133,192.168.43.215,1406,443  >  59999 [ACK] Seq=22193 Ack=2177 Win=261376 Len=1352 [TCP segment of a reassembled PDU]
2395,1166.7477199999998,52.113.194.133,192.168.43.215,1406,443  >  59929 [ACK] Seq=12986 Ack=1582 Win=524288 Len=1352 [TCP segment of a reassembled PDU]
415,172.603342,52.113.194.133,192.168.43.215,320,Application Data
765,368.375676,52.113.194.133,192.168.43.215,1406,443  >  52004 [ACK] Seq=439581 Ack=6192 Win=523776 Len=1352 [TCP segment of a reassembled PDU]
964,519.539681,52.113.194.133,192.168.43.215,956,Application Data
1785,866.326241,52.113.194.133,192.168.43.215,1406,443  >  58011 [ACK] Seq=10353 Ack=1491 Win=262144 Len=1352 [TCP segment of a reassembled PDU]
2663,1223.453662,52.113.194.133,192.168.43.215,1406,443  >  60565 [ACK] Seq=16009 Ack=1484 Win=524288 Len=1352 [TCP segment of a reassembled PDU]
2220,1125.010595,52.113.194.133,192.168.43.215,54,443  >  59561 [ACK] Seq=155 Ack=618 Win=523776 Len=0
1412,740.6008059999999,192.168.43.215,52.113.194.133,54,56560  >  443 [ACK] Seq=1934 Ack=23888 Win=66048 Len=0
1425,740.6020940000001,52.113.194.133,192.168.43.215,1406,443  >  56560 [ACK] Seq=32251 Ack=1934 Win=524032 Len=1352 [TCP segment of a reassembled PDU]
2191,1107.3385210000001,192.168.43.215,52.113.194.133,54,59415  >  443 [ACK] Seq=1604 Ack=11014 Win=66048 Len=0
2017,1038.362995,192.168.43.215,52.113.194.133,54,58495  >  443 [ACK] Seq=2203 Ack=60741 Win=66048 Len=0
2465,1177.784667,52.113.194.133,192.168.43.215,1406,443  >  59999 [ACK] Seq=20841 Ack=2177 Win=261376 Len=1352 [TCP segment of a reassembled PDU]
928,505.22867199999996,52.113.194.133,192.168.43.215,1406,443  >  52004 [ACK] Seq=494559 Ack=6857 Win=523264 Len=1352 [TCP segment of a reassembled PDU]
2070,1044.011451,192.168.43.215,52.113.194.133,54,58495  >  443 [ACK] Seq=2420 Ack=89931 Win=66048 Len=0
441,172.622313,52.113.194.133,192.168.43.215,92,Application Data
478,267.788987,192.168.43.215,52.113.194.133,323,"[TCP Retransmission] 52004  >  443 [PSH, ACK] Seq=4178 Ack=268563 Win=65280 Len=269"
2637,1223.340005,192.168.43.215,52.113.194.133,92,Application Data
2624,1200.5622349999999,52.113.194.133,192.168.43.215,54,"443  >  60432 [FIN, ACK] Seq=18226 Ack=1486 Win=524544 Len=0"
2440,1172.060363,52.113.194.133,192.168.43.215,1406,443  >  59999 [ACK] Seq=10183 Ack=1591 Win=262144 Len=1352 [TCP segment of a reassembled PDU]
980,527.886345,52.113.194.133,192.168.43.215,1406,443  >  52004 [ACK] Seq=520394 Ack=7347 Win=524032 Len=1352 [TCP segment of a reassembled PDU]
716,327.585368,52.113.194.133,192.168.43.215,1406,443  >  52004 [ACK] Seq=411738 Ack=5917 Win=524032 Len=1352 [TCP segment of a reassembled PDU]
922,504.59314800000004,192.168.43.215,52.113.194.133,100,Application Data
2524,1184.2176869999998,52.113.194.133,192.168.43.215,1406,443  >  60197 [ACK] Seq=8807 Ack=1578 Win=262144 Len=1352 [TCP segment of a reassembled PDU]
2089,1044.119746,52.113.194.133,192.168.43.215,1406,443  >  58495 [ACK] Seq=101041 Ack=2420 Win=523520 Len=1352 [TCP segment of a reassembled PDU]
2028,1038.367429,52.113.194.133,192.168.43.215,1406,443  >  58495 [ACK] Seq=67753 Ack=2203 Win=523776 Len=1352 [TCP segment of a reassembled PDU]
7,0.087119,52.113.194.133,192.168.43.215,1406,443  >  52004 [ACK] Seq=1353 Ack=518 Win=524032 Len=1352 [TCP segment of a reassembled PDU]
1186,661.581231,192.168.43.215,52.113.194.133,54,56194  >  443 [ACK] Seq=1453 Ack=13123 Win=66048 Len=0
1775,866.309317,192.168.43.215,52.113.194.133,54,58011  >  443 [ACK] Seq=1491 Ack=2966 Win=66048 Len=0
1050,600.253431,52.113.194.133,192.168.43.215,1406,443  >  52004 [ACK] Seq=548342 Ack=7982 Win=523520 Len=1352 [TCP segment of a reassembled PDU]
2575,1190.535996,52.113.194.133,192.168.43.215,54,443  >  60197 [ACK] Seq=38174 Ack=1861 Win=261632 Len=0
126,64.90850999999999,192.168.43.215,52.113.194.133,54,52004  >  443 [ACK] Seq=2066 Ack=64859 Win=65280 Len=0
1849,903.828316,52.113.194.133,192.168.43.215,54,443  >  58330 [ACK] Seq=1 Ack=567 Win=523776 Len=0
2885,1366.543692,52.113.194.133,192.168.43.215,1406,443  >  61582 [ACK] Seq=262 Ack=1473 Win=524288 Len=1352 [TCP segment of a reassembled PDU]
2798,1320.6054800000002,52.113.194.133,192.168.43.215,54,443  >  61124 [ACK] Seq=224 Ack=619 Win=261632 Len=0
709,327.58420099999995,192.168.43.215,52.113.194.133,54,52004  >  443 [ACK] Seq=5917 Ack=408782 Win=66048 Len=0
2672,1229.644788,192.168.43.215,52.113.194.133,66,60643  >  443 [SYN] Seq=0 Win=8192 Len=0 MSS=1460 WS=256 SACK_PERM=1
1139,658.382675,52.113.194.133,192.168.43.215,1406,443  >  52004 [ACK] Seq=597525 Ack=8547 Win=524288 Len=1352 [TCP segment of a reassembled PDU]
392,169.209463,52.113.194.133,192.168.43.215,1406,443  >  52004 [ACK] Seq=218748 Ack=3796 Win=523264 Len=1352 [TCP segment of a reassembled PDU]
1491,789.56577,192.168.43.215,52.113.194.133,54,56560  >  443 [ACK] Seq=2348 Ack=69075 Win=66048 Len=0
221,78.564065,52.113.194.133,192.168.43.215,1406,443  >  52004 [ACK] Seq=124461 Ack=2551 Win=523264 Len=1352 [TCP segment of a reassembled PDU]
2475,1177.7870369999998,52.113.194.133,192.168.43.215,1406,443  >  59999 [ACK] Seq=29039 Ack=2177 Win=261376 Len=1352 [TCP segment of a reassembled PDU]
18,0.139987,52.113.194.133,192.168.43.215,380,"New Session Ticket, Change Cipher Spec, Encrypted Handshake Message"
59,0.341591,192.168.43.215,52.113.194.133,54,52004  >  443 [ACK] Seq=1435 Ack=29252 Win=66048 Len=0
996,539.26503,192.168.43.215,52.113.194.133,54,52004  >  443 [ACK] Seq=7482 Ack=526804 Win=66048 Len=0
2556,1189.835431,192.168.43.215,52.113.194.133,54,60197  >  443 [ACK] Seq=1860 Ack=27678 Win=66048 Len=0
1483,789.56492,52.113.194.133,192.168.43.215,1406,443  >  56560 [ACK] Seq=62251 Ack=2348 Win=523520 Len=1352 [TCP segment of a reassembled PDU]
2235,1125.139382,192.168.43.215,52.113.194.133,54,59555  >  443 [ACK] Seq=1471 Ack=10356 Win=66048 Len=0
2058,1044.010597,52.113.194.133,192.168.43.215,1406,443  >  58495 [ACK] Seq=82919 Ack=2293 Win=523520 Len=1352 [TCP segment of a reassembled PDU]
412,172.52101299999998,192.168.43.215,52.113.194.133,227,Application Data
1973,1017.7915960000001,52.113.194.133,192.168.43.215,1406,443  >  58495 [ACK] Seq=35805 Ack=2001 Win=523776 Len=1352 [TCP segment of a reassembled PDU]
2480,1177.7903039999999,52.113.194.133,192.168.43.215,1406,443  >  59999 [ACK] Seq=31861 Ack=2177 Win=261376 Len=1352 [TCP segment of a reassembled PDU]
262,82.05041800000001,192.168.43.215,52.113.194.133,54,52004  >  443 [ACK] Seq=2721 Ack=150814 Win=66048 Len=0
1753,860.258714,52.113.194.133,192.168.43.215,54,443  >  57916 [ACK] Seq=18112 Ack=1480 Win=524288 Len=0
1004,543.606452,52.113.194.133,192.168.43.215,328,Application Data
2005,1038.357124,192.168.43.215,52.113.194.133,54,58495  >  443 [ACK] Seq=2203 Ack=51564 Win=66048 Len=0
1904,934.013079,192.168.43.215,52.113.194.133,92,Application Data
150,71.439988,52.113.194.133,192.168.43.215,1406,443  >  52004 [ACK] Seq=80428 Ack=2246 Win=523520 Len=1352 [TCP segment of a reassembled PDU]
108,50.036929,52.113.194.133,192.168.43.215,1406,443  >  52004 [ACK] Seq=57001 Ack=1844 Win=524032 Len=1352 [TCP segment of a reassembled PDU]
1655,821.227667,52.113.194.133,192.168.43.215,1406,443  >  57614 [ACK] Seq=4948 Ack=1447 Win=524288 Len=1352 [TCP segment of a reassembled PDU]
2777,1304.35052,192.168.43.215,52.113.194.133,54,61034  >  443 [ACK] Seq=1765 Ack=27430 Win=66048 Len=0
1572,812.285488,192.168.43.215,52.113.194.133,54,57518  >  443 [ACK] Seq=1474 Ack=6759 Win=66048 Len=0
1388,706.505112,52.113.194.133,192.168.43.215,172,Application Data
2,0.034535,52.113.194.133,192.168.43.215,66,"443  >  52004 [SYN, ACK] Seq=0 Ack=1 Win=65535 Len=0 MSS=1352 WS=256 SACK_PERM=1"
385,168.91818500000002,52.113.194.133,192.168.43.215,54,443  >  52004 [ACK] Seq=215463 Ack=3796 Win=523264 Len=0
531,274.685471,192.168.43.215,52.113.194.133,54,52004  >  443 [ACK] Seq=4966 Ack=298920 Win=66048 Len=0
589,284.348578,52.113.194.133,192.168.43.215,1406,443  >  52004 [ACK] Seq=336210 Ack=5374 Win=523264 Len=1352 [TCP segment of a reassembled PDU]
1018,553.720096,52.113.194.133,192.168.43.215,733,Application Data
1200,661.591672,52.113.194.133,192.168.43.215,92,Application Data
454,217.79840499999997,52.113.194.133,192.168.43.215,1406,443  >  52004 [ACK] Seq=255278 Ack=4178 Win=524544 Len=1352 [TCP segment of a reassembled PDU]
907,434.57989100000003,52.113.194.133,192.168.43.215,1406,443  >  52004 [ACK] Seq=489201 Ack=6638 Win=523264 Len=1352 [TCP segment of a reassembled PDU]
2307,1151.018565,52.113.194.133,192.168.43.215,54,"443  >  59658 [FIN, ACK] Seq=17995 Ack=1462 Win=524544 Len=0"
701,327.583413,52.113.194.133,192.168.43.215,1406,443  >  52004 [ACK] Seq=400670 Ack=5917 Win=524032 Len=1352 [TCP segment of a reassembled PDU]
2110,1073.106197,52.113.194.133,192.168.43.215,100,Application Data
711,327.584385,52.113.194.133,192.168.43.215,188,Application Data
2152,1087.9320460000001,52.113.194.133,192.168.43.215,92,Application Data
856,388.39725,52.113.194.133,192.168.43.215,54,443  >  54765 [ACK] Seq=6135 Ack=676 Win=523776 Len=0
967,519.543771,52.113.194.133,192.168.43.215,1406,443  >  52004 [ACK] Seq=513986 Ack=7258 Win=524288 Len=1352 [TCP segment of a reassembled PDU]
2208,1124.8761140000001,192.168.43.215,52.113.194.133,105,"Change Cipher Spec, Encrypted Handshake Message"
2677,1229.7571189999999,52.113.194.133,192.168.43.215,208,"Server Hello, Change Cipher Spec, Encrypted Handshake Message"
714,327.584569,52.113.194.133,192.168.43.215,1406,443  >  52004 [ACK] Seq=410386 Ack=5917 Win=524032 Len=1352 [TCP segment of a reassembled PDU]
2832,1338.3919779999999,52.113.194.133,192.168.43.215,1406,443  >  61336 [ACK] Seq=13178 Ack=1457 Win=524288 Len=1352 [TCP segment of a reassembled PDU]
2603,1198.137691,52.113.194.133,192.168.43.215,1406,443  >  60432 [ACK] Seq=6300 Ack=1485 Win=524544 Len=1352 [TCP segment of a reassembled PDU]
1950,971.0061099999999,52.113.194.133,192.168.43.215,1406,443  >  58495 [ACK] Seq=22861 Ack=1773 Win=524032 Len=1352 [TCP segment of a reassembled PDU]
1333,684.357066,192.168.43.215,52.113.194.133,54,56451  >  443 [ACK] Seq=1619 Ack=35935 Win=66048 Len=0
959,515.755412,192.168.43.215,52.113.194.133,54,52004  >  443 [ACK] Seq=7169 Ack=511694 Win=66048 Len=0
2038,1043.993615,192.168.43.215,52.113.194.133,54,58495  >  443 [ACK] Seq=2335 Ack=72391 Win=66048 Len=0
1404,740.584695,52.113.194.133,192.168.43.215,1406,443  >  56560 [ACK] Seq=16899 Ack=1934 Win=524032 Len=1352 [TCP segment of a reassembled PDU]
1039,596.162674,52.113.194.133,192.168.43.215,54,443  >  52004 [ACK] Seq=544009 Ack=7893 Win=523520 Len=0
1128,658.379316,52.113.194.133,192.168.43.215,1406,443  >  52004 [ACK] Seq=588852 Ack=8547 Win=524288 Len=1352 [TCP segment of a reassembled PDU]
2245,1125.140415,52.113.194.133,192.168.43.215,1406,443  >  59555 [ACK] Seq=16008 Ack=1471 Win=524288 Len=1352 [TCP segment of a reassembled PDU]
2593,1197.9673189999999,52.113.194.133,192.168.43.215,54,443  >  60432 [ACK] Seq=262 Ack=755 Win=523776 Len=0
53,0.28163699999999997,52.113.194.133,192.168.43.215,1406,443  >  52004 [ACK] Seq=25292 Ack=1435 Win=524288 Len=1352 [TCP segment of a reassembled PDU]
1521,793.528759,192.168.43.215,52.113.194.133,54,56560  >  443 [ACK] Seq=2555 Ack=86310 Win=66048 Len=0
1825,877.919765,192.168.43.215,52.113.194.133,54,58198  >  443 [ACK] Seq=1476 Ack=7641 Win=66048 Len=0
1657,821.227741,192.168.43.215,52.113.194.133,54,57614  >  443 [ACK] Seq=1447 Ack=7652 Win=66048 Len=0
21,0.142151,192.168.43.215,52.113.194.133,92,Application Data
1303,682.078587,52.113.194.133,192.168.43.215,180,Application Data
1237,668.7452559999999,192.168.43.215,52.113.194.133,54,56194  >  443 [ACK] Seq=1874 Ack=41285 Win=66048 Len=0
963,519.481155,52.113.194.133,192.168.43.215,54,443  >  52004 [ACK] Seq=511732 Ack=7258 Win=524288 Len=0
195,76.152243,52.113.194.133,192.168.43.215,111,Application Data
190,76.152068,52.113.194.133,192.168.43.215,172,Application Data
1140,658.3828139999999,52.113.194.133,192.168.43.215,172,Application Data
1571,812.285438,52.113.194.133,192.168.43.215,1097,Application Data
323,104.961142,52.113.194.133,192.168.43.215,1406,443  >  52004 [ACK] Seq=185620 Ack=3163 Win=524032 Len=1352 [TCP segment of a reassembled PDU]
1314,684.234916,192.168.43.215,52.113.194.133,227,Application Data
635,296.35454300000004,52.113.194.133,192.168.43.215,1406,443  >  52004 [ACK] Seq=365928 Ack=5574 Win=524544 Len=1352 [TCP segment of a reassembled PDU]
265,95.57883199999999,192.168.43.215,52.113.194.133,228,Application Data
2739,1300.2878210000001,192.168.43.215,52.113.194.133,196,Application Data
1424,740.602023,192.168.43.215,52.113.194.133,54,56560  >  443 [ACK] Seq=1934 Ack=32251 Win=66048 Len=0
2102,1044.121771,192.168.43.215,52.113.194.133,54,58495  >  443 [ACK] Seq=2420 Ack=110757 Win=66048 Len=0
477,267.48770099999996,192.168.43.215,52.113.194.133,100,Application Data
1335,684.357125,52.113.194.133,192.168.43.215,1406,443  >  56451 [ACK] Seq=36068 Ack=1619 Win=261888 Len=1352 [TCP segment of a reassembled PDU]
610,284.356225,52.113.194.133,192.168.43.215,500,Application Data
1765,861.91358,192.168.43.215,52.113.194.133,54,58011  >  443 [ACK] Seq=618 Ack=224 Win=65792 Len=0
1437,745.2375440000001,192.168.43.215,52.113.194.133,54,56560  >  443 [ACK] Seq=2090 Ack=38030 Win=66048 Len=0
1989,1017.794341,192.168.43.215,52.113.194.133,54,58495  >  443 [ACK] Seq=2001 Ack=48232 Win=66048 Len=0
1411,740.600725,52.113.194.133,192.168.43.215,1406,443  >  56560 [ACK] Seq=22536 Ack=1934 Win=524032 Len=1352 [TCP segment of a reassembled PDU]
1799,870.3279539999999,52.113.194.133,192.168.43.215,54,"443  >  58011 [FIN, ACK] Seq=17361 Ack=1492 Win=262144 Len=0"
580,281.31617,192.168.43.215,52.113.194.133,54,52004  >  443 [ACK] Seq=5224 Ack=332855 Win=66048 Len=0
2420,1171.631316,52.113.194.133,192.168.43.215,123,Application Data
994,539.264943,52.113.194.133,192.168.43.215,1406,443  >  52004 [ACK] Seq=524775 Ack=7482 Win=524032 Len=1352 [TCP segment of a reassembled PDU]
49,0.28146,52.113.194.133,192.168.43.215,118,Application Data
2344,1151.9601810000001,52.113.194.133,192.168.43.215,1406,443  >  59744 [ACK] Seq=14520 Ack=1468 Win=262144 Len=1352 [TCP segment of a reassembled PDU]
1773,866.308991,52.113.194.133,192.168.43.215,1406,443  >  58011 [ACK] Seq=262 Ack=1491 Win=262144 Len=1352 [TCP segment of a reassembled PDU]
1082,650.207888,52.113.194.133,192.168.43.215,1406,443  >  52004 [ACK] Seq=559178 Ack=8245 Win=523264 Len=1352 [TCP segment of a reassembled PDU]
1729,849.701489,52.113.194.133,192.168.43.215,684,Application Data
2205,1124.831776,192.168.43.215,52.113.194.133,620,Client Hello
712,327.584433,192.168.43.215,52.113.194.133,54,52004  >  443 [ACK] Seq=5917 Ack=409034 Win=65792 Len=0
1149,658.3860559999999,52.113.194.133,192.168.43.215,650,Application Data
1690,830.973064,192.168.43.215,52.113.194.133,54,57614  >  443 [ACK] Seq=1627 Ack=29663 Win=66048 Len=0
224,78.567635,52.113.194.133,192.168.43.215,1406,443  >  52004 [ACK] Seq=127165 Ack=2551 Win=523264 Len=1352 [TCP segment of a reassembled PDU]
2856,1347.442853,52.113.194.133,192.168.43.215,54,443  >  61336 [ACK] Seq=24533 Ack=1831 Win=524032 Len=0
539,274.685946,52.113.194.133,192.168.43.215,172,Application Data
2291,1141.51259,52.113.194.133,192.168.43.215,1406,443  >  59658 [ACK] Seq=10350 Ack=1461 Win=524544 Len=1352 [TCP segment of a reassembled PDU]
1272,681.8322,52.113.194.133,192.168.43.215,54,443  >  56451 [ACK] Seq=1 Ack=567 Win=261632 Len=0
1649,821.222851,52.113.194.133,192.168.43.215,1406,443  >  57614 [ACK] Seq=262 Ack=1447 Win=524288 Len=1352 [TCP segment of a reassembled PDU]
1486,789.56528,52.113.194.133,192.168.43.215,118,Application Data
2501,1183.856806,52.113.194.133,192.168.43.215,208,"Server Hello, Change Cipher Spec, Encrypted Handshake Message"
830,388.31822,52.113.194.133,192.168.43.215,1406,443  >  54764 [ACK] Seq=1 Ack=518 Win=524032 Len=1352 [TCP segment of a reassembled PDU]
704,327.583561,52.113.194.133,192.168.43.215,1406,443  >  52004 [ACK] Seq=403374 Ack=5917 Win=524032 Len=1352 [TCP segment of a reassembled PDU]
999,543.327024,192.168.43.215,52.113.194.133,143,Application Data
2030,1038.39414,52.113.194.133,192.168.43.215,636,"Application Data, Application Data"
1419,740.601749,52.113.194.133,192.168.43.215,1406,443  >  56560 [ACK] Seq=28062 Ack=1934 Win=524032 Len=1352 [TCP segment of a reassembled PDU]
1033,589.650296,52.113.194.133,192.168.43.215,1406,443  >  52004 [ACK] Seq=541951 Ack=7804 Win=523776 Len=1352 [TCP segment of a reassembled PDU]
576,281.31379300000003,52.113.194.133,192.168.43.215,1406,443  >  52004 [ACK] Seq=328799 Ack=5224 Win=523520 Len=1352 [TCP segment of a reassembled PDU]
2149,1087.929962,52.113.194.133,192.168.43.215,1406,443  >  59340 [ACK] Seq=4685 Ack=1475 Win=524288 Len=1352 [TCP segment of a reassembled PDU]
2706,1257.994696,52.113.194.133,192.168.43.215,123,Application Data
588,284.348362,192.168.43.215,52.113.194.133,54,52004  >  443 [ACK] Seq=5374 Ack=336210 Win=66048 Len=0
