"No.","Time","Source","Destination","Protocol","Length","Info"
"4","0.274777","127.0.0.1","127.0.0.1","TCP","45","64553  >  33333 [PSH, ACK] Seq=1 Ack=1 Win=65536 Len=1"
"6","0.274939","127.0.0.1","127.0.0.1","TCP","48","64553  >  33333 [PSH, ACK] Seq=2 Ack=1 Win=65536 Len=4"
"8","0.275046","127.0.0.1","127.0.0.1","TCP","46","64553  >  33333 [PSH, ACK] Seq=6 Ack=1 Win=65536 Len=2"
"10","0.630897","127.0.0.1","127.0.0.1","TCP","1504","33333  >  64553 [ACK] Seq=1 Ack=8 Win=65536 Len=1460"
"11","0.630924","127.0.0.1","127.0.0.1","TCP","1504","33333  >  64553 [ACK] Seq=1461 Ack=8 Win=65536 Len=1460"
"12","0.630944","127.0.0.1","127.0.0.1","TCP","1220","33333  >  64553 [PSH, ACK] Seq=2921 Ack=8 Win=65536 Len=1176"
"14","0.631279","127.0.0.1","127.0.0.1","TCP","1504","33333  >  64553 [ACK] Seq=4097 Ack=8 Win=65536 Len=1460"
"15","0.631302","127.0.0.1","127.0.0.1","TCP","1504","33333  >  64553 [ACK] Seq=5557 Ack=8 Win=65536 Len=1460"
"16","0.631322","127.0.0.1","127.0.0.1","TCP","1504","33333  >  64553 [ACK] Seq=7017 Ack=8 Win=65536 Len=1460"
"17","0.631343","127.0.0.1","127.0.0.1","TCP","1504","33333  >  64553 [ACK] Seq=8477 Ack=8 Win=65536 Len=1460"
"18","0.631366","127.0.0.1","127.0.0.1","TCP","1504","33333  >  64553 [ACK] Seq=9937 Ack=8 Win=65536 Len=1460"
"19","0.631387","127.0.0.1","127.0.0.1","TCP","1504","33333  >  64553 [ACK] Seq=11397 Ack=8 Win=65536 Len=1460"
"21","0.631611","127.0.0.1","127.0.0.1","TCP","1504","33333  >  64553 [ACK] Seq=12857 Ack=8 Win=65536 Len=1460"
"22","0.631634","127.0.0.1","127.0.0.1","TCP","1504","33333  >  64553 [ACK] Seq=14317 Ack=8 Win=65536 Len=1460"
"23","0.631660","127.0.0.1","127.0.0.1","TCP","1504","33333  >  64553 [ACK] Seq=15777 Ack=8 Win=65536 Len=1460"
"24","0.631683","127.0.0.1","127.0.0.1","TCP","1504","33333  >  64553 [ACK] Seq=17237 Ack=8 Win=65536 Len=1460"
"25","0.631705","127.0.0.1","127.0.0.1","TCP","1504","33333  >  64553 [ACK] Seq=18697 Ack=8 Win=65536 Len=1460"
"26","0.631727","127.0.0.1","127.0.0.1","TCP","1504","33333  >  64553 [ACK] Seq=20157 Ack=8 Win=65536 Len=1460"
"27","0.631749","127.0.0.1","127.0.0.1","TCP","1504","33333  >  64553 [ACK] Seq=21617 Ack=8 Win=65536 Len=1460"
"28","0.631771","127.0.0.1","127.0.0.1","TCP","1504","33333  >  64553 [ACK] Seq=23077 Ack=8 Win=65536 Len=1460"
"29","0.631792","127.0.0.1","127.0.0.1","TCP","1504","33333  >  64553 [ACK] Seq=24537 Ack=8 Win=65536 Len=1460"
"30","0.631815","127.0.0.1","127.0.0.1","TCP","1504","33333  >  64553 [ACK] Seq=25997 Ack=8 Win=65536 Len=1460"
"32","0.632115","127.0.0.1","127.0.0.1","TCP","1504","33333  >  64553 [ACK] Seq=27457 Ack=8 Win=65536 Len=1460"
"33","0.632137","127.0.0.1","127.0.0.1","TCP","1504","33333  >  64553 [ACK] Seq=28917 Ack=8 Win=65536 Len=1460"
"34","0.632158","127.0.0.1","127.0.0.1","TCP","1504","33333  >  64553 [ACK] Seq=30377 Ack=8 Win=65536 Len=1460"
"35","0.632181","127.0.0.1","127.0.0.1","TCP","1504","33333  >  64553 [ACK] Seq=31837 Ack=8 Win=65536 Len=1460"
"36","0.632202","127.0.0.1","127.0.0.1","TCP","1504","33333  >  64553 [ACK] Seq=33297 Ack=8 Win=65536 Len=1460"
"37","0.632224","127.0.0.1","127.0.0.1","TCP","1504","33333  >  64553 [ACK] Seq=34757 Ack=8 Win=65536 Len=1460"
"38","0.632245","127.0.0.1","127.0.0.1","TCP","1504","33333  >  64553 [ACK] Seq=36217 Ack=8 Win=65536 Len=1460"
"39","0.632267","127.0.0.1","127.0.0.1","TCP","1504","33333  >  64553 [ACK] Seq=37677 Ack=8 Win=65536 Len=1460"
"40","0.632288","127.0.0.1","127.0.0.1","TCP","1504","33333  >  64553 [ACK] Seq=39137 Ack=8 Win=65536 Len=1460"
"41","0.632310","127.0.0.1","127.0.0.1","TCP","1504","33333  >  64553 [ACK] Seq=40597 Ack=8 Win=65536 Len=1460"
"42","0.632333","127.0.0.1","127.0.0.1","TCP","1504","33333  >  64553 [ACK] Seq=42057 Ack=8 Win=65536 Len=1460"
"43","0.632355","127.0.0.1","127.0.0.1","TCP","1504","33333  >  64553 [ACK] Seq=43517 Ack=8 Win=65536 Len=1460"
"44","0.632377","127.0.0.1","127.0.0.1","TCP","1504","33333  >  64553 [ACK] Seq=44977 Ack=8 Win=65536 Len=1460"
"45","0.632399","127.0.0.1","127.0.0.1","TCP","1504","33333  >  64553 [ACK] Seq=46437 Ack=8 Win=65536 Len=1460"
"47","0.632746","127.0.0.1","127.0.0.1","TCP","1504","33333  >  64553 [ACK] Seq=47897 Ack=8 Win=65536 Len=1460"
"48","0.632788","127.0.0.1","127.0.0.1","TCP","1504","33333  >  64553 [ACK] Seq=49357 Ack=8 Win=65536 Len=1460"
"49","0.632815","127.0.0.1","127.0.0.1","TCP","1504","33333  >  64553 [ACK] Seq=50817 Ack=8 Win=65536 Len=1460"
"50","0.632837","127.0.0.1","127.0.0.1","TCP","1504","33333  >  64553 [ACK] Seq=52277 Ack=8 Win=65536 Len=1460"
"51","0.632862","127.0.0.1","127.0.0.1","TCP","1504","33333  >  64553 [ACK] Seq=53737 Ack=8 Win=65536 Len=1460"
"52","0.632883","127.0.0.1","127.0.0.1","TCP","1504","33333  >  64553 [ACK] Seq=55197 Ack=8 Win=65536 Len=1460"
"53","0.632904","127.0.0.1","127.0.0.1","TCP","1504","33333  >  64553 [ACK] Seq=56657 Ack=8 Win=65536 Len=1460"
"54","0.632926","127.0.0.1","127.0.0.1","TCP","1504","33333  >  64553 [ACK] Seq=58117 Ack=8 Win=65536 Len=1460"
"55","0.632947","127.0.0.1","127.0.0.1","TCP","1504","33333  >  64553 [ACK] Seq=59577 Ack=8 Win=65536 Len=1460"
"56","0.632968","127.0.0.1","127.0.0.1","TCP","1504","33333  >  64553 [ACK] Seq=61037 Ack=8 Win=65536 Len=1460"
"57","0.632990","127.0.0.1","127.0.0.1","TCP","1504","33333  >  64553 [ACK] Seq=62497 Ack=8 Win=65536 Len=1460"
"58","0.633012","127.0.0.1","127.0.0.1","TCP","1504","33333  >  64553 [ACK] Seq=63957 Ack=8 Win=65536 Len=1460"
"59","0.633033","127.0.0.1","127.0.0.1","TCP","1504","33333  >  64553 [ACK] Seq=65417 Ack=8 Win=65536 Len=1460"
"60","0.633054","127.0.0.1","127.0.0.1","TCP","1504","33333  >  64553 [ACK] Seq=66877 Ack=8 Win=65536 Len=1460"
"61","0.633074","127.0.0.1","127.0.0.1","TCP","1340","33333  >  64553 [PSH, ACK] Seq=68337 Ack=8 Win=65536 Len=1296"
"63","0.633667","127.0.0.1","127.0.0.1","TCP","1504","33333  >  64553 [ACK] Seq=69633 Ack=8 Win=65536 Len=1460"
"64","0.633681","127.0.0.1","127.0.0.1","TCP","1504","33333  >  64553 [ACK] Seq=71093 Ack=8 Win=65536 Len=1460"
"65","0.633694","127.0.0.1","127.0.0.1","TCP","1504","33333  >  64553 [ACK] Seq=72553 Ack=8 Win=65536 Len=1460"
"66","0.633707","127.0.0.1","127.0.0.1","TCP","1504","33333  >  64553 [ACK] Seq=74013 Ack=8 Win=65536 Len=1460"
"67","0.633719","127.0.0.1","127.0.0.1","TCP","1504","33333  >  64553 [ACK] Seq=75473 Ack=8 Win=65536 Len=1460"
"68","0.633731","127.0.0.1","127.0.0.1","TCP","1504","33333  >  64553 [ACK] Seq=76933 Ack=8 Win=65536 Len=1460"
"69","0.633743","127.0.0.1","127.0.0.1","TCP","1504","33333  >  64553 [ACK] Seq=78393 Ack=8 Win=65536 Len=1460"
"70","0.633759","127.0.0.1","127.0.0.1","TCP","1504","33333  >  64553 [ACK] Seq=79853 Ack=8 Win=65536 Len=1460"
"71","0.633771","127.0.0.1","127.0.0.1","TCP","1504","33333  >  64553 [ACK] Seq=81313 Ack=8 Win=65536 Len=1460"
"72","0.633783","127.0.0.1","127.0.0.1","TCP","1504","33333  >  64553 [ACK] Seq=82773 Ack=8 Win=65536 Len=1460"
"73","0.633794","127.0.0.1","127.0.0.1","TCP","1504","33333  >  64553 [ACK] Seq=84233 Ack=8 Win=65536 Len=1460"
"74","0.633806","127.0.0.1","127.0.0.1","TCP","1504","33333  >  64553 [ACK] Seq=85693 Ack=8 Win=65536 Len=1460"
"75","0.633826","127.0.0.1","127.0.0.1","TCP","1504","33333  >  64553 [ACK] Seq=87153 Ack=8 Win=65536 Len=1460"
"76","0.633837","127.0.0.1","127.0.0.1","TCP","1504","33333  >  64553 [ACK] Seq=88613 Ack=8 Win=65536 Len=1460"
"77","0.633851","127.0.0.1","127.0.0.1","TCP","1504","33333  >  64553 [ACK] Seq=90073 Ack=8 Win=65536 Len=1460"
"78","0.633862","127.0.0.1","127.0.0.1","TCP","1504","33333  >  64553 [ACK] Seq=91533 Ack=8 Win=65536 Len=1460"
"79","0.633873","127.0.0.1","127.0.0.1","TCP","1504","33333  >  64553 [ACK] Seq=92993 Ack=8 Win=65536 Len=1460"
"80","0.633885","127.0.0.1","127.0.0.1","TCP","1504","33333  >  64553 [ACK] Seq=94453 Ack=8 Win=65536 Len=1460"
"81","0.633896","127.0.0.1","127.0.0.1","TCP","1504","33333  >  64553 [ACK] Seq=95913 Ack=8 Win=65536 Len=1460"
"82","0.633907","127.0.0.1","127.0.0.1","TCP","1504","33333  >  64553 [ACK] Seq=97373 Ack=8 Win=65536 Len=1460"
"83","0.633918","127.0.0.1","127.0.0.1","TCP","1504","33333  >  64553 [ACK] Seq=98833 Ack=8 Win=65536 Len=1460"
"84","0.633929","127.0.0.1","127.0.0.1","TCP","1504","33333  >  64553 [ACK] Seq=100293 Ack=8 Win=65536 Len=1460"
"86","0.634173","127.0.0.1","127.0.0.1","TCP","1504","33333  >  64553 [ACK] Seq=101753 Ack=8 Win=65536 Len=1460"
"87","0.634185","127.0.0.1","127.0.0.1","TCP","1504","33333  >  64553 [ACK] Seq=103213 Ack=8 Win=65536 Len=1460"
"88","0.634196","127.0.0.1","127.0.0.1","TCP","1504","33333  >  64553 [ACK] Seq=104673 Ack=8 Win=65536 Len=1460"
"89","0.634208","127.0.0.1","127.0.0.1","TCP","1504","33333  >  64553 [ACK] Seq=106133 Ack=8 Win=65536 Len=1460"
"90","0.634218","127.0.0.1","127.0.0.1","TCP","1504","33333  >  64553 [ACK] Seq=107593 Ack=8 Win=65536 Len=1460"
"91","0.634230","127.0.0.1","127.0.0.1","TCP","1504","33333  >  64553 [ACK] Seq=109053 Ack=8 Win=65536 Len=1460"
"92","0.634243","127.0.0.1","127.0.0.1","TCP","1504","33333  >  64553 [ACK] Seq=110513 Ack=8 Win=65536 Len=1460"
"93","0.634253","127.0.0.1","127.0.0.1","TCP","1504","33333  >  64553 [ACK] Seq=111973 Ack=8 Win=65536 Len=1460"
"94","0.634264","127.0.0.1","127.0.0.1","TCP","1504","33333  >  64553 [ACK] Seq=113433 Ack=8 Win=65536 Len=1460"
"95","0.634274","127.0.0.1","127.0.0.1","TCP","1504","33333  >  64553 [ACK] Seq=114893 Ack=8 Win=65536 Len=1460"
"96","0.634284","127.0.0.1","127.0.0.1","TCP","1504","33333  >  64553 [ACK] Seq=116353 Ack=8 Win=65536 Len=1460"
"97","0.634294","127.0.0.1","127.0.0.1","TCP","1504","33333  >  64553 [ACK] Seq=117813 Ack=8 Win=65536 Len=1460"
"98","0.634304","127.0.0.1","127.0.0.1","TCP","1504","33333  >  64553 [ACK] Seq=119273 Ack=8 Win=65536 Len=1460"
"99","0.634314","127.0.0.1","127.0.0.1","TCP","1504","33333  >  64553 [ACK] Seq=120733 Ack=8 Win=65536 Len=1460"
"100","0.634324","127.0.0.1","127.0.0.1","TCP","1504","33333  >  64553 [ACK] Seq=122193 Ack=8 Win=65536 Len=1460"
"101","0.634334","127.0.0.1","127.0.0.1","TCP","1504","33333  >  64553 [ACK] Seq=123653 Ack=8 Win=65536 Len=1460"
"102","0.634346","127.0.0.1","127.0.0.1","TCP","1504","33333  >  64553 [ACK] Seq=125113 Ack=8 Win=65536 Len=1460"
"103","0.634356","127.0.0.1","127.0.0.1","TCP","1504","33333  >  64553 [ACK] Seq=126573 Ack=8 Win=65536 Len=1460"
"104","0.634366","127.0.0.1","127.0.0.1","TCP","1504","33333  >  64553 [ACK] Seq=128033 Ack=8 Win=65536 Len=1460"
"105","0.634377","127.0.0.1","127.0.0.1","TCP","1504","33333  >  64553 [ACK] Seq=129493 Ack=8 Win=65536 Len=1460"
"106","0.634388","127.0.0.1","127.0.0.1","TCP","1504","33333  >  64553 [ACK] Seq=130953 Ack=8 Win=65536 Len=1460"
"107","0.634400","127.0.0.1","127.0.0.1","TCP","1504","33333  >  64553 [ACK] Seq=132413 Ack=8 Win=65536 Len=1460"
"108","0.634412","127.0.0.1","127.0.0.1","TCP","1340","33333  >  64553 [PSH, ACK] Seq=133873 Ack=8 Win=65536 Len=1296"
"110","0.634599","127.0.0.1","127.0.0.1","TCP","1504","33333  >  64553 [ACK] Seq=135169 Ack=8 Win=65536 Len=1460"
"113","0.636539","127.0.0.1","127.0.0.1","TCP","1504","33333  >  64553 [ACK] Seq=136629 Ack=8 Win=65536 Len=1460"
"114","0.636551","127.0.0.1","127.0.0.1","TCP","1504","33333  >  64553 [ACK] Seq=138089 Ack=8 Win=65536 Len=1460"
"117","0.636931","127.0.0.1","127.0.0.1","TCP","1504","33333  >  64553 [ACK] Seq=139549 Ack=8 Win=65536 Len=1460"
"118","0.636945","127.0.0.1","127.0.0.1","TCP","1504","33333  >  64553 [ACK] Seq=141009 Ack=8 Win=65536 Len=1460"
"119","0.636958","127.0.0.1","127.0.0.1","TCP","1504","33333  >  64553 [ACK] Seq=142469 Ack=8 Win=65536 Len=1460"
"120","0.636971","127.0.0.1","127.0.0.1","TCP","1504","33333  >  64553 [ACK] Seq=143929 Ack=8 Win=65536 Len=1460"
"121","0.636983","127.0.0.1","127.0.0.1","TCP","1504","33333  >  64553 [ACK] Seq=145389 Ack=8 Win=65536 Len=1460"
"122","0.636996","127.0.0.1","127.0.0.1","TCP","1504","33333  >  64553 [ACK] Seq=146849 Ack=8 Win=65536 Len=1460"
"123","0.637008","127.0.0.1","127.0.0.1","TCP","1504","33333  >  64553 [ACK] Seq=148309 Ack=8 Win=65536 Len=1460"
"124","0.637020","127.0.0.1","127.0.0.1","TCP","1504","33333  >  64553 [ACK] Seq=149769 Ack=8 Win=65536 Len=1460"
"125","0.637032","127.0.0.1","127.0.0.1","TCP","1504","33333  >  64553 [ACK] Seq=151229 Ack=8 Win=65536 Len=1460"
"126","0.637043","127.0.0.1","127.0.0.1","TCP","1504","33333  >  64553 [ACK] Seq=152689 Ack=8 Win=65536 Len=1460"
"127","0.637055","127.0.0.1","127.0.0.1","TCP","1504","33333  >  64553 [ACK] Seq=154149 Ack=8 Win=65536 Len=1460"
"128","0.637066","127.0.0.1","127.0.0.1","TCP","1504","33333  >  64553 [ACK] Seq=155609 Ack=8 Win=65536 Len=1460"
"129","0.637077","127.0.0.1","127.0.0.1","TCP","1504","33333  >  64553 [ACK] Seq=157069 Ack=8 Win=65536 Len=1460"
"130","0.637088","127.0.0.1","127.0.0.1","TCP","1504","33333  >  64553 [ACK] Seq=158529 Ack=8 Win=65536 Len=1460"
"131","0.637100","127.0.0.1","127.0.0.1","TCP","1504","33333  >  64553 [ACK] Seq=159989 Ack=8 Win=65536 Len=1460"
"132","0.637113","127.0.0.1","127.0.0.1","TCP","1504","33333  >  64553 [ACK] Seq=161449 Ack=8 Win=65536 Len=1460"
"133","0.637124","127.0.0.1","127.0.0.1","TCP","1504","33333  >  64553 [ACK] Seq=162909 Ack=8 Win=65536 Len=1460"
"134","0.637134","127.0.0.1","127.0.0.1","TCP","1504","33333  >  64553 [ACK] Seq=164369 Ack=8 Win=65536 Len=1460"
"135","0.637149","127.0.0.1","127.0.0.1","TCP","1504","33333  >  64553 [ACK] Seq=165829 Ack=8 Win=65536 Len=1460"
"136","0.637159","127.0.0.1","127.0.0.1","TCP","1504","33333  >  64553 [ACK] Seq=167289 Ack=8 Win=65536 Len=1460"
"137","0.637169","127.0.0.1","127.0.0.1","TCP","1504","33333  >  64553 [ACK] Seq=168749 Ack=8 Win=65536 Len=1460"
"138","0.637178","127.0.0.1","127.0.0.1","TCP","1504","33333  >  64553 [ACK] Seq=170209 Ack=8 Win=65536 Len=1460"
"139","0.637187","127.0.0.1","127.0.0.1","TCP","1504","33333  >  64553 [ACK] Seq=171669 Ack=8 Win=65536 Len=1460"
"140","0.637196","127.0.0.1","127.0.0.1","TCP","1504","33333  >  64553 [ACK] Seq=173129 Ack=8 Win=65536 Len=1460"
"141","0.637205","127.0.0.1","127.0.0.1","TCP","1504","33333  >  64553 [ACK] Seq=174589 Ack=8 Win=65536 Len=1460"
"142","0.637214","127.0.0.1","127.0.0.1","TCP","1504","33333  >  64553 [ACK] Seq=176049 Ack=8 Win=65536 Len=1460"
"143","0.637225","127.0.0.1","127.0.0.1","TCP","1504","33333  >  64553 [ACK] Seq=177509 Ack=8 Win=65536 Len=1460"
"144","0.637234","127.0.0.1","127.0.0.1","TCP","1504","33333  >  64553 [ACK] Seq=178969 Ack=8 Win=65536 Len=1460"
"145","0.637245","127.0.0.1","127.0.0.1","TCP","1504","33333  >  64553 [ACK] Seq=180429 Ack=8 Win=65536 Len=1460"
"146","0.637255","127.0.0.1","127.0.0.1","TCP","1504","33333  >  64553 [ACK] Seq=181889 Ack=8 Win=65536 Len=1460"
"147","0.637266","127.0.0.1","127.0.0.1","TCP","1504","33333  >  64553 [ACK] Seq=183349 Ack=8 Win=65536 Len=1460"
"148","0.637277","127.0.0.1","127.0.0.1","TCP","1504","33333  >  64553 [ACK] Seq=184809 Ack=8 Win=65536 Len=1460"
"149","0.637382","127.0.0.1","127.0.0.1","TCP","1504","33333  >  64553 [ACK] Seq=186269 Ack=8 Win=65536 Len=1460"
"152","0.637514","127.0.0.1","127.0.0.1","TCP","1504","33333  >  64553 [ACK] Seq=187729 Ack=8 Win=65536 Len=1460"
"153","0.637525","127.0.0.1","127.0.0.1","TCP","1504","33333  >  64553 [ACK] Seq=189189 Ack=8 Win=65536 Len=1460"
"154","0.637536","127.0.0.1","127.0.0.1","TCP","1504","33333  >  64553 [ACK] Seq=190649 Ack=8 Win=65536 Len=1460"
"155","0.637547","127.0.0.1","127.0.0.1","TCP","1504","33333  >  64553 [ACK] Seq=192109 Ack=8 Win=65536 Len=1460"
"156","0.637557","127.0.0.1","127.0.0.1","TCP","1504","33333  >  64553 [ACK] Seq=193569 Ack=8 Win=65536 Len=1460"
"157","0.637568","127.0.0.1","127.0.0.1","TCP","1504","33333  >  64553 [ACK] Seq=195029 Ack=8 Win=65536 Len=1460"
"158","0.637579","127.0.0.1","127.0.0.1","TCP","1504","33333  >  64553 [ACK] Seq=196489 Ack=8 Win=65536 Len=1460"
"159","0.637591","127.0.0.1","127.0.0.1","TCP","1504","33333  >  64553 [ACK] Seq=197949 Ack=8 Win=65536 Len=1460"
"160","0.637602","127.0.0.1","127.0.0.1","TCP","1504","33333  >  64553 [PSH, ACK] Seq=199409 Ack=8 Win=65536 Len=1296"
"163","0.637957","127.0.0.1","127.0.0.1","TCP","1504","33333  >  64553 [ACK] Seq=200869 Ack=8 Win=65536 Len=1460"
"164","0.637969","127.0.0.1","127.0.0.1","TCP","1504","33333  >  64553 [ACK] Seq=202329 Ack=8 Win=65536 Len=1460"
"165","0.637980","127.0.0.1","127.0.0.1","TCP","1504","33333  >  64553 [ACK] Seq=203789 Ack=8 Win=65536 Len=1460"
"168","0.638420","127.0.0.1","127.0.0.1","TCP","1504","33333  >  64553 [ACK] Seq=205249 Ack=8 Win=65536 Len=1460"
"169","0.638433","127.0.0.1","127.0.0.1","TCP","1504","33333  >  64553 [ACK] Seq=206709 Ack=8 Win=65536 Len=1460"
"170","0.638447","127.0.0.1","127.0.0.1","TCP","1504","33333  >  64553 [ACK] Seq=208169 Ack=8 Win=65536 Len=1460"
"171","0.638459","127.0.0.1","127.0.0.1","TCP","1504","33333  >  64553 [ACK] Seq=209629 Ack=8 Win=65536 Len=1460"
"172","0.638472","127.0.0.1","127.0.0.1","TCP","1504","33333  >  64553 [ACK] Seq=211089 Ack=8 Win=65536 Len=1460"
"173","0.638484","127.0.0.1","127.0.0.1","TCP","1504","33333  >  64553 [ACK] Seq=212549 Ack=8 Win=65536 Len=1460"
"174","0.638496","127.0.0.1","127.0.0.1","TCP","1504","33333  >  64553 [ACK] Seq=214009 Ack=8 Win=65536 Len=1460"
"175","0.638508","127.0.0.1","127.0.0.1","TCP","1504","33333  >  64553 [ACK] Seq=215469 Ack=8 Win=65536 Len=1460"
"176","0.638521","127.0.0.1","127.0.0.1","TCP","1504","33333  >  64553 [ACK] Seq=216929 Ack=8 Win=65536 Len=1460"
"177","0.638533","127.0.0.1","127.0.0.1","TCP","1504","33333  >  64553 [ACK] Seq=218389 Ack=8 Win=65536 Len=1460"
"178","0.638547","127.0.0.1","127.0.0.1","TCP","1504","33333  >  64553 [ACK] Seq=219849 Ack=8 Win=65536 Len=1460"
"179","0.638559","127.0.0.1","127.0.0.1","TCP","1504","33333  >  64553 [ACK] Seq=221309 Ack=8 Win=65536 Len=1460"
"180","0.638572","127.0.0.1","127.0.0.1","TCP","1504","33333  >  64553 [ACK] Seq=222769 Ack=8 Win=65536 Len=1460"
"181","0.638584","127.0.0.1","127.0.0.1","TCP","1504","33333  >  64553 [ACK] Seq=224229 Ack=8 Win=65536 Len=1460"
"182","0.638596","127.0.0.1","127.0.0.1","TCP","1504","33333  >  64553 [ACK] Seq=225689 Ack=8 Win=65536 Len=1460"
"183","0.638608","127.0.0.1","127.0.0.1","TCP","1504","33333  >  64553 [ACK] Seq=227149 Ack=8 Win=65536 Len=1460"
"184","0.638619","127.0.0.1","127.0.0.1","TCP","1504","33333  >  64553 [ACK] Seq=228609 Ack=8 Win=65536 Len=1460"
"185","0.638631","127.0.0.1","127.0.0.1","TCP","1504","33333  >  64553 [ACK] Seq=230069 Ack=8 Win=65536 Len=1460"
"186","0.638643","127.0.0.1","127.0.0.1","TCP","1504","33333  >  64553 [ACK] Seq=231529 Ack=8 Win=65536 Len=1460"
"187","0.638655","127.0.0.1","127.0.0.1","TCP","1504","33333  >  64553 [ACK] Seq=232989 Ack=8 Win=65536 Len=1460"
"188","0.638666","127.0.0.1","127.0.0.1","TCP","1504","33333  >  64553 [ACK] Seq=234449 Ack=8 Win=65536 Len=1460"
"189","0.638678","127.0.0.1","127.0.0.1","TCP","1504","33333  >  64553 [ACK] Seq=235909 Ack=8 Win=65536 Len=1460"
"190","0.638690","127.0.0.1","127.0.0.1","TCP","1504","33333  >  64553 [ACK] Seq=237369 Ack=8 Win=65536 Len=1460"
"191","0.638702","127.0.0.1","127.0.0.1","TCP","1504","33333  >  64553 [ACK] Seq=238829 Ack=8 Win=65536 Len=1460"
"192","0.638714","127.0.0.1","127.0.0.1","TCP","1504","33333  >  64553 [ACK] Seq=240289 Ack=8 Win=65536 Len=1460"
"193","0.638725","127.0.0.1","127.0.0.1","TCP","1504","33333  >  64553 [ACK] Seq=241749 Ack=8 Win=65536 Len=1460"
"194","0.638737","127.0.0.1","127.0.0.1","TCP","1504","33333  >  64553 [ACK] Seq=243209 Ack=8 Win=65536 Len=1460"
"195","0.638749","127.0.0.1","127.0.0.1","TCP","1504","33333  >  64553 [ACK] Seq=244669 Ack=8 Win=65536 Len=1460"
"196","0.638761","127.0.0.1","127.0.0.1","TCP","1504","33333  >  64553 [ACK] Seq=246129 Ack=8 Win=65536 Len=1460"
"197","0.638771","127.0.0.1","127.0.0.1","TCP","1504","33333  >  64553 [ACK] Seq=247589 Ack=8 Win=65536 Len=1460"
"198","0.638791","127.0.0.1","127.0.0.1","TCP","1504","33333  >  64553 [ACK] Seq=249049 Ack=8 Win=65536 Len=1460"
"199","0.638801","127.0.0.1","127.0.0.1","TCP","1504","33333  >  64553 [ACK] Seq=250509 Ack=8 Win=65536 Len=1460"
"200","0.638928","127.0.0.1","127.0.0.1","TCP","1504","33333  >  64553 [ACK] Seq=251969 Ack=8 Win=65536 Len=1460"
"201","0.638940","127.0.0.1","127.0.0.1","TCP","1504","33333  >  64553 [ACK] Seq=253429 Ack=8 Win=65536 Len=1460"
"202","0.638950","127.0.0.1","127.0.0.1","TCP","1504","33333  >  64553 [ACK] Seq=254889 Ack=8 Win=65536 Len=1460"
"203","0.638962","127.0.0.1","127.0.0.1","TCP","1504","33333  >  64553 [ACK] Seq=256349 Ack=8 Win=65536 Len=1460"
"204","0.638979","127.0.0.1","127.0.0.1","TCP","1504","33333  >  64553 [ACK] Seq=257809 Ack=8 Win=65536 Len=1460"
"205","0.638992","127.0.0.1","127.0.0.1","TCP","1504","33333  >  64553 [ACK] Seq=259269 Ack=8 Win=65536 Len=1460"
"206","0.639003","127.0.0.1","127.0.0.1","TCP","1504","33333  >  64553 [ACK] Seq=260729 Ack=8 Win=65536 Len=1460"
"207","0.639016","127.0.0.1","127.0.0.1","TCP","1504","33333  >  64553 [ACK] Seq=262189 Ack=8 Win=65536 Len=1460"
"208","0.639026","127.0.0.1","127.0.0.1","TCP","1504","33333  >  64553 [ACK] Seq=263649 Ack=8 Win=65536 Len=1460"
"209","0.639037","127.0.0.1","127.0.0.1","TCP","1176","33333  >  64553 [PSH, ACK] Seq=265109 Ack=8 Win=65536 Len=1296"
"213","0.639673","127.0.0.1","127.0.0.1","TCP","1504","33333  >  64553 [ACK] Seq=266241 Ack=8 Win=65536 Len=1460"
"214","0.639684","127.0.0.1","127.0.0.1","TCP","1504","33333  >  64553 [ACK] Seq=267701 Ack=8 Win=65536 Len=1460"
"215","0.639695","127.0.0.1","127.0.0.1","TCP","1504","33333  >  64553 [ACK] Seq=269161 Ack=8 Win=65536 Len=1460"
"218","0.640205","127.0.0.1","127.0.0.1","TCP","1504","33333  >  64553 [ACK] Seq=270621 Ack=8 Win=65536 Len=1460"
"219","0.640224","127.0.0.1","127.0.0.1","TCP","1504","33333  >  64553 [ACK] Seq=272081 Ack=8 Win=65536 Len=1460"
"220","0.640235","127.0.0.1","127.0.0.1","TCP","1504","33333  >  64553 [ACK] Seq=273541 Ack=8 Win=65536 Len=1460"
"221","0.640246","127.0.0.1","127.0.0.1","TCP","1504","33333  >  64553 [ACK] Seq=275001 Ack=8 Win=65536 Len=1460"
"222","0.640258","127.0.0.1","127.0.0.1","TCP","1504","33333  >  64553 [ACK] Seq=276461 Ack=8 Win=65536 Len=1460"
"223","0.640269","127.0.0.1","127.0.0.1","TCP","1504","33333  >  64553 [ACK] Seq=277921 Ack=8 Win=65536 Len=1460"
"224","0.640281","127.0.0.1","127.0.0.1","TCP","1504","33333  >  64553 [ACK] Seq=279381 Ack=8 Win=65536 Len=1460"
"225","0.640293","127.0.0.1","127.0.0.1","TCP","1504","33333  >  64553 [ACK] Seq=280841 Ack=8 Win=65536 Len=1460"
"226","0.640304","127.0.0.1","127.0.0.1","TCP","1504","33333  >  64553 [ACK] Seq=282301 Ack=8 Win=65536 Len=1460"
"227","0.640316","127.0.0.1","127.0.0.1","TCP","1504","33333  >  64553 [ACK] Seq=283761 Ack=8 Win=65536 Len=1460"
"228","0.640327","127.0.0.1","127.0.0.1","TCP","1504","33333  >  64553 [ACK] Seq=285221 Ack=8 Win=65536 Len=1460"
"229","0.640339","127.0.0.1","127.0.0.1","TCP","1504","33333  >  64553 [ACK] Seq=286681 Ack=8 Win=65536 Len=1460"
"230","0.640350","127.0.0.1","127.0.0.1","TCP","1504","33333  >  64553 [ACK] Seq=288141 Ack=8 Win=65536 Len=1460"
"231","0.640362","127.0.0.1","127.0.0.1","TCP","1504","33333  >  64553 [ACK] Seq=289601 Ack=8 Win=65536 Len=1460"
"232","0.640374","127.0.0.1","127.0.0.1","TCP","1504","33333  >  64553 [ACK] Seq=291061 Ack=8 Win=65536 Len=1460"
"233","0.640385","127.0.0.1","127.0.0.1","TCP","1504","33333  >  64553 [ACK] Seq=292521 Ack=8 Win=65536 Len=1460"
"234","0.640397","127.0.0.1","127.0.0.1","TCP","1504","33333  >  64553 [ACK] Seq=293981 Ack=8 Win=65536 Len=1460"
"235","0.640407","127.0.0.1","127.0.0.1","TCP","1504","33333  >  64553 [ACK] Seq=295441 Ack=8 Win=65536 Len=1460"
"236","0.640419","127.0.0.1","127.0.0.1","TCP","1504","33333  >  64553 [ACK] Seq=296901 Ack=8 Win=65536 Len=1460"
"237","0.640431","127.0.0.1","127.0.0.1","TCP","1504","33333  >  64553 [ACK] Seq=298361 Ack=8 Win=65536 Len=1460"
"238","0.640442","127.0.0.1","127.0.0.1","TCP","1504","33333  >  64553 [ACK] Seq=299821 Ack=8 Win=65536 Len=1460"
"239","0.640453","127.0.0.1","127.0.0.1","TCP","1504","33333  >  64553 [ACK] Seq=301281 Ack=8 Win=65536 Len=1460"
"240","0.640464","127.0.0.1","127.0.0.1","TCP","1504","33333  >  64553 [ACK] Seq=302741 Ack=8 Win=65536 Len=1460"
"241","0.640475","127.0.0.1","127.0.0.1","TCP","1504","33333  >  64553 [ACK] Seq=304201 Ack=8 Win=65536 Len=1460"
"242","0.640487","127.0.0.1","127.0.0.1","TCP","1504","33333  >  64553 [ACK] Seq=305661 Ack=8 Win=65536 Len=1460"
"243","0.640498","127.0.0.1","127.0.0.1","TCP","1504","33333  >  64553 [ACK] Seq=307121 Ack=8 Win=65536 Len=1460"
"244","0.640509","127.0.0.1","127.0.0.1","TCP","1504","33333  >  64553 [ACK] Seq=308581 Ack=8 Win=65536 Len=1460"
"245","0.640520","127.0.0.1","127.0.0.1","TCP","1504","33333  >  64553 [ACK] Seq=310041 Ack=8 Win=65536 Len=1460"
"246","0.640532","127.0.0.1","127.0.0.1","TCP","1504","33333  >  64553 [ACK] Seq=311501 Ack=8 Win=65536 Len=1460"
"247","0.640543","127.0.0.1","127.0.0.1","TCP","1504","33333  >  64553 [ACK] Seq=312961 Ack=8 Win=65536 Len=1460"
"248","0.640554","127.0.0.1","127.0.0.1","TCP","1504","33333  >  64553 [ACK] Seq=314421 Ack=8 Win=65536 Len=1460"
"249","0.640565","127.0.0.1","127.0.0.1","TCP","1504","33333  >  64553 [ACK] Seq=315881 Ack=8 Win=65536 Len=1460"
"250","0.640660","127.0.0.1","127.0.0.1","TCP","1504","33333  >  64553 [ACK] Seq=317341 Ack=8 Win=65536 Len=1460"
"251","0.640671","127.0.0.1","127.0.0.1","TCP","1504","33333  >  64553 [ACK] Seq=318801 Ack=8 Win=65536 Len=1460"
"252","0.640682","127.0.0.1","127.0.0.1","TCP","1504","33333  >  64553 [ACK] Seq=320261 Ack=8 Win=65536 Len=1460"
"253","0.640694","127.0.0.1","127.0.0.1","TCP","1504","33333  >  64553 [ACK] Seq=321721 Ack=8 Win=65536 Len=1460"
"254","0.640708","127.0.0.1","127.0.0.1","TCP","1504","33333  >  64553 [ACK] Seq=323181 Ack=8 Win=65536 Len=1460"
"255","0.640726","127.0.0.1","127.0.0.1","TCP","1504","33333  >  64553 [ACK] Seq=324641 Ack=8 Win=65536 Len=1460"
"256","0.640737","127.0.0.1","127.0.0.1","TCP","1504","33333  >  64553 [ACK] Seq=326101 Ack=8 Win=65536 Len=1460"
"257","0.640748","127.0.0.1","127.0.0.1","TCP","1504","33333  >  64553 [ACK] Seq=327561 Ack=8 Win=65536 Len=1460"
"258","0.640762","127.0.0.1","127.0.0.1","TCP","1504","33333  >  64553 [ACK] Seq=329021 Ack=8 Win=65536 Len=1460"
"259","0.640776","127.0.0.1","127.0.0.1","TCP","1368","[TCP Window Full] 33333  >  64553 [PSH, ACK] Seq=330481 Ack=8 Win=65536 Len=1296"
"263","0.641147","127.0.0.1","127.0.0.1","TCP","1504","33333  >  64553 [ACK] Seq=331805 Ack=8 Win=65536 Len=1460"
"264","0.641158","127.0.0.1","127.0.0.1","TCP","1504","33333  >  64553 [ACK] Seq=333265 Ack=8 Win=65536 Len=1460"
"269","0.641551","127.0.0.1","127.0.0.1","TCP","1504","33333  >  64553 [ACK] Seq=336185 Ack=8 Win=65536 Len=1460"
"270","0.641561","127.0.0.1","127.0.0.1","TCP","1504","33333  >  64553 [ACK] Seq=337645 Ack=8 Win=65536 Len=1460"
"271","0.641572","127.0.0.1","127.0.0.1","TCP","1504","33333  >  64553 [ACK] Seq=339105 Ack=8 Win=65536 Len=1460"
"272","0.641581","127.0.0.1","127.0.0.1","TCP","1504","33333  >  64553 [ACK] Seq=340565 Ack=8 Win=65536 Len=1460"
"273","0.641592","127.0.0.1","127.0.0.1","TCP","1504","33333  >  64553 [ACK] Seq=342025 Ack=8 Win=65536 Len=1460"
"274","0.641602","127.0.0.1","127.0.0.1","TCP","1504","33333  >  64553 [ACK] Seq=343485 Ack=8 Win=65536 Len=1460"
"275","0.641613","127.0.0.1","127.0.0.1","TCP","1504","33333  >  64553 [ACK] Seq=344945 Ack=8 Win=65536 Len=1460"
"276","0.641624","127.0.0.1","127.0.0.1","TCP","1504","33333  >  64553 [ACK] Seq=346405 Ack=8 Win=65536 Len=1460"
"277","0.641635","127.0.0.1","127.0.0.1","TCP","1504","33333  >  64553 [ACK] Seq=347865 Ack=8 Win=65536 Len=1460"
"278","0.641645","127.0.0.1","127.0.0.1","TCP","1504","33333  >  64553 [ACK] Seq=349325 Ack=8 Win=65536 Len=1460"
"279","0.641656","127.0.0.1","127.0.0.1","TCP","1504","33333  >  64553 [ACK] Seq=350785 Ack=8 Win=65536 Len=1460"
"280","0.641667","127.0.0.1","127.0.0.1","TCP","1504","33333  >  64553 [ACK] Seq=352245 Ack=8 Win=65536 Len=1460"
"281","0.641679","127.0.0.1","127.0.0.1","TCP","1504","33333  >  64553 [ACK] Seq=353705 Ack=8 Win=65536 Len=1460"
"282","0.641690","127.0.0.1","127.0.0.1","TCP","1504","33333  >  64553 [ACK] Seq=355165 Ack=8 Win=65536 Len=1460"
"283","0.641701","127.0.0.1","127.0.0.1","TCP","1504","33333  >  64553 [ACK] Seq=356625 Ack=8 Win=65536 Len=1460"
"284","0.641712","127.0.0.1","127.0.0.1","TCP","1504","33333  >  64553 [ACK] Seq=358085 Ack=8 Win=65536 Len=1460"
"285","0.641723","127.0.0.1","127.0.0.1","TCP","1504","33333  >  64553 [ACK] Seq=359545 Ack=8 Win=65536 Len=1460"
"286","0.641734","127.0.0.1","127.0.0.1","TCP","1504","33333  >  64553 [ACK] Seq=361005 Ack=8 Win=65536 Len=1460"
"287","0.641746","127.0.0.1","127.0.0.1","TCP","1504","33333  >  64553 [ACK] Seq=362465 Ack=8 Win=65536 Len=1460"
"288","0.641757","127.0.0.1","127.0.0.1","TCP","1504","33333  >  64553 [ACK] Seq=363925 Ack=8 Win=65536 Len=1460"
"289","0.641768","127.0.0.1","127.0.0.1","TCP","1504","33333  >  64553 [ACK] Seq=365385 Ack=8 Win=65536 Len=1460"
"290","0.641779","127.0.0.1","127.0.0.1","TCP","1504","33333  >  64553 [ACK] Seq=366845 Ack=8 Win=65536 Len=1460"
"291","0.641790","127.0.0.1","127.0.0.1","TCP","1504","33333  >  64553 [ACK] Seq=368305 Ack=8 Win=65536 Len=1460"
"292","0.641800","127.0.0.1","127.0.0.1","TCP","1504","33333  >  64553 [ACK] Seq=369765 Ack=8 Win=65536 Len=1460"
"293","0.641822","127.0.0.1","127.0.0.1","TCP","1504","33333  >  64553 [ACK] Seq=371225 Ack=8 Win=65536 Len=1460"
"294","0.641833","127.0.0.1","127.0.0.1","TCP","1504","33333  >  64553 [ACK] Seq=372685 Ack=8 Win=65536 Len=1460"
"295","0.641844","127.0.0.1","127.0.0.1","TCP","1504","33333  >  64553 [ACK] Seq=374145 Ack=8 Win=65536 Len=1460"
"296","0.641855","127.0.0.1","127.0.0.1","TCP","1504","33333  >  64553 [ACK] Seq=375605 Ack=8 Win=65536 Len=1460"
"297","0.641867","127.0.0.1","127.0.0.1","TCP","1504","33333  >  64553 [ACK] Seq=377065 Ack=8 Win=65536 Len=1460"
"298","0.641887","127.0.0.1","127.0.0.1","TCP","1504","33333  >  64553 [ACK] Seq=378525 Ack=8 Win=65536 Len=1460"
"299","0.641902","127.0.0.1","127.0.0.1","TCP","1504","33333  >  64553 [ACK] Seq=379985 Ack=8 Win=65536 Len=1460"
"300","0.641918","127.0.0.1","127.0.0.1","TCP","1504","33333  >  64553 [ACK] Seq=381445 Ack=8 Win=65536 Len=1460"
"301","0.642044","127.0.0.1","127.0.0.1","TCP","1504","33333  >  64553 [ACK] Seq=382905 Ack=8 Win=65536 Len=1460"
"302","0.642056","127.0.0.1","127.0.0.1","TCP","1504","33333  >  64553 [ACK] Seq=384365 Ack=8 Win=65536 Len=1460"
"303","0.642067","127.0.0.1","127.0.0.1","TCP","1504","33333  >  64553 [ACK] Seq=385825 Ack=8 Win=65536 Len=1460"
"304","0.642080","127.0.0.1","127.0.0.1","TCP","1504","33333  >  64553 [ACK] Seq=387285 Ack=8 Win=65536 Len=1460"
"305","0.642090","127.0.0.1","127.0.0.1","TCP","1504","33333  >  64553 [ACK] Seq=388745 Ack=8 Win=65536 Len=1460"
"306","0.642102","127.0.0.1","127.0.0.1","TCP","1504","33333  >  64553 [ACK] Seq=390205 Ack=8 Win=65536 Len=1460"
"307","0.642113","127.0.0.1","127.0.0.1","TCP","1504","33333  >  64553 [ACK] Seq=391665 Ack=8 Win=65536 Len=1460"
"308","0.642124","127.0.0.1","127.0.0.1","TCP","1504","33333  >  64553 [ACK] Seq=393125 Ack=8 Win=65536 Len=1460"
"309","0.642135","127.0.0.1","127.0.0.1","TCP","1504","33333  >  64553 [ACK] Seq=394585 Ack=8 Win=65536 Len=1460"
"310","0.642147","127.0.0.1","127.0.0.1","TCP","1368","[TCP Window Full] 33333  >  64553 [PSH, ACK] Seq=396045 Ack=8 Win=65536 Len=1296"
"314","0.642726","127.0.0.1","127.0.0.1","TCP","1504","33333  >  64553 [ACK] Seq=397369 Ack=8 Win=65536 Len=1460"
"315","0.642739","127.0.0.1","127.0.0.1","TCP","1504","33333  >  64553 [ACK] Seq=398829 Ack=8 Win=65536 Len=1460"
"321","0.643169","127.0.0.1","127.0.0.1","TCP","1504","33333  >  64553 [ACK] Seq=401749 Ack=8 Win=65536 Len=1460"
"322","0.643181","127.0.0.1","127.0.0.1","TCP","1504","33333  >  64553 [ACK] Seq=403209 Ack=8 Win=65536 Len=1460"
"323","0.643194","127.0.0.1","127.0.0.1","TCP","1504","33333  >  64553 [ACK] Seq=404669 Ack=8 Win=65536 Len=1460"
"324","0.643206","127.0.0.1","127.0.0.1","TCP","1504","33333  >  64553 [ACK] Seq=406129 Ack=8 Win=65536 Len=1460"
"325","0.643218","127.0.0.1","127.0.0.1","TCP","1504","33333  >  64553 [ACK] Seq=407589 Ack=8 Win=65536 Len=1460"
"326","0.643231","127.0.0.1","127.0.0.1","TCP","1504","33333  >  64553 [ACK] Seq=409049 Ack=8 Win=65536 Len=1460"
"327","0.643243","127.0.0.1","127.0.0.1","TCP","1504","33333  >  64553 [ACK] Seq=410509 Ack=8 Win=65536 Len=1460"
"328","0.643256","127.0.0.1","127.0.0.1","TCP","1504","33333  >  64553 [ACK] Seq=411969 Ack=8 Win=65536 Len=1460"
"329","0.643269","127.0.0.1","127.0.0.1","TCP","1504","33333  >  64553 [ACK] Seq=413429 Ack=8 Win=65536 Len=1460"
"330","0.643281","127.0.0.1","127.0.0.1","TCP","1504","33333  >  64553 [ACK] Seq=414889 Ack=8 Win=65536 Len=1460"
"331","0.643292","127.0.0.1","127.0.0.1","TCP","1504","33333  >  64553 [ACK] Seq=416349 Ack=8 Win=65536 Len=1460"
"332","0.643303","127.0.0.1","127.0.0.1","TCP","1504","33333  >  64553 [ACK] Seq=417809 Ack=8 Win=65536 Len=1460"
"333","0.643313","127.0.0.1","127.0.0.1","TCP","1504","33333  >  64553 [ACK] Seq=419269 Ack=8 Win=65536 Len=1460"
"334","0.643326","127.0.0.1","127.0.0.1","TCP","1504","33333  >  64553 [ACK] Seq=420729 Ack=8 Win=65536 Len=1460"
"335","0.643337","127.0.0.1","127.0.0.1","TCP","1504","33333  >  64553 [ACK] Seq=422189 Ack=8 Win=65536 Len=1460"
"336","0.643349","127.0.0.1","127.0.0.1","TCP","1504","33333  >  64553 [ACK] Seq=423649 Ack=8 Win=65536 Len=1460"
"337","0.643365","127.0.0.1","127.0.0.1","TCP","1504","33333  >  64553 [ACK] Seq=425109 Ack=8 Win=65536 Len=1460"
"338","0.643377","127.0.0.1","127.0.0.1","TCP","1504","33333  >  64553 [ACK] Seq=426569 Ack=8 Win=65536 Len=1460"
"339","0.643388","127.0.0.1","127.0.0.1","TCP","1504","33333  >  64553 [ACK] Seq=428029 Ack=8 Win=65536 Len=1460"
"340","0.643399","127.0.0.1","127.0.0.1","TCP","1504","33333  >  64553 [ACK] Seq=429489 Ack=8 Win=65536 Len=1460"
"341","0.643409","127.0.0.1","127.0.0.1","TCP","1504","33333  >  64553 [ACK] Seq=430949 Ack=8 Win=65536 Len=1460"
"342","0.643422","127.0.0.1","127.0.0.1","TCP","1504","33333  >  64553 [ACK] Seq=432409 Ack=8 Win=65536 Len=1460"
"343","0.643433","127.0.0.1","127.0.0.1","TCP","1504","33333  >  64553 [ACK] Seq=433869 Ack=8 Win=65536 Len=1460"
"344","0.643445","127.0.0.1","127.0.0.1","TCP","1504","33333  >  64553 [ACK] Seq=435329 Ack=8 Win=65536 Len=1460"
"345","0.643459","127.0.0.1","127.0.0.1","TCP","1504","33333  >  64553 [ACK] Seq=436789 Ack=8 Win=65536 Len=1460"
"346","0.643470","127.0.0.1","127.0.0.1","TCP","1504","33333  >  64553 [ACK] Seq=438249 Ack=8 Win=65536 Len=1460"
"347","0.643482","127.0.0.1","127.0.0.1","TCP","1504","33333  >  64553 [ACK] Seq=439709 Ack=8 Win=65536 Len=1460"
"348","0.643494","127.0.0.1","127.0.0.1","TCP","1504","33333  >  64553 [ACK] Seq=441169 Ack=8 Win=65536 Len=1460"
"349","0.643505","127.0.0.1","127.0.0.1","TCP","1504","33333  >  64553 [ACK] Seq=442629 Ack=8 Win=65536 Len=1460"
"350","0.643516","127.0.0.1","127.0.0.1","TCP","1504","33333  >  64553 [ACK] Seq=444089 Ack=8 Win=65536 Len=1460"
"351","0.643528","127.0.0.1","127.0.0.1","TCP","1504","33333  >  64553 [ACK] Seq=445549 Ack=8 Win=65536 Len=1460"
"352","0.643722","127.0.0.1","127.0.0.1","TCP","1504","33333  >  64553 [ACK] Seq=447009 Ack=8 Win=65536 Len=1460"
"353","0.643732","127.0.0.1","127.0.0.1","TCP","1504","33333  >  64553 [ACK] Seq=448469 Ack=8 Win=65536 Len=1460"
"354","0.643744","127.0.0.1","127.0.0.1","TCP","1504","33333  >  64553 [ACK] Seq=449929 Ack=8 Win=65536 Len=1460"
"355","0.643760","127.0.0.1","127.0.0.1","TCP","1504","33333  >  64553 [ACK] Seq=451389 Ack=8 Win=65536 Len=1460"
"356","0.643771","127.0.0.1","127.0.0.1","TCP","1504","33333  >  64553 [ACK] Seq=452849 Ack=8 Win=65536 Len=1460"
"357","0.643781","127.0.0.1","127.0.0.1","TCP","1504","33333  >  64553 [ACK] Seq=454309 Ack=8 Win=65536 Len=1460"
"358","0.643790","127.0.0.1","127.0.0.1","TCP","1504","33333  >  64553 [ACK] Seq=455769 Ack=8 Win=65536 Len=1460"
"359","0.643800","127.0.0.1","127.0.0.1","TCP","1504","33333  >  64553 [ACK] Seq=457229 Ack=8 Win=65536 Len=1460"
"360","0.643810","127.0.0.1","127.0.0.1","TCP","1504","33333  >  64553 [ACK] Seq=458689 Ack=8 Win=65536 Len=1460"
"361","0.643820","127.0.0.1","127.0.0.1","TCP","1504","33333  >  64553 [ACK] Seq=460149 Ack=8 Win=65536 Len=1460"
"362","0.643830","127.0.0.1","127.0.0.1","TCP","1368","33333  >  64553 [PSH, ACK] Seq=461609 Ack=8 Win=65536 Len=1296"
"363","0.643926","127.0.0.1","127.0.0.1","TCP","1504","33333  >  64553 [ACK] Seq=462933 Ack=8 Win=65536 Len=1460"
"364","0.643937","127.0.0.1","127.0.0.1","TCP","1504","33333  >  64553 [ACK] Seq=464393 Ack=8 Win=65536 Len=1460"
"368","0.644312","127.0.0.1","127.0.0.1","TCP","1504","33333  >  64553 [ACK] Seq=465853 Ack=8 Win=65536 Len=1460"
"369","0.644323","127.0.0.1","127.0.0.1","TCP","1504","33333  >  64553 [ACK] Seq=467313 Ack=8 Win=65536 Len=1460"
"370","0.644335","127.0.0.1","127.0.0.1","TCP","1504","33333  >  64553 [ACK] Seq=468773 Ack=8 Win=65536 Len=1460"
"371","0.644346","127.0.0.1","127.0.0.1","TCP","1504","33333  >  64553 [ACK] Seq=470233 Ack=8 Win=65536 Len=1460"
"372","0.644357","127.0.0.1","127.0.0.1","TCP","1504","33333  >  64553 [ACK] Seq=471693 Ack=8 Win=65536 Len=1460"
"373","0.644368","127.0.0.1","127.0.0.1","TCP","1504","33333  >  64553 [ACK] Seq=473153 Ack=8 Win=65536 Len=1460"
"374","0.644380","127.0.0.1","127.0.0.1","TCP","1504","33333  >  64553 [ACK] Seq=474613 Ack=8 Win=65536 Len=1460"
"375","0.644391","127.0.0.1","127.0.0.1","TCP","1504","33333  >  64553 [ACK] Seq=476073 Ack=8 Win=65536 Len=1460"
"376","0.644402","127.0.0.1","127.0.0.1","TCP","1504","33333  >  64553 [ACK] Seq=477533 Ack=8 Win=65536 Len=1460"
"377","0.644412","127.0.0.1","127.0.0.1","TCP","1504","33333  >  64553 [ACK] Seq=478993 Ack=8 Win=65536 Len=1460"
"378","0.644423","127.0.0.1","127.0.0.1","TCP","1504","33333  >  64553 [ACK] Seq=480453 Ack=8 Win=65536 Len=1460"
"379","0.644434","127.0.0.1","127.0.0.1","TCP","1504","33333  >  64553 [ACK] Seq=481913 Ack=8 Win=65536 Len=1460"
"380","0.644445","127.0.0.1","127.0.0.1","TCP","1504","33333  >  64553 [ACK] Seq=483373 Ack=8 Win=65536 Len=1460"
"381","0.644456","127.0.0.1","127.0.0.1","TCP","1504","33333  >  64553 [ACK] Seq=484833 Ack=8 Win=65536 Len=1460"
"382","0.644468","127.0.0.1","127.0.0.1","TCP","1504","33333  >  64553 [ACK] Seq=486293 Ack=8 Win=65536 Len=1460"
"383","0.644478","127.0.0.1","127.0.0.1","TCP","1504","33333  >  64553 [ACK] Seq=487753 Ack=8 Win=65536 Len=1460"
"384","0.644489","127.0.0.1","127.0.0.1","TCP","1504","33333  >  64553 [ACK] Seq=489213 Ack=8 Win=65536 Len=1460"
"385","0.644500","127.0.0.1","127.0.0.1","TCP","1504","33333  >  64553 [ACK] Seq=490673 Ack=8 Win=65536 Len=1460"
"386","0.644511","127.0.0.1","127.0.0.1","TCP","1504","33333  >  64553 [ACK] Seq=492133 Ack=8 Win=65536 Len=1460"
"387","0.644522","127.0.0.1","127.0.0.1","TCP","1504","33333  >  64553 [ACK] Seq=493593 Ack=8 Win=65536 Len=1460"
"388","0.644534","127.0.0.1","127.0.0.1","TCP","1504","33333  >  64553 [ACK] Seq=495053 Ack=8 Win=65536 Len=1460"
"389","0.644545","127.0.0.1","127.0.0.1","TCP","1504","33333  >  64553 [ACK] Seq=496513 Ack=8 Win=65536 Len=1460"
"390","0.644556","127.0.0.1","127.0.0.1","TCP","1504","33333  >  64553 [ACK] Seq=497973 Ack=8 Win=65536 Len=1460"
"391","0.644568","127.0.0.1","127.0.0.1","TCP","1504","33333  >  64553 [ACK] Seq=499433 Ack=8 Win=65536 Len=1460"
"392","0.644581","127.0.0.1","127.0.0.1","TCP","1504","33333  >  64553 [ACK] Seq=500893 Ack=8 Win=65536 Len=1460"
"393","0.644595","127.0.0.1","127.0.0.1","TCP","1504","33333  >  64553 [ACK] Seq=502353 Ack=8 Win=65536 Len=1460"
"394","0.644607","127.0.0.1","127.0.0.1","TCP","1504","33333  >  64553 [ACK] Seq=503813 Ack=8 Win=65536 Len=1460"
"395","0.644620","127.0.0.1","127.0.0.1","TCP","1504","33333  >  64553 [ACK] Seq=505273 Ack=8 Win=65536 Len=1460"
"396","0.644631","127.0.0.1","127.0.0.1","TCP","1504","33333  >  64553 [ACK] Seq=506733 Ack=8 Win=65536 Len=1460"
"397","0.644642","127.0.0.1","127.0.0.1","TCP","1504","33333  >  64553 [ACK] Seq=508193 Ack=8 Win=65536 Len=1460"
